data_avaliacao;titulo;comentario_positivo;comentario_negativo;nota;;;;;;
20 de fevereiro de 2025;Muito cara para o que oferece;Quarto e banheiros em tamanho bom e limpos. Cama confortável e 4 travesseiros foram disponibilizados, o que é raro de se ver.;Café da manhã ruim. Apesar de muitas opções as comidas não são saborosas. Aipim estava frio, ovo frio, enfim. O corredor do quarto estava sujo nos 3 dias que passei lá. E o lençol da cama era pequeno ou estava mal arrumado pq tava dando pra ver o colchão na parte de cima, embaixo dos travesseiros.;6;;;;;;
17 de fevereiro de 2025;Não recomendo!;Da localização sossegada do hotel.;Hotel antigo, passando por reformas. Ás 8h da manhã começa o barulho. O estacionamento tem vagas apertadas e de difícil localização. Café da manhã de péssima qualidade. Restaurante ruim!;5;;;;;;
17 de fevereiro de 2025;Bom hotel.;quarto amplo e cama grande;A TV é muito pequena. Ar condicionado fazia muito barulho e a comida do restaurante deixa a desejar na qualidade. Pedi um espaguete a bolonhesa e a carne era de péssima qualidade, cheia de gordura e nervos, não consegui comer. E o preço do cardápio não é barato, ou seja, desproporcional cobrar o valor que cobram pela qualidade que oferecem.;7;;;;;;
14 de fevereiro de 2025;Decepcionante;Localização;Estacionamento péssimo. Garagem super apertada e pequena. Corredores com portas velhas. Ar condicionado barulhento. Manta não estava limpa. Wifi muito ruim.;4;;;;;;
10 de fevereiro de 2025;Bom;Poderia ser mais bem cuidado;;7;;;;;;
10 de fevereiro de 2025;Péssima experiência;Quarto amplo, localização boa, mas longe da praia.;Está longe de ser um hotel 4 estrelas. Atendimento péssimo da recepção (despreparados e com poucos colaboradores), room service pífio (não atende e é preciso descer para ser atendido. Inclusive, fui orientada a pedir ifood). Restaurante desorganizado com pedidos trocados e demora excessiva. Ficamos dois dias sem água quente no quarto. A falta de treinamento e despreparo é imensa: da recepção a gerência com feedbacks rudes e intimidadores. Estávamos em um congresso e até a sala apresentava problemas com queda de energia em meio a uma das palestras mais esperadas do dia. ;;;;;;;
"Apenas dois elevadores funcionando causando congestionamento entre os hóspedes e colaboradores. Internet péssima.""";1;;;;;;;;;
9 de fevereiro de 2025;Bom;Quarto bom, espaçoso e limpeza impecável;Café da manhã podia ser melhor;7;;;;;;
9 de fevereiro de 2025;Bom;Boas instalações, limpeza impecável;O café da manhã podia ser melhor, principalmente com relação à variedade de pães/doces. Faltou inclusive o tradicional bolo de rolo. O restaurante onde e servido o café era pequeno para a quantidade de hóspedes.;7;;;;;;
9 de fevereiro de 2025;Ok;A acomodação era boa, com espaço ok. Café da manhã muito variado.;quando chegamos o controle do ar condicionado não funcionava, nem o da TV, que estava quebrado ao meio. Além disso, o quarto possuía uma cama king e apenas uma coberta de solteiro. ;;;;;;;
Por fim; quando eu estava tratando com um funcionária da recepção fui chamada atenção por estar com uma saia longa e a parte de cima do biquíni; alegando se tratar de um hotel “executivo”. Nunca passei por isso numa cidade turística de praia; eu estava saindo para passear. ;;;;;;;
"O café podia ter uma variedade melhor principalmente de doces. Nem o tradicional bolo de rolo eles tinham. A tapioca que comi lá foi a mais sem graça da vida""";7;;;;;;;;;
6 de fevereiro de 2025;Bom;Nas proximidades do aeroporto, é o hotel de melhor custo benefício;;;;;;;;
"Os funcionários são queridos e as áreas compartilhadas são bem bonitas""";Acredito q eu fiquei na modalidade mais simples de quarto. Achei um pouco velho e com coisas com na aparência pelo preço q custa… bom pra passar 1-2 noites;7;;;;;;;;
5 de fevereiro de 2025;Aceitável;;Estacionamento fora do hotel, longe, difícil de entrar e estacionar e custo de 25,00;;;;;;;
Vista do mar não é nada boa;" vê bem de longe atrás dos prédios""";5;;;;;;;;
2 de fevereiro de 2025;Péssima experiência;Na verdade, nada. Achei um falta de respeito com o cliente, jogando duas pessoas q n sabia nem para onde iria.;N gostei de nada, infelizmente ;;;;;;;
"N voltarei mais e tbm n indico""";2;;;;;;;;;
1º de fevereiro de 2025;Precisam melhorar a cozinha;Cama excelente;Checkin lento e comida muito ruim, pedimos uns hambúrgueres e vieram frios, batatas murchas e carne muito salgada.;5;;;;;;
29 de janeiro de 2025;Bom;Cama grande e confortável, restaurante bom, café da manhã ok (poderiam variar nas opções);Não trocaram as toalhas de rosto e o pano do chão do box, somente as toalhas de banho, nos cinco dias que ficamos lá.;7;;;;;;
28 de janeiro de 2025;Muito ruim;Experiência péssima, o flat é legal mas a gestor é horrível;;2;;;;;;
20 de janeiro de 2025;Hospedagem boa, café da manhã ruim;Instalações dos quartos excelentes. Funcionários educados. Chuveiros e camas boas.;;;;;;;;
;;;;;;;;;;
"Solicitei duas taças para o quarto e os mesmos disseram que só disponibilizariam se o vinho tivesse sido comprado no bar do hotel. Achei um absurdo.""";O café da manhã é muito ruim. Tem um pouco de tudo, mas tudo sem capricho. As refeições quentes, geralmente estão frias, como cachorro quente, cuscuz, ensopados. Eles não colocam proteínas de qualidade, geralmente é toscana, mortadela. Fizeram um torta de frango, nem tinha frango. Beiju só tem duas opções salgadas: queijo, presunto e mortadela ou queijo. Beiju doce nunca tinha leite condenado, apesar de está no cardápio. Pão de queijo de péssima qualidade. Sucos aguados. Disseram que a empresa que gerencia o café não é do hotel. Oriento trocar de empresa.;7;;;;;;;;
15 de janeiro de 2025;Regular;A cama, o chuveiro e a localização;Ar condicionado não funcionou direito, limpez deixou a desejar e toalhas de banho velhas e sem cheiro de limpeza. E o café da manhã ruim;6;;;;;;
14 de janeiro de 2025;Aceitável;Hotel razoável. Bom café da manhã.;Lençol da cama não ficava no colchão.;5;;;;;;
12 de janeiro de 2025;Quando eu voltar a Recife ficarei novamente neste hotel, só peço que melhorem as toalhas.;O café da manhã foi bom, mas pode melhorar acrescentando alguns itens, como coalhada e bacon. A localização é muito boa, recomendo para quem quer ficar em Boa Viagem.;Não gostei do cheiro das toalhas, tudo indica que o produto usado na lavagem das toalhas está deixando um mau cheiro nelas. O estacionamento não é por conta da estadia, é cobrada R$ 25,00 a diária.;7;;;;;;
11 de janeiro de 2025;Bom;Compacta e limpa;Pequena, sem vista.;7;;;;;;
7 de janeiro de 2025;Boa localização e péssima comida;Da localização e da reforma na academia. O quarto precisa de reforma, mas ainda é agradável.;Da péssima comida do restaurante. Jantei por quatro vezes diferentes por comodidade e TODAS as vezes a comida veio muito ruim. A piscina está SEMPRE muito suja e no café da manhã não há lugar no salão para todos os hóspedes. Nos dias 1 e 2 de Janeiro o caos foi pior ainda. Os preços dos itens do frigobar do quarto são abusivos;;;;;;;
7 de janeiro de 2025;Poderia ter sido melhor.;A estrutura física do hotel é bem legal e chama a atenção. Os quartos têm camas bem confortáveis e a água do chuveiro é uma delícia, bastante forte.;Passamos somente 01 (uma) diária e 02 (duas) coisas nos chamou atenção de forma extremamente negativa. A 1ª foi o barulho que o ar condicionado fazia, pois toda hora que o compressor disparava para começar a gelar, tomávamos um susto (apto 908). Além disso, passamos por 02 (duas) desagradáveis quedas de energia no hotel que nos fez acordar. Situação bem desagradável.;7;;;;;;
6 de janeiro de 2025;DESAPONTAMENTO;Café da manhã;Limpeza e estacionamento pouco sinalizado, já que é compartilhado entre o hotel e o flat.;6;;;;;;
4 de janeiro de 2025;Estafia lamentável, com um diária exorbitante para a qualidade do hotel.;Nada.;Café da manhã péssimo, desorganizado e num lugar minúsculo para a quantidade de hóspedes. Estacionamento péssimo, sem a menor condição para uso, deveria ser interditado. Sistema de digital nas portas não funcionava, nem comigo nem com minha esposa, além de ter visto vários hóspedes reclamando!!!;6;;;;;;
31 de dezembro de 2024;Percebi um certo descaso com a parte externa dos apartamentos, paredes riscadas e portas danificadas;Organização do quarto;;6;;;;;;
26 de dezembro de 2024;Bom;A estrutura do hotel é bem antiga. O check out poderia ser mais ágil. Café da manhã deixa a desejar mas o atendimento da atendente que faz a tapioca foi o melhor.;Check Out;7;;;;;;
23 de dezembro de 2024;bem localizado.;;Funcionária da recepção mal educada. Quarto antigo. Poucos itens de amenidade no banheiro.;7;;;;;;
13 de dezembro de 2024;Bom;A Foto das belas torres que nos chamam a atenção, sugere ser um hotel luxuoso…;;;;;;;;
;;;;;;;;;;
Porém; não existe luxo…;;;;;;;;;
;;;;;;;;;;
"Temos um hotel que entrega o básico do básico… mas que funciona.""";;7;;;;;;;;
11 de dezembro de 2024;Aceitável;localização;Fizemos reserva de dois quartos duplos, 4 pessoas e lá me cobraram mais duas pessoas. Realmente a reserva impressa estava para dois em dois quartos, mas coloquei no motor de busca p4 pessoas dois quartos. NUNCA VI ESTAR NUM QUARTO DUPLO E NÃO SINGLE, considerarem uma pessoa qd busquei para duas. Não sei de fato se o erro foi da Bokking ou do hotel. Mas, atendimento do hotel ruim, café da manhã tb muito corporativo. Ar condicionado do quarto barulhento demais;5;;;;;;
9 de dezembro de 2024;Confortável e bem localizado, com algumas falhas.;A localização é ótima, perto de tudo em Recife e a a 5 minutos andando do melhor local da praia de Boa Viagem. Quarto confortável, vista do 34º andar é incrível, café da manhã variado, quarto dispõe de shampoo e condicionador em boas quantidades.;O check in demorou muito e o atendimento não foi excelente, a sala do café da manhã e o elevador fazem muito calor. Também é lamentável que tenha que se pagar 20 reais pelo estacionamento, apesar do entorno ser bem tranquilo de estacionar.;6;;;;;;
3 de dezembro de 2024;Atendimento péssimo - número de funcionários insuficiente;;O atendimento na recepção foi péssimo. No horário do check in havia apenas uma funcionária para o hotel gigantesco. Formou-se uma fila, foram quase 50 minutos de pé logo na chegada. A funcionária se desdobrava para atender demandas que chegavam a todo momento, inclusive fez check in de um grupo que sequer esperou com os demais na fila. Desorganização completa e descaso com os clientes. ;;;;;;;
;;;;;;;;;;
O café da manhã é de mediano para ruim. Qualidade dos alimentos não muito boa apesar da grande variedade. ;;;;;;;;;;
;;;;;;;;;;
"Se for encarar leve uma cadeira para aguardar na fila!""";5;;;;;;;;;
2 de dezembro de 2024;Péssima.;Localização boa e algumas pessoas da equipe educadas.;Quartos muito sujos. No meu tinha cabelos na cama (lençol, dentro do edredom e na toalha de rosto);;;;;;;
1º de dezembro de 2024;Ruim;A localização é muito boa, e as instalações do hotel são razoáveis (poderiam ser um pouco melhores).;O atendimento, em geral, é péssimo, seja no check-in, seja no check-out, tudo demora uma pérola. No restaurante é mais ou menos a mesma coisa. Faltam funcionários e os que ali trabalham não são assim tão eficientes.;3;;;;;;
28 de novembro de 2024;Aceitável;Apartamento com excelente vista, e localização ok para deslocamento de dia.;A noite, a região não é muito convidativa para deslocamentos a pé. Não havia informações sobre as tapiocas que poderiam ter sido solicitadas durante o café da manhã.;5;;;;;;
28 de novembro de 2024;Bom;A localização do hotel é excelente. Próximo à praia da Boa Viagem e ao mesmo tempo, próximo ao aeroporto. O café da manhã é muito bem servido.;O quarto merece uma reforma, pois está com cheiro de mofo e as dependências velhas.;7;;;;;;
24 de novembro de 2024;Limpeza deixou a desejar;Limpeza deixou a desejar no banheiro especialmente . As toalhas tinham cheiro . Café da manhã parecia um café da manhã em um campo de refugiados . Acredito que o local do café desproporcional .;;6;;;;;;
18 de novembro de 2024;Bom;Quarto e cama espaçosos;Limpeza. 2 baratas pequenas no banheiro e 1 barata pequena saindo de dentro da bancada do móvel da tv.;7;;;;;;
16 de novembro de 2024;Hotel razoável, mas custo benefício não vale.;Localização e camas.;Check in muito demorado, e o café.. suco de laranja aguado. Não achei custo beneficio bom.;4;;;;;;
10 de novembro de 2024;Razoavel;Já nos hospedamos outras vezes, o café da manhã deu uma piorada, antes tinha muitas opções. Acredito que eles devem voltar a melhorar o café.;;7;;;;;;
7 de novembro de 2024;Bom;Quartos;Café da manhã ;;;;;;;
"Atendimento dos funcionários""";7;;;;;;;;;
7 de novembro de 2024;Aceitável pelo preço;Cafe da manhã é bom! O quarto familia tambem;Ar condicionado quebrado e com barulhos e vazamento;7;;;;;;
5 de novembro de 2024;Conforto e localização muito boas, porém as comodidades estão cada vez mais fracas.;Quartos amplos, cama confortável, limpeza impecável.;Café da manhã sempre lotado, sempre as mesmas opções. Fiquei 3 dias dessa vez e foram as mesmas coisas da última viagem, durante os 3 dias. Inclusive um dos dias faltou coco para as tapiocas, em outro dia acabaram os bolos. Eles permitem a entrada de pessoas de fora, o que termina sobrecarregando a equipe. Internet horrível, sempre caindo e Box do banheiro desconfortável.;7;;;;;;
4 de novembro de 2024;Satisfatório;Localização muito boa e perto de supermercado e restaurantes;Tive que mudar de quarto em função do barulho gerado pelos aparelhos de arcondiconado. O frigobar também é muito barulhento (velho).;6;;;;;;
1º de novembro de 2024;Hotel enganação , não condições com padrão da proposta;So da área de alimentação malmente;Eu achei o hotel uma enganação, chegada bonita mas paguei 340 reais por uma diária e fui para outro hotel ;;;;;;;
Ar condicionado velho ;" cama solteiro extramente pequena quanto de qualidade baixa e hotel muito Carol""";3;;;;;;;;
30 de outubro de 2024;Satisfatório;Espaco do quarto ;;;;;;;;
"Cama boaaa enorme""";Ar condicionado faz muito barulho, horrivel estronda mesmo. Muito barulhento. Acordei varias vezes;;;;;;;;;
"Ralo do banheiro entupido. Tomava banho e a agua acumulava n descia""";6;;;;;;;;;
29 de outubro de 2024;Bom;Boa localização e quarto confortável.;Poucos elevadores para muita gente. Café da manha superlotado, sem mesa disponível, os hospedes tinham que ir para a recepção comer. Espaço pequeno para quantidade de pessoas, demora na reposição das comidas e bebidas que abavam a todo instante. Foi caótico. Acredito que o problema não era em relação aos funcionários, mas sim a estrutura pequena para muita demanda.;7;;;;;;
28 de outubro de 2024;Muito caro pelo que oferecem, não voltaria;Muito caro pelo que oferece!;;;;;;;;
"Não ficaria novamente neste hotel novamente.""";Passei um fim de semana e fiquei as duas noites sem dormir direito.;;;;;;;;;
O ar condicionado é em cima de você; o vento vem no seu rosto e direto nas pernas; ou você fica com frio e se desligar morre de calor.;;;;;;;;
Não tem um edredom; é uma coberta flanelada que chega ser vergonhoso.;;;;;;;;;
O salão para tomar café da manhã é um caos; super pequeno; um barulho terrível e as pessoas uma em cima das outras; devido o espaço ser pequeno. Além disse pra comer tapioca; omelete e outras coisas que eles oferecem só tem uma moça fazendo e a fila fica imensa. Um lugar pra você fazer a refeição em paz assim que acorda; você só passa nervoso. O edifício tem mais de 30 andares; é impossível um espaço daquela para a quantidade de pessoas.;;;;
;;;;;;;;;;
A piscina e academia são bem pequena; não compensa.;;;;;;;;;
Preço muito caro pelo que oferecem.;;;;;;;;;;
O checkin é uma fila grande também; não consigo entender quase 2025 essa burocracia; precisam melhorar bastante. ;;;;;;;;
;;;;;;;;;;
Assim que cheguei a descarga estava com defeito; mas foi prontamente resolvido pela manutenção. ;;;;;;;;;
A única coisa boa é a localização;" de resto não vale a pena e da próxima vez procurarei outras opções.""";3;;;;;;;;
28 de outubro de 2024;Bom;Localização ;;;;;;;;
"Funcionários educados""";Café da manhã muito cheio. O local é pequeno para a quantidade de hóspede.;;;;;;;;;
"Instalações antigas""";7;;;;;;;;;
27 de outubro de 2024;Bom;Pequeno almoço e a simpatia dos funcionários.;Tamanho do quarto e do sistema pra pedir a limpeza no quarto, não nos foi informado e 1 dia perdemos o direito da limpeza no quarto.;7;;;;;;
26 de outubro de 2024;Uma noite em Recife;Localização, tamanho do dormitório e estacionamento.;Acesso por meio de identificação por digital que não funciona direito, ar condicionado barulhento é black-out que não veda bem a luz no dormitório.;7;;;;;;
23 de outubro de 2024;Classificação do hotel incompatível com o que oferece.;Nada.;A limpeza do quarto deixou a desejar. ;;;;;;;
A cabeceira da cama estava toda encardida. ;;;;;;;;;;
Pedi a substituição de toalhas e esperei por quase uma hora para troca-las; o que só aconteceu depois que me dirigi a recepção do hotel.;;;;;;;;;
A grade de canais da TV não tinha uma variedade de canais compatível com a classificação do hotel. Além disso; havia barata andando na área em que o café da manhã era servido. ;;;;;;;;;
"Os travesseiros eram muito baixos e o lençol da cama estava furado.""";4;;;;;;;;;
22 de outubro de 2024;Hotel muito bom;Além das instalações, comodidade e conforto, está bem localizado.;Da cama e travesseiro e da iluminação.;7;;;;;;
21 de outubro de 2024;Acomodação simples e com café da manhã muito fraco;Está bem localizado;Limpeza e café da manhã;5;;;;;;
20 de outubro de 2024;Bom;Chuveiro e vista do andar 23 era muito boa;Café da manhã peguei ovo mechido tava cheio de casca horrível. O preço não condiz com o oferecido.;7;;;;;;
20 de outubro de 2024;Aceitável;Localização;Cheiro do quarto .;5;;;;;;
19 de outubro de 2024;Satisfatório;localização, limpeza e educação dos funcionários.;Café da manhã....percebi que o Hotel estava mais cheio e que não tinha comida suficiente como das outras vezes, faltou bolo, queijo, café, tinha pouco pão . E os funcionários agitados para poder repor e supri a demanda.;6;;;;;;
18 de outubro de 2024;Satisfatório;Bem localizado. Hotel imponente.;Café da manhã tumultuado, sem louça e sem talheres. Ambiente quente. Recepção pouco simpática.;6;;;;;;
18 de outubro de 2024;Bom;Vista;;7;;;;;;
17 de outubro de 2024;Dormi muito mal por causa do ar condicionado;Quarto era bem amplo e tinha uma bela vista.;O ar condicionado era muito ruim, está cheirando mal ou seja sem manutenção/higienização, o ar soprava direto em encima da cama e fazia muito barulho, no meio da noite, não conseguia dormir a cabei desligando e depois não conseguia dormir por causa do calor. Enfim, foi um experiência muito ruim.;7;;;;;;
17 de outubro de 2024;decepcionante;localização meio afastada da praia, café da manhã bom;fiz pedido de entrar mais cedo na hospedagem pois meu voo chegou em recife às 6h00 da manhã, não me permitiram nem propondo um valor maior na diária, me fizeram me trocar de roupas no banheiro da piscina;6;;;;;;
12 de outubro de 2024;nada me agradou, não voltarei;Nada me agradou, não voltarei;nada me agradou, não voltarei;1;;;;;;
12 de outubro de 2024;Agradável mas poderia melhorar;A estrutura do prédio é muito boa, a segurança, os acessos via digital .;Acredito que a gestão do hotel deixa um pouco a desejar. Quartos com um pouco de cheiro de mofo, poderiam melhorar na manutenção/limpeza. O café da manhã também é fraco considerando o padrão do hotel. Tem boa variedade, mas, poderiam ser de melhor qualidade.;7;;;;;;
11 de outubro de 2024;Medio;Localização café da manhã e funcionários do check-in e check-out;O quarto de casal com 2 camas de solteiro ;;;;;;;
Ar condicionado antigo barulhento e controle não funciona ;;;;;;;;;;
Quarto fedido;;;;;;;;;;
"Quarto ficou sem arrumar""";6;;;;;;;;;
9 de outubro de 2024;mais ou menos;Prédio bom.. Deveria ser mais;Funcionários muito enjoados....nao liberam chec in.. Tudo cobra.. E comida horrível do restaurante anexo;6;;;;;;
8 de outubro de 2024;Ruim;Estava muito lotado, o salão do café da manhã é abafado e apertado. As fotos indicam ser em frente à praia e é bem longe .;Localização e preço;6;;;;;;
8 de outubro de 2024;Esperava mais;O quarto é confortável;O cafe da manha deixa muito a desejar. Pouca variedade de sucos, de pães, a reposição não é boa e os sucos que tem nao são bons considerando os serviços de outros hoteis na região. Solicitei um pedido ao ifood e ao chegar verifiquei que o hotel não disponibilizava pratos e talheres. Me ofereceram uma tampa de embalagem para servir de prato. Bem decepcionante;5;;;;;;
6 de outubro de 2024;Não aconselho,pelo menos nesse período que apesar de cheio é mesmo sendo baixa estação deveria e poderia ter muito mais;Quarto e limpeza;Café sem opções;;;;;;;
Fraquíssimo;;;;;;;;;;
Proteínas restritas;;;;;;;;;;
Sem opções sem glúten;;;;;;;;;;
Até bolo dois tipos seco e sem atrativo algum;;;;;;;;;;
;;;;;;;;;;
Jantar ;;;;;;;;;;
Pessimo um simples frango c molho de ervas q véio seco esturricado e claro sem o molho de ervas arroz lavado nem um básico azeite doce e pimenta do reino tinha.;;;;;;;;;;
;;;;;;;;;;
Pessimo é grosseiro o mâitre do restaurante.;;;;;;;;;;
Na quinta feira à noite as 18 45 cheguei do congresso e adentrei ao restaurante q estava aberto e vazio ;de forma grosseira surge o maître e diz SÓ ABRE AS 19h ;"nem boa noite ! Se o Maître é assim imagino o restante .""";5;;;;;;;
2 de outubro de 2024;Péssima experiência. Viagem a trabalho. Internet do hotel sem funcionar. Reportei o problema à recepção, que nada fez pa;Localização;Tudo. Sem internet.;1;;;;;;
1º de outubro de 2024;Preferiria nunca ter estado e/ou conhecido o hotel. Uma das piores experiências da vida.;O atendimento do funcionário Enildo, do restaurante.;A hospedagem inteira. A comida do café da manhã era ok, mas os talheres pareciam gordurosos/mal lavados. O quarto e as instalações do andar eram velhos, com aspecto de mau cuidados. As toalhas do banheiro estavam muito mal cheirosas (trocaram, mas o mal cheiro se manteve nas toalhas e no ambiente). O xampu tinha sensorial e cheiro de detergente barato, enquanto o condicionador tinha cheiro de xixi.;4;;;;;;
30 de setembro de 2024;Falta de cordialidade no atendimento;Gostei da estrutura.;A recepção do hotel não atende chamadas do apartamento. ;;;;;;;
"O atendimento não é bom. Funcionários sem empatia...""";7;;;;;;;;;
22 de setembro de 2024;Café da manhã não é muito bom, o ovo estava com cheiro ruim, os paes estavam duros não estavam frescos, faltava muita co;Tudo limpinho, perfeito, .;Atendimento nota mil, funcionários queridos e solicitos .;7;;;;;;
15 de setembro de 2024;Não oferece o tanto que cobra. Perigoso para quem viaja sem carro.;Bom estacionamento;;;;;;;;
Boa estrutura; porém descuidada;;;;;;;;;
Atendimento cordial das(os) recepcionistas;;;;;;;;;;
"Proximidade dos 02 principais shoppings da cidade.""";Funcionários grossos e mal educados, principalmente da cozinha;;;;;;;;;
Banheiros sujos com mofo nos rejuntes;;;;;;;;;;
Toalhas de banho (inclusive as repostas) velhas e com com mal cheiro;;;;;;;;;;
Ralo da pia entupido (acumulando água);;;;;;;;;;
Restaurante terceirizado não cede pratos e talheres; apenas se for para consumir do próprio restaurante;;;;;;;;;
Entorno perigoso; principalmente para quem transita sem carro;;;;;;;;;
15 de setembro de 2024;Bom;No geral é um hotel confortável, e bem localizado. Tudo limpo.;O café da manhã poderia ser melhorado, e o interior do hotel não é tão bonito.;7;;;;;;
13 de setembro de 2024;Aceitável;Localização.;Chegamos quase meia noite, o quarto de casal que reservei não tinha ... colocaram eu e meu marido em um com duas camas de solteiro. Chegando no quarto...ele tava sujo com papel higiênico usado no lixo e tapetes molhados... o corredor cheirava esgoto muito forte. Era no sexto andar. Fui reclamar mudaram a gente pra outro quarto que cheirava muito forte esgoto... novamente trocaram a gente de quarto e deu certo.. mas já era 1:30 da manhã.;5;;;;;;
8 de setembro de 2024;Ok;Boa localização e de fácil acesso;Precisa de reforma. O disjuntor estava sem tampa e localizado em cima da cama. Café da manhã regular.;6;;;;;;
3 de setembro de 2024;Muito boa, equipe muito atenciosa e prestativa;O café da manhã muito completo porém senti falta da opção do leite Zero Lactose e os omeletes são feitos na chapa e não em frigideira que é o correto. O omelete vem prensado e meio queimado tipo pão de hamburguer.;;;;;;;;
"Ótima localização e perto da praia""";O chuveiro do banheiro poderia ser mais alongado ou direcionável, pois fica muito próximo dos controles de água quente/fria fazendo ficar com o corpo quase colado na parede. Piscina muito fria, não deu para entrar e sauna umida estava em manutenção;7;;;;;;;;
2 de setembro de 2024;Bom;Quarto confortável, atendentes atenciosos.;Higiene do café da manhã. Tudo engordurado, máquina de café com problema vazando na lateral.;7;;;;;;
31 de agosto de 2024;Regular;Conforto;Limpeza;7;;;;;;
30 de agosto de 2024;No geral bom hotel. Café da manhã deixou a desejar.;Quarto espaçoso;Banheiro com cheio ruim;7;;;;;;
