data_avaliacao;titulo;comentario_positivo;comentario_negativo;nota;;;;;;
30 de junho de 2023;não sei se voltaria...;A estadia foi ótima, mais o cafe da manhã deixa a desejar, ficamos 5 dias e todos os dias o cafe FOI O MESMO, omelete horrível, não gostei... outra situação foi que minha filha de 17 anos estava em uma delegação e foi no hotel e não pode subir no meu ap. só se pagasse 40 reais, achei um absurdo.;Cafe da manha...;8;;;;;;
30 de junho de 2023;Excelente;Sim;Tudo ótimo;10;;;;;;
29 de junho de 2023;Voltaria com certeza!;Todos os colaboradores muito simpáticos e sorridentes, higiene e aconchego em todos ambientes, café da manhã mais que completo. Voltaria com toda certeza 👏🏼;A piscina estava suja e senti falta da limpeza.. não utilizamos a piscina por este motivo. Único ponto a melhorar, ao nosso ver.;8;;;;;;
29 de junho de 2023;Muito bom;Da acomodação ( quarto) e banheiro bem equipados.;A recepção dos funcionários, sem um sorriso no rosto e vontade para resolver nossas dificuldades. Parabenizo um atendente que nos recepcionou na nossa chegada, infelizmente não me recordo o nome.;;;;;;;
"Restaurante terceirizado que nos cobrou talheres para refeições que fizemos no quarto. No momento do check out reclamamos e este valor foi excluído. Café da manhã com pão francês que não era fresquinho e pouca variedade de frios.""";8;;;;;;;;;
28 de junho de 2023;Quarto excelente desde instalações limpíssimas a cama, travesseiros e roupas de cama maravilhosas!!!!;O quarto foi ótimo, porem poderia ter um custo mais em conta para o q oferece;O local de localização do hotel é esquisito e mostra-se perigoso por passar em locais suspeitos.;9;;;;;;
28 de junho de 2023;Muito bom;Estrutura, atendimento e localização;As paredes são finas e a gente escuta o hóspede do lado;9;;;;;;
27 de junho de 2023;Excelente;Tudo;Sem reclamações;8;;;;;;
25 de junho de 2023;Agradável!;Ficamos uma diária! Foi tudo bom.;;9;;;;;;
24 de junho de 2023;Boa opção em Recife;Vista do quarto, tecnologia, atendimento;Café, comida, tv;9;;;;;;
23 de junho de 2023;pretendo voltar;cafe da manha muito bom, muitas opções e tudo muito gostoso.;nao gostei pq do horario que ele tava marcado pra iniciar ainda nao estava tudo servido, tapioquinha tinha que esperar muito pra poder ficar pronto.;10;;;;;;
22 de junho de 2023;Bom custo benefício!;Conforto geral, atendimento e localização!;O café da manhã é bom mas o hotel estava muito cheio ao ponto de faltar pratos e talheres para comer.;8;;;;;;
21 de junho de 2023;Razoável;Localização e serviço da recepção.;Higiene do banheiro, academia precisa de manutenção com relação ao aparelhos e café da manhã precisa melhorar alguns itens (salada de fruta, goma de tapioca, bolos, comida de milho).;8;;;;;;
21 de junho de 2023;Boa noite de sono;Os quartos são espaçosos;O café da manhã tem boas variedades, mas só no final do Meu café fiquei sabendo que eram servidas tapiocas e omeletes feitos na hora￼.;9;;;;;;
20 de junho de 2023;Fantástico;Pedimos uma manta e a recepção não informou a camareira. Esperamos 40 minutos pra chegar.;Senti falta de comidas de milho, típicas desta época de festas juninas aqui no nordeste.;9;;;;;;
17 de junho de 2023;Fantástico;;Acho que os funcionários da recepção poderiam ser mais flexíveis para situações de emergência. Cheguei no hotel por volta de 23h por conta de um rio que transbordou nas proximidades e não me permitiu chegar no meu destino. Tentei negociar uma tarifa menor, mas não houve acordo. Paguei uma diária alta pra ficar de 23h do dia que cheguei até às 7h do dia seguinte.;9;;;;;;
16 de junho de 2023;Fantástico;Gosto do conforto. Da praticidade em reservar.;;;;;;;;
De poder chegar a hora que posso devido ao trabalho.;;;;;;;;;;
Tudo funcionando perfeitamente incluindo o ar condicionado que pra mim é o item essencial.;;;;;;;;;;
"Café da manhã excelente.""";A princípio nada.;9;;;;;;;;
15 de junho de 2023;Fantástico;O hotel está em um lugar muito bom!;;;;;;;;
"O atendimento foi excelente!""";O Wi-Fi deixa a desejar!;9;;;;;;;;
15 de junho de 2023;recomendo o local;muito confortável vista linda;café da manhã é sempre o mesmo . poderiam variar mais;8;;;;;;
14 de junho de 2023;Acolhedora.;O café da manhã foi bom, não digo excelente, por que não houve variedade durante minha estadia, todos os dias tinha a mesma coisa, mas nada que fosse ruim, apenas mudaria o cardápio para, até criar uma expectativa ao hóspede.;O serviço de quarto. Se tem um quarto para 3 hóspedes, tem que ter acessórios para os 3. 3 copos, 3 cobertores, 2 travesseiros em cada cama. E a troca de toalhas deve vir acompanhada da troca de copos usados por limpos e qualquer outro utensilio usado pelo hóspede.Caso que não aconteceu.;9;;;;;;
12 de junho de 2023;boa;conforto e localização;café da manhã;10;;;;;;
12 de junho de 2023;Muito bom;;café da manhã super lotado.;8;;;;;;
12 de junho de 2023;Ótimo Custo benefício;Quarto muito confortável e super limpo, localização boa também.;Café da manhã foi um pouco tumultuado. A comida é boa, mas falta organização da equipe.;9;;;;;;
10 de junho de 2023;Fantástico;Quarto confortável para 3 pessoas.;A internet (wifi) não funcionava direito em nenhum momento. Tive que usar os dados móveis do celular durante toda a estadia.;9;;;;;;
8 de junho de 2023;Muito bom;localização;ar. condicionado fica em cima da cama jogando o fluxo de ar direto;8;;;;;;
4 de junho de 2023;Muito bem localizado. Ótimo custo/benefício;A localização.;Não gostei dos travesseiros;8;;;;;;
4 de junho de 2023;Excepcional;O quarto que reservamos tinha uma vista incrível. O café da manhã maravilhoso. Melhor cuscuz que já comi.;Não tenho nada a reclamar.;10;;;;;;
2 de junho de 2023;Confortável e tranquila;Conforto dos quartos e limpeza;Café da manhã possui pouca opção, todos os dias era a mesma opção de cardápio;9;;;;;;
30 de maio de 2023;excelente! em breve estaremos de volta;camas confortáveis;;;;;;;;
quarto bem organizado ;;;;;;;;;;
localização;;;;;;;;;;
"excelente atendimento""";limpeza;10;;;;;;;;
29 de maio de 2023;Hotel bom padrão, com ótimo custo benefício;infraestrutura;;10;;;;;;
29 de maio de 2023;Boa localização. Bom atendimento. Café da manhã ok. No entanto, precisam melhorar na hora do checkin;Boas instalações, academia e café da manhã. A localização é muito boa também.;A longa espera para fazer check in. Não oferecer ferro se passar roupa de forma gratuita.;8;;;;;;
25 de maio de 2023;dias maravilhosos;localização, atendimentos, funcionários, a estrutura e a limpeza.;;9;;;;;;
25 de maio de 2023;Excepcional;Local muito bom , limpeza ótima;;10;;;;;;
23 de maio de 2023;Fantástico;Tudo: localização, atendimento, limpeza, estacionamento que é coberto, além de ter restaurantes bons por perto,, sem precisar ir de carro.;Nada a reclamar.;9;;;;;;
22 de maio de 2023;boa;limpeza, conforto. estava tudo ok!;nada;9;;;;;;
22 de maio de 2023;Muito bom;Atendimento, conforto dos quartos e agilidade dos funcionários.;No começo o hotel tinha um café da manhã maravilhoso, inclusive cheguei a indicar a hospedagem para familiares. Ontem me decepcionei, café mais básico e por o espaço estar cheio, eu e meu esposo tivemos que sentar na área do bar, onde tivemos que trocar as cadeiras por estarem com o assento afundado. Precisa de atenção em relação a isso e não deixar a qualidade cair, como observei em outros hotéis de Recife. Mas no geral o hotel é muito bom, mesmo assim indico a hospedagem.;8;;;;;;
21 de maio de 2023;maravilha;localização, instalações;colchão e travesseiros;8;;;;;;
20 de maio de 2023;Foi legal!;Do salão de beleza!;É um pouco distante de tudo, mas fui com a finalidade de estar no Festival TRIP.;;;;;;;
"Foi ótimo!""";9;;;;;;;;;
19 de maio de 2023;Excepcional;BOM;;10;;;;;;
17 de maio de 2023;Excepcional;Das acomodações do hotel.;;10;;;;;;
17 de maio de 2023;Muito bom;Atendimento da equipe do restaurante (garçons e moça da tapioca), é fantastico.;Estrutura do quarto poderia melhorar.;8;;;;;;
16 de maio de 2023;Excepcional;De tudo.;Nada.;10;;;;;;
15 de maio de 2023;;;;10;;;;;;
15 de maio de 2023;Confortável.;Boa variedade de itens no café da manhã.;Nada para reclamar.;10;;;;;;
15 de maio de 2023;Muito bom;;A TV era pequena, não era smart e os canais disponíveis não foram interessantes;8;;;;;;
14 de maio de 2023;bem localizado, confortável e café delicioso.;conforto;toalhas;10;;;;;;
9 de maio de 2023;Ótima;Bom! com itens variados;Gostei de tudo;10;;;;;;
5 de maio de 2023;Excepcional;tudo perfeito, além do custo benefício;;10;;;;;;
5 de maio de 2023;bom custo benefício;Instalações no geral, quarto, bom custo benefício.;Check in demorado, café da manhã tumultuado (espaço pequeno pra quantidade de pessoas que circulam no hotel).;8;;;;;;
4 de maio de 2023;Fantástico;acomodações confortáveis;recepção demorou mais de 1 hora para atender-nos . havia uma grande fila;9;;;;;;
4 de maio de 2023;ótima;limpeza , localização;Passei mas 1:00 na fila para fazer check-in muito tempo em;;;;;;;
"pé 😞""";10;;;;;;;;;
4 de maio de 2023;satisfatória;Muito bom o café da manhã.;;;;;;;;
A cortesia dos funcionários.;;;;;;;;;;
"A disponibilidade de estacionamento""";O ruído inconveniente do exaustor do exaustor do banheiro;9;;;;;;;;
3 de maio de 2023;Relax;O banho 🚿 é muito bom.;A fechadura eletrônica apresentou defeito.;10;;;;;;
2 de maio de 2023;Boa.;localização, quarto, organização, limpeza, café da manhã, excelentes.;Precisa pagar 20,00 a diária do estacionamento, janela do quarto no 32º andar em que estava com vazamento, começou a chover e estava penetrando água pela janela no quarto, tive que pedir a camareira toalhas para colocar na janela e piso do quarto devido a quantidade de água que entrava.;9;;;;;;
2 de maio de 2023;Muito bom;;Check-in lento;8;;;;;;
2 de maio de 2023;Excepcional;Quarto incrível e boa localização. Foi muito agradável a estadia, fiquei em um quarto muito bom e café da manhã estava muito delicioso e com muitas opções.;;10;;;;;;
2 de maio de 2023;Excepcional;;Piscina muito gelada.;;;;;;;
;;;;;;;;;;
Para o porte do Hotel;" deveria ser aquecida.""";10;;;;;;;;
1º de maio de 2023;Muito bom;Conforto, localização, o chuveiro é maravilhoso.;Check in demorou uma vida. Nunca vi um check in tão demorado. Os funcionários não têm boa vontade;8;;;;;;
1º de maio de 2023;Foi um final de semana muito bom;Quarto amplo, com vista para o mar.;Apenas um espelho estreito na lateral da cama, TV antiga, qualidade ruim de imagem.;9;;;;;;
1º de maio de 2023;Avaliação;Ambiente limpo, organizado e ótimas instalações, funcionários super qualificados e acolhedores. Café da manhã incrível!;Ar condicionado do apartamento 3203 com algum defeito. Desligava sozinho no meio da noite e o controle do ar não conectava com ele. Para ligar e desligar, só direto no botão do ar.;;;;;;;
Fora isso;" a vista do quarto superou minhas expectativas. Um dia de sol com uma vista expectacular!""";9;;;;;;;;
30 de abril de 2023;Bom custo benefício;Café da manhã muito bom, com várias opções e saboroso. Cama com colchão bom e bem espaçoso. Ótimo chuveiro. Tem muitos apartamentos, mas tem três elevadores para compensar. Ar condicionado bom.;Ao chegarmos no hotel, ficamos 1 hora na fila para realizar o check-in. Muitas pessoas na fila para check-in e poucos funcionários para atender. No quarto, ocorreram barulhos semelhantes a uma furadeira ou pressão de água, muito alto, em pleno domingo de manhã bem cedo.;8;;;;;;
29 de abril de 2023;Excelente hotel, vala a pena!;Tudo;Nada;10;;;;;;
27 de abril de 2023;Excepcional;quarto muito confortável, ótima vista, e localização;;10;;;;;;
27 de abril de 2023;Apesar dos pesares, gostei.;quarto novo, aconchegante. boa localização.;café da manhã com poucas opções e o checkin muito demorado, havia uma fila enorme.;8;;;;;;
26 de abril de 2023;Fantástico;Gostei das acomodações, a localização, apenas o check in que demora muito e o café da manhã que não é tão variado. Mas super indico para hospedagem.;A fila de espera no check in e no checkout;9;;;;;;
24 de abril de 2023;Muito bom;Custo benefício, apartamentos confortáveis, boa localização;Estacionamento pago;8;;;;;;
24 de abril de 2023;Muito bom nota 1000;Café da manhã e serviço de quarto;atenção dos funcionários;10;;;;;;
24 de abril de 2023;Fantástico;;A velocidade da internet deve melhorar, alguns serviços de streaming não funcionaram por problema de conexão.;9;;;;;;
21 de abril de 2023;Excepcional;Tudo foi perfeito.;Nada a declarar;10;;;;;;
21 de abril de 2023;Muito bom;Quarto bem confortável, ar condicionado gelando bem, uma boa localização.;;8;;;;;;
21 de abril de 2023;boa;aparência;cheiro dos cobertores.;9;;;;;;
21 de abril de 2023;hotel muito bom, relativamente perto do aeroporto, vista maravilhosa;hotel muito bom, a vista do 34º andar é maravilhosa, quarto bom;café da manhã poucas opções.;9;;;;;;
18 de abril de 2023;Ótima opção.;Do quarto e da piscina.;Deveria ter bolo de rolo no café da manhã e outras opções de pães doces.;9;;;;;;
15 de abril de 2023;Fantástico;A vista é maravilhosa e o quarto é confortável.;O café da manhã está abaixo do nível (e do preço) do hotel.;9;;;;;;
12 de abril de 2023;Bom hotel. Voltaria a ficar hospedado;O hotel é bom no geral. O café da manhã também é gostoso e tinha uma boa variedade, apesar de ser o mesmo todos os dias. Para o meu gosto, o café em si era fraco, tanto o da máquina, quanto o passado. ;;;;;;;;
A localização é boa; e era até perto da praia;" mas se considerar que não dá para nadar na praia de Recife então não faz diferença não ser beira mar. Há um shopping perto e alguns restaurantes e cafés.""";;9;;;;;;
10 de abril de 2023;Satisfeito com o hotel!;De tudo!;Internet no andar 29, PÉSSIMO.;10;;;;;;
9 de abril de 2023;Fantástico;;Cobram para levar talheres ao quarto;9;;;;;;
6 de abril de 2023;Fantástico;Localização e disponibilidade do dia em que precisamos;O restaurante , pessoal despreparado para atender , explicações sobre os pratos e demora no atendimento .;9;;;;;;
5 de abril de 2023;bom custo benefício;cafe da manha, chuveiro.;ar condicionado em cima da cama.;8;;;;;;
4 de abril de 2023;agradável;acomodação;nada a referir.;9;;;;;;
31 de março de 2023;Acessibilidade,conforto, receptividade;Gostei da receptividade dos funcionários , apto confortável e a limpeza excelente.;Gostei de tudo;9;;;;;;
27 de março de 2023;Fantástico;Acomodações limpas e confortáveis. Camas confortáveis e amplas, o quarto triplo era bem espaçoso. Café da manhã com boas e diversas opções regionais.;Wi-fi não pegava sempre e demora demasiada para fazer o check-in, aguardamos cerca de 2h na fila. Em dias de feriado, como foi o nosso caso, poderiam rever o sistema de check-in, até antecipando-o, a fim de agilizar.;9;;;;;;
26 de março de 2023;Muito bom;Localização, infraestrutura e da conservação do hotel como um todo, muito bem cuidado.;;8;;;;;;
25 de março de 2023;Recomendo;A vista surpreendente que eu tive do meu quarto para cidade.;;10;;;;;;
21 de março de 2023;Muito bom;A cama é excelente.;O chuveiro com água quente demorava a esquentar.;8;;;;;;
20 de março de 2023;Poderia ter um custo benefício melhor.;limpeza;tamanho do quarto.;8;;;;;;
20 de março de 2023;Muito bom;Bem localizado. Quarto limpo e confortável.;Check-in lento.;8;;;;;;
18 de março de 2023;Fantástico;ótimo custo benefício;ficamos três dias e o quarto não foi limpo;9;;;;;;
16 de março de 2023;Foi legal;Café da manhã muito bom, Um pouco longe da praia, porém compensou o valor;Atendimento na hora do check-in foi lento e demorado;8;;;;;;
16 de março de 2023;Excepcional;Café da manhã bem completo, com boas opções e variedades e o espaço super confortável. Área de lazer com piscina e sauna e a academia do hotel fizera diferença na estadia, além de claro a localização próxima do aeroporto, a vista do quarto e a opção de maleiro para que pudéssemos deixar as bagagens após o checkout.;Tivemos uma estádia ótima, uma sugestão é que a academia poderia dispor de mais anilhas para os exercícios.;10;;;;;;
16 de março de 2023;Excepcional;O hotel é ótimo, muito bem localizado, café da manhã muito bom e variado. O hotel entrega o que apresenta, tem piscina, sauna, academia, área de convenções, ampla área para relaxamento. O quarto é bom e confortável, até que é silencioso para uma capital, pelo menos no 23º andar... O estacionamento é pago à parte. O restaurante funciona também para almoço e jantar, com um cardápio muito bom e um preço totalmente dentro do razoável.;;10;;;;;;
13 de março de 2023;Tudo perfeito com minha estadia;Tudo estava ótimo;Gostei de tudo;10;;;;;;
12 de março de 2023;Otimo custo benefício;Quarto amplo, cama gigante e confortável, muito limpo, vista incrível (peça pela possibilidade de se hospedar no alto), funcionários atenciosos, café da manhã bom.;Internet do hotel não tem capacidade suficiente para atender o mesmo caso esteja cheio (como estava). Travesseiros podiam ser um pouco melhores e o café da manhã um pouco mais variado.;9;;;;;;
10 de março de 2023;boa;restaurante;;9;;;;;;
9 de março de 2023;Ótimo hotel com reservas ao restaurante.;A localização e custo-benefício são ótimas. Equipe prestativa e atenciosa. Quartos limpos e com bela vista, e extramente confortáveis. O isolamento acústico dos quartos ajuda a dormir.;Não atende bem às pessoas com necessidades específicas. Por exemplo, não tem alimentos sem lactose, apesar de terem garantido isso na reserva (sou altamente intolerante à lactose). Não tem dieta sem glútem (tenho doença celíaca). O restaurante não se mostrou interessado e compreensivo.;8;;;;;;
9 de março de 2023;Vista espetacular! Ótimo custo x benefício. Recomendo muito!;A vista do quarto da janela do 34º andar é incrível!!!;;;;;;;;
"Os funcionários são atenciosos e a limpeza é impecável.""";O café da manhã poderia melhor. ;;;;;;;;;
"São poucas opções de suco e o capuccino é muito doce porque não há como controlar o açúcar da máquina. Isso poderia ser avisado.""";10;;;;;;;;;
9 de março de 2023;Apesar da internet não funcionar o quarto é muito limpo e confortável!;Pontos positivos: quarto- Cama grande limpa e muito confortável, assim como seus travesseiros. ;;;;;;;;
Janela grande; bom espaço de armário; mesa e cadeira; banheiro amplo e chuveiro excelente; quarto bem ventilado; iluminado e ar condicionado excelente. ;;;;;
Limpeza feita diariamente;" café da manhã completo e gostoso.""";Pontos negativos: Wi-Fi não chegava no meu quarto, sinal muito ruim e instável no celular e impossível conexão no notebook, quando precisava trabalhar tinha que ir até a recepção para ter conexão.;;;;;;;;
;;;;;;;;;;
"Foram 5 darias de hospedagem e não houve troca de toalhas e fiquei dois dias sem toalha de piso no banheiro pois durante a limpeza retiraram mas não repuseram.""";8;;;;;;;;;
8 de março de 2023;Excelente localização e estrutura;Localização, estrutura, café da manhã;Nada;9;;;;;;
8 de março de 2023;Bom custo-benefício;quarto simples, mas ok;nada a reclamar;8;;;;;;
8 de março de 2023;regular;quarto;piscina;8;;;;;;
7 de março de 2023;Ótimo custo benefício. Funcionários atenciosos!;Quarto amplo, com bela vista pro mar (fiquei no 28º andar). Chuveiro forte, a gás.;Ar condicionado fica bem acima da cama e a função “swing” não estava funcionando. O vento ficou muito em cima de mim, me incomodou um pouco.;8;;;;;;
7 de março de 2023;Excelente estadia, localização privilegiada.;Localização excelente e vista do quarto ótima! Quarto limpo, organizado;Ar condicionado um pouco barulhento e check-in muito demorado;10;;;;;;
6 de março de 2023;P E R F E I T A;tudo , não teve nenhum defeito!;na hora de ir embora, fiquei triste por que não puder ficar mais 😂🥲;10;;;;;;
6 de março de 2023;Muito bom;Ótimo Café da manhã;;8;;;;;;
6 de março de 2023;Excepcional;Tudo otimo;;10;;;;;;
4 de março de 2023;Muito bom;Localização central, acomodação espaçosa;Gostei de tudo;8;;;;;;
2 de março de 2023;Excepcional;Hotel perfeito para descansar e se preparar para um vôo no dia seguinte. Ótimas acomodações, bem limpas e organizadas, e excelente café da manhã.;;10;;;;;;
1º de março de 2023;Volto em breve !;Chalés confortáveis e limpos, local paradisíaco.;;;;;;;;
Local para quem quer descanso e laser.;;;;;;;;;;
Restaurante excelente;" comida maravilhosa""";;10;;;;;;;
28 de fevereiro de 2023;Boa;Café da manhã simples;O café da manhã. Demora no check-in;9;;;;;;
28 de fevereiro de 2023;Fantástico;Da cama, do chuveiro, da limpeza, da acústica, da localização, do atendimento.;Do café da manhã, que poderia ter mais variedades e da entrada no estacionamento, que toda vez tinha que chamar o segurança para a abertura da cancela, poderia ser um acesso mais ágil com algum tipo de cartão temporário.;9;;;;;;
27 de fevereiro de 2023;Hospedagem Super bem localizada;Tudo maravilhoso. Quarto amplo, camas confortáveis, ar condicionado em pleno funcionamento, banheiro grande, chuveiro maravilhoso. Enfim tudo ótimo;Apenas achei o café da manhã fraco, sempre as mesmas opções, faltou uma sanduicheira para fazer um sanduíche quente. Os pães sempre secos, acho que ficavam muito tempo exposto e isso ressecava os pães. ;;;;;;;
Sempre tinha duas opções de bolos porém sem gosto;" parecia bolos de caixa. Acho que por ser um hotel desse porte poderiam melhorar nas opções de café da manhã""";9;;;;;;;;
27 de fevereiro de 2023;Pit stop;Localização ótima. ;;;;;;;;
Café otimo; funcionários atenciosos e o fato de ter estacionamento coberto;" faz toda diferença..""";O cheiro do cigarro que vinha de outro quarto.;8;;;;;;
26 de fevereiro de 2023;Recife continua uma opção excelente;conforto. atendimento restaurante chuveiro ótimo! tudo perfeito;;10;;;;;;
26 de fevereiro de 2023;Muito bom;quarto amplo e limpo;Paredes finas, e muito barulho durante toda a madrugada. mesmo estando no 24 andar;8;;;;;;
26 de fevereiro de 2023;Me senti em casa;Receptividade dos funcionários, limpeza,organização, conforto;;10;;;;;;
26 de fevereiro de 2023;Muito bom;A localização a muito boa, o preço foi ótimo, os funcionários sempre atenciosos.;O café da manhã não condiz com o hotel.;8;;;;;;
24 de fevereiro de 2023;Excepcional;Conforto e atendimento.;Nenhuma reclamação.;10;;;;;;
24 de fevereiro de 2023;Fantástico;A localização muito boa!;O shampoo e condicionador não são de boa qualidade. Não fazia uma higienização boa dos cabelos, tanto que, precisei comprar em uma farmácia. ;;;;;;;
;;;;;;;;;;
Fica a dica para o hotel.;;;;;;;;;;
;;;;;;;;;;
Também não gostei dos travesseiros.;;;;;;;;;;
;;;;;;;;;;
A luzes do quarto eram meio penumbra;" o banheiro era bem mais iluminado que o próprio quarto.""";9;;;;;;;;
24 de fevereiro de 2023;hotel top, vale a pena.;tudo;checkin demorou. como era feriado, tinha muitos hóspedes e poucos atendentes. isso causou caos no café da manhã também.;10;;;;;;
23 de fevereiro de 2023;Excepcional;Tudo ❤️;;10;;;;;;
23 de fevereiro de 2023;Bom;Ótima localização, excelente café da manhã, estrutura muito boa.;;8;;;;;;
23 de fevereiro de 2023;Retornando ao Carnaval!😄👏😊;Hotel localizado na rua Maria Carolina,661 em Boa Viagem com estacionamento pago coberto há ÷-700 metros da praia.;;;;;;;;
Perto de supermercado (Carrefour); farmácias; restaurantes etc...;;;;;;;;
 Recepção 24 horas; bom atendimento; especialmente a IONARA; educada; gentil; atenciosa; sempre te atendendo com um sorriso no rosto.;;;;
Ótimo café da manhã; bem variado com boas opções e bom atendimento. ;;;;;;;;;
Jantamos no restaurante à Lacarte; comida deliciosa; indico costelinha de porco ao molho barbecuer com arroz de brócolis e batatas; tudo de bom!😊;;;;;;;
Quartos amplos e limpos; camas confortáveis; lençóis cheirosos e macios. ;;;;;;;;
Banheiro amplo e bem higienizado; toalhas grandes e macias. ;;;;;;;;;
Piscina; não é grande; mas bem agradável. ;;;;;;;;
En toda área comum do hotel tinha sempre alguém limpando. Quero destacar o DANILO da limpeza;" sempre atencioso e disposto a nos ajudar! Recomendo!😊""";Nada tenho a reclamar!;;;;;;;;
;;;;;;;;;;
Fomos bem atendidas;" apesar de termos ido no CARNAVAL com um fluxo muito grande de pessoas.""";9;;;;;;;;
23 de fevereiro de 2023;;;;10;;;;;;
23 de fevereiro de 2023;perfeita.;tamanho do quarto.;não tenho nada, pra dizer que não gostei.;10;;;;;;
22 de fevereiro de 2023;Excepcional;Localização, atendimento e praticidade.;;10;;;;;;
22 de fevereiro de 2023;Básico;Quarto e localização;Café da manhã;9;;;;;;
22 de fevereiro de 2023;Hotel de excelente localização e confortável.;Localização excelente. Café da manhã muito bom também. O hotel conta com garagem por 20 reais por diária e vale muito a pena, pois é muito seguro e coberto, principalmente pra mim que fui em época de carnaval. Os funcionários são muito educados.;;10;;;;;;
22 de fevereiro de 2023;Excepcional;TUDO TRANQUILO;;10;;;;;;
22 de fevereiro de 2023;nota 8;localização;espaço para café da manhã. lotado!!!;8;;;;;;
22 de fevereiro de 2023;Excepcional;localização e atendimento da recepção.;o café p quem vai passar várias dias é sempre o mesmo. podia variar um pouco.;10;;;;;;
22 de fevereiro de 2023;Excepcional;Café bem servido. Excelentes profissionais no atendimento. Quarto limpo e amplo.;;10;;;;;;
21 de fevereiro de 2023;Falta de informações para o carnaval;Instalações perfeitas;Funcionários não sabiam dar informações do carnaval na cidade;10;;;;;;
20 de fevereiro de 2023;fantástica;Da limpeza e das instalações;Nada.;10;;;;;;
