data_avaliacao;titulo;comentario_positivo;comentario_negativo;nota;;;;;;
Pedi um copo; uma faca e um garfo ao serviço de quarto; e recebi os mesmos DE PLÁSTICO;" e fui cobrado por isso.""";ABSURDO!;;;;;;
Pedi um copo; uma faca e um garfo ao serviço de quarto; e recebi os mesmos DE PLÁSTICO;" e fui cobrado por isso.""";3;;;;;;
12 de setembro de 2022;Decepcionante;Localização boa;Check-in demorado, nosso cartão não abria a porta do quarto quando chegamos, demorou 30min para nos mudarem de quarto. O cartão do quarto sempre desmagnetizava precisando descer na recepção TODA vez para ir para o quarto, serviço ruim, corredores sujos. Apenas 2 elevadores para 33 andares!!! E no último dia, só um funcionava. café da manhã com poucas opções.;3;;;;;;
10 de setembro de 2022;Aceitável;Proximidade ao supermercado;Desorganizado, reservas não localizadas, mudança de quarto, etc;5;;;;;;
9 de setembro de 2022;briga com esposa;nada;travesseiros de plásticos péssimo.;3;;;;;;
5 de setembro de 2022;Péssimo;Só ficamos 2 horas no hotel, como nada estava certo para nós, fomos embora, mas com a promessa de reembolso total. ( que ainda aguardo).;Buracos na porta, propaganda enganosa em relação ao cardápio e o que foi recebido, ar condicionado e exaustor super barulhentos, quarto ridículo de pequeno ( principalmente pra quem reservou o melhor quarto do hotel), frigobar quase vazio, falta de respeito em relação à comunicação telefônica para as refeições (desligaram na minha cara), Internet para a televisão não funcionava, sendo que acesso à Netflix estava incluso.... pra resumir, eu conseguiria um quarto maior, mais bonito e muito mais barato em qualquer outro lugar. Uma vergonha.;1;;;;;;
5 de setembro de 2022;Mais ou Menos;O quarto vista mar é confortável, limpo e espaçoso, muitos travesseiros.;;;;;;;;
"A localização é boa.""";1- esperar quase 20 minutos pra fazer o check in;;;;;;;;;
2- da total insensibilidade da equipe de recepção em relação a um problema que tive com o carro que ao parar na porta do hotel e ao invés de oferecer ajuda ficavam o tempo inteiro pressionando pra remover o carro enquanto o o socorro do seguro chegava;;;;;;;;;;
3- o café da manhã é fraco com poucas opções e uma tapioca feita sem o menor capricho.;;;;;;;;;;
Tive a sensação de que falta gerencia a um hotel com boa estrutura; funcionários sem treinamento; pouca cortesia e sem foco no cliente;" fazem um estadia “mais ou menos”.""";7;;;;;;
4 de setembro de 2022;Acho que poderiam orientar melhor os colaboradores, quanto ao capricho.;Os colaboradores da higiene muito educados, da recepecção alguns de mal humor.;Telefone do quarto 403 não funcionou durante toda a estadia, não houve reparo, equipe bem inflexível da recepção, pedi para fazer meu check-in 11:50' não deixaram por 10'. ;;;;;;;
No café da manhã pedi para esquentar um lanche; o pão continuou frio nem derreteu o queijo; pedi uma tapioca;" totalmente sem capricho queijo gelado.""";6;;;;;;
4 de setembro de 2022;Decepção e um café da manhã pessimo;Cama boa. Só.;Café da manhã péssimo. Tem uma padaria ao lado, vá lá. Higiene precaria, cheiros ruins. Hotel não vale a pena.;3;;;;;;
1º de setembro de 2022;Apenas razoável, nada além do mínimo pelo preco;Apenas razoável.;Café da manhã é muito ruim. Péssimo. Terceirizado, mendigaria. Horrível.;7;;;;;;
29 de agosto de 2022;Estadia e localização ótimo. Logística péssima, e um funcionário que deveria repensar suas atitudes!;Hotel bem localizado, boa acomodação!;Teve um probleminha com a reserva, foi resolvido por uma atendente na primeira noite, mas ele não passou pra outa.;;;;;;;
Essa por sinal foi irônica; petulante.;;;;;;;;;
Foi comunicado a gerência; que por sua vez disse que iria tomar as providências!;;;;;;;;;
Mas deixa muito a desejar a logística!!!;;;;;;;;;;
Ficamos lá de 15 em 15 dias;" mas vamos procurar outro local!""";3;;;;;;;;
29 de agosto de 2022;Deixou a desejar;Do tratamento dos funcionários;Quarto com vazamento;;;;;;;
29 de agosto de 2022;Bom, mas ...;O hotel é bem localizado e o café da manhã é muito bom.;O estacionamento é apertado e confuso. A diária poderia ser mais barata;6;;;;;;
28 de agosto de 2022;Existem acomodações melhores, não ficarei mais.;O valor e a localização.;A equipe não ajudou em nada as solicitações, solicitei um ferro de passar não tinha, uma impressão e estava sem tinta, de certo que foi mal vontade pq uma recepção não funciona sem tinta.;5;;;;;;
26 de agosto de 2022;não foi boa - não voltarei;acomodação excepcional;serviço de recepção - horrível;2;;;;;;
25 de agosto de 2022;condizente com o valor;preço;cafe da manha;7;;;;;;
21 de agosto de 2022;Umas das piores estadias que já passei.;Localização do Hotel.;vários pontos:;;;;;;;
1. valor ( diária muito cara pelos serviços prestados;;;;;;;;;;
2. Diária não inclui estacionamento ;;;;;;;;;;
3. café da manhã muito ruim;;;;;;;;;;
"4. funcionários com pouca disponibilidade para ajudar""";3;;;;;;;;;
21 de agosto de 2022;Aceitável;quarto limpo;ar condicionado fica em cima da cama, 6h da manhã um barulho muito grande no corredor que me acordou várias vezes, café da manhã com poucas opções de comida.;5;;;;;;
15 de agosto de 2022;Hotel bom mas, mas poderia ter um cuidado melhor com o cheiro/ventilação do quarto e a piscina pequena e fria.;O tamanho do quarto.;Quarto com cheiro de coisa guardada.;7;;;;;;
15 de agosto de 2022;não vá;chuveiro muito bom. cama confortável. vista bonita;hotel velho, estrutura péssima, room service demorado, café da manhã muito ruim, estacionamento sem organização (o carro fica parado na cancela esperando o guarda aparecer e abrir), ar condicionado velho, meu quarto foi arrumado depois das 14:00… enfim, tanta coisa ruim que nem cabe aqui.;1;;;;;;
11 de agosto de 2022;Bom;Café da manhã gostoso. ;;;;;;;;
"Funcionários solícitos e educados.""";Wifi caia toda hora. ;;;;;;;;;
Estacionamento super apertado. ;;;;;;;;;;
Limpeza deixou a desejar. Além disso; funcionários da limpeza muito barulhentos;" colocavam música alta no celular enquanto limpavam outros quartos e batiam as portas.""";7;;;;;;;
8 de agosto de 2022;Não recomendo!;Das instalações, localização, restaurante;A recepção, uma verdadeiro decepção. ;;;;;;;
Nunca fui tão mal atendida. Sem receptividade; frios. Profissionais sem treinamento. Uma bagunça. Meia hora para encontrar uma mala q deixei guardada com a funcionária. Isso só foi só parte do transtorno.;;;;;;;;;
"Tentei falar com a gerência para fazer minhas reclamações pessoalmente e até hoje aguardo contato.""";3;;;;;;;;;
8 de agosto de 2022;Bom;Apartamento muito aconchegante, limpeza sensacional e condizente com as imagens do booking.;;;;;;;;
Atendentes da cozinha atenciosos;" sempre dispostos e passavam para avisar de mesa em mesa o encerramento do serviço de café da manhã.""";Recepcionistas nada simpáticos e desatenciosos, apesar disso o mensageiro e as equipes de governança e a&b foram muito solícitos.;;;;;;;;
;;;;;;;;;;
Segurança/mensageiro desempenhando diversos papéis que não condizem com suas funções.;;;;;;;;;;
;;;;;;;;;;
Os recepcionistas passavam mais de 12h trabalhando; nunca presenciei uma escala tão abusiva na hotelaria.;;;;;;;;;
;;;;;;;;;;
Chegamos por volta de 00:00h e o apartamento ainda não estava pronto; passamos cerca de 1h aguardando liberar a uh; entretanto; quando conseguimos realizar o check-in compensaram com um up de categoria; nos colocaram numa categoria com vista mar panorâmica.;;;;;;
;;;;;;;;;;
Café da manhã com poucas opções; pães e bolos dormidos e restaurante pequeno para atender a quantidade de apartamentos.;;;;;;;;;
;;;;;;;;;;
Um colega que se hospedou em um apartamento próximo ao nosso passou mal e não conseguimos abrir o apartamento; mesmo com a chave mestre da recepção. Chamaram a manutenção para abrir a porta;" mas tivemos de aguardar por muito tempo pois preferiram priorizar o conserto de um ar-condicionado.""";7;;;;;;;
7 de agosto de 2022;Muito ruim.;Estadia cara, estacionamento pago, café da manhã ruim e atendente pouco cortez.;Não gostei de nada, pedir para ser despertado e estou até agora esperando.;4;;;;;;
7 de agosto de 2022;razoável;cama confortável chuveiro bom;café da manhã precisa melhorar mt;6;;;;;;
7 de agosto de 2022;Decepção;Comodidades do hotel;;;;;;;;
Quartos amplos;;;;;;;;;;
Camas muito boas;;;;;;;;;;
"Cafe da manha muito bom""";Realizei o pagamento numa quinta feira, e os hospedes chegaram no sábado por volta das 19h, e na recepção falaram que não tinha sido paga a reserva. A falta de comunicação entre a área de reservas com a recepção foi bem ruim, ate ai tudo bem, um erro. Mas en vez de deixar entrar as pessoas, e depois resolver o problema que eles tinham gerado, não, mantiveram todas as pessoas esperando mais de 1h no lobby do hotel ate resolverem, ridículo, nunca mais reservo nesse hotel.;4;;;;;;;;
1º de agosto de 2022;Ok;Custo benefício compensa. Quarto confortável. Café da manhã simples, mas tudo muito bom. Front desk atencioso.;Room Service horrível. Pedi um lanche e veio pão duro, claramente requentado. Batata encharcada. Preço absurdo pela qualidade oferecida.;7;;;;;;
1º de agosto de 2022;Eu gosto porém essa última vez me deixou as cobertas fedidas e já usadas me deixou decepcionada;as camas são confortáveis e quartos amplos.;As cobertas estavam com mal cheiro, como se estivessem guardado já usados.;;;;;;;
"Precisam urgente olhar para isso pois se trata de higiene e biossegurança.""";7;;;;;;;;;
27 de julho de 2022;Decepcionante;;Quando fiz a reserva pelo Booking.com que demorou quase 40 minutos para aparecer para o Hotel, mesmo eu recendendo uma mensagem de confirmação de reserva.;4;;;;;;
24 de julho de 2022;Aceitável;Da cama espaçosa ,Do quarto, da limpeza;Do funcionário entrando no quarto pedindo para verificar o fregobar!;5;;;;;;
21 de julho de 2022;bom;ótima variação;estacionamento;6;;;;;;
21 de julho de 2022;Bom;Café da manhã bom, localização boa, porém um pouco distante da praia. O hotel possui instalações um pouco antigas, mas confortáveis, e o sinal de wi-fi é fraco nos andares dos quartos.;;7;;;;;;
21 de julho de 2022;Aceitável;;o espaço para café da manhã é ridicularmente pequeno tendo em conta o número de hóspedes. houve um determinado momento que as pessoas se batiam no espaço na tentativa de alcançar o buffet. lamentável. não havia nenhuma opção de alimento para quem tem restrição alimentar ou faz dieta voltada à redução da massa gorda. as toalhas disponibilizadas no banheiro estavam por demais gastas, de tal modo que as fibras do tecido permitiam vislumbrar o outro lado! finalmente, a tarifa diária de R$ 15 por estacionamento parece um despropósito para quem está hospedado.;5;;;;;;
20 de julho de 2022;boa;conforto;elevador muito hóspede para pouco elevador;6;;;;;;
18 de julho de 2022;Satisfatório;Quarto confortável .;Elevadores todos com defeito, muitos hóspedes, um caos.;6;;;;;;
17 de julho de 2022;poderia ter sido melhor.;;O tempo de espera pelo elevador era muito grande.;;;;;;;
O tempo de check in foi muito demorado;" devido a lentidão do sistema.""";7;;;;;;;;
13 de julho de 2022;péssima muita burocracia, a minha digital não funcionava na entrada e saída e no terceiro dia o cartão para abrir a port;só da cama;fizemos uma troca por causa de uma duchinha quebrada e no segundo quarto o chuveiro não parava de pingar;6;;;;;;
13 de julho de 2022;Satisfatório;;O Restaurante deixa muito a desejar. Não há padronização dos pratos, entregas erradas. Chaga a ser caro pelo que é cobrado. Poucas opções de bebidas.;6;;;;;;
12 de julho de 2022;A localização excelente, mas devido essa intercorrência, talvez busque outro hotel!;O tamanho do quarto bom;o Check in tive um probleminha com uma recepcionista, mas as outras super receptivas!;6;;;;;;
11 de julho de 2022;O apto disponibizado não foi o mesmo que reservei;;O quarto que me disponibilizaram não foi o mesmo que reservei. Quando cheguei no hotel estava lotado não tinha o quarto que tinha reservado. Passei muito tempo na recepção para fazer o check in. Na manhã seguinte no horário do café da manhã só tinha um elevador funcionando e os hóspedes se apertavam no elevador. Não tem mensageiro.;3;;;;;;
11 de julho de 2022;Péssimo hotel;;Espera de mais de 10 min para pegar elevador pela manhã, pois deixavam só 1 funcionando.;;;;;;;
#NOME?; então minha digital não funcionava e fiquei “preso” na garagem; tendo que descer as rampas a pé e ir caminhando pela rua até a recepção e estava chovendo.;;;;;;;;
"- travesseiros são horríveis""";4;;;;;;;;;
10 de julho de 2022;Satisfatório;Area da piscina é boa! Bem gostosa para passar o dia!;;;;;;;;
"A cama é larga!""";O hotel nao estao conservado! Numero do quarto incompleto, pintura ruim, a TV no quarto nao estava pegando e tive que trocar ( foram bem rapidos em solucionar esse problema). Cheguei no quarto o vaso sanitario estava sujo nas laterais! ;;;;;;;;;
Um dos elevadores parou um dia o que gerou um transtorno para quem estava no 32 andar.;;;;;;;;;;
Cafe da manha deixou a desejar com recipientes de suco e agua sujos;" com frutas não muito frescas! A sauna a vapor fica ligando e desligando o que nao mantém a temperatura não sendo agradável ( ainda tinha um papel higienico sujo no canto jogado na sauna). Sem opcoes de comida no frigobar somente bebida!""";6;;;;;;;;
10 de julho de 2022;Precisa melhorar o atendimento da recepção e o restaurante;Boa localização, quarto muito limpo e silencioso. Ter um salão de beleza anexo.;Café da manhã pouco variado ( sem nenhum bolo regional, por exemplo), reposição demorada, local do restaurante apertado e barulhento. ;;;;;;;
Equipe da recepção pouco atenciosa; antipática; a impressão que tive é que acham que estão fazenfo um favor pra gente; de algo que ; na realidade; é pago. Nem saudações de bom dia; boa tarde e boa noite usam. ;;;;
No último dia no hotel; cheguei cansada e a porta do quarto não abria; desci três vezes; e eu que sugerir ao recepcionista pra chamar a manutenção; porque ele alegava que eu não estava sabendo abrir a porta e no final;" era problema na bateria da porta.""";4;;;;
9 de julho de 2022;Por favor, voltei ao que era anteriormente;Da localização, das pessoas, da piscina;A estrutura é muito boa e talvez se eu nunca tivesse ficado lá não percebesse o quanto piorou.;;;;;;;
O café da manhã também não é dos melhores.;;;;;;;;;;
Um dos elevadores não estava funcionando e reclamei porque o prédio tem 34 andares e com os três que tem; as vezes demora; agora só com dois elevadores funcionando; aí fica caótico.;;;;;;;
"Vi várias pessoas reclamando e as pessoas faziam cara de paisagem""";7;;;;;;;;;
8 de julho de 2022;Fo;Café da manhã é bom, porém poderia ter mais opções. (Como por exemplo omelete e diversificações de sabores das tapiocas e etc) ;;;;;;;;
"Localização excelente.""";Quarto muito pequeno.;7;;;;;;;;
5 de julho de 2022;razoável;conforto;área de refeições está sem exaustão e com cheiro muito forte de fritura , também aguardei 40 minutos pra fazer check-in com somente uma pessoa na minha frente e não me deram nem uma satisfação do porque da demora sempre fiquei nesse hotel mais já foi bem melhor .;7;;;;;;
22 de junho de 2022;Bom;Cama e lençóis;Elevadores quebrados, só um elevador funcionando para atender uma demanda grande gerando longo tempo de espera.;7;;;;;;
19 de junho de 2022;Estadia boa com ressalvas;Gostei do quarto que fiquei. Paguei mais pela diária para ter vista para o mar e compensou. A cama é king size e confortável.;Não gostei do restaurante. O garçon não é cordial, pareceu não ter boa vontade. Pedi uma comida e o risoto de limão siciliano estava péssimo. Nunca comi um risoto tão ruim, o arroz estava duro, empapado e não tinha gosto algum. ;;;;;;;
Uma das concierges do período noturno não é nada simpática e como minha digital não estava funcionando para acessar o elevador; ela resolveu de muita má vontade me arranjar um cartão de acesso. Parecia que me estava fazendo um grande favor! Meu marido estava junto e ela disse que o cartão seria para os dois. Não queria arrumar um segundo cartão e depois de argumentar que saíamos em horários diferentes; ela resolveu atender nosso pedido tbm de muita má vontade. Hora senhores;" quando vamos embora devolvemos tudo. Não queríamos cartão para levar para casa! Era apenas para uso local! Enfim..restaurante ruim e uma das auxiliares é antipática. O restante tudo bem!""";7;;;;;;
17 de junho de 2022;Dentro do quanto foi ótimo. Fora do quarto foi bem mais ou menos.;localização e preço;o hotel tem pouca estrutura para a quantidade de hóspedes que recebe. Quando chegamos, gastamos mais ou menos 30min na fila para o CheckIn. Café da manhã com MUITA gente. 34 andares e apenas 2 elevadores funcionando.;;;;;;;
- Café da manhã beeem simples. Comida +/-. Frutas maduras e boas. Melhor parte foi a tapioca que está inclusa.;;;;;;;;;;
#NOME?;;;;;;;;;;
- O estacionamento é MUITO apertado. Fui numa L200 e sempre era uma luta para manobrar por ele. Em alguns momentos ficamos travados pq não dá pra passar 2 carros.;;;;;;;;;;
- Academia muuuuito simples. Equipamentos quebrados (máquina principal). Esteira com aviso de manutenção. Não tem anilhas. Colchonete é bom. ;;;;;;;;;;
"- Fiquei no 29 andar. A vista é FANTÁSTICA!""";6;;;;;;;;;
16 de junho de 2022;Decepcionante;;Fomos informados previamente ao check-in por funcionários que os quartos eram equipados com SmartTVs e que dispunham de aplicativos de Streaming. O que não se provou verdade ao chegarmos no quarto, o que frustrou bastante os planos de nossa estadia com vocês;4;;;;;;
14 de junho de 2022;Bom mas nada excepcional!;Café da manhã bastante completo e localização excelente. Próximo a praia, shoppings, mercados e padaria.;Check-in super demorado, fila enorme para conseguir realizar, e isso porque cheguei após o horário de entrada. Ademais, o hotel não dispõe de copos nem talheres para os hóspedes, o que torna a experiência um pouco frustrante, pois o hóspede sequer pode degustar um vinho no quarto, ou experimentar um prato de frios mais à vontade.;6;;;;;;
13 de junho de 2022;estadia muito boa, quarto perfeito, café da manhã excelente e ótimos colaboradores! Peço uma atenção extra no estacionam;quarto muito bonito, cama excelente é ótimo banheiro.;péssimo estacionamento! muito apertado e precisa de uma limpeza nos pisos.;7;;;;;;
11 de junho de 2022;Conforto, mas sem internet!!!!!;A manutenção do quarto está em dia, diferente da última vez que me hoapedei no hotel. O quarto é amplo e a vista dos andares maia altos vale a pena.;Internet não funciona... prejudicou muito a minha estadia pois preciso para o meu trabalho. Liguei na recepcao varias vezes para resoverem, mas nada foi feito.;7;;;;;;
9 de junho de 2022;Bom;;poucos elevadores com muitos hóspedes.;7;;;;;;
3 de junho de 2022;Bom;Localização e novo Café da Manhã;Limpeza;7;;;;;;
30 de maio de 2022;Decepcionante;cama confortável;funcionários mal humorados, demora no atendimento, retirada da bancada de café as 10:00 mesmo para quem já estava no restaurante;3;;;;;;
30 de maio de 2022;Bom;Localização: muito perto do aeroporto.;Café da manhã;7;;;;;;
27 de maio de 2022;Bom;gosto do hotel, e para mim a localização é ideal, juntamente com a relação custo BENEFICIOS! Porém a entrada sempre é exaustiva para quem chega de carro que é o meu caso! Toda vez tem que organizar a entrada na recepção para só depois ter acesso ao prédio do estacionamento. para quem já é cliente, é um processo exaustivo.;;7;;;;;;
26 de maio de 2022;Péssimo custo benefício;Localização;Pelo tamanho do hotel e número de hóspedes é bem relapsa a organização da equipe, limpeza e estrutura.;;;;;;;
Café da manhã fraco e sem graça; não vale o valor pago.;;;;;;;;;
Quartos antigos; mau cuidados; banheiro pequeno; roupa de cama manchada; cortinas que pelo aspecto a muito não eram lavadas; para quem tem renite um desafio.;;;;;
Cama grande e confortável.;;;;;;;;;;
Sem contar a falta de preparo dos funcionários para com os hóspedes; limpeza do quarto é ruim tb.;;;;;;;;;
Pelo valor do hotel não vale a pena.;;;;;;;;;;
A piscina é pequena e a água muito fria.;;;;;;;;;;
Às fotos do hotel não condizem com a realidade;;;;;;;;;;
Ponto positivo a localização perto do Shopping;" da praia e de vários restaurantes e barzinhos.""";4;;;;;;;;
25 de maio de 2022;Regular;Sem Comentarios;Café da manhã > As vezes faltava pratos outras vezes faltava talheres ou algum alimento.;;;;;;;
Deixei uma reclamação por escrito para o gerente do hotel.;;;;;;;;;;
"Péssimo serviço do café""";6;;;;;;;;;
24 de maio de 2022;Péssimo custo benefício;A localização do hotel é boa;Os quartos são antigos, o ar pinga em cima da cama, o banheiro possui um box minúsculo, a limpeza deixa a desejar, a organização pelo número de hóspedes é péssima, o café da manhã é fraco, pouca variedade e sempre as mesmas coisas.;;;;;;;
Os funcionários não são prestativos e tendo em vista o valor da hospedagem não é um bom custo benefício.;;;;;;;;;;
O valor é salgado pelo que oferecem.;;;;;;;;;;
"Às fotos e a propaganda do hotel não condizem com a realidade.""";3;;;;;;;;;
23 de maio de 2022;pelo valor pago deixou a desejar.;quarto espaçoso, cama confortável!;café da manhã deixar a desejar, o estacionamento não está incluso na estadia.;6;;;;;;
23 de maio de 2022;Razoável;Cama confortável;Inflexibilidade por parte do hotel e o café da manhã péssimo ainda tive uma infeção;5;;;;;;
20 de maio de 2022;Bom;A localização e acomodação eram muito boa;O café da manhã poucas opções de pães, frutas, bolos e não tinha nenhuma biscoito de opção;7;;;;;;
18 de maio de 2022;Bom;Gostei da localização,do cafe da manha,da piscina sauna;Do ar condicionado do quarto ( o controle nao funcionava);;;;;;;
A TV ( so pega alguns canais) e os atendentes da noite( em especial o fabio);;;;;;;;;;
"E a comida do restaurante cara e nao e boa.""";7;;;;;;;;;
15 de maio de 2022;Satisfatório;vista maravilhosa.;café da manhã mediano, não compatível com o nível do hotel;6;;;;;;
13 de maio de 2022;Bom mas pode melhorar.;Boas instalações. Limpo, arrumado. Muito agradável. Banho muito bom.;Ar condicionado velho.;;;;;;;
Café da manhã fraco. Pão ruim; pouca variedade.;;;;;;;;;
E o pior; poucos talheres;" e mesas nenhum forro.""";7;;;;;;;
12 de maio de 2022;Uma péssima experiência!;Quando vcs me pedem para reescrever a avaliação negativa de um hotel, a única coisa que me vem a cabeça é que vcs não tem credibilidade e não posso confiar mais em vcs.;;;;;;;;
" At.te Jimmy""";Atendimento péssimo, 45 minutos de check in, 2 pessoas atendendo uma fila gigantesca. Qdo cheguei no quarto no 24 andar, a luz não acendia, desci, pedi para verem, subi e ninguem apareceu, sai a orta não fechavam sai do quarto e deixei minhas coisas la com a porta aberta. voltei a porta não abria, desci e subi umas 6 vezes e ninguem fazia nada. resumo. Fiz uma nova reserva no Mar Hotel e fui pra lá. Descaso, falta de gerencia, pessimo atendidmento. Nunca mais retornarei.;1;;;;;;;;
11 de maio de 2022;Bom;;Fiz um pedido de um sanduíche no quarto, e o mesmo chegou queimado.;7;;;;;;
2 de maio de 2022;bom;cama confortável bem arrumada e limpa;internet fraquíssima. estacionamento péssimo. café da manhã super básico para ser cobrado por fora,;5;;;;;;
1º de maio de 2022;Bom;atendimento no check in e check out;;7;;;;;;
30 de abril de 2022;caro o café;camas;espaço;7;;;;;;
29 de abril de 2022;Bom;Boa localização, perto de supermercado e da praia de Boa Viagem. Hotel grande e com muitas opções.;Não gostei de um fato, na hora do check-out, me cobraram um chocolate que não foi consumido, contestei, não pelo valor, R$ 8,00, mas pela fato de não ter feito o consumo do mesmo. Foi mostrado a nota com o horário, vi que era uma hora que estávamos em um passeio em Maragogi, um pouco longe dali, e chegamos cerca de 2 horas depois do horário.;;;;;;;
Esse fato nos deixou bem chateados;" mas fazer o que.""";7;;;;;;;;
27 de abril de 2022;Bom;Estrutura do hotel, vista magnífica.;Ar condicionado barulhento, café da manhã fraco, demora na hora do check-in.;7;;;;;;
25 de abril de 2022;Razoável.;Localização.;Restaurante caiu muito;;;;;;;
;;;;;;;;;;
Faltou leite na sexta-feira santa;;;;;;;;;;
;;;;;;;;;;
Faltou café no sábado de aleluia;;;;;;;;;;
;;;;;;;;;;
Os ovos mexidos eram frios todos os dias;;;;;;;;;;
;;;;;;;;;;
A salsinha não tinha um bom aspecto;;;;;;;;;;
;;;;;;;;;;
Faltaram bolos novos;;;;;;;;;;
;;;;;;;;;;
Nosso pedido (serviço de quarto) foi trocado;;;;;;;;;;
;;;;;;;;;;
Um hotel como esse perderá muitos clientes pelo péssimo serviço de restaurante (café da manhã e serviço de quarto)! ;;;;;;;;;;
;;;;;;;;;;
"Não pretendo voltar mais em função desse serviço.""";6;;;;;;;;;
25 de abril de 2022;Foi boa!;Razoável, poucos atendentes para demanda, momentos faltava talheres, o mesmo café todos os dias, sem variedades!!;Exceto as falhas já aludidas acima, o custo beneficio vale a pena;7;;;;;;
25 de abril de 2022;Decepção pelo porte do hotel.;Das camas muito confortáveis;Falta de estrutura para atendimento, o hotel não fornece um copo plastico ou talher, se quiser tem que pagar pro restaurante pelo descartavel. Pao de queijo e croissant queimados quase todos os dias no café. Acesso por digital para os elevadores dando erro direto.;7;;;;;;
24 de abril de 2022;hotel razoável;localização;lençóis, atendimento;7;;;;;;
24 de abril de 2022;elevador irritante;quarto amplo;elevador demora ao menos 15 minutos para parar no seu andar .;5;;;;;;
