"data_avaliacao","titulo","comentario_positivo","comentario_negativo","nota"
"28 de abril de 2024","Excepcional","Custo benefício maravilhoso! Hotel simples, mas muito aconchegante. Bem localizado. Café da manhã super completo e delicioso!","","10"
"28 de abril de 2024","Excepcional","Hotel muito bom, quarto organizado e ótima localização","","10"
"28 de abril de 2024","Muito bom","Limpeza e Conforto
Estacionamento amplo.","","10"
"27 de abril de 2024","Maravilhosa","Perfeito. Amamos o atendimento tanto dos meninos na portaria quanto das meninas que faziam o café e a limpeza dos quartos. Um agradecimento especial às meninas (Deusa, Graci, Jaque, Mirian, Sol e Vanessa) que são todas uns amores e nos trataram com muita atenção e carinho, além de preparar as melhores tapiocas e uma torta de bacalhau perfeita.

(Aline)","","10"
"27 de abril de 2024","Relação custo x benefício é bem razoável","Atendimento e limpeza do hotel
Café da manhã simples mas de boa qualidade
Estacionamento gratuito","Acesso aos quartos por escada e sem apoio de funcionários do hotel para transporte de malas
Chuveiro novo mas sem pressão da água
Não fornecem shampoo e condicionador e o sabonete não é de boa qualidade.","8,0"
"26 de abril de 2024","Feedback - Bianca Praia Hotel","Localização excelente, bem limpo e novo tudo! Indicaria com certeza!","Nada. Único ponto talvez seria não ter elevador para chegar ao 2° andar. Com bastantes malas e gente mais idosa, foi sofrido.

Nada incontornável, obviamente.","9,0"
"25 de abril de 2024","Um ótimo custo benefício","Ótima localização e café da manhã maravilhoso!","","10"
"25 de abril de 2024","Razoável","A cama do quatro é excelente, assim como as opções oferecidas de canais de TV.","Os quartos são pequenos e pouco arejados, estive em 3 pessoas e pareceu apertado. A privada do banheiro estava um pouco bamba e entupia com facilidade. Acredito que as acomodações precisem de reparo.","8,0"
"25 de abril de 2024","Custo-benefício bastante adequado.","O local é excelente, com ótimo estacionamento. O quarto é muito bom, com ótimo chuveiro (apesar de elétrico, bastante volume de água) e camas bem boas.","O ar condicionado do 102 é muito barulhento - o motor fica bem na janela do banheiro, e precisa de um ""aperto"" nos parafusos de sustentação, pois está trepidando bastante, o que faz o banheiro virar uma câmara de eco bastante chata.
Outro problema é com a TV: conexão péssima, e canais saindo do ar todo o tempo. Além disso, o salão de café é bastante apertado, e faltam lugares nos primeiros horários.","8,0"
"22 de abril de 2024","Bom, custo benefício e o café é ótimo","Quarto ótimo! Café da manhã muito bom , torta de frango uma das mais gostosas que já comi","Não tem elevador e é difícil de subir e descer com as bagagens","9,0"
"21 de abril de 2024","Receberam nossa pet… Adorei, voltarei outras vezes.","Pessoal super educado , local limpo, ambiente familiar , bom custo benefício .","Não tenho nada a observar","10"
"21 de abril de 2024","Hotel bem aconchegante , próximo à praia","Localização muito boa, quarto pequeno porém confortável, café da manhã bom e organizado.","Ficamos em um quarto no térreo , bem próximo a cozinha e refeitório, então logo cedo dava pra ouvir os barulhos de pratos na cozinha, as pessoas conversando, mas nada que atrapalhou a estadia","9,0"
"21 de abril de 2024","Estada ok para passar uma noite!","Bom atendimento, localização, café da manhã e estacionamento.","O quarto no andar térreo não condiz com as fotos, a conservação deixa a desejar, as toalhas e as roupas de cama estão desgastadas.
O barulho na cozinha de madrugada (1h da manhã) devido ao acesso de outros hóspedes, assim como pela manhã, incomoda e atrapalha o sono.","7,0"
"21 de abril de 2024","Cheguei de madrugada, ótima localização. Tranquilo e seguro","Gostei muito da Localização e organização do quarto","O chuveiro pode melhorar. Estava caído.
O espaço do café muito apertado","9,0"
"21 de abril de 2024","Ótimo","Custo benefício.","Nada a reclamar","10"
"20 de abril de 2024","Boa","Localização","Achei o curso benefício válido apenas.","8,0"
"20 de abril de 2024","Bom","Localização , café da manhã excelente com bastante variedade.","Quarto muito pequeno para 3 pessoas. Ar condicionado não funcionou durante a noite, funcionário da recepção foi solicito e nos emprestou ventilador pois segundo o mesmo o hotel estava cheio e não podíamos trocar de quarto, assim que abri a porta do quarto tinha uma barata morta no chão.
Café da manhã muito gostoso, porém a cozinha é extremamente pequena, tivemos que aguardar em pé para poder liberar uma vaga, sugiro que tenha um rodízio na hora do café para que isso não ocorra,","7,0"
"19 de abril de 2024","Voltaria novamente.","A localização. Recepção rápida. Ter garagem para o carro sem cobrança.","Nada a reclamar.","10"
"19 de abril de 2024","Fantástico","Ótimo café da manhã, alguns alimentos eles fazem na hora como ovo/omelete, tapioca...
Pessoal se esforça para que você se sinta bem.","","9,0"
"18 de abril de 2024","Maravilhosa","De tudo","","10"
"18 de abril de 2024","Ótima","A localização é boa. Próxima ao aeroporto e dá pra ir a pé até a praia. Café da manhã muito bom, e como já disseram aqui, a tapioca de coco com leite condensado é excelente.","Seria mais uma observação, o quarto estava muito bem limpo e arrumado, mas o chuveiro caía pouca água. Acredito que era por causa do ralinho do chuveiro estar com alguns furinhos entupidos. Apenas isso pra reverem nas manutenções.","10"
"18 de abril de 2024","Excepcional","Localização, acomodação e receptividade.","","10"
"18 de abril de 2024","Excelente estadia, todos muito atenciosos. Recomendo.","Muito bom o café da manhã.","","10"
"17 de abril de 2024","Forte","Atendimento","Falta de material higiene no banheiro","9,0"
"17 de abril de 2024","Fantástico","Pousada limpa, bem localizada, organizada, cafe da manha diversificado, comida caseira, funcionarios simpatticos. Passou por uma reforma recente e modernizaram os quartos. Limpos, camas confortaveis. Vale a pena.","De tudo.","9,0"
"17 de abril de 2024","Atenciosos e bem localizados","O quarto que fiquei acomodada (apt. 01) é muito espaçoso, tudo novo e muito limpo. Eles têm o cuidado de deixar um travesseiro extra e colcha dentro do armário. O único incoveniente é que como é perto do refeitório e recepção, há um pouco de barulho logo cedo (um isolante acústico na porta amenizaria), mas eu acordo cedo, então, não foi tão ruim. O hotel sofre um pouco com espaço, então o café da manhã acaba sendo em um cômodo levemente apertado, mas este inconveniente é compensado pela disponibilidade das atendentes, que fazerem tapiocas e ovos mexidos fresquinhos. Adorei! Ah, e o estacionamento do hotel é amplo e seguro.","Não encontrei senha de wi-fi em nenhum lugar. Ainda telefonei para a recepção do hotel, para perguntar, e não consegui ouvir a resposta, porque a ligação ficou muda.","8,0"
"17 de abril de 2024","Fantástico","A equipe e organização do hotel","A cama estava um pouco desconfortável","9,0"
"17 de abril de 2024","Maravilhosa, onquarto ótimo , café da manhã maravilhoso . Super recomendo","Aconchegante","Só da Tv q não pegava internet","10"
"16 de abril de 2024","Excepcional","Hotel muito bom,funcionários super atenciosos e café da manhã delicioso","","10"
"16 de abril de 2024","Localização boa","Localização e café da manhã","Achei o quarto pequeno, mas ok","10"
"15 de abril de 2024","Boa localização em Boa Viagem","A localização é muito boa e os funcionários são prestativos.","O quarto tinha pouca ventilação, o que ocasionou mofo nas paredes e o cheiro estava muito forte.","8,0"
"15 de abril de 2024","Fantástico","Gostei do conjunto.","Não gostei de ter que passar no meio do espaço do café da manhã pra ir pro meu quarto.","9,0"
"14 de abril de 2024","Fantástico",".","","9,0"
"14 de abril de 2024","Ótimo custo-benefício","A localização é ótima. O pessoal do Bianca Praia Hotel é bem atencioso. O café da manhã é ótimo e bem servido. Recomendo a estadia.","","10"
"13 de abril de 2024","Otima","Café da manha excelente, otima acomodação","Tv do quarto, antiga","9,0"
"11 de abril de 2024","Praticidade","Praticidade de ser próximo do aeroporto. Fizemos conexão em Recife p Maceió.","NA","7,0"
"10 de abril de 2024","Muito bom","Gostei muito do quarto bem aconchegante, a localização é ótima, vem pertinho da praia de restaurantes e de supermercado, os funcionários são muito gentis.","Achei o espaço para o café da manhã um pouco apertado, mas o café é delicioso.","8,0"
"9 de abril de 2024","Bom","Café da manhã muito bom","TV não funcionava ⁷7","7,0"
"9 de abril de 2024","Perfeito","limpeza, localização, conforto","Nada","10"
"8 de abril de 2024","ótimo custo benefício","Ótimo custo-benefício. Perto da praia e comércios de boa viagem. Café da manhã ótimo, com sucos naturais e tapioca feita na hora...pra ser excelente só faltou uma máquina de expresso/capuccino. Quarto pequeno mas bem confortável e limpo...com cofre. Equipe atenciosa.","Nada","8,0"
"7 de abril de 2024","Excepcional","Hotel super funcional, confortável e moderno. Todos os funcionários são muito gentis e o café da manhã é muito bom. Com certeza me hospedaria nele novamente.","","10"
"7 de abril de 2024","Otimo estacionamento","Quarto amplo e comfortavel, mas o mais importante para mim é que tinha estacionamento coberto e seguro em frente ao hotel.","Café da manhã que inicia mais tarde que o habitual, então para mim que estava em transito, nao pude esperar.","10"
"7 de abril de 2024","Hotel com bom custo-benefício","Café da manhã compatível com valor da reserva; localização muito boa, próximo à praia, camas confortáveis e chuveiro ok.
Com estacionamento no local. Bônus para o cachorro que ficava no hotel","Poucas opções de restaurantes e mercados na região","9,0"
"6 de abril de 2024","Perfeita.","Gostei principalmente do atendimento dos funcionários. Além de estar bem localizado, com estacionamento fácil, possui cama de qualidade.","Café da manhã simples, mas nada que não atenda.","9,0"
"6 de abril de 2024","Bom custo beneficio","Tem boa localização, algumas quadras da praia de Boa viagem. A poucos metros de supermercado e farmacia.
O quarto é pequeno mais confortavel. Tem frigobar com valores ok. O colchão é bom, tv com canais fechados e streaming,e ar condicionados potente. O banheiro tem um tamanho ok, mas não colocam sabonetes ou mini xampus. 
Os recepcionistas são bem atenciosos e concederam o check-in antecipado pois cheguei pela manhã, nos ajudaram com infos sobre passeios e transporte. O hotel é pet friendly e tem um cachorro mascote que as vezes aparece na recepção.","Sentimos falta de um café mais regional, tinha variedades de doces e outros comidas. A opção de pães era pequena e pareciam dormidos, mas tinha opção de pedir tapioca e ovos na hora. Ficamos no quarto proximo a area do café e com isso ouviamos barulho muito cedo vindo da cozinha e de outros hospedes a qualquer hora, o que foi bastante incomodo. Recomendo pedir para ficar no andar de cima.","7,0"
"6 de abril de 2024","Família","Espaço","","10"
"5 de abril de 2024","Melhor opção que poderíamos ter escolhido","Adoramos tudo! A estrutura do hotel é bem nova e luxuosa a TV funciona muito bem todos os canais, os quartos são bem limpos e bem equipados e todos os funcionários foram muito atenciosos! De bônus ainda tem um cachorrinho lindo que mora no hotel super manso e amoroso! Vamos sentir saudade do Bono!","Nada a reclamar","10"
"4 de abril de 2024","A localização é boa e o hotel agradável.","O Hotel possui uma boa localização, o estacionamento é em outro prédio, o qual é localizado em frente. Porém, existem regras para o estacionamento que não são informadas na descrição do hotel.","O estacionamento com melhor acesso.","7,0"
"3 de abril de 2024","Atendeu as minhas expectativas e o custo benefício muito bom.","O hotel é muito bem localizado perto de tudo. Os funcionários são excelentes muito atenciosos. O local muito limpo e organizado. O custo benefício muito bom. Café da manhã excelente.","Ar condicionado um pouco barulhento. Não havia um local apropriado secar as roupas de praia molhadas.","9,0"
"3 de abril de 2024","Excepcional","Excelente localização, Funcionários atenciosos","","10"
"3 de abril de 2024","A estadia foi perfeita","Café da manhã impecável, os funcionários todos muito simpáticos e prestativos. A localização também é ótima.","Não tive do que reclamar","10"
"2 de abril de 2024","Voltaria com certeza","Gostei de tudo . Custa benefício excelente","","10"
"2 de abril de 2024","aconchegante","Os funcionários são super prestativos e atenciosos. Em especial o Bono (um cachorrinho) que vive do hotel e encanta todos os hospedes que chegam. Lugar super receptivo. Em um proxima oportunidade voltarei","","10"
"2 de abril de 2024","Vale a pena, custo benefício muito bom.","A garagem é o ponto forte, é num prédio em frente o carro fica seguro o tempo todo. Café da manhã simples mas muito bom. O quarto limpo, bem organizado, ar condicionado funcionando muito bem. O atendimento do pessoal todo muito bom.","","10"
"1º de abril de 2024","Hotel maravilhoso, acolhedor e aconchegante. Todos os funcionários são muito gentis e atenciosos. Em especial o Ronaldo,","Muito aconchegante, atendimento perfeito!","Não tenho nenhuma queixa.","10"
"1º de abril de 2024","Fantástico","Parabéns a todos os funcionários pelo ótimo atendimento, simpatia, boa vontade,","O único problema é que o sinal de internet é muito instável, e fica ruim para assistir TV","9,0"
"1º de abril de 2024","Excepcional","O hotel tem uma boa infraestrutura, os quartos são modernos e aconchegantes. Os funcionários são atenciosos e sempre dispostos a ajudar.","","10"
"31 de março de 2024","Muito bom","Localização, quartos organizados.","Amo cachorro, mas a acomodação deixa um cachorro solto na recepção. Acho que isso não seja interessante, pois ele pode atacar uma criança. A garagem é em um local apartado do hotel, tendo o hospede que se deslocar até tal local para colocar o carro e depois atravessar a rua para chegar à hospedagem.","8,0"
"31 de março de 2024","VALEU A PENA A DESCOBERTA DESTE HOTEL","BEM LOCALIZADO, COM ESTACIONAMENTO GRATUÍTO, QUARTO CONFORTÁVEL E BOM CAFÉ DA MANHÃ","O CHUVEIRO PODERIA SER TROCADO POR UM MAIS MODERNO COM O JATO MAIS AMPLO","7,0"
"31 de março de 2024","Excepcional","Conforto e limpeza","","10"
"30 de março de 2024","Localização ótima, e pessoal gente boa","Localização ótima, e o pessoal gente boa.","Pegamos uma quarto dessa vez com Banheiro pequeno, e tinha cheiro de mofo no quarto","8,0"
"30 de março de 2024","Muito bom","","Tá televisão que praticamente não funciona","8,0"
"28 de março de 2024","Excepcional","A localização é ótima. O café da manhã é excelente. O atendimento é ótimo.","","10"
"28 de março de 2024","Ótima","Conforto e bom atendimento!","","10"
"27 de março de 2024","Excepcional","Hotel muito bom, bem localizado, funcionários super educados e prestativos. Recomendo e voltarei outra vez","","10"
"27 de março de 2024","Ótimo custo benefício!","Chegamos de madrugada, recepcionista bem atencioso. Fomos bem rápido pro quarto. Camas bem confortáveis. Café da manhã delicioso!","O ar condicionado do nosso quarto não funcionou, e como era de madrugada e estávamos bem cansados, não avisamos o hotel, que acredito que nos ajudaria. Mas isso não atrapalhou nosso descanso.","10"
"25 de março de 2024","Fantástico","Hotel próximo de supermercado, farmácias, praia","","9,0"
"25 de março de 2024","Bom","","Ar-condicionado virado para cama, fica ruim.
Chuveiro virado para a prateleira de apoio, quase não dava para tomar banho.
Quarto praticamente dentro da copa do café, MUITO barulho cedo da manhã.","7,0"
"24 de março de 2024","Muito bom","Limpeza, funcionários, café e o Bonno.","Tamanho do quarto.","8,0"
"23 de março de 2024","Bom","O hotel é bem localizado. É limpo e organizado.","O quarto é pequeno. O chuveiro não aquece direito. O colchão é muito macio. O espaço de café da manhã é muito pequeno, você tem que aguardar para tomar café, principalmente por volta das oito e oito e meia da manhã. Tem estacionamento, mas é do outro lado da rua e, após as 18 horas, você tem que esperar que alguém da recepção abra o portão para pegar o carro. Não pode parar em frente ao hotel por risco de multas. Acesso aos quartos é por escadas, não tem elevador.","7,0"
"23 de março de 2024","Melhor custo benefício em Recife","Recepção excelente, café da manhã maravilhoso, limpeza exemplar, tem vaga para carro, funcionárias cá cozinha muito solícitas no café da manhã.","Cama bi partida para casal, atrapalhou um pouco.","10"
"22 de março de 2024","Recomendo! Boa relação qualidade-preço","Muito boa relação qualidade-preço, é um espaço agradável, os quartos eram bons, tínhamos direito a pequeno-almoço mas não fomos, tem estacionamento gratuito no parque do hotel que é em frente do mesmo, e os funcionários eram simpáticos.","Faltou a luz durante 3 horas, impossibilitando de carregar os aparelhos eletrónicos, sendo que no meu caso, isso fez falta.","8,0"
"22 de março de 2024","Excelente localização","Localização excelente e funcionários muito atenciosos!","A recepção, refeitório e áreas comuns tem espaço bem limitado; alguns quartos ficam perto do refeitório e é preciso tomar cuidado pra não fazer barulho!","8,0"
"21 de março de 2024","Bono é o destaque!","Bom custo benefício e excelente recepção com Bono, o pet do hotel que dá as boas vindas e anima sua passagem pelo hotel!","Quarto com cheiro de mofo e pontos de mofo no banheiro.","7,0"
"21 de março de 2024","Estadia maravilhosa, funcionários atenciosos e muito educados e de quebra, o Bono que é o melhor funcionário do hotel!","Cama boa!!","Nada","10"
"20 de março de 2024","Ótimo custo benefício","O café da manhã é excelente, funcionários bem prestativos, quarto bastante confortável. O hotel é um primor, além de um lustre lindo no hall","Não possuía elevador. Um funcionário nos ajudou a colocar a mala no quarto. Mas se tivéssemos independência seria interessante.","10"
"20 de março de 2024","Excepcional","Simples mas boa","","10"
"20 de março de 2024","Tivemos uma noite tranquila e um café da manhã muito bom!","Cama muito confortável","Chuveiro precisa melhorar","8,0"
"20 de março de 2024","Maravilhoso","Eu não tenho nem palavras pra agradecer ao Bianca hotel, chegarmos em Recife as 04:00 da manhã e nossa hospedagem só seria as 14h00.
Conversamos com eles e foi realizado o check as 09 da manhã o mais rápido possível sem custos adicionais.
Foi incrível!!!
Ficamos no início da viagem e voltamos no fim também.
Foi maravilhoso demais 
O café da manhã é delicioso também 
O bolinho de limão 🍋 que delícia 😋","","10"
"20 de março de 2024","Vou indicar pra meus amigos!","Café da manhã 😋","","10"
"19 de março de 2024","Excepcional","Hotel pequeno, mas excelente! Limpeza impecável! Quarto muito limpo, cheiroso. Tv grande, ar condicionado bom, chuveiro bom, camas confortaveis. Funcionários educados, atenciosos e café da manhã muito saboroso e variado. Tudo muito bem feito. Ótima localização. Qd precisar voltar ao Recife, com certeza voltarei a me hospedar no hotel.","Nada! Tudo ótimo!","10"
"18 de março de 2024","Fantástico","Localização, limpeza, atendimento e estacionamento gratuito","Escadas","9,0"
"17 de março de 2024","Excepcional","Tudo","Não tenho nada pra falar mal!","10"
"17 de março de 2024","Excelente custo benefício e equipe muito simpática","O hotel apresenta excelente custo benefício. Está todo reformado, tem estacionamento bem em frente e a equipe de funcionários é muito simpática e solícita. Com certeza voltaria a me hospedar.","Não tem elevador.","9,0"
"16 de março de 2024","Ótimo custo benefício","Ótimo custo benefício,funcionários solícitos,sempre dispostos a sanar suas dúvidas.Quarto limpo e organizado.Cafe da manhã muito bom(amei o bolo de limão).","","10"
"16 de março de 2024","Excepcional","Café da manha simples porém com itens regionais deliciosos. Staff da cozinha muito solicitas, gentis e educadas. 
Recepção com funcionários atenciosos e tem um bônus que é o Bono, o cãozinho do hotel, o que torna o ambiente acolhedor e familiar.","","10"
"16 de março de 2024","Excepcional","Hotel muito bom, bem localizado, funcionários solicitos, organizado, limpo. O café da manhã é maravilhoso, tudo bem preparado, as meninas muito simpáticas, atendendo uma solicitação do meu neto de 3 anos com carinho, atenção. Sr. Ronaldo realizou contato antes da nossa chegada muito atencioso","As toalhas","10"
"15 de março de 2024","Me hospedaria novamente","Muito bom","Tudo","10"
"15 de março de 2024","razoável","localização","chuveiro elétrico que queimou durante a estadia e não houve limpeza do quarto. café da manhã bem simples","7,0"
"14 de março de 2024","Boa relação qualidade/preço","Qualidade/preço","Tamanho wc, janela do quarto.","8,0"
"14 de março de 2024","Super recomendo","Excelente localização, funcionários muito simpáticos, acomodações novas, resumindo, recomendo muuuiiito...","café da manhã poderia ter mais opções, mas é bom...","10"
"13 de março de 2024","Bom custo benefício","A localização do hotel é excelente, os funcionários muito prestativos","Muito barulho no meu quarto (acredito que era algum eletrodoméstico usado no café da manhã), que era aos fundos da área da cozinha, após as 6h e não consegui mais dormir.","8,0"
"12 de março de 2024","Excelente opção de hospedagem próximo à praia","O hotel é impecavelmente limpo e cheiroso! O café da manhã é bem servido. Os quartos, apesar de pequenos, são suficientemente confortáveis. Os funcionários são super agradáveis e solícitos. Por fim, o Bonno (cachorro) dá um charme especial à acomodação!","Não tenho do que reclamar.","10"
"10 de março de 2024","Voltarei !","Ótimo custo benefício! Bem organizado apesar de pequeno.","O quarto é um pouco pequeno, mas bem organizado e limpo!","10"
"10 de março de 2024","Tudo perfeito.","Tudo perfeito.","Tudo perfeito.","10"
"10 de março de 2024","Excepcional","Perfeito","O local do café da manhã é pequeno.","10"
"10 de março de 2024","Bom, mas poderia ser melhor.","- Os funcionários são educados e muito solícitos, como chegamos mais cedo que o horário do check-in pudemos deixar as mochilas na recepção e voltamos em uma hora para entrarmos. 
- O espaço social do hotel é bem limpo, quarto e banheiro também.
- O café da manhã é variado e gostoso;
- O ar condicionado do quarto funciona bem e é silencioso.
- As camas são confortáveis (bem fofas). E no armário do quarto deixam mantas e travesseiros extras.
- O hotel fica perto da orla (dois quarteirões) e tem farmácias e supermercado perto dele.","- O wi-fi é muito instável, fica caindo bastante.
- A porta do frigobar abre para a parede, e ele fica situado em frente a cama, dificultando bastante o acesso, se inverter a abertura da porta (pelo modelo do frigobar isso é possível), já facilitaria.
- O chuveiro elétrico é bem alto para trocar a temperatura e só existem duas temperaturas: frio e escaldante.
- Todas as luzes do quarto são de cor amarela (tem gente que acha mais confortável que a cor branca, mas para outras pessoas é muito ruim) recomendo trocar pelo menos a lâmpada principal para a cor branca fria e deixar as luzes indiretas como estão, assim ficaria mais equilibrado. Isso vale para as do banheiro também.
- No banheiro, a porta do box de vidro abrir para dentro dele é desconfortável e pode ser bem perigoso.
- Faltou uma lixeira no quarto.
- O espaço para o café da manhã é muito pequeno e apertado. Na segunda manhã tivemos que esperar em pé alguma mesa desocupar para sentarmos.
- Como o espaço é pequeno, as comidas ficam divididas e fazem uso de prateleiras altas, se você tiver menos que 1,70m não consegue usar a sanduicheira com segurança, por exemplo.","7,0"
"10 de março de 2024","Excelente","Ótima localização, muito bom atendimento, somente é ruim por não ter elevador, mas a portaria foi bem prestativa para levar as malas","Não tinha elevador, e o horário do checkout 11 horas, poderia ser 12:00","8,0"
"10 de março de 2024","Excepcional","Minha estadia Bianca Praia Hotel foi ótimo atendimento nota 10 da entrada a saída voltarei mais vezes.","Nada a reclamar.","10"
"8 de março de 2024","Deixou a desejar","Funcionários simpáticos e boa localização com estacionamento.","Suite com sujeira e mofo nas paredes e chuveiro. Pouca tomada disponível. Toalhas de banho amareladas e até rasgadas.","7,0"
"8 de março de 2024","Satisfatório!","Quarto bem espaçoso e limpeza.","Espaço para café da manhã poderia ser maior.","9,0"
"8 de março de 2024","Fantástico","Gostei muito do cachorrinho que mora no Hotel.","","9,0"
"7 de março de 2024","Excepcional","Excelente, custo benefício de primeira, ótimo atendimento, instalação renovada, super indico.","","10"
"7 de março de 2024","Excelente estadia","Funcionários prestativos e educados, quartos limpos, cafe da manha otimo.","","10"
"6 de março de 2024","Tranquila...","Limpeza e simplicidade das instalações !!! Café da manhã dentro da expectativa.","Nada que desabone o hotel.","10"
