"data_avaliacao","titulo","comentario_positivo","comentario_negativo","nota"
"4 de maio de 2023","Me hospedaria novamente","Quarto e banheiro amplos!! Funcionários atenciosos!! Shopping e aeroporto próximos!! Éramos em 4 adultos e uma criança!!","Ter que marcar horário pra tomar café!!","8,0"
"3 de maio de 2023","Fantástico","O atendimento foi excelente, o pessoal da recepção é muito atencioso, nos ajudou com dicas de passeios e o que fazer, fora o café da manhã que é uma delicia, não tenho o que reclamar, somente elogiar. Se eu futuramente voltar a Recife, com certeza me hospedarei la mais vezes.","","9,0"
"3 de maio de 2023","Dentro da expectativa, excelente custo benefício, muito boa localização","Localização excelente, pertinho da praia e com muito comércio e restaurantes perto. Relativamente perto do aeroporto. O quarto, embora pequeno, limpo e confortável. Banheiro bom, limpeza ok no geral. Não tomei café porque saí de madrugada para o aeroporto.","O quarto é muito pequeno, embora estivesse dentro das minhas expectativas e motivos (fiquei apenas algumas horas para descansar até horário de embarque). Não recomendo para muitos dias de hospedagem por conta do tamanho do quarto. Ainda assim, gostei do hotel e principalmente da localização.","10"
"2 de maio de 2023","Excepcional","Gostei de tudo, boa localização, tudo limpinho, café da manhã muito gostoso e os funcionários super agradáveis","","10"
"1º de maio de 2023","Muito bom","Bem localizado","Café da manhã","8,0"
"1º de maio de 2023","Muito bom","Os funcionários são muito atenciosos. A garagem é ótima e cômoda. Os quartos são confortáveis.","O colchão estava deformado e isso deu dor nas costas. O café é bom, mas o espaço apertado demais. Eles até fazem rodízio de horário para o café, mas como estava lotado, não funcionou. É preciso ficar se espremendo e esbarrando em outras pessoas.","8,0"
"1º de maio de 2023","Fantástico","As instalações são novas e bem decoradas. O local muito limpo e organizado. A localização é muito boa. Café da manhã simples, mas gostoso.","As roupas de cama e toalhas precisam ser renovadas, pois estão desgastadas.","9,0"
"1º de maio de 2023","Muito bom","Boa localização, internet de boa qualidade, cama boa.","O café da manhã foi muito tumultuado","8,0"
"30 de abril de 2023","Excepcional","o atendimento do recepcionista RONALDO foi realmente muito excelente. atendeu a mim e minha esposa com muita presteza e vontade. Funcionário nota 10.","","10"
"29 de abril de 2023","Bom","Localização.","Recipientes da alimentação do cachorro colocados no chão, ao lado do balcão de ""self service"", no salão de refeição!","7,0"
"29 de abril de 2023","Ótimo custo benefício.","Ótimo localização. Café da manhã bem servido. Funcionários simpáticos.","","10"
"29 de abril de 2023","Muito bom","localização","","8,0"
"28 de abril de 2023","Perfeita","A pousada é uma gracinha, muito bem localizada e acomodações excelentes. Apenas bem próximos do quarto da frente( No meu caso). No mais, o lugar e acolhedor, os atendentes são simpáticos na medida do possível, o café da manhã me surpreendeu bastante. Já fiquei em hotéis que não ofereciam um café tão caprichado. Lugar aconchegante e super bem decorado. Recepção organizada e um ambiente muito bem cuidado e decorado c muito bom gosto. Amei a experiência e voltaria com certeza.","Acho que hotéis e pousadas deveriam envestir e cobrar dos funcionários de frente uma atuação 100% (dentro do limite) no que eles podem oferecer, até pq a recepção é a imagem da pousada. Chegamos de madrugada e acredito muito em uma recepção acolhedora indiferente do horário. Não sei o limite da formalidade nesse atendimento, mas eu acredito mais excesso de simpatia que no da formalidade.","8,0"
"27 de abril de 2023","Excepcional","","O ar condicionado poderia ser mais potente","10"
"27 de abril de 2023","Excelente","Acomodação","","9,0"
"26 de abril de 2023","Fantástico","Bom atendimento e receptividade.Boa localização","","9,0"
"24 de abril de 2023","Excelente","Boa localização, quarto bem decorado é muito limpo. Tudo organizado. Funcionários simpáticos e prontos para ajudar em todas às necessidades.","Não temos nada a reclamar.","10"
"24 de abril de 2023","Muito bom","A localização super me atendeu. O café da manhã era ""fresquinho"" e tinha uma torta de frango bem caseirinha deliciosa!😜👍🏻","Na ocasião da reserva não atentei para o tamanho do quarto. Era o uinico disponível. Quando vi pessoalmente verifiquei ser extremamente pequeno para ser classificado como quarto para casal. Infelizmente não tinham outra opção.","8,0"
"24 de abril de 2023","Ótimo opção em Boa Viage.","Atendimento prestativo e boa localização.","","10"
"24 de abril de 2023","Excelente custo-benefício","Localização excelente. Café da manhã atendeu minhas expectativas. 
Tapioca de queijo coalho SENSACIONAL.
Funcionários extremamente simpáticos.","O ar condicionado poderia gelar mais.","9,0"
"24 de abril de 2023","Excelente custo-benefício.","Localização excelente. Café da manhã atendeu minhas expectativas. 
Tapioca de queijo coalho SENSACIONAL.
Funcionários extremamente simpáticos.
Ar condicionado gelando muito bem.","A cama poderia ser um pouco mais confortável e o quarto que ficamos era bem pequeno, bem apertado (embora houvessem quartos maiores que só foram disponibilizados numa segunda estadia)","8,0"
"24 de abril de 2023","Excepcional","Do moço da recepção, muito simpático e as camareiras também e o café da manhã é otimo","É tudo muito bom","10"
"23 de abril de 2023","Excepcional","Localização","","10"
"19 de abril de 2023","Boa localização e próximo de avenidas","Hotel bem localizado, próximo a praia de Boa Viagem e cerca de 10 minutos do aeroporto. O atendimento é excelente, além de um café da manhã bem servido com frutas, bolo, pães e frios fresquinhos. Tem até pudim! 

As instalações são bem conservadas e tudo bem arrumado.","","9,0"
"18 de abril de 2023","Excepcional","Café da manhã de excelência","","10"
"18 de abril de 2023","Ótimo custo benefício","O quarto tem um tamanho bom, tem smartTV, o banheiro é enorme. No geral bem aconchegante. 
Café da manhã super bom, com ovos e tapioca feitos na hora. Várias frutas, bolo, pães - até empadão tinha.
Estacionamento na frente do hotel - incluso já.","O travesseiro era bem fino e as toalhas do segundo dia estavam muito muito velhas...","8,0"
"18 de abril de 2023","lugar top muito bom infelizmente não tomamos café por conta do horário.","tudo muito limpo e confortável.","café da manhã só depois das 07:00 aí não né,café sempre inicia as 06:00,pra você sair depois do café o trânsito é horrível.","8,0"
"17 de abril de 2023","Bom","Funcionários muito simpáticos e disponíveis. Café da manhã muito farto, com muitas opções. Cama confortável, ar condicionado em pleno funcionamento, smart tv com plataforma de streaming, frigobar, armário e cobertores extras.","O quarto é bem pequeno e o nosso estava com um cheiro de mofo. Algumas toalhas estavam manchadas também.","7,0"
"17 de abril de 2023","razoável","gostei da localização.","não gostei da cama 
não gostei do café da manhã 
e n gostei do tamanho do banheiro que é minúsculo.","7,0"
"17 de abril de 2023","Excepcional","Funcionários muito educados, apt limpo e confortável. já é a segunda vez que fico no Bianca e com certeza ficarei mais vezes. Excelente custo benefício","","10"
"17 de abril de 2023","Perfeito","Atendimento rápido prático ficamos satisfeitos com o hotel voltaríamos outras vezes","","10"
"16 de abril de 2023","Excepcional","Café. Da Manhã","","10"
"16 de abril de 2023","Fantástico","Quarto bom, banheiro bom, café da manhã ótimo, simpatia dos funcionários, localização ótima. Só dormimos uma noite para pegarmos o voo no outro dia.","Não tem elevador tendo que subir com as malas na escada. Para gente ok mas pode ser ruim para quem tem dificuldade.","9,0"
"15 de abril de 2023","Excepcional","Excelente quarto, pequeno porém de muito bom gosto, facilidade de apagar as luzes ao lado da cama e suporte para malas, bom café da manhã.","","10"
"13 de abril de 2023","Ótima","Excelente localização","","10"
"13 de abril de 2023","Excepcional","Todos os ambientes maravilhosos! Gostei muito do café da manhã.","Não tenho do que reclamar.","10"
"13 de abril de 2023","Confortável","Localização excelente, funcionários amáveis e café da manhã bem gostoso com tapioca feita na hora. Chuveiro bom, cama com colchões confortáveis e um quarto bem espaçoso.","Na segunda noite tivemos um problema de barulho. Ficaram falando na recepção muito alto, perto da nossa janela, nos impossibilitando de dormir. Mesmo pedindo para diminuir o volume, não fomos atendidos, o que nos deixou bem cansados e irritados.","7,0"
"12 de abril de 2023","Fantástico","O atendimento foi ótimo. Café da manhã muito bom.","","9,0"
"12 de abril de 2023","Excepcional","receptividade","","10"
"11 de abril de 2023","Fantástico","Tudo é bem organizado","","9,0"
"10 de abril de 2023","Boa localização é ótimo custo benefício","Estadia, quarto confortável com vista, ar condicionado, mesa pra computador e boa localização. Ótimo Café da manhã.","Não tenho nada para reclamar.","10"
"10 de abril de 2023","Razoável","Gostei da localização, higiene, cafe da manha.","1. Não gostei do estacionamento, pois ele fica apartado. Ou seja, a acomodaçao fica em um local e o estacionamento em outro. Saliento que os dois ficam na mesma na rua. Apenas frisei essa questão porquanto é chato voce sair a noite e voltar tarde e ter que colocar o carro em um lugar e sair andando para o hotel em outro. Isso interfere diretamente na segurança do hóspede. 2. Pedi uma cama de casal, porém foram colocadas duas camas de solteiro. Até então não havíamos percebido que não era cama de casal. Já tarde da noite percebemos que as camas se mexeram, tiramos os cobertas e vimos que eram na verdade 2 camas de solteiro.","8,0"
"10 de abril de 2023","Experiência muito boa, fomos muito bem acolhidos. Certamente voltaremos para rever o Bono.","Localização excelente, o hotel fica próximo à praia de Boa Viagem e no entorno é muito bem abastecido pelo comércio local. Além disso, a toda a equipe do Hotel é muitíssimo atenciosa, simpática, dão ótimas indicações de passeios bem como orientações quanto a locais a se evitar. Tudo é muito simples, mas aconchegante, limpo, seguro e organizado.","A cama poderia ser mais confortável, mas pode ter sido o caso específico do quarto que fiquei hospedado. Além disso, apesar de que o café da manhã ser muitíssimo bem feito, farto e saboroso, poderia ter mais variedade de itens. Mas nada que prejudique a experiência de uma boa estadia.","9,0"
"10 de abril de 2023","Fantástico","Quarto novo. Banheiro limpo, novo e com chuveiro quente. Atendeu bastante o que eu precisava. Me surpreendi com o tamanho do quarto. Imaginava que seria apertado, mas atendeu bem, considerando que viajo sempre com meu marido e três filhos. O fato de possibilitarem cama extra p criança pequena me agradou muito. Com certeza voltaremos.","","9,0"
"9 de abril de 2023","Bom","","cheiro cigarro no quarto","7,0"
"8 de abril de 2023","Voltaria,mas teria que ficar no térreo.","Limpeza e café da manhã simples,mas tudo delicioso.","O fato de não ter elevador","8,0"
"8 de abril de 2023","Super agradável.","Atendentes super simpáticos e prestativos. Localização excelente.","Nada a declarar.","10"
"7 de abril de 2023","Simples, mas funcional","Localização boa. Quartos simples, mas funcionais. Estacionamento fechado em parceiro em frente ao hotel.","Café da manhã pouco variado.","8,0"
"7 de abril de 2023","Muito bom","Localização.","Escadas. Café da manhã simples.","8,0"
"7 de abril de 2023","Muito bom","Café da Manhã bem gostoso, equipe prestativa, localização muito boa da pra ir a pé a praia de Boa Viagem.","Cama confortável, porem o colchão muito mole afundava e doía as costas. O quarto pequeno para três pessoas.
Mesmo assim foi muito bom","9,0"
"6 de abril de 2023","Fantástico","Excelente custo-benefício!","Limpeza","9,0"
"5 de abril de 2023","Excepcional","Gostei de tudo. Hotel maravilhoso!","Não tenho que reclamar de nada.","10"
"5 de abril de 2023","Bom custo benefício","Boa localuzação, funcionários simpáticos e solícitos. Bom café da manha, com direito à tapioca e ovo feitos na hora. Quarto bom, com frigobar. À dois quarteirões da praia de Boa Viagem. Bom custo benefício.","Nao tem elevador. Durante a noite faltou água e logo depois, aparentemente consertaram, mas a água ficou completamente escura, Nao houve informaçao sobre isto, ou seja , os hóspedes ficaram sem água limpa durante toda a noite. A internet nao estava boa. Apesar disso, os pontos positivos superaram os problemas, já que a internet e a água, provavelmente já devem estar sendo resolvidos.","8,0"
"4 de abril de 2023","Excepcional","Café da manhã bem honesto
Funcionários bem prestativo e educado
Quarto limpinho","","10"
"4 de abril de 2023","Muito bom","Do quarto , confortável","Café da manhã","8,0"
"3 de abril de 2023","Muito bom","Os quartos são grandes, ideiais para famílias. O cafe da manhã foi muito bom.","","8,0"
"3 de abril de 2023","Muito bom","Ótima localização","","8,0"
"3 de abril de 2023","Muito bom","O café da manhã estava muito bom. superou as expectativas. 
Ótima localização. Perto da praia e do aeroporto.","Colchão da cama de casal muito mole.","8,0"
"2 de abril de 2023","Muito boa!","Ótima localização! Próximo a orla, restaurantes, supermercados e farmácias. Funcionários sempre cordiais. O café da manhã foi servido no buffet pequeno mais excelente.","A porta do banheiro do quarto era de correr e não tinha como fechar. E acima da cabeceira da cama havia um interruptor fora da parede, com os fios a mostra o que poderia ter causado um choque.","8,0"
"2 de abril de 2023","Fantástico","Atendimento e localização.","Do colchão, muito mole.","9,0"
"1º de abril de 2023","Muito bom","Localização e conforto","","8,0"
"31 de março de 2023","Hotel boutique nota 1000!","O hotel é uma graça! Pequeno e intimista! Quase um hotel boutique! Reformado e de bom gosto! Fica bem próximo da praia e na melhor localização de Boa Viagem. Dá para fazer tudo à pé. Conta com restaurantes, farmácias, supermercados,... tudo muito próximo do hotel. Funcionários de uma simpática ímpar, sem contar com a recepção que tivesse de uma Lassie, uma cachorrinha super amável, que fazia festa com todos os hóspedes, que não passavam pela recepção sem fazer uma brincadeira com ela, que retribuía com um carinho sem igual. Ficamos super satisfeitos com a hospedagem no Bianca Praia Hotel e voltaremos logo que pudermos. Super indicamos!","Não observamos pontos negativos.","10"
"31 de março de 2023","Fantástico","Atendimento","Café desorganizado","9,0"
"31 de março de 2023","Excepcional","A equipe foi extremamente solicita quando eu precisei, tanto na antecipação do checkin, quanto no check-out. O café da manhã tinha de tudo um pouco, as acomodações são boas e a localização é ótima.","","10"
"30 de março de 2023","Bom","Funcionários atenciosos, café da manhã, localização.","Toalhas com mal cheiro, aparentemente mal lavadas e com aspecto de muito velhas. Além disso apareceu uma barata no quarto.","7,0"
"30 de março de 2023","ótima localização, café da manhã saboroso","a localização é muito boa, só a 2 ruas da praia, da pra ir caminhando tranquilamente. o café da manhã é saboroso!","só 1 funcionário que não foi muito educado. os outros são ótimos","8,0"
"29 de março de 2023","Boa estadia.","Boa localização e próximo ao aeroporto. Confortável.","No apartamento em que eu estava, no segundo pavimento, faz bastante barulho no telhado quando chove.","9,0"
"29 de março de 2023","Bom custo x beneficio","Quartos bem cuidados, cama confortável, chuveiro bom.
Café da manhã com variedades.","Senti falta da hospitalidade que o turista espera, das informações básicas sobre restaurantes próximos, passeios disponíveis.
Pela minha experiência de viagens a trabalho, tem mais o perfil de hotel para estadias para viagens a negócios.
Deixo claro que todos da recepção foram muito educados e prestativos.","8,0"
"28 de março de 2023","Perfeita","O quarto muito limpo e organizado, o café da manhã delicioso e com muitas variedades. Simplesmente tudo perfeito.","","10"
"28 de março de 2023","Bom hotel, porém com ressalvas quanto café da manhã e quartos térreos","Hotel bem localizado que possui estacionamento fechado e com camas confortáveis.","Ficamos hospedados no andar térreo, onde já antes das 7h da manhã começa um barulho infernal da cozinha que fica colada aos quartos do andar térreo. Escuta-se tudo o que fala e barulhos de xícara batendo muito forte. O isolamento acústico é zero. O café da manhã é servido até às 10h, fomos tomar às 9h e já não havia a maioria dos itens básicos que não foram repostos como pães, queijos, presunto, etc. Até o café não tinha na máquina, porém esse foi reposto depois de certa demora. As pessoas que foram tomar café essa hora claramente estavam bem chateadas com esse fato, inclusive nós, que só escolhemos esse hotel pelo fato de ter café da manhã incluso.","7,0"
"27 de março de 2023","Bom","O hotel fica próximo a orla e ao aeroporto.","Achei o quarto pequeno para três camas. Apertado.","7,0"
"27 de março de 2023","Ótimo custo benefício. Local excelente para relaxar.","Lugar com área de lazer ampla. Piscina muito boa e excelente atendimento.","","9,0"
"27 de março de 2023","Ótima para aproveitar Recife!","A localização do hotel é excelente, perto de várias farmácias, mercado, shopping, claro, da praia de Boa Viagem; a região é aparentemente segura. O ambiente é muito limpo, e o café da manhã bem gostoso.","O telefone do quarto não funcionava e não tinha elevador (não é um problema real, só uma observação).","8,0"
"26 de março de 2023","Bom pra ficar pouco tempo","A localização é muito boa. 
O hotel é bonitinho, limpo, preço bom, tem estacionamento gratuito (num prédio na frente) , atendentes simpáticos. Café da manhã gostoso.","O hotel como um todo é bem pequeno. 
O quarto é pequeno, a cama é pequena, as toalhas de banho estavam bem velhas (saindo as fibras da toalha) e o lençol da cama tb tinha furinhos de antigo. Não conseguia fechar totalmente a cortina e entrava claridade. O banheiro só tinha uma lâmpada e ficava um pouco escuro pra se arrumar. O secador de cabelo também muito antigo e quase não seca. A luz do banheiro não apagava também.","7,0"
"25 de março de 2023","Muito bom","Ótima localização e atendimento excelente, o café da manhã também foi muito bom","","8,0"
"24 de março de 2023","Bom para ficar poucas noites.","Passamos apenas uma noite mais atendeu nossa expectativa.","Como a gente ficou em um quarto próximo a cozinha logo cedo tinha um barulho de pratos batendo.","7,0"
"23 de março de 2023","Muito bom","Simpatia dos funcionários, pessoal da cozinha alem do cafe da manha gostoso sao super carinhosos, super bem localizado, pertinho da praia, na altura que da pra entrar, ar condicionado bom, cafe da manha variado e bem feito","Quartos pequenos, pouca iluminação natural, sentimos falta de um espaço em comum mais iluminaco","8,0"
"21 de março de 2023","Viagem com a família","Tudo perfeito....","Gostei de tudo.","10"
"21 de março de 2023","otima","O café muito bom, tudo muito simples mas muito organizado e de ótima qualidade","","8,0"
"21 de março de 2023","excelente estadia. Hotel muito bom!!!","limpeza do hotel, quartos, café da manhã, localização e em ter estacionamento.","gostei de tudo","10"
"21 de março de 2023","Lugar tranquilo e familiar super aconchegante","ambiente familiar e tranquilo","não teve","10"
"21 de março de 2023","Fantástico","Café da manhã delicioso, localização perfeita, funcionários atenciosos.","Nada a reclamar.","9,0"
"20 de março de 2023","Satisfatório","Bem variado com bastante opções","Acomodar cachorro.","8,0"
"19 de março de 2023","Muito satisfeita, super recomendo!","Recepção muito boa, quarto muito lindo, café da manhã muito bom, perfeito, com certeza voltaria a me hospedar em outra ocasião.","Gostei de tudo","10"
"19 de março de 2023","Ótima estadia, Custo benefício :)","Atendeu as expectativas, bom quarto! Café da manhã excelente","Nada a declarar","9,0"
"19 de março de 2023","Muito bom","O café da manhã era simples, mas muito gostoso. Muito bem localizado, tem estacionamento coberto e os funcionários são muito atenciosos.","Ficamos em um quarto para quatro pessoas. Na reserva, informamos que seriam quatro adultos, no entanto uma das camas era de criança e meu pé ficava para fora da cama. Havia comunicação de um quarto para outro, dava para escutar as conversas e o choro da criança, acredito que por conta do vidro que tem na fachada do hotel.","8,0"
"19 de março de 2023","Bom","Localização, café da manhã e simpatia do atendente","","7,0"
"19 de março de 2023","Excepcional","TUDO!
Ótimo atendimento!
Vim com meu pet e fomos mega bem recebidos
Eles tem estacionamento seguro
Café da manhã mt gostoso
Ótima localização","Nada a reclamar","10"
"18 de março de 2023","Excelente","Limpeza, café da manhã muito bom, quarto compacto, porém bem confortável.","Só o chuveiro que pra mim que sou alto a vazão fica próxima a parede, mais não atrapalhou a estada.","9,0"
"18 de março de 2023","Ótimo custo benefício","Custo benefício, café da manhã ótimo, limpeza.","Quartos pequenos.","8,0"
"17 de março de 2023","Tranquilo","O café muito bom","O banheiro o chuveiro tava frio","7,0"
"16 de março de 2023","Bom","Atenção da equipe.","Estado geral do hotel regular; roupas de cama e banho (muito) amareladas/gastas; café da manhã sem cuidado (apesar de um local familiar e com capacidade para poucos hóspedes).","7,0"
"16 de março de 2023","Excepcional","Localização, quarto confortável e funcionários simpáticos e prestativos.","","10"
"15 de março de 2023","Bom","Da localização.","A sala de café da manhã, além de ser pequena e não ter mesas suficientes, possui cadeiras muito grandes que não permitem que duas pessoas sentem de costas uma par a outra em mesas diferentes. Muito ruim a sala de café da manhã. Péssima.","7,0"
"13 de março de 2023","Excelente custo-benefício","Funcionários muito educados, solícitos e preocupados com nosso bem estar.
o café da manhã delicioso e diversificado.
A localização é perfeita quem vai para passeio.
Tudo limpo, confortável, organizado e funcionando.
Preço mais que justo para o que oferece.","","10"
"13 de março de 2023","Excepcional","Café da manhã gostoso, ótimos funcionários.","Nada.","10"
"13 de março de 2023","Excepcional","Funcionários atenciosos e café da manhã de qualidade. Inclusive facilidade para check in","Nada a declarar.","10"
"13 de março de 2023","foi de acordo com que esperávamos","banheiro amplo e bem limpo!","","8,0"
"13 de março de 2023","Fantástico","Atendimento","Nada a declarar","9,0"
"13 de março de 2023","Muito bom","Excelente custo benefício. Ótima localização, café da manhã simples mas satisfatório.","","8,0"
"13 de março de 2023","Surpreendente","Me surpreendi positivamente com essa pousada. Voltarei com certeza!","","10"
"12 de março de 2023","Excepcional","Tudo localizaçao otima ,cafe da manha maravihoso","Nada","10"
"12 de março de 2023","localização!","localização. perto do shopping, praia e supermercado. ótimo atendimento. garagem segura do outro lado da rua já incluso!","","10"
"11 de março de 2023","Recomendo. 5*","Estava tudo perfeito em relação ao quarto, limpeza e simpatia dos funcionários. Tem estacionamento em frente. Recomendo","Não é que não gostamos mas o estacionamento poderia ser portão automático para ajudar os funcionários que tem que ir abrir toda hora.","10"
"10 de março de 2023","Bom","tudo muito limpinho","só não gostei pq o cachorro fica solto tsrs e as vezes causa medo nas crianças. mas o cachorro é lindo","7,0"
"10 de março de 2023","Muito bom","Muito bem equipado, tv com muitas opções de canais fechado.","Deixou a desejar na limpeza. Ficamos no quarto 204 o ar condicionado não deu vazão.","8,0"
"9 de março de 2023","Excelente custo X beneficio em Recife","Limpeza do hotel, café da manhã muito gostoso, equipe atenciosa, estacionamento gratuito e localização.","Hotel pequeno com quartos um pouco apertados.","10"
"9 de março de 2023","Excepcional","Atendimento dos funcionários é excelente.","Gostei de tudo.kkk","10"
"9 de março de 2023","Excepcional","Excelente localização, café da manhã espetacular, funcionários solícitos, instalação simples porém confortável.","","10"
"8 de março de 2023","Ótimo hotel","Ótima localização do Hotel, quarto limpo e silencioso, café da manhã saboroso e funcionários muito atenciosos.","Quarto é bem apertado, só pra dormir.
Ar condicionado, ventilando mal e com cheiro de morfo. 
Falta de elevador.","9,0"
"8 de março de 2023","ótima","Atendimento dos colaboradores, Ezequiel e Marcelo, muito solícitos. Café da manhã muito bom! Tapioca com vários sabores à escolher","","9,0"
