"data_avaliacao","titulo","comentario_positivo","comentario_negativo","nota"
"17 de junho de 2024","Satisfatório","Ambientes espaçosos e limpos. Atendimento cordial e ágil. Estacionamento gratuito ao lado.","O quarto e o banheiro estão precisando de uma reforma caprichada. Só havia travesseiros altos e as toalhas pareciam muito gastas. Apesar de termos chegado às 03:00hs, não permitiram um horário estendido para café da manhã e acabamos não tomando.","6,0"
"14 de junho de 2024","Tem outros hotéis pelo mesmo preço em condições melhores.","Cama confortável.","O quarto tinha vários pontos de mofo, tive crises de alergia e de tosse. Além disso, os quartos extremamente próximos e a janela do meu quarto (que era no térreo) dava pra uma sala de convivência. Ou seja, um dos dias era meia noite, dia de semana e eu a trabalho, toda hora acordava assustada com as pessoas falando muito alto “do meu lado”. Outro detalhe é que a luz desse ambiente passava a noite toda acesa, o que fazia entrar uma claridade diretamente na direção do travesseiro. Ainda bem que levei tapa olhos.","4,0"
"13 de junho de 2024","Decepcionante.","","escadas, ar- condicionado sem funcionar, cama pequena e dura, chuveiro fraco, muito móvel no quarto e acima da cama.
Bati cabeça na televisão.","4,0"
"2 de junho de 2024","NÃO VALE O CUSTO","","Achei que ia apanhar do manobrista do estacionamento, só iria deixar o carro próximo a ele e já veio gesticulando algo do tipo 'não é para deixar aí, coloque neste sentido'

O quarto reservado era para a minha família, me colocaram no térreo, com janela para um corredor sem privacidade nenhuma, no mesmo pavimento do local do café da manhã, muitas máquinas próximas ao quarto, o que não corresponde com quarto silencioso
Banheiro minúsculo, o que categorizo a experiência como péssima e só tinha um espelho de correr como porta, com zero privacidade a quem está defecando.","6,0"
"23 de maio de 2024","Muito ruim","Localização","Tivemos azar , só pode ....","2,0"
"21 de maio de 2024","Satisfatório","Localização","Não tem elevador. Tem que subir escadas","6,0"
"11 de maio de 2024","Aceitável","","Tamanho do quarto","5,0"
"29 de abril de 2024","Razoável","Pequeno almoço bom. Simpatia do staff","Quarto muito pequeno. Casa de banho a precisar de ser renovada.","6,0"
"28 de abril de 2024","Infelizmente decepção com a experiência","A limpeza da recepção e a localização nao é ruim","O quarto tinha mofo nas paredes e rodapés, a janela não abria (quarto no térreo) e o cheiro de umidade era grande, barulho muito cedo (ao lado da cozinha), as toalha estavam muito puídas, a portaria frequentemente ficava sem ninguém e a porta fechada (havia necessidade de tocar o interfone e aguardar alguém abrir). Havia também um cachorro na portaria (acredito ser do dono do Hotel). Eu amo cachorro e ele parece bem dócil MAS isso pode ser um problema para quem tem medo de animal ou criança muito pequena. Quanto ao quarto, talvez a condição dos quartos superiores sejam melhores.","4,0"
"27 de abril de 2024","Podia ser melhor","Localização boa , limpeza e educação dos funcionários.","O colchão ruim, quarto com cheiro e paredes com mofo","6,0"
"24 de abril de 2024","Wi-fi péssimo","O café da manhã é muito bom...","Recepcionista muito incoveniente.
O wi-fi é péssimo, ficamos no quarto 01 e o wi-fi não pegava de nenhum jeito.
Muito barulho no quarto, pois ficar ao lado da cozinha.","2,0"
"12 de abril de 2024","Satisfatório","","Meu quarto ficou perto do local que serve o café da manhã , então desde 5h da manhã eu tinha sido acordada por causa da conversa dos funcionários em preparar o desjejum , além do barulho com a arrumação dos pratos e das mesas . Achei isso muito chato para quem é hóspede , acabei não pegando mais no sono , com o barulho externo do espaço .","6,0"
"11 de abril de 2024","Razoável","Estacionamento","Quartos pequenos, chuveiro péssimo e café da manhã razoável","6,0"
"4 de abril de 2024","Difícil","Localização e café da manhã ótimos.","Nos colocaram no quarto 4 no térreo, quarto pequeno sem ventilação e o pior era que tinha uma janelinha no banheiro que dava direto na área de descanso dos colaboradores, um cheiro insuportável de cigarro, pedi para trocar o quarto, porém falaram que estava lotado. 
Os quartos superiores podem até ser bom, mas eu não indico se hospedarem no térreo, principalmente o quarto 4.
Foi 1 noite bem complicada.","4,0"
"30 de março de 2024","Custo benefício bom, mas decepcionante!","O hotel é até bonito, próximo ao aeroporto é tbm do shopping. Os porteiros são muito solícitos e educados.","O cheiro do quarto quando chegamos era horrível, além das roupas de cama que tbm estava com cheiro forte de sujo (como se estivessem molhado e não deixado secar). Não conseguimos tomar café devido ao local do café ser pequeno e ter hóspedes sem noção, que querem esperar o passeio dentro do refeitório. O que dificulta muito quem precisa embarcar logo nas primeiras horas do dia.
O chuveiro tbm não esquentava bem, até o porteiro nos explicar que existe uma chave de segurança que nada mais é que um interruptor que parece mais ser da luz do que de segurança.
As toalhas estavam com cheiro ruim, amareladas e com manchas.","5,0"
"29 de março de 2024","Satisfatório","","Quarto casal muito pequeno 
Moscas no café da manhã","6,0"
"27 de março de 2024","Aceitável","Atendimento e localização","Cama desconfortável e muito barulho","5,0"
"24 de março de 2024","não gostei","Café da manhã bom, porém com poucas opções e os funcionários fazendo pressão para os hóspedes terminarem logo o café.","Diária muito cara para poucos benefícios. Chuveiro apenas com água fria, mosca no quarto, quarto com limpeza inadequada, internet péssima, TV não funcionava, café da manhã bom, porém com poucas opções e os funcionários fazendo pressão para os hóspedes terminarem logo o café.","4,0"
"11 de março de 2024","Poderia melhorar","O atendimento dos funcionários foi muito cordial","O ar do quarto estava despejando agua encima de uma das camas, tinha muito pernilongo no quarto.
As roupas de cama estavam manchadas","6,0"
"23 de fevereiro de 2024","Decepcionante","Nada","Tinha uma barata no quarto. Trocamos de quarto. Mas a noite não foi tranquila.","4,0"
"21 de fevereiro de 2024","Razoável","Quarto grande para famila","Recepcionista muito grosseiro. Café da manhã muito apertado!!! 
Não nos informaram sobre um interruptor que fica fora do box para ligar a eletricidade do chuveiro. Meu marido tomou banho de água fria. Depois outra hóspede nos explicou como aquecê-lo","6,0"
"20 de fevereiro de 2024","Péssimo","Localização","Urina do cachorro em ambientes comuns,exemplo nos corredores","1,0"
"17 de fevereiro de 2024","Satisfatório","Localização. Café da manhã (apesar de muito barulho das funcionárias da cozinha).","Limpeza horrível.
Roupa de cama suja.
Escadas...","6,0"
"17 de fevereiro de 2024","Péssimo","O café da manhã era bem servido mais o espaço é muito pequeno","Do quarto muito pequeno sem ventilação","3,0"
"16 de fevereiro de 2024","Aceitável","Localização","Banho, instalações, vista","5,0"
"12 de fevereiro de 2024","Valor muito acima do que é oferecido","","Fiquei no térreo, próximo à recepção. Nada obstante, a internet era péssima e não pegou no quarto. O hotel não atendeu as expectativas, em virtude do alto valor pago na diária. Outro ponto desagradável: falta de água no quarto, motivo pelo qual não pude nem lavar minhas mãos e me foi oferecido o banheiro social do hotel.","5,0"
"11 de fevereiro de 2024","Agradável","Quarta com tamanho bom, chuveiro bom. Café da manhã gostoso e variedade boa. Ótimo atendimento dos funcionários.","O box do banheiro é bem pequeno, quase não dá para se movimentar. A cama eram duas de solteiro combinadas bem perceptível pois ficava um espaço entre elas. Wi-Fi bem ruim no segundo andar. A localização não é tão próximo da orla como eu pensei.","6,0"
"7 de fevereiro de 2024","A estadia poderia ter sido melhor.","Da localização. 
O café da manhã era bom e as meninas da cozinha foram muito receptivas.","O quarto tinha cheiro de mofo.
A janela estava quebrada, não trancava.
Apesar da cama ser de casal, não tinha coberta de casal.
Atendimento da recepção ruim. Chegamos e não nos deram nenhuma explicação de nada, apenas disseram o número do quarto e fizeram a cobrança.","6,0"
"7 de fevereiro de 2024","Atendimento e localização","As equipes da limpeza e da cozinha são incríveis, fazem de tudo para nos sentirmos à vontade e bem acolhidas, surreal o carinho e atenção delas!!! O café da manhã tinha uma grande variedade e tudo era muito gostoso! 
A localização é excelente!","O quarto triplo era bem apertado, o banheiro além de apertado precisa urgentemente de melhorias (assento do sanitário, chuveiro e suporte para produtos no box).","6,0"
"30 de janeiro de 2024","Falta de Higiene","Terem reservado quarto no térreo como pedimos.","Tinha um cachorro andando dentro do hotel, fezes de cachorro no corredor próximo a porta do quarto e urina de cachorro no chão e nas paredes. O cachorro ficava transitando onde é servido as refeições. Total falta de higiene.","2,0"
"30 de janeiro de 2024","Regular","De quase nada","De quase tido em geral","4,0"
"29 de janeiro de 2024","Satisfatório","Proximidade do aeroporto, acesso ao hotel.","O hotel não tem elevador, pedi andar alto mas fui surpreendida na chegada. Não foi legal, mesmo que tenha sido um quarto no segundo andar.","6,0"
"21 de janeiro de 2024","Aceitável","Cafe da manhã","Os quartos sem janela.","5,0"
"19 de janeiro de 2024","Infelizmente insatisfeito","Dá limpeza, funcionários.","O quarto em que fui hospedada fica próximo a cozinha, com muito barulho do quarto conseguia ouvir o barulho da cozinha e toda vez que abria a porta do banheiro social o vácuo rebatia na porta do quarto fazendo um barulho a sensação era que alguém estava abrindo a nossa porta.","3,0"
"18 de janeiro de 2024","Aceitável","quartos bom ar funcionando ok","café da manha não tinha mesa limpa tudo tinha que pedir para funcionário muito ruim e o local apertado","5,0"
"17 de janeiro de 2024","Poderia ser melhor.","Da localização e da garagem para o carro.","O refeitório é muito acanhado, as opções de comida do café da manhã é pouco variado a manutenção e limpeza do banheiro deixaram a desejar.","5,0"
"14 de janeiro de 2024","Decepcionada","Perto da praia e funcionários solícitos e educados.","Não sei se nos colocaram neste quarto porque seria apenas uma noite, mas não era nada do que vi nas fotos ao seleciona-lo. Principalmente o banheiro foi a MAIOR decepção. Pequeno demais, com mofo nas paredes, e sem um suporte nem p por sabonete. Quarto com pequena janela que dava p os fundos do prédio. Abafado e sem ventilação. Apenas ar condicionado. Se ficássemos p ir a praia não teríamos como ficar no hotel. Só passagem mesmo. Mas a tarifa paga provavelmente foi a mesma de outros quartos melhores (apresentados na foto do booking).","6,0"
"5 de janeiro de 2024","Péssimo","","Quando cheguei, às 23h - horário avisado desde a reserva! - me disseram que a reserva tinha sido cancelada a meu pedido, o que absolutamente não era verdade! Tarde da noite, tivemos que encontrar outra acomodação.","1,0"
"5 de janeiro de 2024","Satisfatório","A localização é muito boa.","O quarto que fiquei a porta do banheiro não fechava, o quarta tinha muito inserto.","6,0"
"29 de dezembro de 2023","Decepcionante","Da localização","Ar condicionado com cheiro de mofo","4,0"
"28 de dezembro de 2023","Satisfatório","Atendimento da recepção excelente","Cama/travesseiro desconfortável, ar-condicionado fraco e barulhento, espaço de café da manhã bem cheio","6,0"
"26 de dezembro de 2023","Ruim","Localização boa","Barulheira a noite toda.Chegamos no hotel as 22:30 pra sair as 6 da manhã ,a noite inteira teve pessoas batendo portas e falando nos corredores, ar condicionado não tinha como regular temperatura .","3,0"
"15 de dezembro de 2023","Satisfatório","O hotel é bem simples, com cama ruim e o banheiro mal dá para se virar; café da manha satisfatório; a limpeza nas áreas comuns deixa bastante a desejar. É um hotel pet friend, e em relação a isso foi tudo bem, porém deveriam disponibilizar tapetes higiênicos e potes de agua para os pets, para mim não fez falta pois sempre levo e, nem gosto de deixar o meu usar esses pertences de outros pets.","a limpeza em geral e o banheiro extremamente apertado","6,0"
"14 de dezembro de 2023","Não gostei e não voltaria.","*Boa localização para quem pretende curtir a orla de Boa Viagem. 
*Estacionamento gratuito em frente à pousada. 
*Café da manhã com boas opções e variedades.","*Ambiente para café da manhã pequeno, com cadeiras grandes (o que torna o salão mais desconfortável). Além disso, ficou um cachorro circulando no ambiente do café. Questionei o fato de ter um cachorro circulando, o responsável então me perguntou se eu não gostava de animais, respondi que achava bem complicado ter animal solto circulando assim em área de refeição e o levaram para a cozinha!
*Pouco depois do meu check-in, avistei fezes no caminho da recepção para os quartos. Avisei ao recepcionista que me disse ""é do cachorrinho, vou pedir para limpar"". 
*Ao efetuar a reserva, solicitei cama de casal. A Pousada respondeu que atenderia ao meu pedido, mas na verdade juntaram duas camas de solteiro com um lençol de casal, o que deixou bem desconfortável, Melhor teria sido falar a verdade.","4,0"
"10 de dezembro de 2023","Hotel extremamente simples em Recife","A localização é ótima e tem estacionamento (fica no prédio da frente).","Espaço do café da manhã bem apertado, tivemos que esperar liberar mesa para poder tomar. O banheiro é pequeno e a limpeza deixou muito a desejar, tinha pelo/cabelo no box.","6,0"
"1º de dezembro de 2023","Decepcionante","Da localização, por ser próximo à praia","A limpeza deixou-a desejar 
Os funcionários não foram muito receptivos 
E no estabelecimento há um cachorro doméstico o qual fica na cozinha, dessa forma, transpareceu um ambiente não limpo.","4,0"
"29 de novembro de 2023","Quarto minúsculo/ W lan horrível","Café da manhã e as copeiras","Cama com defeito, Quarto muito pequeno, wlan não funcionou. Para enviar mensagem tive que sair do quarto","6,0"
"24 de novembro de 2023","Pelo que vi no site esperava mais.","Localização.","Do café da manhã.
Acessibilidade.
Fotos de divulgação muito distantes da realidade.","6,0"
"24 de novembro de 2023","Inferior ao esperado.","O café da manhã e a localização","A limpeza e o tamanho do quarto. Fora que, juntar duas camas de solteiro não faz isso uma cama de casal.","6,0"
"20 de novembro de 2023","Satisfatório","Localização","","6,0"
"18 de novembro de 2023","Não recomendo","Lamentável","Sem comentários","1,0"
"8 de novembro de 2023","Lamentável, não retorno.","Recepção do atendente Everaldo/Aderaldo e localização.","Mau estado dos quartos, mau cheiro, ar condicionado quebrado, tive que trocar de quarto… ambiente precário diferente do que eu imaginei pelas fotos.","3,0"
"4 de novembro de 2023","Aceitável","Localização e atendimento.","Colchão ruim, quarto pequeno, café da manhã com poucas opções (pão velho e seco, não tinha ovo nem queijo branco). O exaustor do banheiro com problema, a parede do quarto ficou toda molhada.","5,0"
"31 de outubro de 2023","otimo custo beneficio","Cafe da manha bom, localização boa perto da praia, hotel limpo....funcionarios atenciosos, restaurante proximo","Eu não gostei da cama colchão muito mole se um é mais pesado que o outro o colchão entorta","6,0"
"30 de outubro de 2023","Pra quem quer só dormir por 1 noite TALVEZ o custo benefício valha","Quarto estava bem limpo e o chuveiro funcionava bem. Tem frigobar no quarto","Pelas fotos e avaliações eu esperava mais. As camas e os travesseiros eram MUITO moles (pra quem tem problema de coluna pode desistir de se se hospedar neste local, eu que não tenho sai com dor nas costas). No café da manhã as comidas podiam ter escrito o que são, vi algumas coisas em travessas que não fazia ideia do que era. Senti falta de coisas simples como um ovo mexido. Lavar o rosto na pia do banheiro era bem difícil. A pia era pequena e a torneira era bem no meio.","6,0"
"25 de outubro de 2023","Satisfatório","Preço.","Muito pequeno, enfim.","6,0"
"20 de outubro de 2023","Ruim. O cheiro de mofo no quarto estragou tudo.","O café da manha era bom, apesar do restaurante ser muito pequeno para o número de hóspedes.","O cheiro de mofo no quarto era muito forte.","4,0"
"15 de outubro de 2023","Não recomendo, simples demais","Café da manhã razoável
 Localização ok","Cama ruim, parecia um colchão de água.
Chuveiro ruim, água saia praticamente rente a parede do banheiro. Não tinha shampoo.
O quarto era divisória feita com armário e não parede, ou seja, escuta-se tudo que ocorre no quarto ao lado, uma vergonha! 
Tem um cachorro circulando pelo hotel, anti higiênico, porque fica na área onde ocorre o café da manhã. 
Não tem elevador
Estacionamento é do outro lado da rua.
Na esquina parece ter um ponto de prostituição","4,0"
"1º de outubro de 2023","Lugar razoável","Minha avaliação como bom,tv não ligava no controle , só manualmente, a princípio não consegui ligar tive que avisar recepção,que depois de alguns minutos ligaram a tv. Só que depois o problema voltou. Pia do banheiro pouca água saindo da torneira banheiro teto descascando, preço um pouco alto pelas condições do ambiente ,já estive em lugares melhores em boa viagem por menos. Café da manhã bom. Wi-fi péssimo, sinal ruim caindo bastante.","Tv com problema, wi fi péssimo.","6,0"
"30 de setembro de 2023","Satisfatório","A localização e o café da manhã.","O quarto tinha cheiro de umidade/mofo, pedimos para trocar, mas eles disseram ser todos iguais. O chuveiro não era bom, elétrico e saia pouca água. Quarto com coisas danificadas, o lençol da cama de casal era muito pequeno, tamanho de solteiro. O local para tomar o café da manhã é muito pequeno.","6,0"
"26 de setembro de 2023","Hotel bom mas que infelizmente teve maus hóspedes","Bom tamanho e moderno","Mofo no teto do banheiro e poeira no Ar e por trás da Tv. No café da manhã teve um grupo que comeram tudo pela frente e não houve comida para os outros hóspedes. A sala para o café não comporta todos hóspedes e fica muito apertado e sem mesas. Teriam que ter mais reposição dos itens. Infelizmente existe pessoas que só pensam em si e parece que nunca viram comida na vida. Estragaram muita coisa e com olho grande pareciam uma praga de gafanhotos comendo tudo pela frente. Houve bastante hóspedes que reclamaram e ficaram indignados com a situação.","6,0"
"23 de setembro de 2023","Boa localização, mas limpeza poderia ser melhor.","A localização é boa, as pessoas muito gentis e solícitas com as informações. Boas opções de café da manhã.","O quarto é bem simples e precisava de um pouco de manutenção, pois o aspecto estava meio velho. O banheiro tinha cabelo e o vaso não estava limpo. O café da manhã poderia se estender um pouco mais tarde.","6,0"
"22 de setembro de 2023","Trevas","Educação dos funcionários.","Tinha uma barata no travesseiro e todos os lençóis de cama estavam manchados e/ou furados. Além disso, tinha teia de aranha e unhas no chão do quarto.","1,0"
"20 de setembro de 2023","Satisfatório","","Roupas de cama e travesseiros mais novos. Quarto muito pequeno pra família.","6,0"
"19 de setembro de 2023","Experiência ruim","","Atendimento recepção, quarto e banheiro.","5,0"
"19 de setembro de 2023","Tinha tudo pra ser bom... mas não foi.","Escolhemos o hotel por conta da localização. Como iríamos chegar bem tarde, escolhi algo proximo do aeroporto, mas que nos desse a possibilidade de conhecer Boa Viagem, mas chegamos em Recife e estava chovendo. 
Na manhã seguinte estava chovendo mais ainda, por tanto a localização não conseguiu encobrir os outros problemas que tivemos.","Chegamos de madrugada e logicamente não esperávamos chegar em Recife debaixo de chuva. 
Acordamos com o quarto cheio de agua. As malas que ficaram em cima de uma esteira estavam molhadas. 
Acredito que o pessoal do hotel tbm não estava esperando que chovesse, pois havia um buraco no teto onde caia muita agua, ou seja, não foi algo inusitado. 
A acomodação não poderia estar disponível.","6,0"
"12 de setembro de 2023","Satisfatório","A localização é muito boa.","Solicitamos um quarto com cama de casal e foi colocado duas camas de solteiro juntas, sendo que entre elas parecia que tinha um pedaço de pau, impedindo dormir junto como casal. Quarto e banheiro extremamente pequeno impossibilitando muita movimentação. O café da manhã se chegar após as 08:45 (horário que tomamos café durante os dois dias) não há reposição dos produtos que acabaram, tinha acabado os pães, sanduiches, ovo cozido entre outros.","6,0"
"10 de setembro de 2023","Experiência péssima","Apenas a localização","O apartamento não condiz com as fotos, extremamente apertado e improvisado, barulhento pois dá pra ouvir qualquer barulho dos corredores. Fiquei no quarto 07 ao lado da rouparia e de manhã cedo às 6h já dava pra ouvir barulho de funcionário e até música. Pedi pra colocar cama de casal e juntaram 2 de solteiro com a luminária no meio da cama na parede, colocando em risco a segurança pois poderia bater a cabeça naquilo. Banheiro super apertado mal dá pra se mexer, a pia é muito baixa. Café da manhã é péssimo, quando cheguei não tinha quase nada e os funcionários não repõem","1,0"
"10 de setembro de 2023","Satisfatório","Atendimento na recepção muito bom, conforto do hotel muito bom, café da manhã ótimo","Camareiras extremamente despreparadas e mal educadas, antes de dar o horário de sair, sentaram na porta do quarto praticamente nos expulsando e soltando palavras desagradáveis para irmos embora o tempo inteiro, solicitei a gerente e a mesma não estava no local.","6,0"
"7 de setembro de 2023","Deixa a desejar.","Localização","Muita escada (3 andares sem elevador), colchão de mola muuiiiito macio, cama de casal pequena demais, café da manhã servido em local sem conforto (tivemos que ficar aguardando por um bom tempo a vagar mesa).","5,0"
"30 de agosto de 2023","Deu certo pq praticamente só dormi.","Gostei da recepção, todos muito solicitos, café da manhã muito bom. Limpeza padrão","O quarto não tinha nenhuma Janela, então me senti enclausurada, apareceu barata no banheirto.","4,0"
"26 de agosto de 2023","Satisfatório","O café da manhã é bom.","O quarto é pequeno e tem cheiro de mofo.","6,0"
"25 de agosto de 2023","Falta manutenção","Localização e atendimento","Limpeza e manutenção. A TV não funcionou e não fizeram a devida manutenção , bem como, o sinal de wi fi","4,0"
"22 de agosto de 2023","Horrível","Atendimento / bons funcionários / café da manhã muito bom","Quarto pequeno demais / chuveiro pressiono / ar condicionado com problema (tive que chamar o recepcionista 3 vezes durante a noite porque o disjuntor desligava sozinho","6,0"
"20 de agosto de 2023","Satisfatório","A simpatia dos funcionários","Meu quarto ficava no térreo, ao lado da cozinha.Dava para escutar tudo desde muito cedo.","6,0"
"16 de agosto de 2023","Só pra passar uma noite.","Localização","Escadaria pra subir. Várias. Cama péssima. Quarto cheio de mofo.","5,0"
"15 de agosto de 2023","Razoável","Hospitalidade, funcionários prestativos.","Utilizei um quarto triplo(106), quarto estava com mau cheiro, muito mofado, infelizmente o hotel estava cheio e não foi possível efetuar a troca de quarto.","5,0"
"14 de agosto de 2023","Não gostei","Localização","Muuuito pequeno o quarto. Lençóis e toalhas antigas. Aspecto de sujo. Banheiro meio sujo.","6,0"
"13 de agosto de 2023","A única coisa que tenho de ponto positivo é o atendimento das moças no café da manhã. Elas são extremamente educadas e s","Estive na acomodação antes da pandemia, e o atendimento e a acomodação já foram melhores.
O quarto que nos colocaram era no terreo, do lado da área de café, estava com o banheiro entupido e o ar condicionado vertendo água. Precisamos mudar de quarto logo no primeiro dia.
Informamos o que estava acontecendo logo cedo e nos falaram que pra resolver o problema precisaria esperar o zelador ??? E que ele só chegaria depois das 9h.
Um absurdo. Qualquer problema que ocorra antes das 9h não será resolvido.","A manutenção dos quartos e ambientes poderiam ser melhor.
Os lençóis e toalhas estão bem gastos, o ar condicionado faz muito barulho( quando não quebra), os banheiros precisam urgente de manutenção.
No café da manhã não há opção de zero glúten/lactose.","6,0"
"8 de agosto de 2023","Ruim","Apenas a localização é boa.","Limpeza péssima, acho que limpam apenas o chão, muita poeira nos móveis.
O banheiro parece que nunca teve uma limpeza de verdade, muita mancha de mofo nos azulejos, o box chega a ser nojento, fora isso o chuveiro nao esquentou e a agua sai torta.
Toalhas muito velhas","2,0"
"8 de agosto de 2023","Aceitável","Do café da manhã!!","Do estacionamento da outra via da rua , não tem elevador tendo que subir escada ficando com as pernas a mostra de quem esta no café da manhã.. não tem piscina pra uma ária bem localizada","5,0"
"5 de agosto de 2023","Não voltaria","Localização","Banheiro, escadas para chegar ao quarto, garagem em prédio fora do hotel, cheiro de mofo no quarto, colchão muito mole","6,0"
