data_avaliacao;titulo;comentario_positivo;comentario_negativo;nota;;;;
5 de fevereiro de 2023;Baixo custo-benefício;Quarto tem uma boa estrutura e o hotel tem uma boa localização, apenas.;O hotel está completamente cercado por outros prédios, comprovando como é falta a imagem que é apresentada, aparentando ser um hotel muito maior e sem outros ao redor.;;;;;
;;;;;;;;
Além disso; o hotel me posicionou no térreo; onde não se tinha uma visão agradável; apenas um muro com espinhos. ;;;;;
;;;;;;;;
O hotel não conta com estacionamento tampouco com café da manhã; fazendo com que se tenha que pagar um adicional para vir a desfrutar de tais serviços.;;;;;;;
;;;;;;;;
Por fim; concluo afirmando que não foi uma experiência digna do valor desprendido;" provando-se uma estadia muito cara sem muito a agregar ao cliente.""";4;;;;;
26 de janeiro de 2023;Bom custo benefício, mas não voltaria.;A localização é boa, muito próximo da praia e do shopping. As instalações do hotel possuem design moderno e bonito.;Um dia antes da viagem recebi uma mensagem dizendo que deveria entrar em contato com o hotel para demonstrar interesse na reserva e que tinha até as 16hrs do dia seguinte para fazer isso. Caso contrário a reserva seria cancelada. Acho isso um absurdo pois é óbvio que a pessoa tem interesse, senão não teria feito a reserva. Imagine também que a pessoa possa estar em trânsito sem conexão e ao chegar no hotel tem uma surpresa bastante desagradável.;;;;;
;;;;;;;;
Outras coisas que não gostei: As paredes do quarto estavam sujas;" não tinha toalha de rosto no banheiro e o filtro do ar condicionado estava muito sujo de poeira.""";7;;;;;;
24 de janeiro de 2023;mais ou menos;;não estava com cheiro bom;6;;;;
22 de janeiro de 2023;local agradável, limpo, condiz com o ofertado. funcionários atenciosos;limpeza e conforto;;7;;;;
13 de janeiro de 2023;Excelente localização e bom custo benefício, mas a garagem é minúscula.;Boa opção de hotel perto da praia, bem localizado e Pet Friendly;;;;;;
;;;;;;;;
Escolhi esse hotel por ser próximo da praia e ser bem localizado.;;;;;;;;
Tem mercados; farmácias e restaurantes por perto.;;;;;;;
Da pra ir a pé para o Shopping de Recife (de preferência de dia que é menos perigoso).;;;;;;;;
;;;;;;;;
Fomos bem recebidos no hotel; nos informaram sobre o café da manhã que é servido nos quartos e no check in nos deram uma cortesia. Tanto na recepção quanto pelos manobristas da garagem; fomos bem atendidos; os funcionários foram educados e prestativos.;;;;;
;;;;;;;;
O café da manhã foi servido no quarto no horário marcado na recepção; a comida estava boa.;;;;;;;
;;;;;;;;
O quarto Standart que foi o que escolhemos não é muito grande; mas pra quem vai passar a maior parte do dia fora; serviu bem. Estava limpo; bem arrumado e organizado; cama boa; chuveiro quente.;;;
É um quarto funcional para duas pessoas;" mesmo para aqueles que tem um cachorro também.""";Quando fui estacionar o carro apareceu uma desvantagem, a garagem é bem apertada. Não tem vaga para SUV grande e camionete, mesmo sedam fica bem apertado. Custei a conseguir estacionar e mesmo assim pra sair do carro sem encostar a porta no carro do lado foi uma dificuldade.;;;;;;
;;;;;;;;
A limpeza de quarto foi feita somente no primeiro dia;" no segundo não fizeram.""";7;;;;;;
11 de janeiro de 2023;razoável;localização;instalações;7;;;;
10 de janeiro de 2023;Estadia muito ruim;Apenas da localização;Estado geral do quarto ruim.;;;;;
Banheiro com vazamento no vaso; torneira da pia quebrada; o banheiro alaga quando toma banho.;;;;;;
"Roupa de banho encardida e velha""";2;;;;;;;
5 de janeiro de 2023;Bom;;café restrito;7;;;;
4 de janeiro de 2023;Minha estadia deixou a desejar em relação ao café da manhã, a ausência de frigobar, e ao fato de qualquer item precisar;A acomodação é padrão. Hotel executivo. É ok.;O café da manhã é pessimo. O Café preto horrível. Não dispõe de frigobar, e sim de uma adega de vinho que não guarda nenhuma pertinência com a finalidade da acomodação.;5;;;;
4 de janeiro de 2023;não vou nunca mais;quarto limpo bem arejado;café da manhã muitoooooo ruimmmmmmm estacionamento horrível apertado e tem que deixar chaves do carro com manobrista;4;;;;
31 de dezembro de 2022;Ruim;Das fotos no site booking;A nota não condiz com fabuloso;;;;;
Péssimo café da manhã;" animais latindo..""";2;;;;;;
31 de dezembro de 2022;Ruim;Das fotos publicadas no site do booking.;Das instalações em geral, garagem rua e café da manhã.;2;;;;
29 de dezembro de 2022;Bom;boas camas;quarto no térreo e sem bufê de café da manhã;7;;;;
22 de dezembro de 2022;Bom;Limpeza , localização;Café da manhã;7;;;;
19 de dezembro de 2022;Bom;Da localização;Das opções de café da amanhã, falta um espelho grande no quarto;7;;;;
16 de dezembro de 2022;Decepção;Banheiro extremamente sujo , mofo e sem ingienisar;Banheiro extremamente sujo, mofo,sem condições de uso;4;;;;
16 de dezembro de 2022;Bom custo benefício, precisando apenas de alguns ajustes!;Café da manhã servido no quarto, gentileza dos funcionários.;Reduzido quantitativo de funcionários, roupas de cama manchadas aparentando estarem sujas, estacionamento muito pequeno. Passamos 1 hora no quarto esperando a camareira chegar no quarto para trocar as roupas de cama, que estavam manchadas.;7;;;;
15 de dezembro de 2022;Bom;Localização;Quarto pequeno;7;;;;
11 de dezembro de 2022;Bom;Da recepção e simpatia dos funcionários;;7;;;;
10 de dezembro de 2022;Decepcionante;O chuveiro era bom e a cama confortável.;A limpeza estava bem;;;;;
precária. Havia várias aranhas e teias de aranha atrás da porta do banheiro e dentro do box. No segundo dia; apareceu uma barata no quarto; além de haver sujeira embaixo da cama de solteiro. Enfim; a limpeza é péssima. ;;;;;
Reclamei durante a estadia sobre a limpeza do quarto; mas; ainda assim;" não deram prioridade.""";4;;;;
8 de dezembro de 2022;Rasuavel;Instalação;Um perfume q deixei voltei pra buscar e eles disseram q não tinha deixado, e deixei sim no banheiro;3;;;;
8 de dezembro de 2022;Atendeu a necessidade;Da localização, tamanho do quarto, cama e chuveiro.;Café da manha. Era no quarto, sem estrutura para comer direito e todo dia a mesma coisa com muito pão.;7;;;;
7 de dezembro de 2022;Ótimo custo benefício. Instalações novas e confortáveis. Não gostei do café da manhã(muito restrito);Ótimo custo benefício. As instalações são novas. Muito agradável.;O ponto negativo para mim foi o café da manhã. Como o café da manhã é servido no quarto, já vem a bandeja pronta. E todo dia era a mesma coisa: um mini pão francês integral (meio duro), um mini pão francês normal, um mini croissant, um ovo mexido, duas opções de frutas, três fatias de queijo, iogurte, suco e café. ;;;;;
;;;;;;;;
O ponto negativo para mim foi não ter tido a opção de escolher o que iria comer. Ex.: ao invés dos pães; poderia ter a opção de escolher cuscuz ou tapioca. ;;;;;;;
;;;;;;;;
Fiquei 3 dias;" então no último dia já nem aguentava ver aqueles pães.""";7;;;;;;
30 de novembro de 2022;Não é um hotel mas uma pensão moderninha.;A localização era boa e o hotel é relativamente novo. O quarto aparentemente estava limpo.;Apesar de relativamente novo, o mobiliario é muito simples e de baixa qualidade. As roupas de cama são de péssima qualidade. Não oferece qualquer tipo de serviço, nem uma pessoa para carregar suas malas. Há apenas uma pessoa na portaria, que caso se ausente, fica sem um substituto. Muito ruim.;7;;;;
27 de outubro de 2022;Barata no quarto;A localização é boa, o preço convidativo, o wifi é razoável e o atendimento e solução de problemas foi justa, mas vejam abaixo...;"O hotel está com 4 anos, mas já está velho, apesar de ser todo com tema em preto que evita os defeitos e sujeira aparecerem, se você olhar atento, já está tudo virando um lixo no hotel... Má qualidade das coisas e falta de manutenção... Mas o pior de tudo foi que, saí para jantar e eles foram juntar as camas (pois solicitamos quarto de casal e ao chegar eram 2 camas de solteiro), ao voltar, havia uma baratinha morta em cima da cama, não fiquei feliz, mas peguei um papel higiênico, catei e pus no lixo, mas ao voltar, fui reparar, tinham ao menos 10 baratinhas mortas no chão... Imediatamente ligamos na recepção, pelo modo como fomos atendidos, eles já sabiam... Na hora prontamente nos trocaram de quarto, o rapaz que subiu pra ajudar nos relatou que quando foram juntar as camas viram uma barata e jogaram ""produto"", poxa, mas aí é ÓBVIO que o restante delas vai sair do ninho e se espalhar ne, resumo, uma dezena de baratas mortas pelo quarto e uma ainda viva... Pior, ainda aplicarem produto e não falarem nada com o cliente, forçando o cliente a dormir com inseticidas cancerigenas!!! Ao menos nos trocaram de quarto prontamente, para um quarto quádruplo e foi resolvido, mas poxa, já haviam visto as baratas, deveriam ter já sugerido a troca de cara e jamais deixar o cliente dormindo com inseticida na cara... Triste decisões...";6;;;;
19 de outubro de 2022;Bom;Bom preço e localização;Acústica ruim. Quarto barulhento. Internet estava com problema e não funcionou. Ovos em falta no café da manhã.;7;;;;
18 de outubro de 2022;Bom;Estava limpo. Cama confortável.;Nao gostei porque tinha cheiro de maresia no quarto. estava muito abafado quando cheguei. Cheiro forte. Parecia mofo, mas é da maresia. O quarto extremamente pequeno para 2 pessoas. Sem lugar para acomodar as coisas, roupas. O espaço para pendurar roupas, era muito pequeno. Nem compensou tirar roupas da mala para pendurar. O frigobar apenas esfriou as bebidas. Não gelava.;7;;;;
16 de outubro de 2022;Regular.;da localização;quarto no andar térreo, sem vista. os quartos não possuem rodapés dão aspecto de sujo, a mobília é simples.;4;;;;
9 de outubro de 2022;Bom;Localização, próximo ao aeroporto;Roupa de cama suja;7;;;;
5 de outubro de 2022;Bom custo benefício;Quarto limpo, chuveiro bom, funcionários muito atenciosos.;Café da manhã no quarto sem lugar pra sentar e comer, 1 pessoa senta na cadeira as demais tem que comer na cama, cai comida no quarto, por isso tinham muitas formiguinhas dentro do quarto. Não tem toalha de rosto, só de banho e não possuem estrutura para criança (assento redutor de privada, banheira);7;;;;
5 de outubro de 2022;Satisfatório;Cama ótima, localização, recepção ótima tem lugar para guardar a mala se precisar esperar mais tempo no hotel.;Barulho demais, café da manhã ótimo porém suco veio estragado pedimos a troca e não veio.;6;;;;
4 de outubro de 2022;Aceitável;Atendimento;Café da manhã;5;;;;
1º de outubro de 2022;Satisfatório;CAFE BOM;NAO TEM SERVICO DE CUARTO,SI DESEYA COMER ALGO TEM QUE PROCURAR UM RESTOURANTE;6;;;;
27 de setembro de 2022;Café poderia ser melhor.;Ótima localização.;Do café da manhã, porque era sempre servidos os mesmos alimentos no quarto. Pouca variedade. Fora isso...restante tudo muito bom.;7;;;;
26 de setembro de 2022;a estadia foi satisfatória, mas o relacionamento humano foi perfeito!;os atendimentos na recepção foram sempre ótimos e destaco a excelência da atenção e zelo do gerente com o hotel e com o hóspede. Parabéns e obrigada!;café da manhã no quarto, falta de restaurante para uso dos hóspedes, bem como ausência de serviço no quarto para refeições rápidas.;6;;;;
25 de setembro de 2022;razoável;a cama é confortável, o quarto é limpo e silencioso. ótimo para curta estadia de 1 ou 2 noites no máximo.;café da manhã igual todos os dias, pão, ovo mexido, uma fruta, iogurte suco de laranja, 1 fatia de queijo, 1 de peito de peru, 1 fatia de queijo branco, todos os dias a mesma coisa, no banheiro não tem lugar para colocar um shampoo ou sabonete, eles fornecem sabonete líquido e shampoo, mas quem leva não tem onde colocar, ah não tem toalhas de rosto, você seca a B.nda e depois passa a mesma toalha no rosto,;6;;;;
24 de setembro de 2022;Bom;Gostamos do espaço do quarto e da limpeza do mesmo.;Esqueceram de anotar o horário do nosso café da manhã e mesmo depois de ligarmos reclamando demorou +-45 minutos para mandarem. Não tem opções para pessoas com restrições alimentares.;;;;;
"O box do banheiro tem uma falha de montagem que faz com que a água vaze por todo o banheiro durante o banho.""";7;;;;;;;
19 de setembro de 2022;Aceitável;QUARTO MUITO BOM;PAGAR O CAFÉ DA MANHA E PAGAR O ESTACIONAMENTO.;5;;;;
15 de setembro de 2022;boa opção;Instalações novas;limpeza quarto;7;;;;
11 de setembro de 2022;Equipe amável, mas há necessidade de atenção com a limpeza.;A equipe é muito amável.;Convém melhorar a limpeza do quarto. Havia poeira nos cantos e o chão não estava limpo o suficiente. Era impossível andar descalço e o pé não ficar sujo pela poeira. Havia furos nos lençóis também.;7;;;;
8 de setembro de 2022;Tirando o banheiro, o demais gostei de tudo;Dos funcionários;Dó banheiro, ficava cheio de água na hora que tomavam banho;7;;;;
6 de setembro de 2022;Excelente custo benefício;limpeza;vista;7;;;;
31 de agosto de 2022;Aceitável;A localização, o café e os funcionários são bons.;O hotel tem cheiro de mofo em todos os locais. O lençol da cama estava com furos e sujo. As cobertas que pedimos eram ruins. No quesito conforto, deixa muito a desejar.;5;;;;
31 de agosto de 2022;Satisfatório;Localizacao;Cafe da manha e estacionamento;6;;;;
25 de agosto de 2022;boa;Boa localização. Equipe muito atenciosa, mas o quarto tinha problemas que inundavam o banheiro a cada banho, pia com problema de manutenção;O quarto tinha problemas que gerava desconforto;5;;;;
16 de agosto de 2022;Decepcionante.;Localização, estrutura (conforto e limpeza);Atendimento (desorganização no planejamento do café da manhã - cujo sistema do Hotel determina que seja servido no quarto).;3;;;;
15 de agosto de 2022;Confortável e limpo, mas com péssimo atendimento;Conforto, limpeza e localização.;Pessimo atendimeto na recepção e no restaurante.;1;;;;
15 de agosto de 2022;Bom;limpo, bem localizado.;ainda cobram uma taxa p o pet, outra p café e outra p estacionamento.;7;;;;
28 de julho de 2022;Satisfatório;Localizacao;Falta acessibilidade malas;6;;;;
27 de julho de 2022;Bom;;Do atendimento inicial na recepção e de pagar pelo estacionamento.;7;;;;
27 de julho de 2022;É um hotel pequeno que atende quem precisa somente dormir, mas o cheiro de mofo atrapalha muito.;Funcionários muito educados e prestativos.;;;;;;
"Tudo aparentemente limpo.""";Cheiro muito forte de mofo!;;;;;;;
Tanto quarto como o hotel são pequenos. ;;;;;;;;
"Pela avaliação de 8.9 eu tinha expectativa mais alta.""";6;;;;;;;
26 de julho de 2022;Precisa melhorar muito a limpeza e nível do quarto. Camas e travesseiros ruins e lençóis de baixa qualidade;funcionários da recepção muito prestativos e gentis. Destaque para o Gabriel que deu dicas de restaurantes bacanas na cidade e nos atendeu sempre com bom humor.;Limpeza muito a desejar. Havia cabelo no quarto e banheiro quando chegamos. Muito caro pela qualidade do quarto e limpeza precária. Qualidade da cama e lençóis também deixaram a desejar.;4;;;;
20 de julho de 2022;Detestei;Localização;Cachorro latindo a tarde inteira, quarto e corredores com mofo, roupa de cama suja, garagem péssima, os carros ficam todos impedindo a passagem dos outros.;1;;;;
12 de julho de 2022;Acredito que houve Discriminação;Da localização;Recepcionista Gabriel colocou CELULAR no bolso de imediato, ao notar minha presença.;5;;;;
12 de julho de 2022;Atendeu, porém ficar atento aos pontos acima.;Funcionários atenciosos.;Quarto apertado pra 3 pessoas.;;;;;
Ar condicionado fica caindo um pouco de água no chão;" além disso algumas formigas no quarto.""";7;;;;;;
5 de julho de 2022;Hotel com cheiro de novo!;Quarto excelente! Com boa aparência. ;;;;;;
Boas opções de refeição por perto.;;;;;;;;
"Banho excelente!""";Café da manhã não é gratuito!;;;;;;;
Geladeira não gela..;;;;;;;;
"Art condicionado barulhento.""";7;;;;;;;
2 de julho de 2022;Não volto;;O café da manhã é sofrível. A água do chuveiro fede. Os lençóis fedem. O quarto é minúsculo.;1;;;;
30 de junho de 2022;Bom custo benefício;Ótima localização e bom café da manhã servido no quarto.;O chuveiro demora demais a esquentar a água.;7;;;;
28 de junho de 2022;Hotel com apto espaçoso, porém não dispõe de salão para café da manhã (servido no quarto);Apartamento espaçoso e com atendente que trabalha à noite (Marcos) extremamente prestativo e eficiente. Chegamos por volta das 20h e fomos bem recebidos.;Lamentavelmente, o hotel não dispóe de salão de café da manhã e, a um custo adicional em relação à diária, serve um café no apto a pedido. Com isso, a opção de escolha da pessoa fica tolhida...;;;;;
"Os itens servidos no café da manhã são do tipo industrializados e estão aquém do outro hotel do qual tive de sair meio às pressas pelo fato de estar sem energia elétrica.""";7;;;;;;;
27 de junho de 2022;Achei cara;Café da manhã bacana;Preço;5;;;;
18 de junho de 2022;Bom;Localização é boa;;7;;;;
16 de junho de 2022;hotel bom custo benefício para estadias curtas;o hotel está todo reformado e os quartos são confortáveis.;a limpeza do banheiro deixou a desejar e a água do chuveiro demora um tempo a esquentar.;7;;;;
15 de junho de 2022;Bom;Da umidade;;7;;;;
13 de junho de 2022;Satisfeito.;Achei bastante cômodo o café da manhã no quarto. Uma boa idéia.;Nada a considerar.;7;;;;
12 de junho de 2022;Decepcionado;Ar condicionado bom, boa localização;o quarto é inferior ao que vim da última vez, internet péssima!;6;;;;
9 de junho de 2022;Aceitável;;quarto com roupa de cama suja;5;;;;
30 de maio de 2022;Espera que fosse um pouco melhor.;Localização excelente, assim como limpeza.;Elevador nao funcionou por dois dias e uma goteira em cima da cama.;7;;;;
29 de maio de 2022;Satisfatório;Local;Arrumação limpeza e atendimento;6;;;;
28 de maio de 2022;Bom;tudo, gente é muito bom o hotel, infelizmente fomos no dia em que estava com muita chuva e ficamos ilhados, mas os funcionários super prestativos e atenciosos.;;7;;;;
26 de maio de 2022;Bom;atendimento, etc;nao tem geladeira;7;;;;
25 de maio de 2022;Satisfatório;A atenção dos funcionários.;Do quarto, inclusive do cheiro, e do café da manhã. O café torna-se enjoativo em razão da falta de variedade de 1 dia p o outro.;6;;;;
25 de maio de 2022;Não vale o valor.;Cama, chuveiro.;A TV não funcionou. Não houve prontidão em solucionar o problema. Havia um funcionário em todo o hotel aparentemente. Pagamos pelo café da manhã, mas não consumi pelo horário. Pedi indicação de restaurantes e também não fui bem atendida.;7;;;;
23 de maio de 2022;Bom;O hotel é bom, se for para passar uma noite ou estar a trabalho na cidade, é uma ótima opção. O café da manhã é muito bom, vem no quarto para cada pessoa e tem variedade.;O chuveiro precisava de manutenção.;7;;;;
21 de maio de 2022;Foi mais ou menos;Só a localização;Não gostamos porque o café não era incluso;5;;;;
16 de maio de 2022;A pessoa que me atendeu me enviou para um quarto que tinha hospede, fiquei super constrangido, tendo;Localização, limpeza e conforto.;A pessoa que me atendeu me enviou para um quarto que tinha hospede, fiquei super constrangido, tendo que voltar a recepção, buscar um novo quarto e etc. Foi uma experiencia muito ruim.;6;;;;
12 de maio de 2022;Bom;;Viemos ter a limpeza do quarto somente às 15h, ficamos no quarto sujo, com café da manhã não recolhido, mesmo tendo havido solicitado. Recepção atende excepcionalmente bem, porém não nos deu resolutividade a este problema. ;;;;;
Wi-Fi com sinal péssimo;" o que dificultou nosso trabalho de home office.""";7;;;;;;
9 de maio de 2022;Baixo custo-benefício;A maior parte dos funcionários são respeitosos e solícitos.;O quarto não tinha toalha de rosto nem espelho grande. O papel higiênico estava no final e não tinha um papel reserva. A tv do quarto está instalada num corredor estreito e é muito fácil trombar com ela. Mesmo após a flexibilização das medidas restritivas de combate ao coronavirus, o café da manhã continua sendo servido no quarto. O hotel não disponibiliza computador para que os hospédes possam fazer check-in de voo.;4;;;;
4 de maio de 2022;Aceitável;Gosto da comodidade do Fity. Hotel atende as nossas necessidades para rápidas idas a Recife. Proximidade no hotel, café da manhã completo e rápido, entregue no quarto.;Já estive outras vezes no Fity e infelizmente tivemos a péssima experiência de ter duas baratas no quarto. Além disso, a água estava gelada. Mudaram-nos de quarto e o problema da água não foi sanado. Parece que foi geral.;5;;;;
2 de maio de 2022;Satisfatório;Localização.;Limpeza.;6;;;;
2 de maio de 2022;Quarto pequeno mas cama confortável.;Bem localizado;cheiro forte de tinta no quarto, tivemos q abrir as janelas para passar o cheiro…… banheiro sujo…. com teias de aranha nos cantos. Assento da privada não para em pé, tem uma arame enferrujado no lugar de um pino original (“engembra”);5;;;;
1º de maio de 2022;Suficiente.;Acomodação boa, nova, quarto 107 com barras de sustentação, banheiro adaptado para deficientes físicos, apesar de não requisitado. Café da manhã servido no quarto com boa variedade.;Água do chuveiro não esquentou. Cama de molas um pouco desconfortável. TV com canais inoperantes. Janela com visão para a parede do vizinho.;6;;;;
29 de abril de 2022;Bom;Bom custo benefício ;;;;;;
Chuveiro excelente ;;;;;;;;
"Recepção muito boa""";Não tem salão de café da manhã.;;;;;;;
Corredores estreitos ;;;;;;;;
Escadaria da rua para a Recepção;" não tem rampa de acesso""";7;;;;;;
27 de abril de 2022;Boa localização em Boa Viagem...;Localização em boa Viagem...;Estacionamento apertado...;7;;;;
17 de abril de 2022;Acabamento;Localização;Qualidade do quarto;;;;;
"Acabamento do quarto e hotel de péssima qualidade""";7;;;;;;;
11 de abril de 2022;o hotel tdo perfeito, já o café da manhã…… não dar nem para avaliar.;as acomodações do quarto estava tdo perfeito.;o café da manhã é abaixo da crítica.;7;;;;
5 de abril de 2022;Bom;Simpatia dos funcionários;O quarto era muito pequeno, sobretudo o banheiro;7;;;;
4 de abril de 2022;Satisfatório;Limpeza;Não tem Café da manha na hospedagem.;6;;;;
3 de abril de 2022;O hotel é bom, mas o custo-benefício é baixo;O quarto estava super limpo e cheirosinho. Os travesseiros são muito confortáveis, não são aqueles travesseiros de hotéis tradicionais que é pequeno e mole. A decoração do hotel é muito bonita, super atual e transada.;A televisão do quarto estava quebrada, o frigobar não estava esfriando, o controle do ar-condicionado é grudado na parede então você tem que se levantar para mexer. Aparentemente o meu quarto ficava localizado ao lado de algum tipo de depósito de limpeza, então os funcionários sempre circulavam por lá, paravam no corredor e ficavam conversando muito alto, parecia que estavam dentro do quarto, e também faziam barulho para pegar o material de limpeza dentro do depósito. A vista do quarto era muito ruim, o quarto fica no térreo e a janela, que é pequena, dava para um muro. Não entra luz direito no quarto e dá uma sensação de que você tá em um alçapão. A rua do hotel não tem estacionamento fácil e eles cobram r$ 15 pela diária do estacionamento. No geral o quarto é bom mas não oferece uma sensação de estar hospedada em um hotel, as paredes são muito finas ou a cama é muito próxima da porta, não sei direito o que é, mas dá a sensação de que você não tem privacidade nenhuma porque se escuta tudo que tá acontecendo no corredor.;7;;;;
17 de dezembro de 2023;Hotel muito bom por um excelente preço;Tivemos uma excelente estadia, desde a cordialidade e a flexibilidade dos funcionários da recepção às instalações do quarto.;O café da manhã era muito bom, mas como ponto de melhoria seria bom ter mais opções de proteínas, como frango desfiado ou carne moída.;10;;;;
11 de outubro de 2023;Melhor custo benefício;Funcionários atenciosos, lençóis limpinhos e cheirosos, cama boa e quarto escurinho. Os funcionários arranjaram um pão com queijo tarde da noite pq eu havia comprado comida e estava estragado. Achei de uma sensibilidade incrível.;Pelo valor estava tudo ótimo;10;;;;
14 de agosto de 2023;Satisfatória e sim eu voltaria!;Chuveiro Maravilhoso, roupas de cama, limpeza inicial e banheiro incrível!;Televisão ligava e desligava sozinha em momentos esporádicos, frigobar poderia ter bebidas à disposição e a limpeza diária da acomodação poderia passar um pano melhor no chão!;8;;;;
8 de julho de 2023;Fantástico;Custo benefício e localização.;Café da manhã apenas é servido no quarto.;9;;;;
15 de janeiro de 2023;Execelente custo benefício , ótima localização.;Quarto limpo e agradável;poderia ter um espelho;10;;;;
23 de outubro de 2022;Excepcional;de uma forma em geral, principalmente da limpeza e da honestidade pois deixo gravado que esqueci um bem nas acomodações do hotel que se posicionou informando e guardando para nosso retirada.;;10;;;;
31 de julho de 2022;Estadia foi maravilhosa;Atendimento, café da manhã, higiene, localização, qualidade dos serviços prestado a;gostamos de;;;;;
"tudo""";10;;;;;;;
15 de maio de 2022;ficaria novamente mas não pediria o café da manhã.;equipe educada, prestativa, quarto organizado e limpo.;o café da manhã é muito pouco, pouca comida, gostosinho mas pouco, não recomendo pegarem, se você andar 5 minutos tem uma padaria do outro lado da rua e você come bem melhor.;10;;;;
5 de outubro de 2023;Satisfatório;;Estacionamento pago.;6;;;;
