data_avaliacao;titulo;comentario_positivo;comentario_negativo;nota;;;;
café no quarto muito interessante; mas como sugestão; poderiam perguntar ao hóspede o que ele quer;" pois veio muita coisa que não comemos e é um desperdício.""";sabonete e shampoo sem cheiro;;;;
"travesseiros podiam ser mais novos""";10;;;;;;;
21 de janeiro de 2023;maravilhoso;instalações novas e muito boas, cordialidade dos funcionários, ar e cama mto bons, chuveiro espetacular. café da manhã servido no quarto é top.;nada a reclamar;8;;;;
19 de janeiro de 2023;Fantástico;Café manha e funcionários agradáveis e gentis.;Reservei o hotel achando que tinha piscina ...e café da manhã incluso na diária.. mas custo de 25.00 foi satisfatório, devido qualidade do café oferecido.;9;;;;
19 de janeiro de 2023;ótimo custo benefício;custo benefício;nada a reclamar;10;;;;
18 de janeiro de 2023;Tudo otimo !;localização , limpeza e funcionários .;Um ônibus de turismos estaciona na frente do hotel.;10;;;;
18 de janeiro de 2023;hotel bem localizado. Atendentes super prestativos. Recomendo;Organização e praticidade;;10;;;;
17 de janeiro de 2023;Excelente estadia;Dos funcionários, sempre atentos e atenciosos. Do café da manhã servido no quarto e de muito boa qualidade.;Quando chegamos na hora destinada ao checkin não havia, ainda, apartamento disponível, o que nós obrigou a mudar nossos planos compromissos que teríamos a seguir.;10;;;;
16 de janeiro de 2023;Fantástico;Localização silenciosa;Muitas mensagens de confirmação antes da hospedagem;9;;;;
15 de janeiro de 2023;Maravilhosa;Acomodação satisfatória, funcionários educados, manobrista à disposição dos hóspedes, café da manhã ótimo;Estacionamento poderia ser maior;10;;;;
15 de janeiro de 2023;conforto, lazer e felicidade;Da receptividade e interação com os funcionários;Nada, a experiência foi incrível;10;;;;
14 de janeiro de 2023;Fantástico;Localização, atendimento, limpeza;O café do da manhã no quarto, prefiro quando tem uma área para o café , Voce se servindo com o Que você prefere.;9;;;;
14 de janeiro de 2023;Muito bom;Da localização.;Barulho adjacente ao quarto no início da manhã.;8;;;;
12 de janeiro de 2023;Bom custo x benefício com um staff sensacional;A estrutura do hotel é boa, cumpre o que promete, pessoal excelente, sempre disposto à ajudar, da recepção, as meninas do café da manhã e os manobristas. Limpeza é ótima e o café da manhã no quarto é uma ótima ideia, pois reduz o tempo de serviço em um buffet, filas, etc.;A falta da piscina é algo que realmente impactou sobretudo o nosso filho. O valor foi um pouco alto frente a estrutura, porém como era altíssima temporada (ano novo) entendemos que é a demanda e oferta na cidade toda.;8;;;;
12 de janeiro de 2023;Recomendo!;Cama grande e nova. Hotel muito limpo e ótima localização;;9;;;;
9 de janeiro de 2023;Excepcional;Atendimento e instalações.;;10;;;;
6 de janeiro de 2023;ótimo custo benefício;aconchegante ;;;;;;
"bem localizado""";o lençol estava manchado com uma marca escura;8;;;;;;
6 de janeiro de 2023;Excepcional;ótima localização, funcionários educados e mimo de boas vindas;;10;;;;
5 de janeiro de 2023;Gostei bastante. Retornaria com a minha família!;Funcionários muito receptivos e atenciosos. Boas vindas com dois bolinhos de rolo e acho que mais uma bebida, não me lembro. Eles são bem legais, me deram instruções de onde comer e turistar. Apartamento bem confortável, tudo novinho, moderno e limpo. A estadia eh bem interessante para mais de uma pessoa, pois o preço fica bastante acessível. Eles não cobram pelo número de hóspedes no quarto, o valor eh único, e além de uma cama de casal o meu quarto tinha mais uma cama de solteiro. O café da manhã é levado no quarto, achei muito legal.;O café da manhã poderia estar incluso na minha estadia. Não achei o custo benefício tão bom, pq me hospedei sozinha, então o valor do quarto mais café da manhã em uma apartamento térreo não ficou interessante.;8;;;;
3 de janeiro de 2023;Excepcional;Ótima localização , tudo super novo e um ótimo café da manhã servido no quarto .;;10;;;;
3 de janeiro de 2023;Excepcional;localização;;10;;;;
3 de janeiro de 2023;Preço e localização. Atendimento. Vale a pena.;Localização.;Café servido no quarto;8;;;;
3 de janeiro de 2023;Excepcional;tudo de bom;;10;;;;
2 de janeiro de 2023;Muito bom;;NÃO TEM SEPARAÇÃO DE MATERIAL RECICLÁVEL do lixo comum! ABSURDO! PRECISA TER RECIPIENTES PARA GUARDA E ENCAMINHAMENTO DE MATERIAL RECICLÁVEL!;8;;;;
1º de janeiro de 2023;Fantástico;Nossa estadia foi maravilhosa, fomos muito bem recebidos pelo Sr. que estava na recepção, inclusive nos foi dado um lindo brinde do hotel ao chegarmos. Está localizada próximo da praia de Boa Viagem, podendo ir a pé, caso queira. Amamos o café da manhã.;;9;;;;
1º de janeiro de 2023;Excepcional;Absolutamente tudo!;;10;;;;
30 de dezembro de 2022;Muito bom;;café da manhã deixa a desejar;8;;;;
26 de dezembro de 2022;Fantástico;Atendimento e instalações.;Sem observações.;9;;;;
26 de dezembro de 2022;Ótima opção de hospedagem.;Ótima localização (praia, shopping e restaurantes).;;;;;;
Café da manhã muito bom.;;;;;;;;
Funcionários educados e solícitos.;;;;;;;;
"Cama confortável.""";Cobrança do estacionamento.;9;;;;;;
26 de dezembro de 2022;Hotel novo e confortável;O hotel é novo, tudo funciona bem, gostei da organização.;nada;10;;;;
25 de dezembro de 2022;Excepcional;De absolutamente tudo! Da acolhida, localização, higiene, funcionários.. tudo!;;10;;;;
25 de dezembro de 2022;Muito bom;;não gostei do café da manhã vir pro quarto. além de não ser confortável, ficamos limitados na escolha do que comer, e possibilidade de repetir;8;;;;
22 de dezembro de 2022;Maravilhoso!;Camas confortáveis, café da manhã bem reforçado e atendimento excepcional!;;10;;;;
22 de dezembro de 2022;atendeu todas as expectativas;Dimensões do quarto, banheiro, limpeza, materiais empregados no piso, paredes, iluminação, muito bem construído e excelente acabamento. Proximidade com a praia de boa viagem, num local onde o banho de mar é permitido.;no café da manhã havia poucas frutas, diferente da variedade que somos acostumados nos hotéis do nordeste brasileiro. Uma sugestão é incluir as frutas típicas, mais saborosas e agradáveis de consumir (abacaxi, mamão, melão, manga…);9;;;;
21 de dezembro de 2022;Muito boa é um local tranquilo.;Espaçosa e agradável.;;10;;;;
20 de dezembro de 2022;Simplicidade com conforto;Facilidade na reserva e praticidade na estadia;Barulho (quarto próximo ao elevador no nível da recepção);9;;;;
20 de dezembro de 2022;recomendo;bastante satisfatório;não tenho do que reclamar;10;;;;
19 de dezembro de 2022;Muito bom;Boa acomodação para minha utilização que foi somente dormir.;;8;;;;
18 de dezembro de 2022;Pouco espaço para apoiar as malas e pouco espaço para comer o café da manhã que é servido no quarto;Ótima localização e camas confortáveis.;Pouco espaço para apoiar as malas e pouco espaço para comer o café da manhã que é servido no quarto;8;;;;
18 de dezembro de 2022;Malhor que o esperado.;Cama e chuveiro excelentes. O café da manhã no quarto é uma grande ideia, traz mais conforto principalmente para quem viaja com crianças. Funcionários extremamente simpáticos, que fazem de tudo para que sua estadia seja o mais agradável possível.;O café da manhã poderia ter um pouquinho mais de variedade. Acaba vindo praticamente idêntico todos os dias.;9;;;;
14 de dezembro de 2022;Fantástico;A equipe. Desde o manobrista, a recepção e até mesmo as camareiras são extremamente atenciosos.;;9;;;;
13 de dezembro de 2022;Fit 4 You - Fity - clean, minimalista e perfeito.;Hotel moderno desde o hall de entrada até o quarto. Decoração minimalista e sóbria. Quarto amplo, ar condicionado eficiente, garagem adequada e com manobristas atenciosos, café da manhã servido no quarto muito bom !;Não tenho nada a declarar. O fato do café da manhã ser servido no quarto pareceu estranho no início da estadia, porém foi surpreendente. É só marcar o horário que o café é entregue na porta. Não houve nenhum contratempo com relação a esse serviço.;9;;;;
11 de dezembro de 2022;Excepcional;Ótima localização, próximo a beira mar. Quarto espaçoso, banheiro com um bom chuveiro.;;10;;;;
10 de dezembro de 2022;Sempre nos sentimos bem acolhidos!🙌👏🏻👏🏻;A higiene, os funcionários super educados, à praticidade e o conforto!;Para o custo benefício foi maravilhoso!;10;;;;
8 de dezembro de 2022;gostei da estadia no Fity Hotel;localização, gentileza dos funcionários;café da manhã com poucas frutas e igual em todos os dias;8;;;;
8 de dezembro de 2022;O hotel é muito bom;Atendimento e limpeza;Travesseiros;9;;;;
6 de dezembro de 2022;Estadia perfeita como sempre, atendendo minhas necessidades.;O café da manhã servido no quarto é bom e completo, porém quando a hospedam é mais longa seria interessante que pudéssemos ter algumas opções a escolher.;;9;;;;
6 de dezembro de 2022;Bom custo benefício;Quarto confortável.;Sem janela.;8;;;;
3 de dezembro de 2022;Paz e tranquilidade resume o hotel. Ótima escolha!;Já é a segunda vez que nos hospedamos no Fity Hotel e simplesmente amamos. ;;;;;;
Hotel com uma localização tranquila e acessível;" com acesso próximo a Praia de Boa Viagem e Aeroporto de Recife.""";Nada a declarar.;8;;;;;
2 de dezembro de 2022;ótimo custo benefício;Quarto amplo, chuveiro excelente, funcionários cordiais, café da manhã servido no quarto, amei ♥️;;;;;;
Deixa um elogio para o recepcionista Thiago;" nos atendeu super bem. No checkin ainda recebemos um mimo bolo de rolo.""";achei a cama um pouco mole (não era cama king, era 2 camas de solteiros juntas) e um pouco de pó nos móveis. mas fora isso, amei essa hospedagem, me arrisco a dizer um dos melhores hotéis que me hospedei;9;;;;;
1º de dezembro de 2022;Hotel com ótima localização.;;Parecia que o ar-condicionado precisava de limpeza/manutenção.;8;;;;
30 de novembro de 2022;Excelente em tudo;O atendimento é excepcional. A recepção, manobristas, copeiras, limpeza, todos muitos organizados e simpáticos. Limpeza nota 10. Café no quarto nota mil, servido em bandejas com opcoes de suco, leite, ovos, frutas, bolo, pães, etc. Chuveiro ótimo e tomadas perto da cama.;Poucas opções na geladeira do lobby para compras rápidas. A rua onde está localizada entrada do hotel é estreita e escura.;10;;;;
30 de novembro de 2022;Fantástico;funcionários simpáticos e prestativos, limpeza, localização;nos acomodaram em um quarto adaptado e avisaram sobre o vazamento de água do box do banheiro. mas é algo básico que da para ser consertado. a cada banho era um tapete de chão que ficava encharcado, tivemos que pedir mais.;9;;;;
25 de novembro de 2022;;;;10;;;;
22 de novembro de 2022;Hotel com potencial;hotel moderno e instalações novas. chuveiro e cama muito bons.;economias desnecessarias tipo nao fornecer toalha de rosto, tabua da privada bem fragil de plastico, lixeira nao funcionando o pedal.;8;;;;
21 de novembro de 2022;excelente opção em boa viagem;localização e estrutura nova;as opções do café não me agradou e não ter buffet;9;;;;
21 de novembro de 2022;Excepcional;Atendimento agradável e cortês por parte do funcionário Thiago Lins, na nossa chegada ao hotel , hotel limpo e camas excelentes. Recomendo com certeza.;Não gosto de pagar estacionamento separado da diária, em nenhum hotel. Acho mesquinharia do hotel.;10;;;;
20 de novembro de 2022;A estadia foi boa, confortável, o hotel é bem localizado, só me incomodou o café no quarto.;Os atendentes são todos muito atenciosos. O hotel é todo arrumadinho, contemporâneo.;Não gostei de o café da manhã ser no quarto. As coisas esfriam muito rápido. E, como cada hóspede agenda na hora que quer, a gente acaba ouvindo todas as vezes que a camareira leva o café de alguém, pq ela batia alto e falava “café da manhãããã”. Eu acordava umas 4x até meu horário.;9;;;;
20 de novembro de 2022;Excepcional;O hotel é limpo, equipe atenciosa e prestativa..;;;;;;
O café da manhã é no quarto no horário agendado;" vem bem servido e é gostoso.""";;10;;;;;
18 de novembro de 2022;Um achado moderno em Recife;Tudo como esperado. Gostei do fato de ter um hotel essencial moderno em Recife, coisa que é dificil de achar.;;;;;;
Café da manhã muito bom. Upgrade de quarto foi um plus;" assim como os bolos de rolo no welcome kit. Possuir estacionamento também foi muito bom (15 reais a diária)""";Nada a reclamar;10;;;;;
17 de novembro de 2022;ótima localização (próximo a praia de boa viagem), quartos super confortáveis;conforto dos quartos, atendimento dos funcionários;café da manhã opcional servido no quarto (com tarifa extra) - comida não era boa, embalada com plástico;8;;;;
16 de novembro de 2022;boa surpresa em Boa Viagem;atendimento dos funcionário e instalações relativamente novas do hotel;não tem opção de café da manhã fora do quarto;10;;;;
16 de novembro de 2022;Fantástico;Atendimento, conforto, limpeza.;Café da manhã servido no quarto. Um café bem servido, mas simples. Não é vantagem. Melhor tomar café pela rua, se possível.;9;;;;
16 de novembro de 2022;Fantástico;O hotel possui instalações novas e está bem localizado.;Pouco espaço para tomar o café da manhã que só pode ser servido no quarto.;9;;;;
16 de novembro de 2022;Excepcional;localização, recepção, conforto, variedade no café da manhã entregue no quarto e valor bem acessível.;;10;;;;
16 de novembro de 2022;muito bom;Quarto amplo e limpo, serviço de café no quarto muito bom. Hotel com bom custo benefício para quem quer ficar próximo à praia e não precisa de estrutura de lazer no hotel.;;8;;;;
16 de novembro de 2022;Muito boa e voltaria novamente.;atendimento dos funcionários, organização e limpeza das instalações;acústica dos quartos, barulho nos corredores e até mesmo em quartos vizinhos incomodavam um pouco.;9;;;;
15 de novembro de 2022;Excepcional;Atendimento excepcional desde o Sr. Do estacionamento ao recepcionista. Praticidade, excelente arquitetura, colchões excelentes, muita limpeza. AMAMOS!;;10;;;;
15 de novembro de 2022;Excente opção. Voltaria com certeza;ótimas instalações. Banho perfeito. Atendimento atencioso.;Tudo perfeito.;9;;;;
13 de novembro de 2022;Estadia ótima;Minha estadia foi ótima. As instalações são novas e confortáveis. Café da manhã bom. Voltaria mais vezes.;O sinal de Wi-fi foi um pouco instável. Poderia melhorar esse aspecto.;10;;;;
11 de novembro de 2022;Volto fácil, fácil.;Localização, tamanho do quarto e do banheiro. A internet funcionava bem. Café da manhã farto e com muitas opções. Bom atendimento, existência de garagem. Limpeza.;O estacionamento ser gratuito.;8;;;;
10 de novembro de 2022;Muito bom;Cama confortável;Formato do café da manhã. Sugestão: lista de itens para servir no café;8;;;;
9 de novembro de 2022;Fantástico;a água do chuveiro vazava para outra aérea do banheiro;era quarto para paraplégico;9;;;;
8 de novembro de 2022;Excepcional;Limpo, organizado, equipe gentil e prestativa. Excelente quarto, acomodações. Tudo maravilhoso.;;10;;;;
7 de novembro de 2022;Excepcional;Localização. Higiene Atendimento.;;10;;;;
5 de novembro de 2022;Excepcional;Receptividade, conforto, segurança, cordialidade da equipe.;Falta apenas um cobertor no quarto;10;;;;
4 de novembro de 2022;excelente hotel, funcionários muitos solícitos;quartos novinhos e bem organizados, café da manhã servido no quarto, um diferencial!;;10;;;;
3 de novembro de 2022;Muito bom. Falta mais limpeza;Bem localizado. Atendimento simpático e rápido.;A cama de solteiro parecia q a perna estava solta e encontramos um palito de pirulito no meio do lençol e vi mancha de batom em um travesseiro e t fronha suja.;10;;;;
2 de novembro de 2022;Excepcional;Café da manhã tem o diferencial de ser no quarto, estava bem servido.;;10;;;;
1º de novembro de 2022;Estadia excelente, vou retornar.;A cordialidade e a gentileza dos funcionários, e a localização.;o quarto que fiquei está precisando renovar a pintura;10;;;;
1º de novembro de 2022;excelente custo benefício;o quarto arejado e limpo, o banheiro com chuveiro excelente, é a cama Box ótima.;gostei de tudo;10;;;;
31 de outubro de 2022;Minha estadia foi ótima e eu voltaria a me hospedar neste hotel!;Gostei das instalações modernas;Não gostei por não ter toalha de rosto banheiro e nem cobertor no quarto! Tive que solicitar nas duas ocasiões! ;;;;;
Também acho que falta um espelho de corpo inteiro no quarto;" pois não dá para vc se arrumar se alguém estiver tomando banho!""";10;;;;;;
30 de outubro de 2022;Hotel excelente para pequenas estadias.;Quarto pequeno, mas confortável. Café da manhã somente nos quartos, com hora marcada. Boas instalações sanitárias. Boa quantidade de tomadas.;Apesar de ter 2 camas, havia somente um cobertor.;9;;;;
29 de outubro de 2022;Recomendo;Quarto e banheiro amplo;;;;;;
Atendimento ;;;;;;;;
Localização ;;;;;;;;
"Estacionamento privativo""";Atendeu nossa expectativa;9;;;;;;
27 de outubro de 2022;Fantástico;Instalações novas e ótima localização.;Acesso ao hotel por escadas dificulta pra quem está com bagagem pesada.;9;;;;
27 de outubro de 2022;Excepcional;Quartos ótimos grandes.;;10;;;;
27 de outubro de 2022;Excepcional;Otima localização, atendimento excelente, bem limpo e confortável;nada a reclamar;10;;;;
26 de outubro de 2022;Excepcional;Quartos super limpos e novos.;;10;;;;
26 de outubro de 2022;Uma estadia memorável;O conforto do quarto e a conscientização do meio ambiente muito incentivada;;10;;;;
24 de outubro de 2022;Fantástico;atendimento excelente dos funcionários do hotel! localização privilegiada, com mercado e a praia da no viagem muito próximo! adoramos!!;;9;;;;
23 de outubro de 2022;Excelente! Volto outras vezes!;Hotel compacto, novo, muito confortável, limpo, bem localizado, com atendimento excelente dos funcionários. O meu agradecimento especial à recepcionista Débora, que eficazmente resolveu uma demanda pessoal minha!!!;No hotel há no térreo um apartamento sem janela, que coincidentemente seria o meu. A recepcionista Débora conseguiu um remanejamento e nos acomodou em dois apartamentos vizinhos no segundo andar, já que viajava com minha família. Sugiro avisar no ato da reserva que existe um apartamento nessa condição, para evitar surpresas desagradáveis, sendo que no meu caso o problema foi prontamente resolvido!;10;;;;
23 de outubro de 2022;Maravilhoso;Hotel excelente. Ótima localização, perto da praia de Boa Viagem.;;;;;;
Todos os funcionários muito simpáticos; com destaque para a Débora que nos concedeu check in antecipado e para Tiago muito solicito.;;;;;;;
A limpeza do hotel é um dos destaques: tudo limpinho e cheiroso.;;;;;;;;
"Indico sem medo!""";;10;;;;;;
22 de outubro de 2022;Muito bom;localização, instalações;Durante os três dias no café da manhã serviram queijo estragado, comuniquei na recepção mas nos dias seguintes continuaram servindo o mesmo queijo estragado.;8;;;;
22 de outubro de 2022;Ótimo custo x beneficio;A localização é ótima, a infraestrutura do hotel é muito boa, o café da manhã é servido no quarto, achei que viria pouca comida mas veio mais que o suficiente;;8;;;;
21 de outubro de 2022;Excepcional;Adorei o atendimento de todos os funcionários, o conforto do quarto. O chuveiro maravilhoso.;Falta um espelho de corpo inteiro no quarto;10;;;;
20 de outubro de 2022;Fantástico;Limpo, bem localizado , ótimo custo benefício;Café da manhã deixou a desejar;9;;;;
19 de outubro de 2022;estadia rapida pois foi apenas um pernoite mas resolveu minha necessidade;muito bom;mais uma ou duas cadeiras para sentar e tomar o cafe no quarto;8;;;;
19 de outubro de 2022;Fantástico;Atendimento excelente, instalações novas .;Nada;9;;;;
18 de outubro de 2022;Recomendo!;Nota 10.. Café da manhã no quarto na medida certa. Limpeza impecável. Localização maravilhosa. Chuveiro perfeito.;Unico detalhe é que na parte de dentro do box do banheiro não tem suporte para colocar nossos produtos . Tive que deixar meus cremes de cabelo na pia do lado de fora do box ou no chão.;10;;;;
17 de outubro de 2022;muito boa;tudo;garagem;10;;;;
17 de outubro de 2022;Estivemos por 4 dias hospedados no Fity, eu e meu filho e nossa acomodação atendeu nossas expectativ;O café da manhã é excelente e servido no quarto todas as manhãs pontualmente, de acordo com horário escolhido pelo hóspede. ;;;;;;
"Equipe bastante atenciosa que busca atender todas as necessidades.""";A única observação que eu faço é a respeito das janelas (a do meu quarto não abria, era um vidro grande fiixo), senti falta de poder arejar um pouco.;8;;;;;;
16 de outubro de 2022;Fantástico;;Cafe da manha poderia ser o tradicional e nao levar pra dentro do quarto.;9;;;;
14 de outubro de 2022;Excepcional;Gentileza do funcionário da recepção, café da manhã servido no quarto, contendo várias opções, estacionamento com manobrista, chuveiro muito bom.;Não tive nada do que reclamar;10;;;;
14 de outubro de 2022;PERFEITO, quero voltar em breve!;Amei o conforto do quarto, o banheiro e principalmente o café da manhã na cama.;NADA a reclamar!;10;;;;
13 de outubro de 2022;Ótimo custo-benefício e com excelente localização.;localização e custo-benefício, bem como os quartos são de ótimo tamanho e o café da manhã é bom. Os funcionários são super educados e solícitos.;Nada a registrar.;10;;;;
12 de outubro de 2022;Excepcional;excelente estrutura e serviços fornecidos;nada a reclamar;10;;;;
12 de outubro de 2022;excelente;limpeza , cordialidade dos funcionários e localização;;10;;;;
11 de outubro de 2022;;;;9;;;;
9 de outubro de 2022;Otimo custo benefício e funcionários atenciosos;A recepcionista muito atenciosa me cedeu um quarto antes do horário do check in sem custos extras e vc é recebido com um brinde de bolo de rolo (achei fofo do hotel). Funcionários muito educados e cordiais.;Particularmente não gostei do café ser servido no quarto. Isso limita as opções de comida. Quarto não muito silencioso e ar condicionado um pouco antigo.;9;;;;
9 de outubro de 2022;Me hospedarei novamente se voltar ao Recife;Cafe da manha no quarto de boa qualidade e quantidade. Como eramos tres pessoas ficou apertado e nao tinha cadeira suficiente para todos.;Atençao e educaçao do pessoal da recepção, Kit cortesia na chegada;9;;;;
8 de outubro de 2022;Muito bom, recomendo e hospedaria de novo.;Excelente recepção, ganhamos até um voucher do restaurante perto do hotel, além de uma lembrança quando fizemos o um check-in.;;;;;;
Quarto que ficamos muito bom; limpo e confortável.;;;;;;;
"Ótima localização.""";Não tem suportes para itens de banho no banheiro.;;;;;;;
Não tem espelho no quarto;" apenas no banheiro.""";9;;;;;;
8 de outubro de 2022;Excepcional;ficamos muito satisfeitos, seja com as instalações do hotel, seja com o atendimento da equipe. recomendamos sem dúvida.;;10;;;;
7 de outubro de 2022;custo benefício relativo.;Funcionários muito atenciosos e boa localização.;café da manhã no quarto;8;;;;
6 de outubro de 2022;Hospedagem recomendada.;O conforto da cama, que é bem grande, e dos travesseiros é muito bom. O quarto é silencioso, numa região que não teve muito barulho. Quarto padrão que atende a estadia. Janela veda bem o barulho externo e a cortina blackout funcionava corretamente. ;;;;;;
;;;;;;;;
A região possui alguns comércios próximos; um grande mercado hortifruti na rua de trás e locais para comer bem próximos também. Ar condicionado por controle fixo na parede; porém atendeu sem problemas. ;;;;;;
;;;;;;;;
A água do chuveiro era bem quente.;;;;;;;;
;;;;;;;;
Próximo à recepção tem uma geladeira com itens para vender a preços até que justos; além de um microondas que vi ao lado; a disposição para uso. ;;;;;;
;;;;;;;;
A comunicação a partir da reserva foi muito boa; com disponibilidade de preenchimento prévio do cadastro; para agilizar o check-in.;;;;;;
;;;;;;;;
O estacionamento; apesar de pago 15 reais a parte; e nao ser muito espaçoso; possui manobrista 24h. Não tive problema para sair a noite; por exemplo. Entretanto; poderia ser cortesia aos hóspedes. ;;;
;;;;;;;;
"Recomendo a hospedagem no local e voltaria a me hospedar numa próxima oportunidade.""";"Como os demais comentários, o café da manhã no quarto não permite muita escolha da variedade. No momento da entrega vc apenas opta pela quantidade e como quer o café (puro, com leite, etc), suco e bolinhos ja embalados. É feito o agendamento da entrega nos horários estabelecidos (cada meia hora. ex: as 07h, 07h30, 08h). Vem uma quantidade não muito grande mas que, sinceramente, atende a necessidade básica. A bandeja é bem bonita e com uma flor de enfeite. Não achei tão ruim essa condição, mas uma quantidade um pouco maior de frios, por exemplo, poderia ser mais adequada. O suco de laranja também estava com sabor de fruta ""passada"", o que acredito ser uma situação bem pontual e muitas vezes fora do controle durante o preparo.";8;;;;;;
6 de outubro de 2022;Uma ótima estádia!;Do atendimento da equipe!;O café da manhã, não digo ruim, mas não é tão bom.;9;;;;
6 de outubro de 2022;Me surpreendeu positivamente, super recomendo!!!;Excelente custo benefício, ótima localização, quarto e banheiro amplos, café da manhã excelente, equipe do hotel muito educada e simpática. Me surpreendeu positivamente, super recomendo!!!;;10;;;;
5 de outubro de 2022;Excepcional;O café da manhã servido no quarto é bem caprichado.;;;;;;
Adorei o fato de ser Pet Friendly e incluírem caminha + pote + tapete higiênico ;;;;;;;;
