data_avaliacao;titulo;comentario_positivo;comentario_negativo;nota;;;;
25 de junho de 2024;Não considero 4 estrelas;Localização, vista!;Sofá cama perigosa para crianças, cabeceira da cama principal soltando da parece, janela banheiro quebrada, muito barulho,;5;;;;
23 de junho de 2024;Excepcional;Cama muito confortável, localização perfeita em relação à praia e restaurantes, funcionário muito educados e prestativos.;O elevador tem um cheiro leve de umidade.;10;;;;
21 de junho de 2024;Aceitável;Os funcionários são atenciosos.;As acomodações são antigas.;5;;;;
18 de junho de 2024;Satisfatório;Localização, e atendimento dos funcionários;Diária muito caro para o que o hotel oferece. Telefone só fazia ligação, não atendia.;6;;;;
9 de junho de 2024;Muito ruim;O custo é válido;O hotel não tem ferro de passar, só tem 2 elevadores e um deles ficou quebrado, instalações antigas, não adequado para quem tem crianças (a janela fica na altura da cama e não tem proteção contra quedas), ar condicionado muito barulhento, o local para café da manhã é pequeno (fiquei um bom tempo sem mesa);2;;;;
4 de junho de 2024;Excepcional;Ótima localização com acesso à vários lugares. As meninas do café uma nota 1000 pela simpatia. Com certeza voltarei;Não tenho nada do que reclamar.;10;;;;
4 de junho de 2024;Excepcional;Dos funcionários, em especial, do pessoal do restaurante.;;10;;;;
30 de maio de 2024;Excepcional;Do atendimento, desde a recepção até as meninas do refeitório. Atenciosos e sempre pronto para ajudar.;;;;;;
"Localização perto de tudo.""";;10;;;;;;
30 de maio de 2024;Ótima localização e excelente vista do mar.;Cafê da manhã, próximo a fudo e excelente atendimento.;Nada;10;;;;
30 de maio de 2024;Satisfatório;Localização excelente;O prédio necessita uma revisão geral na manutenção.;;;;;
O café da manhã é excessivamente regional. Visivelmente agrada aos hóspedes da região NE;" enquanto fica a dever para os padrões da região S e SE.""";6;;;;;;
28 de maio de 2024;Aceitável;Localização e café da manhã;Camas e travesseiros desconfortáveis, o hotel é antigo, banheiro bem pequeno e. o chuveiro não é a gás. Além do mais o estacionamento é pago a parte.;5;;;;
27 de maio de 2024;Excelente!;Atendimento dos funcionários, principalmente da recepção e mais especificamente da Lorena.;Não houve nada que eu pudesse reclamar.;10;;;;
27 de maio de 2024;Foram somente 3 noites mais adorei ficar na suite O caffè da manhã maravilhoso Recomendo Voltarei;Ottima visto mare , vicino a tutto;Piscina pequena 😁;10;;;;
26 de maio de 2024;Muito bom;O quarto que ficamos foi ótimo, limpeza, café da manhã muito o funcionários todos muito simpático.;A televisão no quarto não funcionou.;10;;;;
25 de maio de 2024;Razoável;Os funcionários são bem simpáticos e atenciosos.;O preço pago pelo hotel não equivale às instalações. Achei um valor alto sendo que as instalações são muito simples.;;;;;
O primeiro quarto que fiquei na torneira tinha um vazamento e na descarga também.;;;;;;;;
Muito de quarto e era o mesmo padrão de quarto;" só que sem vazamentos.""";6;;;;;;
25 de maio de 2024;Uma ótima opção em Boa Viagem;O atendimento dos funcionários foi excelente! Além disso, o café da manhã foi simples, mas muito gostoso e com várias opções. Foram super atenciosos com meu bebê também, desde o berço do quarto até o cadeirão para o café da manhã. Recomendo demais a estadia se você tiver crianças.;Nada.;10;;;;
24 de maio de 2024;Excepcional;Café da manhã a maravilhoso, sem contar que é um hotel beira mar.;Ponto negativo é que o estacionamento do hotel é pago então tivemos que colocar o carro na rua para não termos custos adicionais;10;;;;
24 de maio de 2024;Hotel lindo 😊 com uma ótima localização!;Gostei muito da localização! Nota 10;;10;;;;
23 de maio de 2024;Aceitável;;Banheiro, box pequeno mau dava pra entrar,;;;;;
"A instalacao tem que mudar a port do box do banheiro pois dificulta a entrada no chuveiro""";5;;;;;;;
20 de maio de 2024;Parabéns a equipe , obrigada por tudo . Excelência;Perfeição , amamos;Tudo . Excelente;10;;;;
20 de maio de 2024;Mais ou menos;Cafe bom mas os aptos bem simplórios;Roupas de camas e apto pré Isa de modernização;5;;;;
19 de maio de 2024;Excepcional;Café da manhã excelente ;;;;;;
"Atendimento do hotel""";Pouco garçom para atendimento ;;;;;;;
"Hotel excelente mas faltam a pessoal de atendimento nas área de lazer""";10;;;;;;;
16 de maio de 2024;Foi uma ótima estadia!;Limpeza, atendimento, um bom café da manhã!;Nenhuma reclamação;10;;;;
10 de maio de 2024;Aceitável;Localizacao;Fechadura com problema. Apto só abria com chave mestra. Quando sai, precisei solicitar a camareira para abrir a porta para mim. Em vez de me mudarem de quarto, arrumaram a excelente solução de ter que pedir para camareira abrir a porta toda vez que saia.;5;;;;
8 de maio de 2024;Excepcional;A estrutura e a localização são ótimas.;Na;10;;;;
5 de maio de 2024;Perfeito❤;Atendimento dos funcionarios excelentes.;;10;;;;
30 de abril de 2024;Decepção;Espaço;Demora no atendimento, solicitamos toalhas extras e não recebemos.;6;;;;
28 de abril de 2024;Ótimo local retornarei e recomendo;Localização e atendimento;Horário do café;10;;;;
27 de abril de 2024;Foi boa;Café da manhã bom, muitas variedades, o pessoal da recepção nao são simpáticos, o mensageiro do hotel foi super solicito, nos ajudou bastante.;Eu não gostei que a fechadura do meu quarto deu defeito, pedi reparo mas não foram reparar, a fechadura eletrônica não trancava por dentro;10;;;;
25 de abril de 2024;Excepcional;L;Localização;10;;;;
24 de abril de 2024;Ficamos somente um dia foi uma estadia razoável;Cama de casal grande e confortável;Banheiro muito pequeno;5;;;;
24 de abril de 2024;Aceitável;Muito bem localizado;;;;;;
Bom café da manhã;;;;;;;;
"Equipe atenciosa e prestativa""";Hotel está velho, precisa se modernizar urgente, principalmente os quartos.;;;;;;;
Quarto muito escuro;" espelho mofado. Sensação não foi agradável.""";5;;;;;;
24 de abril de 2024;Péssima;Localização;Na recepção deram 2x o cartão errado pra entrar no quarto, fiquei 1:30 esperando eles resolverem e me dar o cartão de acesso correto. ;;;;;
Funcionária do restaurante não espera você terminar de comer; pegou o copo da minha mão; e recolheu os pratos sem ao menos perguntar se a gente tinha terminado. ;;;;;;
Você pode entrar apenas uma vez pra tomar café da manhã e ele controla meu filho pegou iogurte a moça pediu pra devolver (a mesma funcionária que retirou os pratos e copos enquanto nós comia) ;;;;;;;;
Camas todas de solteiro; eles apenas se juntam pra formar cama de casal;" sem conforto algum.""";1;;;;;
24 de abril de 2024;Relativamente boa. Conforto do espaço do quarto, espaço do hotel, café da manhã OK, mas falta investir em uma internet d;Café da Manhã ótimo, vi outros comentários ruins, mas na verdade tem de tudo. Oferecem sempre comidas típicas do local também. O adorado pão de sal que não é bom, mas eles oferecem outros pães. Funcionários sempre solicitos e acomodação confortável .;O conforto de cama e espaço do quarto, limpeza é ok. Mas os equipamentos como chuveiro, Tv e internet precisam melhorar. Chuveiros antigos, televisão sem acesso à internet e o próprio WiFi é horrível nos quartos. Se você estiver a trabalho sugiro procurar saber da internet ou outro hotel. Esse não é o melhor para esse acesso.;6;;;;
22 de abril de 2024;Hospedagem em Boa Viagem;Localização;;;;;;
"Possibilidade de check-in antecipado""";Quarto com cheiro ruim ;;;;;;;
"Banheiro com vaso sanitário não funcionando""";6;;;;;;;
22 de abril de 2024;Decepcionante;A reserva era para 8 pessoas e 2 quartos, mas nos quartos só tinha 3 camas. Tamanho do banheiro.;Reserva pra 8 pessoas e só tinha 6 camas e tamanho do banheiro, muito pequeno.;4;;;;
21 de abril de 2024;Excepcional;A vista para praia;...;10;;;;
21 de abril de 2024;Excepcional;Excelente em tudo. Nada a reclamar. Café da manhã excelente! Colaboradores muito simpáticos (Adônis e uma moça que não lembro o nome, entre tantos outros). Higiênico e muito confortável!! Nota 10!;;10;;;;
21 de abril de 2024;Boa;Café;Ar com defeito e cama com o pé soltando;10;;;;
21 de abril de 2024;Péssimo;Só localização.;;;;;;
A fachada é bonita;" mas o resto não compensa ficar a desejar""";Cheio muito forte de mofo,os ap sem ventilação, meu marido tem alegia, reclamamos nos assim que chegamos no quarto, nos trocou mas o outro também não atendeu ;;;;;;
"O café da manhã não tem opção nenhuma""";1;;;;;;;
16 de abril de 2024;Hotel recomendado para negócios, não recomendo para viagem em fámilia.;A ducha do banheiro é maravilhosa. Localização do hotel é boa;Fiquei hospedado no quarto 301, a potência do ar condicionado não é ideal para dimensão da suíte, mesmo a suíte tendo 2 ar condicionados, um para cada comodo, o ar condicionado não resfria o quarto.;6;;;;
14 de abril de 2024;Recomendo;Localização, quarto que reservei tinha vista para o mar e café da manhã muito bom;O fato de não ter tomadas 110V, pois levei ferro, minha mãe levou prancha de fazer chapinha no cabelo e não pude ligar lá, tive que comprar um ferro de 220v para passar as roupas, e tbm de ter q pagar o estacionamento R$ 32 por dia, deveria já ser de cortesia para o hóspede. Tirando isso a instalações são boas e funcionários bons;10;;;;
14 de abril de 2024;Reavaliem as estrelas. Péssimo.;Do calçadão da praia.;O quarto para 3 pessoas era apertado, sem ventilação (janela para um muro, ar condicionado quebrado. Ficamos somente uma diária. É desonesto.;3;;;;
13 de abril de 2024;Ruim;Localização;Infelizmente a experiência não foi boa, anúncio dizia ser 4 estrelas, parei o carro na entrada, conversei com o manobrista, me explicou muito educado como funcionava o estacionamento e não veio ninguém ajudar com as malas, viajamos com um bebê, logo temos um tanto considerável de bagagem.;;;;;
No check in esqueceram do berço; levou uma hora pra entregarem o berço.;;;;;;;
Pedi um copo de vidro emprestado e cobram R$5;00 pra cada item; copo; taça; talheres... ;;;;
Elevador já cheira a mofo; corredor dos quartos então..;;;;;;;
Quartos antigos e sem cuidado; móveis estufados de água; lascados; sem manutenção; tudo bem velho; chuveiro tiraram o aquecedor central e tem um Lorenzetti simples; enfim; teve 4 estrelas ha uns 30 anos; hoje tenta sustentar 3.
No café da manhã novamente problemas com as regras; o bebê dormia; um do casal desceu pra comer e pediu uma tapioca e mencionou que era pra levar pro bebê comer; imediatamente foi negado o pedido; alegando que que não garantiam a conservação do produto.;;;;
Localização excelente; atendimento no geral muito cordial;" quarto amplo.""";3;;;;;
6 de abril de 2024;Excelente, tudo de acordo com o esperado para o nível de hotel;De tudo, tanto a localização como as acomodações e café da manhã, são excelentes;;10;;;;
1º de abril de 2024;Ótima;Normal;Nada;10;;;;
28 de março de 2024;O hotel deixa a desejar nas manutenções preventivas, não fazemreparos na estrutura dos apartamentos.;;Deixou a desejar bastante na qualidade e na estrutura dos quartos que fiquei hospedado;;;;;
;;;;;;;;
704;801;" 1201""";1;;;;;
28 de março de 2024;A qualidade de conservação dos apartamentos não é mais a mesma. A Manutenção preventiva não é feita.;Café da manhã top.;;;;;;
Bem localizado;" na beira da praia.""";Fiquei hospedado no quarto standard apartamento 704. Eu e minha esposa.;;;;;;
Esperei uma cama de casal; eram 2 camas de solteiro juntas e o edredom por cima. ficava aquela diferença no meio.;;;;;;;
O banheiro com a torneira do chuveiro danificada.;;;;;;;;
Já foi bom o hotel; a experiência em 2 visitas ; em apartamentos diferentes. Foram péssimas.;;;;;;
;;;;;;;;
Tive hospedado na suite familia; no apartamento 801. O ar-condicionado da sala de estar não gelava. O hotel não faz manutenção preventiva.;;;;;;;
"Os valores cobrados não estão de acordo com a qualidade oferecida....""";1;;;;;;;
25 de março de 2024;Excepcional;Gostei de tudo;;10;;;;
23 de março de 2024;Excepcional;Sim;Nada;10;;;;
23 de março de 2024;Satisfatório;A localização é ótima.;Funcionário da recepcao (um em especifico) precisa tratar melhor os hóspedes no checkin, passar as informações necessárias da estadia.;6;;;;
21 de março de 2024;Excepcional;Limpeza do local;O funcionário não consegui passar cartão de crédito;10;;;;
21 de março de 2024;Decepcionante;;Internet péssima;4;;;;
18 de março de 2024;PESADELO;Nunca mais voltaria a esse hotel . Foi vendido como uns dois melhores de Recife porém nossa estadia foi horrível. O quarto de hotel um pesadelo conseguia ouvir os hóspedes do quarto acima caminhando por tanto a penas descansei. O café da manhã bem básico sem café expresso . O quarto fedendo a mofo. O banheiro fedendo con azulejos sujos. Encontrei cabelos de mulher no banheiro. Só para ter uma idea troquei três quartos no hotel .Fiz a reserva antes de chegarmos ao hotel e pedi duas camas de solteiro quando chegamos o recepcionista nem sabia desse pedido. As janelas do último quarto batendo pelo vento fazendo barulho que impedia dormir. Pedi um cobertor e parecia un lençol bem fininho. Os travesseiro fedendo a suor e cigarro de outra pessoa. A cama parecia de pedra. No segundo quarto que estivemos não funcionava nem o ar nem o telefone. A vista do quarto foi uma surpresa incrivelmente dava para uma parede de outro prédio e para as escada de outro prédio por tanto não conseguimos abrir as cortinas ,por falta privacidade. Não consegui tomar banho de piscina no me senti confiante de entrar nela . O hotel só oferece serviço de quarto pra jantar. O hotel não é apto para alérgicos pedi pra a senhora que limpa o quarto para não limpar porque botam um produto que depois você não pode respirar. O sabão con un cheiro horrível ;;;;;;
"Com certeza esse foi o pior hotel que já ficamos no Brasil. Não indicaria. PESADELO!!""";Nunca mais voltaria a esse hotel . Foi vendido como uns dois melhores de Recife porém nossa estadia foi horrível. O quarto de hotel um pesadelo conseguia ouvir os hóspedes do quarto acima caminhando por tanto a penas descansei. O café da manhã bem básico sem café expresso . O quarto fedendo a mofo. O banheiro fedendo con azulejos sujos. Encontrei cabelos de mulher no banheiro. Só para ter uma idea troquei três quartos no hotel .Fiz a reserva antes de chegarmos ao hotel e pedi duas camas de solteiro quando chegamos o recepcionista nem sabia desse pedido. As janelas do último quarto batendo pelo vento fazendo barulho que impedia dormir. Pedi um cobertor e parecia un lençol bem fininho. Os travesseiro fedendo a suor e cigarro de outra pessoa. A cama parecia de pedra. No segundo quarto que estivemos não funcionava nem o ar nem o telefone. A vista do quarto foi uma surpresa incrivelmente dava para uma parede de outro prédio e para as escada de outro prédio por tanto não conseguimos abrir as cortinas ,por falta privacidade. Não consegui tomar banho de piscina no me senti confiante de entrar nela . O hotel só oferece serviço de quarto pra jantar. O hotel não é apto para alérgicos pedi pra a senhora que limpa o quarto para não limpar porque botam um produto que depois você não pode respirar. O sabão con un cheiro horrível ;;;;;;;
"Com certeza esse foi o pior hotel que já ficamos no Brasil. Não indicaria. PESADELO!!""";1;;;;;;;
11 de março de 2024;Aceitável;Somente da localização.;As fotos enganam muito! Nao colocam as fotos dos banheiros, pois eh uma vergonha. O box eh muito pequeno e escuro! Foi bem difícil de dar banho na minha filha no espaço tão pequeno. ;;;;;
Fora que a vista do quarto dava direto para outro prédio ao lado; não dava para ver o mar. Quartos e banheiros sujos. ;;;;;;;
Café da manhã estava bom; mas o ambiente eh muito pequeno e quente. Os garçons não davam conta de limpar as mesas; e amar condicionado não dava conta;" e olha que o ambiente eh pequeno. Péssimo! Não voltaria nesse hotel!""";5;;;;
11 de março de 2024;Boa localização;Localização;Os lençóis estavam manchados, acústica ruim, a janela do banheiro estava quebrada e não fechava com isso o barulho ficava mais alto, umas das camas é sofá cama e era muito ruim. ficamos no quarto 301, fizemos upgrade de quarto quando chegamos no hotel.;6;;;;
9 de março de 2024;Excepcional;;A Tv não pegava os aplicativos e o quarto modelo antigo.;10;;;;
9 de março de 2024;Não recomendo pois na mesma localização há outros hotéis que foram elogiados por locais.;Teve dois funcionários que foram bem solícitos em vista de alguns que não se mexiam pra ajudar, quando houve necessidade devido aos problemas nas instalações.;Os quartos com cheiro de mofo;;;;;
4 de março de 2024;Podia ser melhor pelo custo os funcionários mais treino;Localization os funcionários bons mas precisa mais treinos;Sem blecaute e condicionador fraco o café da manhã tapioca queimada e demora até em hambúrguer;5;;;;
28 de fevereiro de 2024;Satisfatório;Localização boa.;Cama casal pequena , chuveiro muito próximo a parede,;6;;;;
28 de fevereiro de 2024;Precisa melhorar as camas e cobertores.;Limpeza.;O tamanho da cama de Casal, se for um casal grade, não dá não !;6;;;;
25 de fevereiro de 2024;Ótimo hotel!;Ótimo hotel!;;10;;;;
23 de fevereiro de 2024;decepção;;o hotel está totalmente insalubre;3;;;;
23 de fevereiro de 2024;Ótima estadia;Gostei bastante da minha estadia no Hotel Euro Suit. O atendimento é maravilhoso, o hotel, a localização, o café da manhã... Só elogios!;;10;;;;
19 de fevereiro de 2024;Hotel maravilhoso;Tudo maravilhoso, ficamos no quarta de frente para o mar, tem uma vista sensacional. Os funcionários são muito simpáticos e extremamente atenciosos.;Ter que ir embora...🤣;10;;;;
18 de fevereiro de 2024;Excepcional;Localização, limpeza e atendimento muito bom;;10;;;;
17 de fevereiro de 2024;Perfeita;Da localização, limpeza, café da manhã e atenção dos funcionários.;Nada. Só a Internet poderia ser melhorada. Fica caindo, principalmente a noite.;10;;;;
15 de fevereiro de 2024;Decepcionante;A localização é boa em relação à praia de Boa Viagem. Fácil locomoção para shopping recife (20 min a pé), aeroporto a poucos minutos (de carro) e outras partes da cidade. O centro é distante.;;;;;;
"Serve como lugar para dormir.""";O hotel já dá sinais de exaustão onde os equipamentos são antigos e demonstrando conservação precária. Os acabamentos são ruins e o ar condicionado vazou na primeira unidade que nos ofereceram (como upgrade) e o vaso sanitário não funcionava. ;;;;;;;
Uma aparência típica dos anos 70 já muito desgastada e explorada.;;;;;;;;
Foi um pouco frustrante porque a diária é muito cara no carnaval e o custo benefício é desfavorável.;;;;;;;;
"O atendimento realmente é bem reativo e apenas alguns funcionários da limpeza e café da manhã demonstram algum interesse em atender.""";6;;;;;;;
14 de fevereiro de 2024;Hotel excelente, bem localizado e ótima equipe de funcionários.;Atendimento excepcional, equipe atenciosa e eficiente. Tive um acidente e precisei de auxilio, fui prontamente atendida e o problema resolvido com muita presteza e agilidade por todos os funcionários.;;10;;;;
10 de fevereiro de 2024;Excepcional;Gostamos muito da suite 1101... suíte enorme de frente para mar... Café da manhã excelente... Atendimento excepcional... Muito bom mesmo, recomendo;Nada a declarar...;10;;;;
5 de fevereiro de 2024;Ruim;Café da manhã;Quarto entupido, sujo, encontrei muito cabelo cumprido no chão, banheiro entupido e ralos, mais de 1 dias pra fazerem uma mudança de quarto aonde não pude usar o banheiro, ar condicionado lavei o filtro, pois não saia ar dele de tão sujo q estava...;3;;;;
4 de fevereiro de 2024;Ficamos encantados com o lugar!;Excelente café da manhã, suco de laranja e tapioca feitos na hora, equipe super atenciosa e uma grande variedade de opções, com frutas, pães e bolos muito gostosos.;As cortinas das janelas apresentam dificuldades para abrir, talvez um modelo diferente, como persiana rolo poderia facilitar. Um outo item que sinto falta, nos hotéis em geral, é um cabideiro de chão, pois sempre temos um casaco, uma bolsa, um chapéu para pendurar.;10;;;;
3 de fevereiro de 2024;Estadia com vista privilegiada em Boa Viajem.;Como sempre atendimento excelente, funcionários maravilhosos, café delicioso e variado. Localização excepcional na frente do mar.;Não gostei muito da iluminação da minha suíte dessa vez. Achei o quarto um pouco escuro e a central não estava gelando muito. Mas nada que tirasse a qualidade do hotel. Já me hospedei 3x e quero me hospedar novamente na próxima viajem pra Recife.;10;;;;
2 de fevereiro de 2024;Excelente lugar;Do ambiente,muito bom mesmo.;Nada a reclamar,estava perfeito;10;;;;
1º de fevereiro de 2024;Ótimo custo benefício;Sossego e localização;Cortinas ultrapassaras;10;;;;
31 de janeiro de 2024;Razoável!;Localização foi a melhor possível.;A cama péssima!!!! Desconfortável! Saímos mais cansados do q qndo chegamos.;4;;;;
31 de janeiro de 2024;Localização boa para o aeroporto;Café da manhã, localização, carregador de malas e manobrista.;Quarto, garagem e recepção.;6;;;;
31 de janeiro de 2024;Bom para uma noite!;Café da manhã e localização;Recepção, garagem e quarto;6;;;;
28 de janeiro de 2024;Nota 10;Minhas estadia no Euro Suíte foi perfeita, os funcionários maravilhosos, limpeza, custo benefício perfeito, excelente localização super indico.;;10;;;;
27 de janeiro de 2024;Satisfatório;Localização e funcionários;Chuveiro com pontos de ferrugem;;;;;
Local para banho extremamente pequeno.;;;;;;;;
Café da manhã sem muita variedade nos dias da semana.;;;;;;;;
Desorganização nos alimentos no café da manhã. Às 9h; muitos itens faltando ;;;;;;;
"Valor elevado da diária em relação ao que é oferecido.""";6;;;;;;;
26 de janeiro de 2024;Excepcional;Adorei o café da manhã, uma delícia, quarto bem limpinho e muito aconchegante 🩷;;10;;;;
23 de janeiro de 2024;Maravilhoso, perfeito;Excelente localização, equipe educada, café da manhã ótimo, as acomodações confortável;Gostei de tudo;10;;;;
23 de janeiro de 2024;Melhor localização de boa viajem!;Hotel otimo,;Gostei de tudo;10;;;;
21 de janeiro de 2024;Excelente custo benefício;Localização e organização.;;10;;;;
19 de janeiro de 2024;Hospedagem em Boa Viagem.;Tudo perfeito. Funcionários atenciosos, café da manhã super variado e delicioso, serviço de toalhas , limpeza e higiene, simplesmente um hotel perfeito em tudo. Nota 1000.;Tudo foi do meu agrado. Tudo perfeito.;10;;;;
17 de janeiro de 2024;Não voltarei;A localização é boa, a equipe é muito atenciosa, e a limpeza foi muito boa;As toalhas e os lençóis são muito velhos e encardidos e a comida do restaurante é abaixo do razoável;5;;;;
13 de janeiro de 2024;Satisfatório;boa localização e bom custo benefício;quartos apertados, wifi nao pegava em todos os quartos, instalações antigas;6;;;;
13 de janeiro de 2024;Muito ruim;;Fiz uma reserva antecipadamente e chegamos a noite por volta das 19h, a acomodação ainda “nao estava pronta”, tivemos que esperar. Quarto muito ruim, estrutura antiga, ar condicionado passou a noite toda vazando, molhou todo o chão, encharcou a apostila do meu curso inteira (perdi ela), no dia seguinte acionamos a recepção, que enviaram um técnico que mexeu no aparelho por 5minutos e colocou um balde embaixo, “pq não tinha como resolver”, café da manhã deu diarreia em mim e na pessoa que estava comigo.;2;;;;
12 de janeiro de 2024;Extremamente confortável;Ótimo custo benecífico e localização.;;10;;;;
11 de janeiro de 2024;Satisfeito !;Gostei da atenção dos funcionários, do quarto confortável, café da manhã e limpeza !!;;10;;;;
10 de janeiro de 2024;Tudo perfeito;Sempre me hospedo neste hotel quando estou a passeio.;;;;;;
sempre fui muito bem atendida;" os funcionários são prestativos e cordiais.""";;10;;;;;
9 de janeiro de 2024;Aceitável;Quarto.;Antipatia do funcionário no check in.;;;;;
Antipático ao extremo.;;;;;;;;
Reserva feita há muitos dias antes e parecia que tínhamos chegado de surpresa; sem nenhuma empatia e metido demais ;;;;;;;
"Um completo imbecil""";5;;;;;;;
9 de janeiro de 2024;Aceitável;;Quartos muito pequeno, sanitário ruim, mais é bem localizado;5;;;;
6 de janeiro de 2024;Não voltaria;Localização;Toda a estrutura do quarto é contrária ao mostrado nas fotos. Aluguei a opção deluxe com vista para a praia, e na verdade a vista é bem pequena de uma janela lateral;5;;;;
5 de janeiro de 2024;Excepcional;Localização, conforto e café da manhã. Vale super a pena;;10;;;;
5 de janeiro de 2024;Satisfatório;Nada tudo caro estacionamento tem que pagar 25 reais;Piscina pequena atendimento dos funcionários não e legal estacionamento pra fazer checkin muito ruim sem vaga pra estacionar só cabe um veículo refeições caras no preco;6;;;;
4 de janeiro de 2024;Não recomendo.;Localização;Tratamento dos funcionários da recepção. Parece que estão trabalhando sem receber 1 real pelo mal humor contagiante e grosserias;1;;;;
3 de janeiro de 2024;Acomodação e limpeza muito bom, mais o café da manhã não muito bom, poucas opções.;Quarto confortável e limpo;Café da manhã;10;;;;
3 de janeiro de 2024;Muito boa;O café da amanhã é maravilhoso e a localização perfeita;A piscina é perigosa pra quem não sabe nadar e principalmente pra crianças, de resto tudo perfeito;10;;;;
1º de janeiro de 2024;Excepcional;Ótima Localização, Tudo estava excelente.;;10;;;;
