data_avaliacao;titulo;comentario_positivo;comentario_negativo;nota;;;;;;;
8 de maio de 2023;Muito bom;A localização é muito boa, 10 min ou menos do Marco Zero indo de Uber, e mais ou menos o mesmo tempo do aeroporto. A praia fica muito próxima, virou a direita andou um pouco chegou. Instalações limpas e atendimento excelente. Café da manhã delicioso!;;8;;;;;;;
5 de maio de 2023;Observando detalhes;O apto que fiquei foi muito confortável, banheiro excelente, o ar condicionado funcionando perfeitamente.;Poderia melhorar os recepcionistas, tem alguns que parecem estressados.;9;;;;;;;
5 de maio de 2023;Bom;Localização e estacionanento grátis.;Café da manhã.;7;;;;;;;
1º de maio de 2023;Muito bom;muito boa;faltou café da manhã e não tem nada próximo;8;;;;;;;
30 de abril de 2023;Bom;Localização tranquila atendendo as minhas necessidades;;7;;;;;;;
27 de abril de 2023;Boa...;Tudo muito bom..;O horário do café da manhã e muito curto , e começa tarde ...deveria ser de 06:00hs as 10:00hs - o horário que eles aplicam e de 07:00hs as 09:30hs;9;;;;;;;
27 de abril de 2023;Muito bom;localização ótima;;8;;;;;;;
25 de abril de 2023;Bom custo benefício;Café da manhã muito bom. Comida saborosa. Ótima localização.;Sem elevador. Quartos sem proteção acústica nenhuma.;9;;;;;;;
23 de abril de 2023;Feriado de Tiradentes no Recife;A localização. Perto da praia de Boa Viagem, de supermercado, de restaurantes, de padarias, etc;O colchão achei duro e os travesseiros eram muito baixo.;8;;;;;;;
23 de abril de 2023;Recomendo pelo custo beneficio;Recomendo para viagens a lazer onde o hotel será apenas um apoio para banho e dormida, como também a trabalho. Ótima localização, equipe muito simpática e resolutiva. O hotel só possui escadas, então não seria recomendado para quem necessita de acessibilidade. Café da manhã razoável. Voltaria.;Não ter elevador.;8;;;;;;;
23 de abril de 2023;Bom;Organização e limpeza do local, e forma de pagamento no ato da hospedagem.;Faltou apenas um ponto , avisar limite de volume da tv e barulhos nos aptos após às 22hs . No primeiro dia demorei pegar no sono, devido um dos meus vizinhos está com barulhos e tv com volume alto isso já pós 22:20h .;7;;;;;;;
22 de abril de 2023;Bom atendimento.;Gostei dos funcionários. Principalmente a funcionária Cecilia.;;9;;;;;;;
21 de abril de 2023;Bom;Atendimento!;Quarto não era tão espaçoso, e éramos 2 e deixaram apenas 1 toalha e 1 lençol para nós. Sentimos falta dessa atenção, considerando que era um casal.;7;;;;;;;
20 de abril de 2023;Regular. Bom custo-benefício!;A localização e o café da manhã foram bons. O quarto é regular, mas pelo preço, a relação custo-benefício é boa. Apesar de pequeno, o quarto e o banheiro são funcionais.;O tamanho do quarto e alguns detalhes como rachaduras na parede. Fatores que não influenciam na estadia. Iria novamente.;9;;;;;;;
20 de abril de 2023;Fantástico;O hotel é de fácil localização, os quartos são bons, muito bem limpos e organizados, o café da manhã é gostoso, só não achei super completo mas pelo preço que paguei é ótimo.;;9;;;;;;;
19 de abril de 2023;Muito bom;O hotel era bem localizado, próximo a padaria, restaurantes e praia. Tudo estava muito limpo, o chuveiro era bem forte, a cama era confortável, o ar condicionado era forte e não fazia barulho. Os funcionários foram prestativos e o café da manhã era satisfatório.;Não teve algo que eu não gostei, apenas poderia ter um espelho maior no quarto.;8;;;;;;;
19 de abril de 2023;Fantástico;Café da manhã ótimo todos muito simpático...e atencioso da recepção....gostei muito ......;;9;;;;;;;
17 de abril de 2023;valeu pelo custo x benefício mas não voltaria;localização;quarto precisa de reforma ;;;;;;;;
banheiro tb ;;;;;;;;;;;
"café da manhã sem muitas opções.""";7;;;;;;;;;;
16 de abril de 2023;Bom;Bom;Do quarto;7;;;;;;;
16 de abril de 2023;Hotel Uzi Mar;A refeição é simples, porém muito boa!;tamanho do quarto que é muito pequeno. baixa iluminação.;7;;;;;;;
16 de abril de 2023;Bem localizada e em paz.;Pertinho da praia.;Nada a declarar.;8;;;;;;;
15 de abril de 2023;Apesar do bom preço e da ótima localização, não tem conforto e o café da manhã deixa a desejar.;A localização é, sem dúvida, o ponto alto da estadia. Localizado bem perto da praia de Boa Viagem(não precisa usar carro), é próximo também a padaria, bares e restaurantes. Fica a poucos minutos do Recife antigo e de fácil acesso para o aeroporto. Outro ponto positivo é a existência de garagem coberta.;O café da manhã é bem básico, os alimentos não possuem uma boa apresentação e parecem ser do dia anterior. Se você é uma pessoa que prioriza um bom café da manhã, este não é o lugar. O quarto é pequeno e a cama de alvenaria. O banheiro não tem box completo e a pia é bem pequena.;7;;;;;;;
12 de abril de 2023;Muito bom;Limpeza e localização;O café da manhã bem Pouca opção.;8;;;;;;;
10 de abril de 2023;Muito bom;Bem localizado.;Não tem restaurante.;8;;;;;;;
5 de abril de 2023;Bom custo beneficio.;Bom café da manhã, bom custo beneficio, funcionários sempre dispostos em ajudar.;;7;;;;;;;
4 de abril de 2023;Muito bom;Tudo;;8;;;;;;;
3 de abril de 2023;Muito bom;funcionários muito prestativos. excelente localização. café da manhã muito bom.;cama um pouco desconfortável, muito barulho a noite, talvez da parte de fora do ar condicionado ou algo no telhado, no mais estava bom.;8;;;;;;;
1º de abril de 2023;Perfeito!;Ótimo;Tudo perfeito!;8;;;;;;;
31 de março de 2023;Boa;Localização! Custo beneficio.;Reservei 03 quartos para 4 adultos e 2 crianças, porém o terceiro quarto era horrível. pequeno e as escadas que incomodavam pq tinha idosos.;8;;;;;;;
31 de março de 2023;Razoável;Funcionários desatentos. Ausentes na portaria. Tem chamar e demoram pra atender.;Porta de entrada n há livre acesso. Demoram pra atender. Durante tida hospedagem tínhamos que solicitar o número de toalhas não eram em número aos dois hóspedes. Consideraram um. Tá;7;;;;;;;
30 de março de 2023;Bom;;cama desconfortável e chuveiro sem box;7;;;;;;;
30 de março de 2023;Bom;Localização, custo X benefício.;O quarto que fiquei muito pequeno, também melhorar as opções de canais da TV.;7;;;;;;;
29 de março de 2023;Bom;Funcionários;Tudo satisfatório;7;;;;;;;
28 de março de 2023;Muito bom;Localização e custo beneficio;Só da falta de opção para jantar no hotel mesmo.;8;;;;;;;
28 de março de 2023;Localização, café e atendimento. Praticidade e agilidade.;Atendimento, localização, acessibilidade e café muito bom.;Não há o que dizer sobre esse quesito.;9;;;;;;;
28 de março de 2023;Hotel confortável e bem localizado;"A organização do hotel é muito boa, o quarto é espaçoso e confortável, ara condicionado e água quente pra ligar e usar, sem precisar de ""jeitinho"" pra funcionar do modo certo, excelente localização em Boa Viagem, de fácil acesso e saída.";;8;;;;;;;
28 de março de 2023;Muito bom;CAFÉ DA MANHÇÃ BEM COMPLETO, TUDO MUITO SABOROSO!;;8;;;;;;;
26 de março de 2023;ótima;café da manhã;teve um barulho na madrugada, porém hospedem fora de si.;9;;;;;;;
23 de março de 2023;Fantástico;café da manha muito bom.;sem reclamações.;9;;;;;;;
23 de março de 2023;Fantástico;Quarto confortável, hotel ok.;;9;;;;;;;
23 de março de 2023;Fantástico;A limpeza dos quartos é perfeita. Ótima localização. Funcionários atenciosos.;O quarto estava com uma lâmpada queimada, não havia tomadas perto da cama.;9;;;;;;;
23 de março de 2023;boa relação custo benefício;Poderia colocar mais opções no café da manhã, tanto frutas como demais itens.;;8;;;;;;;
21 de março de 2023;Custo Benefício;Localização;Café da manhã;7;;;;;;;
20 de março de 2023;Fantástico;Hotel dentro do esperado. ;;;;;;;;;
Bem localizado em boa viagem. Funcionários Educados; mas não muito simpáticos. ;;;;;;;;;;
Café da manha bom; um bom custo benefício para quem procura algo central com o preço justo para a diária.;;;;;;;;;;
"Tem estacionamento gratuito para hóspedes.""";;9;;;;;;;;;
20 de março de 2023;Muito bom;Dá boa recepção, dá atenção, limpeza, bom café dá manhã;Cama e talvez o regular do chuveiro quente/frio;8;;;;;;;
20 de março de 2023;Bom;Perto do centro, dá pra fazer tudo andando. Funcionários atenciosos, café da manhã supriu as necessidades.;Teve um inseto no quarto que deu uma desanimada, cama bem desconfortável.;7;;;;;;;
19 de março de 2023;Passei uma semana muito agradável.;Excelente localização, a duas quadras da praia. Funcionários bastante atenciosos. Bom café da manhã, com toques regionais e ótimo custo/benefício, com preço bastante justo.;O hotel ainda tem alguns setores em obras, mas isso não causou qualquer transtorno.;8;;;;;;;
17 de março de 2023;Bom;;no café da manhã poderia ter mais frutas.;7;;;;;;;
16 de março de 2023;Muito bom;Tudo estava bem, porém o cheiro do banheiro estava um pouco ruim (mofo).;Cheiro do banheiro.;8;;;;;;;
16 de março de 2023;um local para dormir com conforto;Não tomei cafe da manha pois precisava sair mais cedo que o horario disponivel quando procurei a recepção, fui informado que não tinha como adiantar;;;;;;;;;
16 de março de 2023;Conforto e simplicidade, num local bem localizado.;Custo-benefício, limpeza, banho muito bom, espaço no quarto, cama confortável.;;;;;;;;;
;;;;;;;;;;;
"Tudo simples e muito satisfatório""";;8;;;;;;;;;
16 de março de 2023;Bom;localização;quarto minúsculo e muito barulho nos corredores;7;;;;;;;
14 de março de 2023;Ótimo custo benefício;Excelente localização, ótimo custo-benefício. Compensa muito.;;8;;;;;;;
14 de março de 2023;Bom;Localização, limpeza e estacionamento.;Café da manhã;7;;;;;;;
14 de março de 2023;Eu recomendo;Bom custo beneficio;A pouca variedade no café da manha;9;;;;;;;
12 de março de 2023;Foi tranquila;Do café da manhã e do atendimento;Achei a recepção muito quente;8;;;;;;;
7 de março de 2023;Fantástico;a localização e o café da manhã . funcionários são atenciosos.;;9;;;;;;;
7 de março de 2023;Bom;Da localização perto da Praia de Boa Viagem;A cama não era confortável;7;;;;;;;
3 de março de 2023;Fantástico;;Precisa melhorar mais o café da manhã;;;;;;;;
Mais opções ;;;;;;;;;;;
"E mais tomadas no quarto""";9;;;;;;;;;;
3 de março de 2023;Fantástico;O Café da Manhã é Ótimo! Tem Várias coisas próximas pois fica localizado em uma avenida super movimentada! E o Quarto estava Limpo!;O isolamento acústico do Quarto não é muito bom, então de manhã logo cedo da pra ouvir as pessoas passando no corredor e conversando....e a Televisão não é smartv e não Tem Netflix nem YouTube....;9;;;;;;;
3 de março de 2023;Fantástico;Hotel com ótimo custo benefício, café da manhã simples e agradável, acomodações limpas, internet de boa qualidade, tv com netflix e localização maravilhosa para praia e sem dificuldades para o centro. Ótima escolha.;;9;;;;;;;
27 de fevereiro de 2023;Estadia razoável e preço agradável.;Localização.;;7;;;;;;;
19 de fevereiro de 2023;Muito bom;Da comodidade o quarto, muito boa.;Do café da manhã, pouca variedade.;8;;;;;;;
18 de fevereiro de 2023;Muito bom;Custo benefício bem razoável, preço justo pelo que oferece.;Não teve nada desagradável .;8;;;;;;;
17 de fevereiro de 2023;Muito bom;Café da manhã perfeito , maravilhoso. Ótima localização, a poucos metros da orla de boa viagem;Meu quarto ainda não estava reformado, a cama não era muito boa;8;;;;;;;
16 de fevereiro de 2023;Muito tranquila;Café simples e bem feito;;;;;;;;;
15 de fevereiro de 2023;para uma dormida, o hotel foi bom.;localização e preço;nada que mereça colocar aqui.;8;;;;;;;
15 de fevereiro de 2023;Muito bom;Ótima localização e organização. Excelente custo benefício;Travesseiro muito magrinho;8;;;;;;;
12 de fevereiro de 2023;Bom;Café da manhã;Internet;7;;;;;;;
10 de fevereiro de 2023;Muito bom;Localização, custo benefício, garagem e café da manhã;Nada que venha desadradar;8;;;;;;;
10 de fevereiro de 2023;Fantástico;Localização;;9;;;;;;;
10 de fevereiro de 2023;Fiquei satisfeito;Regular;;7;;;;;;;
8 de fevereiro de 2023;Fantástico;Boa localização, excelente atendimento.;O café da manhã é um pouco fraco em relação a outros. Mas no geral muito bom.;9;;;;;;;
7 de fevereiro de 2023;Bom;Café da manhã dentro dos padrões para o preço da diáriae a localização é boa, pena que tem poucas vagas para estacionamento.;Achei poucas vagas de estacionamento;7;;;;;;;
7 de fevereiro de 2023;Muito bom;Excelente acomodação.;;8;;;;;;;
6 de fevereiro de 2023;Muito bom;O espaço do quarto estava satisfatório;;;;;;;;;
Próximo à praia;;;;;;;;;;;
"Opção de alimentação variada""";Horário do café poderia começar mais cedo;8;;;;;;;;;
6 de fevereiro de 2023;ótima;Boa localização, atendimento dos funcionários excelente, e café da manhã básico mas muito saboroso. Ótima escolha, voltaria a me hospedar com certeza.;Poderia ter escova de dente e touca no banheiro, e café descafeinado no café da manha.;8;;;;;;;
4 de fevereiro de 2023;A estadia foi aprazível.;Gostei bastante das acomodações e do café da manhã. Ótimas opções.;;8;;;;;;;
4 de fevereiro de 2023;Ótimo custo-benefício;Funcionários atenciosos, ambiente limpo, boa quantidade de opções no café da manhã.;Só me incomodou o fato de o quarto não ter uma janela ou outro espaço para entrada de ar, só tinha um basculante com visão para uma parede, que mal dava pra saber se era dia ou noite.;9;;;;;;;
3 de fevereiro de 2023;bom custo benefício;bom custo benefício, café da manhã não tem muitas opções, mas é bom.;nada que desabone a pousada.;8;;;;;;;
2 de fevereiro de 2023;Voltaria ao Uzi Mar;A gentileza dos funcionários, o conforto da cama, a limpeza do quarto, a localização do hotel.;Faltou ter toalha de mão no banheiro e a disposição dos alimentos no café da manhã fazia com que formasse fila para as pessoas se servirem como se fosse restaurante de comida a quilo. No primeiro dia isto atrapalhou o café.;9;;;;;;;
2 de fevereiro de 2023;Hotel razoável;Limpeza, café da manhã;Travesseiros não macios;;;;;;;;
"Um pouco distante do aeroporto""";7;;;;;;;;;;
1º de fevereiro de 2023;Ótima;Ótimo café da manhã com varias opções de comida ! Localização perfeita a uma quadra da praia de boa viagem !;;9;;;;;;;
1º de fevereiro de 2023;Fantástico;Gostei muito do Hotel, tem estacionamento na frente e coberto! O quarto bom.;Achei pouca variedade no café da manhã em relação à ‘mistura’ (só havia ovo e salsicha ou ovo e calabresa) e o cuscuz estava sempre seco. Como tinham outras preparações fiquei satisfeita. Porém mesmo assim compensa pelo custo benefício! Voltaria outras vezes!;9;;;;;;;
31 de janeiro de 2023;Acomodação razoável.;Gostamos da localização. É pertinho da praia e de locais de alimentação. Também gostamos do café da manhã.;Não gostamos do tamanho do apto. Muito pequeno! Não tem isolamento acústico, e, com isso, ouvimos muito barulho (TV, conversas, discussões) durante o dia e a noite. Não há sossego depois das 22h porque dá pra ouvir tudo o que ocorre nos corredores e aptos vizinhos. Ou seja, nosso descanso foi tumultuado pela má educação dos outros hóspedes, pela falta de regra de silêncio após às 22h e pela falta de estrutura dos aptos para reduzir ruídos externos.;;;;;;;;
Também não gostamos dos travesseiros;" pois eram muito baixos e desconfortáveis para o pescoço.""";7;;;;;;;;;
30 de janeiro de 2023;boa;quarto;banheiro com vazamento no box;9;;;;;;;
30 de janeiro de 2023;gostei muito e voltaremos;atendimento, limpeza e café da manhã;o café poderia ir até mais tarde;9;;;;;;;
29 de janeiro de 2023;Muito bom;Excelente custo benefício!! Boa localização e acomodação.;O café da manhã tem poucas opções, porém o suficiente para fazer uma boa refeição.;8;;;;;;;
29 de janeiro de 2023;Bom;Atendimento excelente;Muito barulho, os quartos são colados e os hóspedes fizeram muito barulho durante a noite;7;;;;;;;
28 de janeiro de 2023;Bom;Localização;Quarto com pouca ventilação e abafado.;7;;;;;;;
27 de janeiro de 2023;Muito bom;A localização é excelente e o café da manhã tem muitas opções.;;8;;;;;;;
27 de janeiro de 2023;Bom;Localização. O hotel fica próximo de bares, restaurantes, farmácia, padaria...;Só havia um lençol fininho e pequeno para se cobrir. Precisamos pedir dois. O café da manhã é fraquinho e o quarto pequeno. Mas diante do custo é ok.;7;;;;;;;
27 de janeiro de 2023;O hotel possui um excelente custo-benefício. Recomendaríamos com certeza.;Café da manhã satisfatório com o básico mas tudo muito saboroso. Quartos bem limpos e o chuveiro com água aquecida e forte.;Sentimos falta de luz natural e vista do quarto pois a janela era virada para um corredor. Wi-fi falhava algumas vezes.;8;;;;;;;
26 de janeiro de 2023;Bom;localização;o lençol de cama estava sujo;7;;;;;;;
26 de janeiro de 2023;excelente localização;localização;;8;;;;;;;
25 de janeiro de 2023;Preço justo;café da manhã muito bom;;;;;;;;;
acomodações muito boas;;;;;;;;;;;
localização do muito boa;;;;;;;;;;;
atendimento cordial;;;;;;;;;;;
"rapidez no atendimento tanto no entrada como na saída.""";nada a declarar;8;;;;;;;;;
25 de janeiro de 2023;muito boa, mas a infraestrutura precisa melhorar;atendimento e limpeza;o cheiro não muito agradável;8;;;;;;;
25 de janeiro de 2023;Fantástico;Café da manhã é bom.;;9;;;;;;;
25 de janeiro de 2023;Bom Custo Benefício!;custo benefício! Localização!;café da manhã!;9;;;;;;;
24 de janeiro de 2023;Boa Estadia;Gostei do quarto, do café da manhã, do custo benefício, dos funcionários, especialmente, da Lena e do Mizael.;;8;;;;;;;
23 de janeiro de 2023;ficaria novamente;muito bom. e pessoal muito simpatico;estacionamento .;9;;;;;;;
23 de janeiro de 2023;Muito bom;Muito bem localizado, simples mais aconchegante. Bem limpo e funcionários atenciosos e educados.;Atraso no check in.;8;;;;;;;
23 de janeiro de 2023;Fantástico;A localização que é excelente, muito próxima a praia de Boa viagem.;;;;;;;;;
"O custo benefício é excelente.""";;9;;;;;;;;;
22 de janeiro de 2023;Fantástico;Tudo legal.;Devia ter aquelas placas de solicitação de arrumação do quarto para pendurar na porta.;9;;;;;;;
20 de janeiro de 2023;Ótima localização;A localização é excelente: pertinho da praia e, principalmente, do aeroporto, o que facilita muito para quem está embarcando ou desembarcando na cidade. L café também é ótimo.;Na verdade, a acomodação estava de acordo com o anunciado nas fotos, então, nada a reclamar.;9;;;;;;;
20 de janeiro de 2023;Muito boa, dentro das expectativas . Ótimo custo benefício.;Café da manhã muito bom;;;;;;;;;
18 de janeiro de 2023;Excelente localização;;Café da manhã, pouquíssimas opções.;9;;;;;;;
17 de janeiro de 2023;muito bom o custo benefício;próximo ao aeroporto e ao lado da praia;;8;;;;;;;
17 de janeiro de 2023;Muito bom;Da localização e limpeza;O quarto só foi disponível as 15hs. Sendo que o check-in inicia as 14hs;8;;;;;;;
15 de janeiro de 2023;Bom;Da limpeza e conforto do apartamento 225;;7;;;;;;;
11 de janeiro de 2023;Bom;O hotel no tinha vista nenhum na janela.;;;;;;;;;
nao tinha edredons no hotel;" causando desconforto.""";melhor café da manha;;;;;;;;;
"disponibilidade de cobertores mais confortáveis.""";7;;;;;;;;;;
10 de janeiro de 2023;Bom;O hotel fica a duas quadras da praia. Os funcionários são bem atenciosos.;O hotel parece um labirinto, em reforma. As portas dos banheiros fazem muito barulho. Café básico.;7;;;;;;;
10 de janeiro de 2023;Fantástico;Ótimo custo benefício, localização privilegiada e funcionários atentos e educados.;Hotel peca um pouco no conforto, não oferece mantas e é possível ouvir muito o barulho dos outros hospedes e funcionários nos corredores. As vezes antes das 7h da manhã.;9;;;;;;;
9 de janeiro de 2023;Foi apenas uma noite, no geral gostamos da estadia, boa localização e bom custo benefício.;Localização;Falta de elevador e atenção no atendimento.;7;;;;;;;
9 de janeiro de 2023;Bom;O hotel é limpo, tem um café básico, mas gostoso.;Muito barulho. As portas dos banheiros (todos) precisam urgentemente de manutenção. Ao ponto que quando abrem no quarto vizinho, você escuta no seu quarto.;7;;;;;;;
9 de janeiro de 2023;Muito bom;;Café da manhã poderia ter mais opções.;8;;;;;;;
9 de janeiro de 2023;Bom;Localização. Preço.;Café Manhã.;7;;;;;;;
8 de janeiro de 2023;Excelente custo benefício;Hotel com boa localização.;As camas ficam um pouco a desejar.;9;;;;;;;
7 de janeiro de 2023;Muito bom;Quartos limpos e funcionários muito simpáticos;Reforma...e falta de elevador;8;;;;;;;
6 de janeiro de 2023;Muito bom;O café da manhã é muito bom;Não tem elevador;8;;;;;;;
6 de janeiro de 2023;Voltarei;Localização, atendimento, café da manhã, excelente.;Subir escada;9;;;;;;;
3 de janeiro de 2023;bom custo benefício;bom café da manhã, quarto pequeno porém confortável. localização otimaaa;;8;;;;;;;
31 de dezembro de 2022;Fantástico;Café da manhã bem satisfatório.;;;;;;;;;
Funcionários excelentes;;;;;;;;;;;
Apesar de ter uma cara de hotel simples;" o custo benefício vale a pena.""";O hotel todo tá sendo reformado.;;;;;;;;;
O banheiro é um pouco pequeno e mal estruturado.;;;;;;;;;;;
"Água quente não funcionou muito bem""";9;;;;;;;;;;
31 de dezembro de 2022;Bom custo benefício;A Localização é boa. Poucos metros da orla de boa viagem. Quarto limpo e cama confortável. Café da manhã simples.;Tive dificuldade em ter água quente no chuveiro. Seguimos as orientações mas a água não esquentava.;8;;;;;;;
29 de dezembro de 2022;Muito boa;O hotel tem novos quartos no primeiro piso muitos bons. Nem todos os quartos tem ar condicionado silencioso. Por isso, precisamos trocar de quarto. Achamos ótimo o café da manhã e a proximidade da.praia e acesso a outras vias para Olinda etc.;;9;;;;;;;
22 de dezembro de 2022;Fantástico;Localização, conforto,limpeza e atendimento e um ótimo café da manhã.;O estacionamento pequeno. Sai a noite e quando voltamos não tinha vaga pra estacionar. Tive q deixar o carro na rua;9;;;;;;;
22 de dezembro de 2022;Bom;a água do hotel tem cheiro ruim.;;7;;;;;;;
22 de dezembro de 2022;Boa;gentileza dos funcionários;quartos antigos;7;;;;;;;
16 de dezembro de 2022;Bom custo-benefício para poucos dias de hospedagem.;Bom custo-benefício e com acesso a restaurantes baratos próximos.;No quarto que fiquei a vista não era muito boa, mas não fiquei muito tempo no quarto.;8;;;;;;;
12 de dezembro de 2022;Muito bom;Atencao da equipeda recepcao e da limpeza;o cafe da manha e simples, porem bom.. exeto a falta de sucos e outras comidas eventualmente;8;;;;;;;
10 de dezembro de 2022;Boa;Boa localização, preço razoável, café da manhã razoável pode ser melhorado.;Café precisa melhorar;7;;;;;;;
9 de dezembro de 2022;Bom custo benefício;chuveiro, café, atendimento, localização;porta só abre a metade, ar condicionado razoável, só dão um cartão para duas pessoas;7;;;;;;;
4 de dezembro de 2022;Bom;Localização;Café da manhã com poucas opções;7;;;;;;;
3 de dezembro de 2022;Nao pretendo voltar.;Dos funcionarios. Atenciosos.;Das instalaçoes, quarto sem ventilaçao e FALTA DE COBERTOR;8;;;;;;;
29 de novembro de 2022;Bom;Atendimento dos funcionários, localização, café da manhã.;Achei o quarto ruim, pouca ventilação, a janela do quarto muito pequena e abre para um fosso. A cuba da pia do banheiro é minúscula só para lavar as mãos já molha tudo.;7;;;;;;;
28 de novembro de 2022;O hotel tem uma excelente limpeza e um bom café da manhã;Café da manhã, limpeza e localização;Estacionamento;8;;;;;;;
27 de novembro de 2022;Fantástico;Da facilidade e agilidade na hospedagem;Nada;9;;;;;;;
24 de novembro de 2022;Dentro do esperado.;A localização é ótima, os funcionários do hotel são muito atenciosos, o café da manhã é bom.;Não há edredom, apenas lençóis. No café não repõem o que vai acabando. A cama é muito dura e o chuveiro não esquenta muito bem.;8;;;;;;;
20 de novembro de 2022;Bom;Custo benefício;Não usam a comunicação do app booking.;7;;;;;;;
17 de novembro de 2022;Boa.;A localização é ótima. O hotel é novo então está tudo funcionando: ar, wi-fi, chuveiro, etc.;;8;;;;;;;
17 de novembro de 2022;foi boa,;custo e localização.;frigobar não tem nada, aí se queixem beber uma água tem que descer, se colocarem tapete de tecido no banheiro trás mais conforto pq o outro que está não é absorvível…importante ter uma mantinha no quarto para caso a gente precise, e o quarto não tem um cheirinho agradável, qdo cheguei parecia que tinham acabado de usar o banheiro…deixei um pedido na observação quando fiz a estadia por aqui, para que tivesse manta e higiene pq sou asmática mais não tinha manta e o quarto não estava com cheiro agradável, estava com cheiro de esgoto, algo assim.São críticas construtivas, espero voltar em breve e ter esses problemas resolvidos.;7;;;;;;;
16 de novembro de 2022;Boa. Mas pode melhorar;O quarto e localização são ótimos!;A limpeza do quarto não ocorreu no penúltimo dia, então ao voltar da praia o quarto ficou cheio de areia, toalhas molhadas. Tivemos que ficar assim até o dia seguinte para entrega do quarto. Ou seja ficou quase 2 dias sem limpeza.;7;;;;;;;
14 de novembro de 2022;Ótimo custo x beneficio.;Boa localização, quarto agradável, bem mobiliado e chuveiro muito bom.;Escadas. Café da manhã muito básico. Garagem é rotativa, mas não tive problemas.;9;;;;;;;
14 de novembro de 2022;Fantástico;Tudo muito bom, perfeito!;Gostei de tudo.;9;;;;;;;
