data_avaliacao;titulo;comentario_positivo;comentario_negativo;nota;;;;
26 de outubro de 2022;Aceitável;café da manhã é excelente.;É a terceira vez que me hospedo aqui, mas essa terceira vez fiquei muito insatisfeita pois as outras vezes que me hospedei fiz a reserva exatamente igual e tinha um quarto enorme com uma cama king e essa última vez uma caminha casal padrão mal da pra gente se mexer.;5;;;;
25 de outubro de 2022;Satisfatório;Localização boa. Em frente a praia.;Pra ser um hotel 4 estrelas falta muito. Prédio antigo, mobiliário antigo, academia ridícula, piscina nem se fala. Café da manhã ok.;6;;;;
22 de outubro de 2022;Satisfatório;limpeza do quarto e equipe gentil;acomodação bastante antiga, não valeu o quanto paguei, café da manhã “ok”. cama e travesseiros desconfortáveis;6;;;;
21 de outubro de 2022;Excepcional;Top muito chique;Praias cheia de tubarao não pode entrar na água. Mas o hotel é excelente;10;;;;
21 de outubro de 2022;Não recomendo, péssima experiência!;Vista pro Mar, só.;Do geral em si, pois tem instalações antigas, coisas quebradas e não consertadas.;;;;;
Há uma obra no local e depois as 18h continuou e os funcionários informaram que não tinha; mas gravei e mostrei e não disseram nada;" graças a Deus que fiquei somente 2 dias.""";2;;;;;
16 de outubro de 2022;Excepcional;Super bem localizado, funcionários atenciosos, quarto confortável, hotel com boa estrutura.;Gostei de tudo;10;;;;
15 de outubro de 2022;Meia boca;Chuveiro bom, apesar de torto e jogar água de forma estranha;Quase tudo, a começar por cobrar o empréstimo de colher. Tudo é cobrado.;3;;;;
15 de outubro de 2022;Media;O café da manhã e totalmente satisfatório, inclusive a equipe de colaboradores;A recepção não é pro ativa, desatenciosos;6;;;;
14 de outubro de 2022;Excepcional;Atendimento e disponibilidade dos funcionários.;Hotel antigo, precisando de reformas, mas com bom custo benefício.;10;;;;
13 de outubro de 2022;Aceitável;;Colchao muito ruim, não consegui dormir durante a estadia. O chuveiro do quarto deixa muito a desejar.;5;;;;
12 de outubro de 2022;Excepcional;Confesso que fiquei com receio após ler alguns comentários. Chegando lá a experiência foi completamente diferente, amei tudo! Café da manhã muito saboroso, limpeza do quarto foi feita todos os dias, os dois elevadores estavam funcionando. Adoramos tudo!!;;10;;;;
10 de outubro de 2022;Hotel bem localizado, mas que precisa melhorar estrutura e café da manhã;Localização.;Café da manhã sem variedade e qualidade. O espaço do restaurante muito pequeno e confuso. Academia melhor informar que não possui. Quartos com estrutura antiga e escuro.;5;;;;
10 de outubro de 2022;Decepcionante;Localização;Quarto ruim com banheiro péssimo;4;;;;
8 de outubro de 2022;Excepcional;Instalações.;;;;;;
Localização ;;;;;;;;
"Atendimento.""";;10;;;;;;
7 de outubro de 2022;Péssimo;Localização;Chegamos tarde, mais de meia noite casada, tomei banho e fui me deitar, notei que não havia cobertor, então fui ligar na recepção pra pedir, o telefone não funcionava, estava cansada resolvi dormir assim mesmo. No outro dia desci para tomar o café da manhã o leite estava com gosto de queimado. Deus do céu que dia.;1;;;;
7 de outubro de 2022;Boa localização, mas infraestrutura antiga;Localização muita boa e funcionários atenciosos.;Parece que parou no tempo, é um hotel relativamente antigo. Faltam coisas que hoje qualquer hotel simples possui, como acesso a Netflix, ou até mesmo tomada próximo a cama. ;;;;;
O quarto estava com as paredes sujas do tempo; lençóis manchados;" a janela fazia muito barulho com o vento e estava presa com um pedaço de guardanapo para amenizar. O café também deixou a desejar.""";5;;;;;
6 de outubro de 2022;Excepcional;Localização ótima e café da manhã muito bom também. Quarto amplo, confortável, e nada a reclamar.;;10;;;;
5 de outubro de 2022;Excepcional;Localização, atendimento, comodidade e cafe sao perfeitos;;10;;;;
2 de outubro de 2022;Atendeu nossa necessidade e o custo-benefício estava dentro das expectativas.;Localização do hotel muito boa e a equipe de funcionários muito atenciosa e dedicada .;;;;;;
Café da manhã muito bom e variado também. Atendeu bem nossa expectativa. ;;;;;;;;
;;;;;;;;
"Feirinha noturna da Boa Viagem continua muito boa e super vale a pena frequentá-la.""";O sinal da TV muito ruim ( tempo inteiro).;;;;;;;
O quarto não disponibilizou travesseiros extras nem colcha. Precisamos pedir .;;;;;;;;
"Fomos atendidos com cordialidade e ficamos agradecidos.""";5;;;;;;;
2 de outubro de 2022;Relação custo/benefício desproporcional;Da receptividade do funcionário Fábio e do taxista/guia Evandro, localizado no hotel.;Da falta de receptividade e despreparo com situações adversas da funcionária Michele. Entendo que no momento do meu check in, ela estava sozinha e atendendo outros hóspedes, mas não a apressei e esperei pacientemente a minha vez. Quando ela me atendeu, a senti nervosa, afobada em falar ao invés de ouvir, tanto que precisei falar 2 vezes o meu CEP porque ela não encontrou no sistema, até ela perceber que tinha escutado ou digitado errado. Por fim, ao pagar a estadia total naquele momento, não sei o que aconteceu, que ela não deu baixa do pagamento no sistema, e no dia seguinte ela ligou para o meu quarto perguntando se eu ainda tinha o comprovante de pagamento e se poderia levar a recepção para que ela pudesse dar baixa. Sorte que eu tinha guardado, mas se não tivesse o que teria acontecido? Enfim, acredito que a funcionária pode melhorar, até porque depois desse episódio ela se mostrou mais calma e receptiva com 2 solicitações minha: de limpeza do quarto e restabelecimento do sinal da televisão. E não tirando a responsabilidade da gestão do hotel por deixar só um funcionário na recepção em certo horário.;;;;;
Outro fator negativo do hotel;" é falta de vazão de água nas descargas dos vasos sanitários do quarto e do banheiro da piscina.""";6;;;;;;
27 de setembro de 2022;Toppp;Tudo muito bom;;;;;;
"Voltarei com certeza""";;10;;;;;;
26 de setembro de 2022;Satisfatório;Localização excelente. Funcionarios da recepção muito pro ativos. Quartos e instalações OK.;Atendimento do restaurante muito limitado (sem estrutura para crianças).;;;;;
Quarto sem interfone e; mesmo avisando;" nao houve solução.""";6;;;;;
26 de setembro de 2022;Maravilhoso.;A vista do mar de boa viagem;Dos bolsonaristas mau educados ( hóspedes).;10;;;;
20 de setembro de 2022;Ótimo, recomendo!;Bem localizado, beira mar, café da manhã com uma boa variedade, quarto amplo, cama confortável, funcionários simpáticos e prestativos!;;10;;;;
19 de setembro de 2022;Não foi um bom custo-benefício para nós...;Café da manhã bom. Localização do hotel é de frente para o mar.;Na reserva feita no booking, pedi um quarto com vista para o mar, mas os reservados pela plataforma são do tipo standard sem vista para o mar.;;;;;
Informamos que estaríamos em três (dois adultos e uma criança de 5 anos). Mesmo assim; nos deram um quarto com uma cama de casal; porém;" desconfio que seja até uma cama menor que a de casal. Ar condicionado muito barulhento. Estacionamento é cobrado à parte e a água da piscina é muito fria.""";4;;;;
14 de setembro de 2022;Não recomendo!;Localização ótima, vista linda da piscina. Camareira cuidadosa deixando tudo organizado da melhor forma possível;Nos decepcionamos muito com a hospedagem por não atender nossa solicitação para ver o ralo do chuveiro que estava entupido. O chuveiro precisava ser desligado com frequência para não vazar água por todo banheiro, além de mudar a temperatura sem termos mexido em nada. Saia do hiper quente para o hiper gelado sem torcarmos no chuveiro. Ar condicionado pingando a noite toda, tivemos que usar as toalhas e o lixeiro para aparar a água. Não fizeram nada para melhorar a nossa instalação. Apenas informaram que não poderiam fazer nada no momento e que iriam ver no dia seguinte, passou o dia seguinte e nada mudou! O hotel tinha tudo para ser uma hospedagem tranquila e agradável, mas não foi! Não recomendo.;4;;;;
12 de setembro de 2022;O custo benefício vale a pena, pois o hotel não tem luxo mas é bem localizado e limpo.;A localização é maravilhosa.;A questão das janelas não terem vista nenhuma pois é muito próximo do prédio ao lado. E as cortinas, acho q precisam de uma renovada.;6;;;;
8 de setembro de 2022;Excepcional;Bom;;10;;;;
8 de setembro de 2022;Pouco respeito com os hospedes;Localizacao;Quartos velhos, janelas barulhentas, café da manhã de pessima qualidade. O hotel estava em reforma com muito barulho e nao fui avisada disso no momento da reserva. Por esse motivo, fiz checkout antecipado, solicitei reembolso e nao tive resposta formal do hotel até entao....me sinto lesada e enganada.;3;;;;
4 de setembro de 2022;Excepcional;Muito bom, Nao tive reclamacao ainda passei do horario e não cobraram nada kkkk;;10;;;;
1º de setembro de 2022;Bom;Localização;Cheiro muito forte de cloro;10;;;;
31 de agosto de 2022;Excepcional;Eu adorei tudo, voltarei a me hospedar novamente com certeza, ah e consertaram o elevador.;Pouca variedade no cardápio, e super caro a alimentação do hotel para o que é apresentado, comi fora todos os dias ou pedi comida via delivery;10;;;;
31 de agosto de 2022;Excelente estadia.;localização e café da manhã excelentes!;existe turismo sexual na região.;10;;;;
30 de agosto de 2022;MUITO BOA.;;Os 2 aptos que alugamos eram os melhore, de frente para o mar, mas cheios de problemas: CHUVEIRO ELÉTRICO COM PÉSSIMO AQUECIMENTO (MEU NETO TEVE QUE TOMAR BANHO QUASE FRIO), VAZAMENTO NA DUCHA ÍNTIMA ALAGANDO O BANHEIRO, INTERFONE QUE NÃO LIGAVA PARA A PORTARIA, PIA DO BANHEIRO ENTUPIDA.;;;;;
;;;;;;;;
MAS;DEPOIS DA RECLAMAÇÃO; O GERENTE GERAL DA REDE; ELIAS NOS RECEBEU COM MUITA EDUCAÇÃO;" PEDIU DESCULPAS E NOS CONCEDEU UM DESCONTO NAS DIÁRIAS POR NÃO HAVER TEMPO HÁBIL PARA SANAR AESSAS DEFICIÊNCIAS ENCONTRADAS. o PESSOAL DO HOTEL FOI NOTA 10. EXCELENTE""";10;;;
29 de agosto de 2022;Satisfatório;Localização, disposição dos manobristas (educados e dispostos a ajudar);Demora no balcão de check-in;6;;;;
25 de agosto de 2022;Excepcional;Localização;;10;;;;
15 de agosto de 2022;Ótima;Limpeza e disposição dos móveis no quarto;Cama afunda no meio!;10;;;;
9 de agosto de 2022;pessima, deu alergia por causa acaro,;localizacao;quarto, mofo, muito acaro;2;;;;
9 de agosto de 2022;Satisfatório;O check in foi fácil e rápido e o staff é ótimo. Comida do restaurante é gostosa.;Café da manhã super lotado, o hotel não é novo e o quarto cheirava como se estivesse fechado há muito tempo. Box do banheiro para tomar banho super pequeno. Toalhas antigas.;6;;;;
4 de agosto de 2022;Foi razoável;Da localização;Da falta de elevador, do café da manhã;6;;;;
1º de agosto de 2022;Melhores férias;Da vista para o mar;Elevador com problema;10;;;;
31 de julho de 2022;vale o custo;localidade e preço;cama do quarto o colchão tão velho que tinha um buraco no meio;6;;;;
31 de julho de 2022;Aceitável;;Chuveiro do banheiro, janelas do quarto.;5;;;;
29 de julho de 2022;Pior experiência;Parcialmente do cafe da manhã;O Hotel é péssimo. Pior chuveiro que já usei. Apenas 1 elevador e sempre lotado, demorando 20min para chegar, comida do restaurante horrivel. Serviram parmegiana com catchup. O hotel é velho e remendado. A chave da porta pára de funcionar o tempo todo. O elevador é minusculo e só tinha 1 para o hotel todo. O chuveiro esta todo entupido e a pressão q sai em poucos furos te machuca. A Internet nao funciona. A localização é ruim em relação ao centro ou centro histórico, com poucas opções de restaurantes. A praia nao é apropriada a banho, devido ataque de tubarao.;1;;;;
25 de julho de 2022;Excepcional;Gostei de absolutamente tudo.;;;;;;
"Espaço e serviços excepcionais.""";Gostei de tudo.;10;;;;;;
22 de julho de 2022;Tudo muito bom, parabéns a todos vcs;Fantástico.;;;;;;
Café excelente; alimentação ótima; tudo perfeito;" parabéns a equipe toda 👏👏👏👏👊""";Falta barzinhos próximo;10;;;
21 de julho de 2022;satisfatoria;localização;apenas 1 elevador, demorava pra chegar;6;;;;
21 de julho de 2022;Péssimo;A localização e ótima bem na frente da praia de Boa Viagem. Funcionários prestativos tbm.;Chuveiro frio e café da manhã horrível.;1;;;;
20 de julho de 2022;Custo Benefício nota mil;localização;sala de estar muito apertada para o sofá cama;10;;;;
19 de julho de 2022;Eu não gostei de passar 4 dias reclamando de chuveiro.;O café da manhã é bom. A localização é muito boa.;Chegamos com muita chuva. Na hora do banho descobrimos que o chuveiro estava com defeito. Hora esquentava demais hora gelava. Nisso quase queimei meu braço. Solicitamos conserto. Dois dias tomando banho frio. 😠 No outro dia voltando do passeio, o chuveiro ainda estava com problema. O professional informou que o serviço não foi feito pq nós teríamos saido e não deixamos autorização para ele entrar no quarto. Mas quando descemos para falar com alguém da recepção, o profissional já abriu o quarto sem autorização e já estava trocando a peça do chuveiro. Agradecemos e fui tomar banho. O chuveiro saia água por cima e por todos os lados. Decidi deixar prá lá e contar esse causo🤪 aqui pra vcs. Foi realmente muito chato😒;5;;;;
18 de julho de 2022;Satisfatório;A localização do hotel é muito boa.;O hotel é velho, sem manutenção nem reformas. A garagem é muito apertada, não deveria ser paga. O restaurante muito pequeno. No meu entender o hotel não merece nem três estrelas, quanto mais quatro.;6;;;;
15 de julho de 2022;Excepcional;O hotel é excelente! Atendimento, custo benefício, infraestrutura e localização. Gostamos muito e com certeza quando voltarmos a Recife ficaremos no Euro Suite novamente.;;10;;;;
15 de julho de 2022;Otima;De tudo do local da localização;SO cafe da manha que e bem fraquinho pela estrutura do hotel;10;;;;
14 de julho de 2022;Otima;Café e localização ótimos;;10;;;;
12 de julho de 2022;Excelente;Atendimento dos funcionários muito prestativos e educados. Excelente café da manhã. Localização perfeita.;Falta de educação de alguns hóspedes com os funcionários, mesmo estes sendo altamente atenciosos com todos. Vi e ouvi a falta de educação de hóspedes.;10;;;;
11 de julho de 2022;Aceitável;Atendimento dos funcionários;;5;;;;
11 de julho de 2022;Excepcional;Segurança, limpeza, atendimento, localização;Nada. Tudo muito bom;10;;;;
7 de julho de 2022;Só a localização vale a pena.;A localização.;Café muito fraco. Quarto muito apertado. Banheiro mínimo. Não funciona o restaurante nem o atendimento aos quartos , após 22h.;6;;;;
5 de julho de 2022;Terrivel;Nada;Quartos antigos com;;;;;
Cheiro de mofo limpeza ;;;;;;;;
Limpeza pessima;;;;;;;;
Colchoes de baixa qualidade;;;;;;;;
"Travesseiros pessimos""";1;;;;;;;
4 de julho de 2022;ok;localização;conforto e cafe da manhã;5;;;;
1º de julho de 2022;Excepcional;atendimento,localização,café da manhã…;;10;;;;
28 de junho de 2022;Excepcional;Da suíte.;;10;;;;
26 de junho de 2022;pela minha experiência com eles não recomendo.;localização;cama muito ruim,ralo do box banheiro entupido.;4;;;;
26 de junho de 2022;Decepcionante;Na verdade só gostei dos funcionários são fixes;Do quarto muito ruim;4;;;;
23 de junho de 2022;Aceitável;Localização;"Velho, antigo, cheiro forte de mofo nos corredores e de ""guardado"" nos quartos. Banheiro minúsculo, Internet lenta e estacionamento cobrado";5;;;;
23 de junho de 2022;Aceitável;Localização;"Velho, antigo, cheiro forte de mofo nos corredores e de ""guardado"" nos quartos. Banheiro minúsculo, Internet lenta, cobram estacionamento...";5;;;;
22 de junho de 2022;Aceitável;A vista é maravilhosa;Com a chuva teve infiltração no quarto, alagou, a limpeza deixou a desejar também.;5;;;;
21 de junho de 2022;Instalações antigas, renovação urgente.;Funcionários atenciosos e boa localização.;Cheiro de esgoto no quarto, ralo do chuveiro parcialmente entupido, exaustor do banheiro não funcionava, colchão muito velho e deformado. Cafe da manhã pouco variado e sem reposição. Chão do quarto pegajoso.;6;;;;
21 de junho de 2022;Excepcional;Funcionários extremamente educados, hotel como um todo muito agradável.;;10;;;;
20 de junho de 2022;Excelente acomodação;Da vista do mar e da excelente acomodação. Café da manhã muito satisfatório.;;10;;;;
19 de junho de 2022;Aceitável;Localização;Não me entregaram o quarto que eu havia reservado. Tive que permanecer pois já não tinha mais tempo hábil para a mudança de Hotel.;5;;;;
14 de junho de 2022;Não indico a ninguém este hotel;somente do café da manhã;Ao chegar no quarto a chave não pegava por 3 vezes, e ficamos aguardando do lado de fora do apartamento, onde era pra ter oferecido outro quarto para se acomodar, depois de uns 40 minutos mandou um funcionário para ver porque a chave não abria a porta que a gente tentou por 3 vezes indo a recepção. Depois de 40 minutos o funcionário abriu a porta para entrar e ainda foi fazer a mudança da pilha da porta lá do apartamento que ficamos , pois foi muito constrangedor para nós, inclusive falei que queria outro quarto para o funcionário e ele falou que iria trocar a pilha, mais a nossa obrigação não era esperar o funcionário consertar, era eles nos acomodar e , nos colocar em outro lugar que não foi feito. então a minha primeira impressão não foi satisfatório.;4;;;;
13 de junho de 2022;Local excelente, mas péssimo hotel;O café é razoável.;Do tamanho do quarto;;;;;
12 de junho de 2022;Decepcionante;Já tinha me hospedado nesse hotel, sempre feliz pelo que era oferecido, mas dessa vez foi um horror. Me colocaram num quarto muito pequeno, banheiro ruim e cheiro ruim também.;Quarto. Me colocaram num quarto minúsculo. Me senti muito chateado.;4;;;;
12 de junho de 2022;Péssimo;;Reservei pelo Booking,chegando no Hotel não pude fazer o check-in,o recepcionista altamente deselegante ,sarcástico,arrogante...;1;;;;
11 de junho de 2022;Aceitável;Localização;Instalações antigas , chuveiro , porta de entrada com defeito;5;;;;
8 de junho de 2022;Excepcional;Da suite e do café da manhã;Não se aplica;10;;;;
7 de junho de 2022;Boa experiência com conforto.;A vista do quarto é realmente incrível! Apesar do aspecto um pouco antigo, as instalações do quarto foram muito bem projetadas. Cama confortável, bom custo benefício da comida do restaurante e os alimentos disponibilizados no quarto facilitaram muito. Legal também ter happy hour.;Achei perigosa a divisão de altura da piscina ser junto as escadas para descer. Tive uma breve sensação de afogamento. O Wi-Fi também não funcionou para trabalho na área projetada para isso. Tive que trabalhar em uma mesa menor e sem a vista.;10;;;;
5 de junho de 2022;Decepcionante;Ótima localização na praia de Boa Viagem;Quarto muito pequeno, mesmo pra uma pessoa, instalações antigas, chuveiro ainda do tipo elétrico. Tive que pedir pra mudar de quarto, pois o que me deram estava com o chão todo sujo com areia de praia, e não foram capaz de irem até no quarto levar as chaves do outro quarto, tive que descer até a recepção para pegar.;4;;;;
30 de maio de 2022;Baixar a categoria para 02 estrelas. Hospedagem péssima.;A localização;Cama velha com colchão arreado, quarto pequeno, tampa do vaso solta, cortina caindo chuveiro eletrico pessimo;3;;;;
28 de maio de 2022;Pessima;De nada. Só tenho que falar todas as coisas negativas;De tudo.nada presta.;;;;;
Os recepcionista são despreparados e só pq reclamei pq as pessoas estavam passando na minha frente; colocaram toda minha família em 3 apartamentos péssimos de propósito.;;;;;;;
O número dos ap. foram o 506; 606 e o 906.;;;;;;;
Sabem pq ?;;;;;;;;
Pq nesses 3 apartamentos era o de fazia mais barulho pelo motivo de estarem em manutenção o elevador.;;;;;;;;
Pergunto a vcs: não é muita coincidência todos os apartamentos serem e final 06 ;" ontem ficava coloca no elevador que estava em serviço e que não paravam de fazer barulho?""";1;;;;;;
27 de maio de 2022;Avaliação;Localização;Eu precisava trabalhar e a internet não funcionava direito, travava toda hora. Mesmo depois de reclamar, não conseguiram resolver o problema. ;;;;;
A TV estava num local ruim; em cima de um móvel no canto. O ideal era q estivesse na parede; pois dependendo da posição q uma pessoa deitava; a outra não conseguia ver. ;;;;;
Havia vazamentos de água na descarga; no chuveiro e na torneira do banheiro.;;;;;;;
Um rapaz da manutenção esteve lá; mexeu na descarga; mas logo depois voltou a vazar.;;;;;;
Sugeri que trocassem as buchinhas das torneiras. Como a utilização é grande;" precisam de trocas periódicas.""";6;;;;;;
26 de maio de 2022;Aceitável;Ótima Localização e o café da manhã, foram as únicas coisas que me agradaram.;Tinha um cheiro muito forte de produto de limpeza no quarto quando cheguei, isso logo atacou a alergia e tive uma péssima noite de sono. Limpeza do chão, com cabelos provavelmente do hospede anterior e equipamentos antigos.A garagem ruim, sem sinalização e muito suja, nao tem informativo que nao a passagem para dentro do prédio internamente, dia chuvoso e procurando a escada para acessar o prédio mas nao ha.;5;;;;
25 de maio de 2022;um desastre;localização na praia da boa viagem em frente à praia;prédio e apartamentos antigos necessitando de uma boa reforma, paredes manchadas e descascadas pela infiltração. chegamos em uma noite de chuva com infiltração na parede do corredor, o quarto com infiltração ainda maior parecendo uma lagoa de tanta água no chão. solicitado uma troca de quarto o atendente desdenhou e somente disse não ter outro quarto, ou seria esse quarto alagado ou eu poderia trocar hotel se eu quisesse. isso as três da manhã chegando em voo noturno duas da manhã a recife. não sairia às três da manhã a procura de outro hotel com uma criança de 5 anos dormindo no colo em meio a chuvarada, sem cabimento. sem opção fiquei no quarto, enxugaram o chão com toalhas e deixaram toalhas encostadas na parede para não escorrer mais água (toalhas que provavelmente serão utilizadas pelos hóspedes posteriormente). no quarto além da lagoa, encontrei banheiro todo encardido, louças da pia e vaso sanitário encardidos, toalhas com manchas, água do chuveiro não aquecia adequadamente além de tudo banho morno. na manhã seguinte sai do hotel. além disso posso falar do café da manhã fraco poucas opções de alimentos, pães, frutas, sucos. reposição lenta sem limpeza adequada das mesas.;2;;;;
22 de maio de 2022;Excepcional;Presteza da equipe em atender as necessidades que apareceram. As informações do site condizem com a realidade do local.;;10;;;;
20 de maio de 2022;Ok;A variedade do café da manhã e a localização.;A fechadura eletrônica do nosso quarto só funcionava depois de várias tentativas, o box do banheiro não ficava aberta e se deixassemos ela batia com força sozinha, as tomadas perto da cama são do padrão antigo e achei a piscina muito pequena pro padrão do hotel.;5;;;;
20 de maio de 2022;Críticas e elogio;Fomos muito bem atendidos pelo garçom da noite, foi muito prestativos;Gostei da localização.;;;;;
Do restante tenho algumas críticas a fazer.;;;;;;;;
Os funcionários apesar de serem educados; não falam a mesma língua.;;;;;;;
O restaurante oferece um café da manhã muito bom e variado; porém o hotel faz uma propaganda de refeições que deixa a desejar.;;;;;;;
O jantar para quem se interessa; inicia as 18:00; porém os pratos não ficam prontos e a cada item solicitado; há uma espera absurda de preparação das refeições.;;;;;
Outra coisa que notamos foi que a área da piscina não é limpa com frequência; sendo que tinha uma lixeira muito lotada e ficou assim por 3 dias seguidos. O banheiro do quarto é muito mal distribuído e o box é menor que de um box de navio para quem já conhece. Não dá nem para se mexer dentro do box. O quarto era triplo;" não sei dizer se pá outros apartamentos eram iguais.""";4;;;;;
18 de maio de 2022;Não voltaria;O banheiro era ok, pequeno, mas chuveiro muito bom, porém não tinha luz dentro do box. Localização tb boa.;Um dos elevadores quebrado, formava fila pra subir. Aí todo mundo se acumulava pra entrar no elevador. Quarto velho, colchão péssimo, som da tv horrível, cortinas velhas, precisávamos de uns pratos para cantar parabéns e servir um pedaço de bolo, queriam nos cobrar 5 reais por prato, estávamos hospedados lá, achei um absurdo! Café da manhã fraquíssimo. Péssimo custo-beneficio. Atendimento ruim.;2;;;;
18 de maio de 2022;Excepcional;Próximo da praia , da piscina e do cafe da manhã!!;Tudo muito bom!!;10;;;;
16 de maio de 2022;Excepcional;Café da manhã maravilhoso, atendimento dos funcionários, localização boa, quartos confortáveis...rķ;Só não gostei do elevador, que só funcionava um e o fluxo de pessoas era alto, esperavamos muito.;10;;;;
16 de maio de 2022;Péssimo;Péssimo.;Tudo;1;;;;
15 de maio de 2022;agradável, porém seria possível melhorias;localização , vista;limpeza,;10;;;;
15 de maio de 2022;Excepcional;Gostaria de dar Parabéns ao funcionário Ricardo da recepção, muito atencioso! Tive uma ótima estadia.;;10;;;;
13 de maio de 2022;onde eu vou é esqueço meus problemas, pós tudo ao redor é agradável.;o atendimento é excelente, todos os funcionários muito atenciosos, tanto na entrada até mesmo na saída.;limpeza e organização;10;;;;
