data_avaliacao;titulo;comentario_positivo;comentario_negativo;nota;;;;;;;
12 de fevereiro de 2023;Excepcional;Localização;Camas um pouco dura;10;;;;;;;
11 de fevereiro de 2023;Excepcional;• Atendimento dos funcionários (recepcionistas);;;;;;;;;
• Localização;;;;;;;;;;;
• Conforto;;;;;;;;;;;
• Segurança;;;;;;;;;;;
"• Ambiente limpo e agradável.""";;10;;;;;;;;;
11 de fevereiro de 2023;MARAVILHOSA;banheiro, camas, piso, lençóis.;não disponibiza edredons;10;;;;;;;
9 de fevereiro de 2023;Satisfatório;Hotel simples somente para pernoite.;colocar um box no banheiro na hora do banheiro chuveiro molha o banheiro todo.;6;;;;;;;
7 de fevereiro de 2023;Excepcional;Quartos super limpos e cheirosos.;;10;;;;;;;
6 de fevereiro de 2023;Satisfação;Ambiente super confortável, organizado e com ótima localização. Funcionários super educados e prestativos. Café da manhã excelente e super saboroso. Recomendo muito❤️;;10;;;;;;;
5 de fevereiro de 2023;Aceitável;Limpeza e equipe de recepção.;Quarto muito pequeno;;;;;;;;
5 de fevereiro de 2023;Hospedagem muito agradável.;Hotel bem localizado (próximo à praia) e muito limpo. Café da manhã simples, mas muito bom. O atendimento dos(as) funcionários(as) foi excelente, todos(as) muito cordiais.;;10;;;;;;;
2 de fevereiro de 2023;Satisfatório;Localização;Café da manhã;6;;;;;;;
1º de fevereiro de 2023;Excepcional;Internet;;10;;;;;;;
1º de fevereiro de 2023;Má experiencia e muito tempo perdido para resolver o problema;cafe da manha, bom;o quarto que me queriam dar não tem janela apenas um postigo com uma parede feia a meio metro de distancia;;;;;;;;
o hotel tem a maior parte da rede de incendio desativada e/ ou deinstada; no meu quarto nem detetores tem (fui tecnico de segurança);;;;;;;;;;
o hotel não pode trabalhar assim; é proibido e perigoso;;;;;;;;;;
a empregada que me recebeu; ficou agressiva quando lhe disse tudo o que atrás afirmei.;;;;;;;;;;
"Vou participar ás autoridades locais""";1;;;;;;;;;;
30 de janeiro de 2023;Voltaremos em breve🙏🏻🙏🏻🙏🏻;Tudo maravilhoso, funcionários educadíssimos, limpeza espetacular, localização ótima, café muito bom, realmente não tenho nenhuma reclamação, fiquei com minha família e gostamos muito.;na realidade é só uma dica, o ar do quarto 224 precisa de uma manutenção, pois como o quarto é grande, ele demora um pouco para esfriar, provavelmente uma carga de gás resolveria, mas não atrapalha a qualidade do hotel.;10;;;;;;;
27 de janeiro de 2023;Vale a pena;Ótima localização, bem próximo a praia.;Nada;10;;;;;;;
24 de janeiro de 2023;Decepcionante;funcionários;do resto;4;;;;;;;
24 de janeiro de 2023;Muito boa;Ambiente tranquilo;Que não avisam o andar pessoa fica no anuncio;10;;;;;;;
22 de janeiro de 2023;Bom custo-benefício, mas não voltaria a me hospedar.;Equipe atenciosa e quarto com bom tamanho e cama confortável. Café da manhã satisfatório;Acústica muito ruim. Vizinho do quarto ao lado estava dando banho em uma criança após meia-noite e o barulho ecoava em todo o quarto.;6;;;;;;;
22 de janeiro de 2023;Excelente custo benefício;localização muito boa, quartos amplos, funcionários dispostos a lhe auxiliar.;;10;;;;;;;
20 de janeiro de 2023;Apenas razoável.;O quarto é bacana, com tudo novo. Chuveiro bom, cama boa, acomodações no quarto boas. Ponto positivo.;Café fraco, estacionamento ruim, atendimento apenas razoável. Não retornaria.;5;;;;;;;
19 de janeiro de 2023;Muito ruim;A Localização é ótima;A cama super dura, banheiro estava bem sujo e sempre cheirava mal, o hotel não tem secador e também não tinha uma mantinha pra dormir a noite;2;;;;;;;
19 de janeiro de 2023;Hotel uzi mar TOP!;Bom atendimento, limpeza, café da manhã, acomodação! Tudo ok!;Sem reclamações!;10;;;;;;;
15 de janeiro de 2023;Quarto minúsculo;;O quarto tem pouco espaço para locomoção de duas pessoas, o espaço do corredor é estreito. Tem uma mesa, porém, fica no meio do corredor citado apenas com uma cadeira. O ar-condicionado funciona bem, a TV também funciona de forma regular, porém só tem uma tomada disponível para uso, a outra fica no banheiro, a que tinha do lado da cama estava quebrada. ;;;;;;;;
;;;;;;;;;;;
"O café da manhã é regular com um tempo amplo para atendimento.""";6;;;;;;;;;;
14 de janeiro de 2023;Poderia ser melhor..;localização, tem restaurantes e farmácias por perto. A praia fica pertinho também.;;;;;;;;;
os funcionários são simpáticos e educados.;;;;;;;;;;;
"o café da manhã tem uns bolos muito bons nota 10.""";Não dispor de coberta nas camas. ;;;;;;;;;;
Havia um cheiro forte no quarto; mesmo que tinha sido limpado a pouco tempo.;;;;;;;;;;
a internet não funciona principalmente a noite; quem vai a trabalho pena pra conseguir fazer algo que precise na internet.;;;;;;;;;;
Tampa do vaso sanitário estava quebrada;" e seria uma boa colocar box no banheiro pq uma parte fica aberta e molha tudo pra fora.""";5;;;;;;;;;
13 de janeiro de 2023;Excepcional;Quarto ótimo, café da manhã muito bom, tudo bem organizado e limpo...;;10;;;;;;;
12 de janeiro de 2023;Decepcionante;Localização boa e funcionários atenciosos;Peguei o quarto simples, mas o simples é quase precário. Tanto que passei uma noite e cancelei a outra diária. ;;;;;;;;
Quarto mofado; sem lugar pra pendurar toalha; box sem proteção e molha o banheiro; cama absurdamente dura. ;;;;;;;;
"Fora que eu cheguei não tinha toalha para os dois e o chão tava molhado.""";4;;;;;;;;;;
10 de janeiro de 2023;Localização boa.;Hotel bem localizado, uma rua antes da praia. Limpeza e instalações boas tb.;Não permitem parcelar o valor da estadia.;10;;;;;;;
10 de janeiro de 2023;Excepcional;localização, café da manhã, funcionários atenciosos e prestativos.;sugestões: televisão não funcionava alguns canais (travava bastante e não reproduzia) e não é possível acessar aplicativos como YouTube, Netflix… os lençóis cumpriram com minha necessidade, mas são bastante finos.;10;;;;;;;
9 de janeiro de 2023;Muito legal!;Localização, ambiente e acomodação!;O quarto en si mt confortável e café da manhã!;10;;;;;;;
8 de janeiro de 2023;Excepcional;Limpeza, atendimento e organização.;Nada !;10;;;;;;;
4 de janeiro de 2023;Memoravel;Localização, equipe maravilhosa.;Não teve o que eu não gostei.;10;;;;;;;
3 de janeiro de 2023;HORRÍVEL;;Pior hotel que já me hospedei na vida, parece mais com um motel. Tudo velho, banheiro se box, vaso vazando.;1;;;;;;;
30 de dezembro de 2022;Excepcional;Hotel maravilhoso, simples e bom. Funcionário muito atenciosos.;Localização;10;;;;;;;
26 de dezembro de 2022;Recomendo o hotel ,boa localização e limpeza impecável;Limpeza,organização;;10;;;;;;;
26 de dezembro de 2022;Excelente hotel;Quarto e café da manhã;Não se aplica;10;;;;;;;
26 de dezembro de 2022;Excepcional;Quarto amplo e limpo, funcionários gentis.;Tudo está perfeito.;10;;;;;;;
26 de dezembro de 2022;Bom custo benefício;Ótima localização e bom custo benefício;O café da manhã poderia ter mais opções e o quarto com instalações melhores (cama, banheiro);6;;;;;;;
25 de dezembro de 2022;Excepcional;O hotel possui um excelente localização e um ótimo custo-benefício.;;10;;;;;;;
25 de dezembro de 2022;Muito bom custo benefício e muito bom atendimento;Do custo benefício;Nada;10;;;;;;;
24 de dezembro de 2022;Muito boa a estadia;Fomos muito bem atendidos ;;;;;;;;;
;;;;;;;;;;;
"Simples e aconchegante""";Nada;10;;;;;;;;;
22 de dezembro de 2022;Excepcional;tudo em ordem;;10;;;;;;;
20 de dezembro de 2022;Excepcional;Localização e atendimento;O horário do café. Pra quem vai fazer concurso. Fica inviável tomar café às 07h00. Se fosse a partir das 06h00 ajudaria bastante.;10;;;;;;;
19 de dezembro de 2022;Satisfatório;ok;;6;;;;;;;
19 de dezembro de 2022;Razoável.;Quarto limpo e organizado.;No quarto não há tomada perto da cama.;10;;;;;;;
14 de dezembro de 2022;Bom;Gostei da acomodação e dos funcionários.;Não gostei da gestão de não ter enderdon , já não é a primeira vez que falou isso . Que o hotel deveria ter o enderdon .;10;;;;;;;
12 de dezembro de 2022;Excepcional;Da limpeza, do atendimento e muito sossegado.;;10;;;;;;;
10 de dezembro de 2022;Excepcional;hotel bonito como os quartos tbm , que estavam limpos.;;;;;;;;;
gostei bastante.;;;;;;;;;;;
"só n sei o café dá manhã por que acordei tarde rsrs""";;10;;;;;;;;;
9 de dezembro de 2022;Aceitável;;Instalações.;5;;;;;;;
5 de dezembro de 2022;Decepcionante;O chuveiro era forte e com jeitinho da pra dosar a temperatura da água.;A cama é extremamente desconfortável, é só um colchão fino em cima de concreto, acordei com dor nas costas todos os dias além de dormir super mal.;4;;;;;;;
2 de dezembro de 2022;Muito bom, mas o café da manhã poderia melhorar;Localização e valor;Café da manhã: para beber só tinha café, leite e água. Nem um suco para as pessoas que não tomam café.;;;;;;;;
"No quarto que ficamos não tem tomada perto da cama.""";10;;;;;;;;;;
24 de novembro de 2022;Maravilhosa.;A cordialidade de atendimento e o café feito com muito carinho pelas funcionárias do hotel.;Nada a observar;10;;;;;;;
22 de novembro de 2022;razoavel;do atendimento e do café da manha;do quarto como um todo, internet ruim, tv a cabo que não funciona e pouca tomada no quarto.;5;;;;;;;
21 de novembro de 2022;Excepcional;Equipe muito atenciosa. Bom atendimento. Café da manhã muito bom !;;10;;;;;;;
21 de novembro de 2022;Super recomendo. Me hosperadaria novamente, sem dúvida;ótima localização, perto da Praia da Pina com excelentes restaurantes, supermercado e farmácia.;;10;;;;;;;
20 de novembro de 2022;Excelente custo benefício;Quarto inteiro, ótimo chuveiro, colchão excelente.;A única coisa que poderia melhorar é o café da manhã, mas está de acordo com o valor cobrado na diária.;10;;;;;;;
19 de novembro de 2022;Excepcional;local;nada;10;;;;;;;
19 de novembro de 2022;Hotel nota 10 dentro do perfil ofertado;Hotel nota 10 dentro do perfil que foi ofertado. Recepção, acomodação, café da manhã, cordialidade de toda equipe, tudo muito organizado.;;;;;;;;;
;;;;;;;;;;;
Recepção cordial e disponível para atender todas as dúvidas.;;;;;;;;;;;
;;;;;;;;;;;
Quarto limpo; ar condicionado funcionando; TV; frigobar; banheiro limpo e com chuveiro quente e frio.;;;;;;;
;;;;;;;;;;;
Café da manhã muito bem servido dentro do padrão do hotel com frutas; culinária nordestina; sucos; bolos bem servidos. Detalhe: chegamos para o café da manhã faltando pouco tempo pra encerrar o horário. Funcionárias muito atenciosas.;;;;;;;;
;;;;;;;;;;;
" Dentro do padrão do hotel está de parabéns!""";;10;;;;;;;;;
19 de novembro de 2022;Ruim;;O quarto com cheiro de bolor;3;;;;;;;
17 de novembro de 2022;Péssimo;;A cama é pequena e dura, só havia apenas uma toalha no quarto duplo, escuta todos os barulhos do quarto ao lado e corredor. Café da Manhã muito fraco, sem opções e variedades.;5;;;;;;;
17 de novembro de 2022;Maravilhosa.;Excelente localização, ótimo ar condicionado, excelente colchão, roupas de cama e banho limpíssimas... excelente custo benefício. Recomendo e voltarei mais vezes.;Tudo foi ótimo.;10;;;;;;;
16 de novembro de 2022;Não será uma opção para uma próxima viagem.;Nada;Da localização, café da manhã, quarto, canais de TV, internet.;2;;;;;;;
16 de novembro de 2022;Toop, muito massa, show;Atendimento, quarto, e lazer;Nada kkk;10;;;;;;;
16 de novembro de 2022;Ainda com essa falha mesmos assim e nota10,mais o proprietário comprei os edredoms.;Gostei de tudo ,principalmente do atendimento dos funcionários .;Só não gostou um pouco porque não tem edredom Só isso.;10;;;;;;;
15 de novembro de 2022;Justa;a localização é perfeita, várias compridas perto ao hotel, padaria, farmácia e claro a praia;o hotel não tem uma vista tão boa.;10;;;;;;;
13 de novembro de 2022;decepcionante;atendimento da primeira atendendo e localização;a estrutura, cama dura, o chão não estava seco e não secava, não tinha edredom, banheiro molhava inteiro no banho por existir box. Café da manhã acabava às 09:30, às 09h já tinha algumas coisas que não tinham mais e não iam ser repostas. Wi-Fi péssimo simplesmente não pegava no quarto. Banheiro muito simples o espelho era horrível, pia velha e iluminação péssima.;2;;;;;;;
9 de novembro de 2022;Excepcional;A atendente do turno da manhã é mto simpática, me atendeu mtooo bem!;;10;;;;;;;
7 de novembro de 2022;Excepcional;Gostei da hospedagem em tds os pontos. Perto da praia, shopping, feirinha de Boa viagem. Td muito bom.;;10;;;;;;;
4 de novembro de 2022;Excelente!;Reservei para minha avó e duas amigas e elas amaram a localização, limpeza e atendimento dos funcionários!;;10;;;;;;;
2 de novembro de 2022;Excepcional;Do conforto e acochego do quarto;;10;;;;;;;
2 de novembro de 2022;prisão;Da localização;O quarto fechado sem visualizar o externo. parece uma sela de prisão. Tinha quartos melhores, pedi na portaria mas não fui atendido.;5;;;;;;;
31 de outubro de 2022;Excepcional;Perfeito , ambiente simples porém muito bom. O ar condicionado muito gelado , limpeza boa. E atendimento massa. Café da manhã simples , mas foi muito bom. Indico e volto. Localização ótima numa avenida principal.;Então , demorou só um pouco pra confirmar a estadia por causa do booking , nem foi culpa deles. Só isso , de resto muito bom.;10;;;;;;;
31 de outubro de 2022;Excepcional;Localização, estrutura do quarto e presteza dos funcionários.;;10;;;;;;;
30 de outubro de 2022;Caro pelo que o hotel oferece;Chuveiro quente e ótimo. cama confortável.;Estacionamento fica na rua. Hotel não tem elevador e tive que subir malas pesadas pelas escadas.;5;;;;;;;
27 de outubro de 2022;Muito boa, voltarei;Hotel bem organizado, mesmo com uma parte em construção não incomodou em nada na estadia. Quartos limpos. Banheiro limpo. Camas arrumadas. Ar-condicionado funcionando normalmente.;O som externo. Precisaria de um isolamento. Mas nada que incomode muito. É bem tranquilo;10;;;;;;;
25 de outubro de 2022;Excepcional;localização e do custo benefício;;10;;;;;;;
25 de outubro de 2022;Excepcional;Localização e limpeza excelente, café gostoso e funcionários atenciosos, voltarei sempre.;Não tenho o que dizer, gostei de tudo.;10;;;;;;;
23 de outubro de 2022;Excepcional;ótima localização, quarto muito bom, ótimo custo benefício e principalmente o atendimento dos funcionários!;;10;;;;;;;
21 de outubro de 2022;Aceitável;a localização;O café da manhã e bem simples e no dia que estamos hospedamos estava uma bagunça , estavam recebe;5;;;;;;;
20 de outubro de 2022;Satisfatório;A localização de acordo com minhas finalidades e próxima do aeroporto.;Não gostei da cama, era dura. O lençol não combatia o frio, pois era preciso ligar o ar para dormir. Mesmo em grau biemte esfriada mito devido a pequenez do apartamento.;6;;;;;;;
19 de outubro de 2022;Excepcional;Top de mais o atendimento e espero voltar mais vezes;Gostei de tudo 😃;10;;;;;;;
18 de outubro de 2022;custo médio;funcionários;cama dura e sem cobertor;6;;;;;;;
17 de outubro de 2022;Péssima;Nada;Quarto tem mais cabelo que o tony Ramos, parece uma barbearia;1;;;;;;;
14 de outubro de 2022;Muito agradável;Atendimento muito bom;só tinha uma toalha no quarto;10;;;;;;;
12 de outubro de 2022;Ótima voltarei com certeza;Localização,limpeza,funcionários e café da manhã muito bom;;10;;;;;;;
10 de outubro de 2022;Excepcional;Muito boa a acomodação,os funcionários são bem atenciosos.;;10;;;;;;;
10 de outubro de 2022;bom bom bom;localização;atendimento;10;;;;;;;
2 de outubro de 2022;Férias familiar.;O hotel é excelente e muito confortável. Minha família gostou do local, além de ser bem localizado.;;10;;;;;;;
25 de setembro de 2022;Bom local, mas acomodação fraca.;Localização;Café da manhã muito fraco, cama e travesseiros duros, toalhas de banho e roupa de cama muito gastas, não tinha toalha de rosto e nem cobertor ou manta.;5;;;;;;;
22 de setembro de 2022;Foi uma estadia restauradora!;A batata doce, o inhame, o café com leite...gostei de tudo que provei.;Não tenho reclamação!;10;;;;;;;
21 de setembro de 2022;Excelente e com custo bom para quem precisa de preço e qualidade;Atendimento excelente dos funcionários.cafe da manhã com muitas opções e tudo fresquinho.cama confortável e chuveiro bom;Nada;10;;;;;;;
21 de setembro de 2022;Satisfatório;Atendimento;Da vista da janela. Quarto escuro;6;;;;;;;
20 de setembro de 2022;Bom custo benefício e localização privilegiada.;Ótima localização, bom custo benefício em se tratando de Recife e serviço condizente com a proposta e categoria do hotel de padrão simples. Próximo a praia, a supermercado e de locais para alimentação de todos os gostos e bolsos.;Durante minha estadia não tive reclamação a fazer, por entender a proposta e categoria do hotel.;10;;;;;;;
19 de setembro de 2022;Recomendo Quarto ótimo Café da manhã uma delicia;Muito excelente e confortável, quarto muito limpo, ambiente aconchegante;;10;;;;;;;
19 de setembro de 2022;muito rápido;quarto;como;5;;;;;;;
19 de setembro de 2022;Excepcional;Hotel muito bom ;;;;;;;;;
Funcionários educados e simpático ;;;;;;;;;;;
Quartos ótimos e limpos;;;;;;;;;;;
"Recomendo muito""";;10;;;;;;;;;
19 de setembro de 2022;EXCELENTE!!;Adorei o Atendimento,desde a recepção ao café da manhã.;;10;;;;;;;
18 de setembro de 2022;Não gostei.;Os pontos positivos são a localização e o café da manhã;Cama péssima, parece que você está deitando sob uma pedra;;;;;;;;
18 de setembro de 2022;Aceitável;localização;as roupas de cama não estavam cheirosas, tinha cheiro de mofo, tinha mosquito e o tapete do banheiro não parecia higienizado.;5;;;;;;;
18 de setembro de 2022;Excepcional;Maravilhoso café da manha, camas confortáveis, quartos grandes ,super recomendo;;10;;;;;;;
18 de setembro de 2022;Excepcional;Café da manhã maravilhoso , banheiro excelente , quarto grande, camas confortáveis;;10;;;;;;;
15 de setembro de 2022;Excepcional;Excelente acomodação!;;10;;;;;;;
14 de setembro de 2022;Excelente!!;Acomodação confortáveis, limpeza impecável!!!;Nada;10;;;;;;;
13 de setembro de 2022;decepção pela limpeza do local.;localização, hotel perto da praia, perto de lojas, bom local,;limpeza do hotel, muito ruim, péssimo, não indicaria pela limpeza, tem que melhorar muito para ficar pior. Agua vazando no box do banheiro, terrivel, sujo.;4;;;;;;;
13 de setembro de 2022;Excepcional;Café da manhã tava maravilhoso. ;;;;;;;;;
Atendimento atencioso.;;;;;;;;;;;
"Quarto reformado.""";Tomada longe da cama.;10;;;;;;;;;
12 de setembro de 2022;Aceitável;Localização boa.;;5;;;;;;;
12 de setembro de 2022;Satisfatório;Móveis novinhos e ambiente bem limpo.;Conforto das camas e principalmente travesseiros.;6;;;;;;;
31 de agosto de 2022;Péssimo;Nada;Apartamento fedorento, velho, ainda o banheiro entupido, pedimos para trocar o apartamento e só tinha cama de solteiro. café precário.;;;;;;;;
"Jamais voltarei neste hotel.""";1;;;;;;;;;;
30 de agosto de 2022;Excepcional;Estava tudo perfeito;;10;;;;;;;
29 de agosto de 2022;Excepcional;Tudo. O hotel a localização, os funcionários, limpeza, café da manhã com gostinho de casa tudo perfeito. Indico.;Não tem nada que não gostei.;10;;;;;;;
17 de agosto de 2022;Decepcionante;Localização;A foto não batia com o quarto.;;;;;;;;
O banheiro tinha um cheiro horrível.;;;;;;;;;;;
O hotel está em reforma;" então está com bastante sujeira e transtorno.""";4;;;;;;;;;
16 de agosto de 2022;Dormi mal;Localização;Barulho e a cama;1;;;;;;;
14 de agosto de 2022;custo benefício p uma estadia;;Não disponibilizam nenhuma manta ou edredom, quarto é bem pequeno.;5;;;;;;;
8 de agosto de 2022;Razoável;café da manhã e localização.;instalações com aspecto interno acabado. Ar condicionado apresentou problemas e ralo do chuveiro com dificuldade para descer a água.;6;;;;;;;
2 de agosto de 2022;Aceitável;O hotel é bem localizado e próximo a praia.;O café da manhã não tem muitas opções de pratos.;5;;;;;;;
31 de julho de 2022;Quarto mais barato que tinha, porém era muito pequeno. Se for passar o dia fora compensa.;Localização.;Método de pagamento.;6;;;;;;;
27 de julho de 2022;Aceitável;localização;Do quarto estava com infiltração e mofo;5;;;;;;;
24 de julho de 2022;Recomendo.;Excelente custo benefício.;;10;;;;;;;
23 de julho de 2022;Decepcionante;Localização boa;Banheiro sem ducha;4;;;;;;;
22 de julho de 2022;pedi para não limpar o quarto devido a motivos pessoais e mesmo assim limparam;tudo normal para a estadia prevista;ralo do chuveiro entupido e mal cheiro no banheiro;6;;;;;;;
22 de julho de 2022;Excepcional;limpeza, e o atendimento de cada colaborador;nada;10;;;;;;;
18 de julho de 2022;Excepcional;Tudo;;10;;;;;;;
18 de julho de 2022;Equipe de colaboradores de primeira. As acomodações são proporcionais ao preço.;Equipe muito prestativa, e atenciosos. ;;;;;;;;;
Sempre prontos para auxiliar. ;;;;;;;;;;;
"Café da manhã bacana e limpeza muito boa.""";Wi-Fi oscilando. ;;;;;;;;;;
"Quarto bem pequeno.""";10;;;;;;;;;;
18 de julho de 2022;Satisfatório;Localização;Quarto abafado. Janela de frente para parede.;6;;;;;;;
13 de julho de 2022;hospedagem simples com custo barato;custo benefício;café da manhã com poucas opções;5;;;;;;;
7 de julho de 2022;Aceitável;Ja fiquei outras vezes gostei de tudo...;Dessa vez na madrugada faltou energia e o gerador não funcionou,infelizmente deixou a deseja...;5;;;;;;;
5 de julho de 2022;Excelente e quero voltar de novo!;Valor custo benefício e localização...;Sem indicativos!;10;;;;;;;
29 de junho de 2022;Excelente;De tudo desde o atendimento da portaria a cozinha. Um hotel simples mais muito aconchegante, o café da manhã muito diversificado , a copeira muito gentil e preocupada em nos servir bem. Tudo maravilhoso. As toalhas trocadas diariamente, limpeza do quarto Boa foi tudo maravilhoso;De nada tudo perfeito;10;;;;;;;
27 de junho de 2022;Aceitável;O café da manhã era ótimo, e a localização é boa pra quem quer ficar num bairro mais classe média. Mas como é longe do centro histórico e como não é recomendável mergulhar na praia de Boa Viagem, acho que eu preferia ter me hospedado em outro bairro. Gostei do frigobar no quarto.;Não tem elevador, tivemos que subir e descer nossas malas pela escada. A infraestrutura em si dos quartos é bem velha, no meu quarto a janela dava pra um muro, ou seja, não tinha circulação nenhuma de ar e não entrava luz natural (as roupas e toalhas não secavam direito). Os móveis eram antigos. E uma noite encontramos uma barata enorme no quarto, que se escondeu nas frestras do teto do quarto (ou seja, provavelmente outras amigas moram por ali).. Na minha opinião, a estadia não condiz com o preço cobrado.;5;;;;;;;
26 de junho de 2022;Ótima;Café da manhã, equipe etc…;Não teve nada que não gostei;10;;;;;;;
24 de junho de 2022;Satisfatório;Hotel bem localizado e barato, no entanto peca no conforto e no café da manha.;;6;;;;;;;
21 de junho de 2022;não retorno;ar funciona e quarto limpi;no banheiro não tinha kit limpeza. apenas dois sabonetes.;2;;;;;;;
17 de junho de 2022;Excepcional;Café da manhã muito bom.;Não tinha lençol na cama para se encobrir.;10;;;;;;;
12 de junho de 2022;Excepcional;localização e café da manhã.;a cama é um pouco dura.;10;;;;;;;
9 de junho de 2022;Satisfatório;Funcionários e café da manhã;Os quartos ficam muito barulhentos, dá pra ouvir tudo dos outros quartos e corredores, péssimo pra dormir;6;;;;;;;
8 de junho de 2022;Horrível;Só localização;Lençóis com cheiro de usado.;;;;;;;;
Fui cobrada a mais do que contratei pelo booking ;;;;;;;;;;;
"Conforto nenhum.""";1;;;;;;;;;;
8 de junho de 2022;Satisfatório;Localização, café da manhã, quarto aparentando novo.;Fiquei em um quarto com uma janela que dava para a parede da área interna do hotel, não entrava luz. Sensação claustrofóbica.;6;;;;;;;
31 de maio de 2022;Excelente localização e custo benefício.;Bem localizado, limpo, organizado, café da manhã gostoso, tem local para estacionar, apesar de ser rotativo já está ótimo, além do atendimento dos profissionais ser excelente! Prontidão em atender, ajudar e servir. Parabéns a equipe!;Poderia ter duchinha no banheiro.;10;;;;;;;
27 de maio de 2022;Recomendo;Localização, limpeza e um ótimo atendimento. Está em fase final de reforma, mas nada que prejudique a qualidade do hotel. Custo benefício ótimo. Parabéns.;A rampa do estacionamento da frente deve ser refeita. E travesseiro mais confortáveis.;10;;;;;;;
24 de maio de 2022;Excepcional;Atenção dos funcionários, preço e café da manhã simples mas delicioso.;Nada;10;;;;;;;
23 de maio de 2022;Aceitável;Espaço fisico do quarto;Forro de cama e toalhas, assim como café da manhã ficam muito a desejar;5;;;;;;;
22 de maio de 2022;Jamais volto lá.;;O primeiro quarto que nos acomodaram era horrível, mofo nas paredes e nas portas e banheiro sem box. Porta de madeira se desfazendo e com sinal de arrombamento. Quando reclamei, nos colocaram em um quarto melhor, mas ainda assim as instalações não são confortáveis. Não tem a comodidade de ter itens no frigobar, tem que ficar subindo e descendo escadas porque nem elevador tem. Café da manhã tb não agrada. O hotel no geral tem um aspecto de mal cuidado. Jamais voltaria lá!;5;;;;;;;
