data_avaliacao;titulo;comentario_positivo;comentario_negativo;nota
7 de agosto de 2023;Maravilhosa;Tava tudo uma maravilha Amei Minha mãe veio e me indicou;não tenho que reclamar;10
23 de março de 2025;Fantástico;O café da manhã é maravilhoso.;;
23 de março de 2025;Péssima surpresa e resolução proforma.;Boa localização, café da manhã bom, ar condicionado bom;Meu quarto estava num andar em reforma, o ultimo quarto ao lado do tapume, confesso que me senti a principio insegura e logo depois preocupada com o barulho, em nenhum momento do check in isso foi informado, o cheiro de reforma estava no andar todo. Mas a pior situação foi....já com o sentimento de insegurança, ouvi barulho na minha porta, parecia alguem passando a chave, por sorte tinha trancado a minha porta, mas como não sabia a acústica do hotel, pensei que poderia ser o vizinho, ou mesmo a obra...o barulho se estendeu por mais umas 4 vezes, e criei coragem e abri, tinha um homem de fato tentando abrir a minha porta. Ele estava com a chave para o mesmo quarto 311. Descemos na recepção para resolver, a pessoa da recepção somente se desculpou de forma bem pro forma e me deixou no quarto, afinal eu já estava lá, e colocou a pessoa em outro, e fim, disse que a chave não abriria a porta pq o sistema não faz 2 chaves para o mesmo quarto e foi isso. Eu peguei o meu constrangimento e insegurança e guardei no bolso.;7
18 de março de 2025;Excelente!!!;Excelente localização!;Falta de estacionamento!;9
11 de março de 2025;Bom custo benefício.;O hotel fica em uma ótima localização. Possui uma cobertura bem bonita e agradável para passar parte do dia e apreciar a vista. Rápido do check-in e chek-out. Máquina do café da manhã e a tapioca eram bons.;Embora eu não tenha experimentado nenhum problema, verifiquei que o hotel tem uma estrutura um pouco mais antiga. As roupas de cama poderiam ser mais novas e o café da manhã mais generoso com mais opções.;8
11 de março de 2025;Muito bom;Localização;Preço dos alimentos;8
10 de março de 2025;O quarto estava ok .;O cafe da manhã é bom .;A piscina é minúscula.;7
10 de março de 2025;Fantástico;Café da manhã;Não tinha estacionamento;9
9 de março de 2025;Bom hotel, nada excepcional. Pelo preço, consideraria outras opções.;De modo geral, é um bom hotel. Quarto amplo, limpeza ok, tirando um ou outro funcionário da recepção, o tratamento foi muito cordial. É bem localizado: farmácia, padarias e restaurantes por perto. De frente pra praia. O café da manhã era ótimo.;O quarto tinha um cheio constante de mofo, que, por vezes, impregnava na roupa de cama. Creio que por alguma falha no ar condicionado (de onde caia muita água quando desligado). A recomendação foi deixá-lo constantemente ligado.;7
6 de março de 2025;Muito bom;cafe da manha fraco, pois muito básico e nada gostoso. O ovo mexido não tinha gosto de nada, bolos ruins, nenhum pao gostoso. achei terrível acordar de uma noite de carnaval e ter que tomar café da manha ouvindo frevo nas alturas... perdão, mas tudo tem hora. Também o lugar do café da manhã é muito ruim. Pequeno para a quantidade de pessoas, disposição do buffet também péssima, dificultando a mobilidade no sãlão. O salão é bem aquém do restante do hotel.;;8
6 de março de 2025;Bom;;Não tem estacionamento. Frigobar desabastecido.;7
5 de março de 2025;Fantástico;Café da manhã maravilhoso, quarto bem espaçoso, piscina ok. Pela estrutura do hotel e o que ele oferece tivemos um ótimo custo/benefício.;;9
5 de março de 2025;Precisando de cuidados na área da piscina;Café e recepção;Área da piscina e janelas dos quartos sujas;7
5 de março de 2025;Boa localização;Localização, bom café da manhã, tamanho do quarto;Quarto estava sujo nos cantos do chão, área da piscina é bem pequena e acesso estranho;9
5 de março de 2025;Médio-Ruim;As dependências do quarto parecem velhas, com aspecto de sujeira. O ralo do chuveiro não funciona bem, acumulando água do banho.;As dependências do quarto parecem velhas, com aspecto de sujeira. O ralo do chuveiro não funciona bem, acumulando água do banho.;7
26 de fevereiro de 2025;Excelente,;Excelente;;9
23 de fevereiro de 2025;Bom;;Falta de estacionamento ou valet.;
22 de fevereiro de 2025;Boa mas, poderia ser melhor com o que descrevi acima;Café da manhã, bom. toda equipe do hotel é muito simpática e prestativa desde a recepção, garsons e fachineiras.;Eles tem uma picina no último andar e o espaço é muito mal aproveitado.Poderiam deixá-lo aberto de noite para os hóspedes dar uma relaxada, tomar um vinho, fumar um cigarro já que em todo hotel não é permitido. Temos então que ir para a frente do hotel para fumar e mendigos se aproximam e pedem coisas....muito desagradável.;9
22 de fevereiro de 2025;Ótima localização;Café da manhã muito bom, com tapioca e omelete preparados na hora, muitas frutas , pães e bolos. Quarto ok com banheiro de bom tamanho e um chuveiro ótimo, ar condicionado que funciona bem e cama boa. Área da piscina muito boa apesar das cadeiras esquentarem muito no sol (fica difícil sentar). Localização do hotel excelente. Funcionários muito prestativos e educados. Tive um pequeno problema que foi prontamente resolvido.;Academia péssima com poucos aparelhos e quase nenhum funcionando, além de ser em um espaço muito pequeno.;9
19 de fevereiro de 2025;O quarto luxo é uma ótima pedida!;O quarto luxo é bem confortável e espaçoso, a cama é boa, o café da manhã é gostoso (tem várias frutas e frios), tem tapiocas e omeletes feitos na hora e a localização é excelente.;Cobertores de solteiro para as camas de casal, as cortinas com mofo e o blecaute não funciona bem. Falta uma cafeteira e copos no quarto.;7
17 de fevereiro de 2025;Muito bom;O funcionário Paulo é bastante cortês. Grata pelo seu atendimento, Paulo.;;8
17 de fevereiro de 2025;Tranquilidade;Café da manhã;Falta de estacionamento;9
13 de fevereiro de 2025;Razoável;Gostei da localização e do café da manhã variado.;O quarto tinha cheiro de mofo, estava empoeirado e as toalhas com mau cheiro.;7
10 de fevereiro de 2025;Estrutura muito boa, quarto amplo e bem arrumado. Localização ótima;Estrutura muito boa, quarto amplo e bem arrumado. Localização ótima.;Box do banheiro vazava bastante e deixava o banheiro bem molhado. Mas não atrapalhou a estadia.;9
7 de fevereiro de 2025;Muito bom;cafe da manha e localização excelente ,;ar condicionado barulhento e estava congelando , o técnico foi verificar mas não consertou...;8
7 de fevereiro de 2025;Muito bom;Localização e café da manhã;;8
5 de fevereiro de 2025;Poderia ter sido melhor se a pessoa da recepção escolhesse um quanto melhor para mim.;Excelente café da manhã. Camas confortáveis. Quarto muito limpo. Na recepção não foi tão bem. Fiquei 3 dias em um quarto escuro com a janela virada para uma parede.;Localização do quarto. At condicionado sem controle. Ou ficava gelado ou desligava.;8
3 de fevereiro de 2025;Foi apenas uma noite e gostamos muito do hotel, ótimas instalações.;Da localização, do café da manhã e do conforto dos quartos.;;9
3 de fevereiro de 2025;Ótima localização, custo-benefício, café da manhã e bom atendimento.;A localização é excelente, muito perto da praia, de vários restaurantes e bares e também de mercado, farmácia e loja de conveniência. Dá pra fazer tudo a pé. O café da manhã é uma delícia, super bem servido e com bastante variedade.;Havia um som ligeiramente incômodo do ar condicionado que nos obrigou a desligá-lo algumas vezes à noite para conseguirmos dormir melhor. Não chegamos a cobrar a recepção a respeito disso porque por acaso encontramos no nosso quarto um cartão de reclamações deixado pelos hóspedes anteriores falando justamente sobre esse problema e informando que a recepção não fez nada a respeito quando eles reclamaram.;8
3 de fevereiro de 2025;Bom;Bem localizado. Café da manhã bom!;;7
2 de fevereiro de 2025;Valeu pelo custo benefício;Gostei da localização e os funcionários da recepção muito atenciosos.;No quarto tinha cupim nos móveis! A cama de solteiro rangendo e os travesseiros todos altos demais! Presenciei a funcionaria que faz tapioca sendo mal educada com uma hóspede.;7
31 de janeiro de 2025;Fantástico;Localização, quartos espaçosos, café da manhã variado e muito bem servido;O ar condicionado do quarto onde ficamos fazia um barulho acima do normal.;9
29 de janeiro de 2025;É bom, mas...;A localização é muito boa e o check-in foi bem rápido. Tivemos um pequeno inconveniente, pois fiz a reserva errada para duas camas de solteiro, mas o pessoal da recepção resolveram rapidamente.;Eu fico muito triste e desgostoso por saber que em pleno 2025 ainda existem hotéis que exploram os hospedes cobrando um absurdo nos itens do quarto, exemplo: tomei 3 águas de 250ml cada e nos cobraram o absurdo de R$24,00. Espero que sinceramente eles levem em consideração a sugestão e mudem seu perfil pra algo mais moderno e justo.;7
26 de janeiro de 2025;Fantástico;Reservei para os meus pais, e eles adoraram.;;9
25 de janeiro de 2025;Muito bom;Café da manhã maravilhoso e farto;Limpeza deixou a desejar;8
25 de janeiro de 2025;Muito boa!!!!;Quarto bem espaçoso;O barulho da ar condicionado, foi difícil para dormir, parecia a turbinada de uma avião!;9
24 de janeiro de 2025;Tranquila;Localização;A limpeza do quarto;8
23 de janeiro de 2025;Já quero voltar...;Super indico, gostei da localização, da recepção e acolhimento. Conforto no quarto, a culinária excelente, café da manhã maravilhoso.;;9
21 de janeiro de 2025;Fantástico;Café da manhã muito bom. ;;
21 de janeiro de 2025;Excelente hotel, recomendo!;Excelente!;O hotel não oferece estacionamento.;9
20 de janeiro de 2025;Fantástico;Localização e café da manhã;;9
20 de janeiro de 2025;Fantástico;Localização excelente beira mar .;;
19 de janeiro de 2025;Boa;Localização;Ar condicionado barulhento;7
19 de janeiro de 2025;Foi divertida;Da cama e do chuveiro;Barulho de reforma, máquinas quebrando coisas pela manhã.;8
16 de janeiro de 2025;Hotel velho, precisando de reforma;Do custo benefício. Box do banheiro é grande e a ducha é boa.;O quarto que fiquei era pequeno. Instalações velhas, precisam ser atualizadas. Cama pequena e não muito confortável. Travesseiro desconfortável. Banheiro escuro. Café da manhã fraco.;7
15 de janeiro de 2025;Ótimo hotel, porém o ar condicionado...;Cama extremamente confortável, banheiros super limpos, ótima localização frente mar.;Apesar do quarto possuir ar condicionado, o barulho do mesmo atrapalha o sono e mesmo com a ventilação no mínimo exigindo pouco esforço do ar condicionado o barulho é sempre alto e isso eu não gostei. A paz só veio desligando o ar condicionado.;8
14 de janeiro de 2025;Fantástico;Café da manhã;O quarto não teve vista pro mar;9
12 de janeiro de 2025;Muito agradável;Localização, limpeza e pequeno almoço;Área da piscina;9
10 de janeiro de 2025;Vou voltar......;Localização, Limpeza, Agilidade e Facilidade em tudo. Ótimas instalações. Excelente Café da Manhã. Ótima Cozinha.;Ar Condicionador não dava regulagem. Congelava a noite e era muito barulhento. Parecia um gerador a diesel de tanto barulho.;9
9 de janeiro de 2025;Confortável;Boa estrutura a um preço bom;;8
7 de janeiro de 2025;Fantástico;Boa localização e uma ótima vista do nascer do sol.;Instalações antigas.;9
7 de janeiro de 2025;Ótima localização , conforto;Quarto tamanho bom, cama e travesseiros confortáveis. Ótima localização . Funcionários atenciosos.;;8
6 de janeiro de 2025;Fantástico;A localização e o café da manhã são ótimos. Funcionários educados e prestativos.;Cheiro de mofo no quarto.;9
4 de janeiro de 2025;Bom, mas pode melhorar;Café da manhã muito bom, inclusive com tapioca e omelete feito na hora! Cama e chuveiro bons. Localização excelente!;As instalações são antigas, o ar condicionado central não tinha como controlar a temperatura e ficava extremamente gelado o quarto. Equipamentos da academia sem manutenção (estação multifuncional não funcionando) e tem sauna seca e molhada, aparentemente bem legais, mas que devem ser pagas para utilizar (creio que poderiam rever esse item, pois melhoraria a experiência dos hóspedes). Também tem um bar na piscina, o que é bem legal, mas os preços bem salgados, talvez com preços menores e mais parecidos com o comércio em geral, haveria bem mais utilização pelos hóspedes.;8
3 de janeiro de 2025;Fantástico;Gostei da localização, limpeza, o café da manhã foi bom.;Acho que poderiam melhorar o ar condicionado.;9
3 de janeiro de 2025;Muito bom;A localização foi boa pq era próximo ao evento do réveillon, mas não é a parte central de Boa viagem.Para quem procura uma parte mais calma da cidade é uma boa localização.;A parte referente alimentação, café da manhã e jantar, deixou a desejar. Nada saboroso.;8
2 de janeiro de 2025;Um dos melhores cafés que ja usufrui em hotel.;Um café da manhã surreal em termos de diversidade e qualidade.;Tudo muito simples. Mas um excelente custo beneficio.;8
2 de janeiro de 2025;Bom;Excelente localização e gentileza dos funcionários.;Falta de estacionamento, e poucas opções no jantar, principalmente para crianças.;7
1º de janeiro de 2025;Oito;Atendimento muito cordial , funcionários excelentes ,localização bom;Muito caro;9
1º de janeiro de 2025;Um Excelente Custo Benefício em Boa Viagem;Localização frente ao Mar, Hospitalidade dos Funcionários, um excelente Café da Manhã. Wi-Fi de boa qualidade.;O Espaço da Piscina ser pequeno, mas acolhedor.;9
31 de dezembro de 2024;Agradável, falta estacionamento;Localização, custo benefício e café da manhã são bons.;Não tem estacionamento e travesseiros eram bem ruins.;8
31 de dezembro de 2024;De modo geral foi uma estadia boa, contudo avalio o hotel como um bom hotel 3 estrelas e não 4 como divulgado;Localização;Tamanho do quarto e academia muito pequena;7
29 de dezembro de 2024;Prefiro Ibis;Localização;quarto velho, ar não regulava a temperatura, sem manta , travesseiro péssimo. Banheiro velho;7
27 de dezembro de 2024;Agradável;Tudo ok;Tudo ok;8
27 de dezembro de 2024;Foi boa;Localização;Internet;8
27 de dezembro de 2024;Foi boa;Localização;Internet;8
26 de dezembro de 2024;Realização .;A limpeza;Tudo estava ótimo .;9
26 de dezembro de 2024;Atendeu as expectativas, localização muito boa frente ao mar;Ótimo café da manhã, restaurante com boas opções a lá carte.;;8
23 de dezembro de 2024;Fantástico;Conforto do quarto, localização, café da manhã;Único ponto negativo do hotel que não possui estacionamento próprio;9
23 de dezembro de 2024;Fantastica!;A localização do hotel é simplesmente maravilhosa. Vista para a praia e super perto de bares e restaurantes.;;
21 de dezembro de 2024;Estadia tranquila;Tudo exceto ar condicionado e interfone;Ar condicionado não funcionava ;
21 de dezembro de 2024;Fantástico;Gostei do quarto, grande e espaçoso ;;
18 de dezembro de 2024;Muito boa, preço justo, café variado;Limpeza;Gostei;9
14 de dezembro de 2024;Bom;localização;O descuido com os detalhes para um hotel que se diz de alto padrão chama atenção- curtinas sujas, lençóis com manchas, toiletries de péssima categoria, frigobar com produtos vencidos.;7
9 de dezembro de 2024;Vale pelo custo e localização;Localização;Limpeza e colchão precisam ser melhores;7
6 de dezembro de 2024;Muito bom;Oi café da manhã é muito bom com comidas típicas.;Da falta de locais para pendurar as toalhas usadas no banheiro e da dificuldade de ajustar o ar condicionado.;8
4 de dezembro de 2024;Excelente hotel para negócios;Localização e café da manha maravilhoso. A localização também é bem boa, cama confortável.;Uma funcionária do staff do restaurante me parecia trabalhar não tão feliz.;8
30 de novembro de 2024;Aceitável;Café da manhã muito bom e a localização;Um pouco antigo o edifício e o atendimento profissional mas sem simpatia;7
29 de novembro de 2024;Agradável especialmente porque estava à passeio.;Localização e café da manhã.;Falta de manutenção das instalações, quarto com cheiro de mofo. Não me senti muito segura.;7
27 de novembro de 2024;Localização e piscina;A localização é perfeita e a vista da piscina é linda.;Falta um cuidado maior com a limpeza.;8
27 de novembro de 2024;Muito bom;Localização e cafe da manhã;Limpeza e temperatura do ar-condicionado do meu quarto não era ajustável;8
27 de novembro de 2024;Mas nao classificaria ruim,,,, obra não é eterna. boa sorte aos proximos;Funcionários simpaticos e receptivos. Apenas um pequeno incomodo foi que no andar acima, deveria estar tendo obra.;Obra acima do nosso apto;8
27 de novembro de 2024;Muito bom;Funcionários extremamente simpáticos, limpeza excelente, ótimo café da manhã.;O quarto fazia uma barulho alto de vez enquanto como se fosse uma máquina de lavar centrifugando, o ar condicionado central também fazia um barulho alto.;8
23 de novembro de 2024;Tinha tudo pra ser maravilhosa mas não foi.;Cama bem confortável, quarto muito bom e espaçoso e um banheiro muito bom.;Gostei muito do hotel da recepção que me atendeu muito bem, através de André e Cláudio, se não me falha a memória.;
22 de novembro de 2024;Hotel simples, mas entrega o básico: boa localização, bom banho e bom café da manhã;A vista para o mar, chuveiro bom;Colchão de mola;7
19 de novembro de 2024;Conforto no banheiro, café da manhã delicioso e ótima localização. Só a piscina que é bem pequena.;Tive uma experiência incrível! O banheiro é super espaçoso, o que trouxe muito conforto e praticidade para minha estadia. O chuveiro é maravilhoso, com uma pressão excelente e água na temperatura ideal – um verdadeiro convite para relaxar. O café da manhã também foi um destaque: variado, com opções fresquinhas e deliciosas, perfeito para começar o dia com energia. Além disso, a localização é simplesmente perfeita! Fiquei perto de tudo o que precisava, com fácil acesso aos melhores pontos da cidade. Recomendo muito essa acomodação!;A piscina é pequena e não é profunda.;8
14 de novembro de 2024;Marante uma escolha certa para trabalho e ou Lazer! Maravilhoso!;Gostei muito dos funcionários, super cuidadosos! Gostei também da localização do hotel, do quarto, do café da manhã. Estava trabalhando, mas pretendo voltar para lazer e ficarei no Marante, com certeza!;;9
11 de novembro de 2024;Bom;Café da manhã é muito bom , localização privilegiada;A limpeza do banheiro não foi boa, chegamos e tinha restos de sabonete no box do banheiro, a chave do quarto não funcionava direito e várias vezes um funcionário tinha que vir junto p abrir a porta do quarto.;7
10 de novembro de 2024;Bom;Achei o quarto antigo e bem;;
6 de novembro de 2024;Bons momentos em Boa Viagem;Excelente localização, bem em frente à praia. Há várias opções de restaurantes próximos, gostei muito.;Eu gostei de tudo, os funcionários são extremamente educados e atenciosos.;8
6 de novembro de 2024;A estadia foi maravilhosa, aconchegante, com uma vista maravilhosa da Praia!;Os dois melhores pontos é a localização de frente para o mar, com as janelas de parede inteira envidraçada, é possível ter uma vista maravilhosa e a equipe de funcionários do hotel que são muito simpáticos e prestativos. Os funcionários procuram resolver tudo o que é pedido e se preocupam em resolver qualquer dificuldades ou dúvidas dos hóspedes.;Gostei de tudo. O que poderia ser melhor é a limpeza com um pouquinho mais de capricho na hora de varrer em baixo das camas e nos cantinhos da parede.;8
6 de novembro de 2024;Muito bom;Localizacao;;8
5 de novembro de 2024;Foi boa !;A localizaçao excelente;A limpeza do quarto deixa a desejar;8
4 de novembro de 2024;Fantástico;Atendimento ;;
2 de novembro de 2024;Poderia ser mais barata considerando as comodidades;Café da manhã e simpatia dos funcionários;Cama pouco confortável e cobertores insuficientes para aquecer quando o ar central do ap estava ligado. Além disso, o armário e travesseiros estavam com mofo.;7
29 de outubro de 2024;Muito boa e confortável, tirando as toalhas que esta fedendo, o demais foi ótimo.;Localização e comodidade;As toalhas estavam com mal cheiro por mais uma vez tive que fazer uma reclamação devido essa queixa.;8
28 de outubro de 2024;Gratidão a Deus;Vista para o mar;;8
28 de outubro de 2024;Boa;Mais ou menos;O cartão da porta não pegou. Lixeira sem tampa e atrás das cortinas tem que limpar mais pois fedor de mofo.;7
27 de outubro de 2024;Bom;Localização é boa e o café da manhã muito bom.;Limpeza, quarto com cheiro de tinta e pouco ventilado. péssimo ar condicionado.;7
26 de outubro de 2024;Café da manhã delícia.;O café da manhã é MARAVILHOSO!!!! Onde eu saboreie o melhor cuscuz da minha vida😊!!!! A cama também é muito boa! Mas o Hotel precisa de uma renovada! Mas gostei muito!!! A localização também é muito boa!;O arcondicionado desligou as duas noites às 5horas da manhã e eu acordei. Mas foi só isso.;8
26 de outubro de 2024;uma boa pedida em boa viagem;Hotel executivo padrão, com diferencial de ser em frente ao mar de boa viagem. É bem confortável, staff atencioso e prestativo e o café da manhã é muito bom, com várias opções de frutas, doces e salgados e ainda com tapioca ou omelete feitas na hora. A localização é excelente para quem quer explorar recife ou mesmo ficar aproveitando a praia em frente.;Não tem nada que não gostamos;9
24 de outubro de 2024;normal;localização é muito boa;não tem estacionamento , achei o custo benefício alto;8
24 de outubro de 2024;Muito bom;Café da manhã bom.;posição do quarto. muito próximo ao prédio ao lado. sem privacidade.;8
22 de outubro de 2024;Fantástico;A localização é ótima e o café da manhã muito saboroso.;;9
22 de outubro de 2024;Muito bem localizado e confortável, no entanto a limpeza dos quartos e higienização das toalhas precisa melhorar.;Café da manhã e localização;Limpeza. ;
18 de outubro de 2024;Prática;A localização e o Desjejum;Barulho do arcondicionado;8
18 de outubro de 2024;poderia ter sido melhor;fomos bem recebidos, funcionarios educados muito bom;um absurdo uma garrafinha minúscula de agua custar 9 reais mais taxa ;
14 de outubro de 2024;Foi acima da expectativa;O café da manhã muito bom, faltou o pão de queijo, mas havia outras opções para celíacos, então tudo bem!;Senti falta de um cobertor :(;8
11 de outubro de 2024;Muito tranquila;Atendimento muito bom. Quarto limpo e espaçoso.;;9
8 de outubro de 2024;Tranquila;Localização;Quarto antigo.;7
3 de outubro de 2024;Fantástico;Otimo;...;9
3 de outubro de 2024;Bom lugar para se hospedar.;Sempre me hospedo nesse hotel quando vou à Recife. Excelente infraestrutura e localização.;Retiraram os bolos tradicionais de PE do café da manhã. Uma pena.;9
1º de outubro de 2024;Excelente localização e custo benefício adequado;Localização;Barulho do ar condicionado;9
1º de outubro de 2024;Muito bom;Excelente localização, tem um custo benefício muito bom. O café da manhã tem bastante variedades de frutas, pães, bolos e claro a tapioca feita na hora.;"No primeiro dia, o quarto estava com cheiro de ""coisa antiga"", o que me incomodou um pouco. Mas, deixei a janela aberta no dia seguinte pela manha e não tive mais problemas.";8
30 de setembro de 2024;Aprazível estadia;Cama confortável, excelente ducha e climatização;;9
29 de setembro de 2024;Muito bom, recomendo.;Gosto desse hotel, já frequento há algum tempo. Custo benefício, próximo do aeroporto. Reconendo;O hotel é bom, não tem o que não gostar.;9
28 de setembro de 2024;Uma boa dica;O atendimento da recepção é a cozinha . Super disponíveis para servir e ajudar.;;
27 de setembro de 2024;Bom;Tamanho do banheiro, limpeza e café da manhã.;Travesseiros péssimos. Não há estacionamento. Ok. Mas é obrigatório ter um serviço de valet. Claro que pago por fora. Extremamente decepcionante isso.;7
26 de setembro de 2024;Muito bom;Localização excelente, café da manhã farto e com bom horário. Boa televisão e ar condicionado. Água quente disponível no banheiro.;Não tinha coberta adequada na cama para o nível configurado para o ar condicionado central. Limpeza do banheiro poderia ser melhor. Havia uma pequena goteira no banheiro do quarto 418.;8
21 de setembro de 2024;Otimo custo benefício;Localização;Não fornecem ferro de passar roupa;7
20 de setembro de 2024;esperava bem melhor;localização excelente, atendimento da recepção;quarto com cheiro de mofo, colchão da cama terrível , quase que uma mola me machucava;7
15 de setembro de 2024;Bom;Localização muito boa, instalações muito boas.;Não tem estacionamento, o café da manhã poderia ter um pouco mais de variedade, a equipe que trabalha no café da manhã poderia ser mais cordial com os hóspedes e a cama de casal na realidade eram duas camas de solteiro juntas.;7
13 de setembro de 2024;Excelente localização, em frente à praia;Localização, ótimo atendimento, cafá da manhã muito bom;sem reclamações;9
12 de setembro de 2024;Cliente satisfeito;Cordialidade dos funcionários, em particular do gerente Sr. Edson e do responsável pelo bar Sr. Marconi;Ar condicionado (muito forte);8
