data_avaliacao;titulo;comentario_positivo;comentario_negativo;nota;;;;;;;;
12 de dezembro de 2022;Excepcional;Localização excelente. Do lado da feirinha e praticamente em frente a orla de boa viagem. Tem tudo próximo e da pra resolver tudo a pé. O café da manhã é um capítulo a parte! Além da variedade, tem um funcionário só para preparar tapioca na hora! Eu amei a instalação, cama, chuveiro bom, limpeza, ar condicionado funciona!!!;Não tive do que me queixar.;10;;;;;;;;
11 de dezembro de 2022;Excepcional;E a segunda vez que me hospedo. Os quartos são espaçosos, práticos e corretos. Café da manhã variados, mas teria adorado beber sucos naturais.;;;;;;;;;;
Ao lado tem uma igreja linda e muito antiga; com uma feirinha de artesanato bem básica.;;;;;;;;;;;
"Funcionários atenciosos sempre disponíveis para ajudar. Voltarei!""";;10;;;;;;;;;;
9 de dezembro de 2022;Excepcional;Localização excelente.;;10;;;;;;;;
7 de dezembro de 2022;Aceitável;Quarto mto amplo e ótimo café da manhã;Péssima limpeza, saiam larvas do ralo do Box. O entorno do hotel é um local inseguro.;5;;;;;;;;
7 de dezembro de 2022;Pelo valor cobrado na diária, com ctz existem opções melhores.;O quarto tem uma vista parcial para o mar. O serviço de quarto funciona bem. O restaurante é bom, com preço justo, pratos bem servidos e funciona 24h.;É um hotel antigo que precisa de uma modernização. ;;;;;;;;;
De uma forma geral; o quarto é bastante simples. Não havia cobertor e o chuveiro elétrico;" não esquenta a água de maneira adequada.""";5;;;;;;;;;
2 de dezembro de 2022;Perfeita;Estadia perfeita! Atendimento excelente, café da manhã completo, restaurante disponível para o outras refeições. Limpeza e conforto do quarto, excepcional!;;10;;;;;;;;
1º de dezembro de 2022;Ótima estadia e localização.;Boa localização ao lado da feirinha, café da manhã bom, bem limpinho.;O estacionamento é cobrado a parte, e ainda precisa ficar pedindo para trazer o carro na recepção.;10;;;;;;;;
1º de dezembro de 2022;Decepcionante.;Localização.;Checkin marcado para as 14h00, mas só fomos liberados para o quarto as 15h48! O hotel estava super desorganizado.;4;;;;;;;;
30 de novembro de 2022;localização excelente;localização;não há estacionamento no hotel;10;;;;;;;;
27 de novembro de 2022;Deixou a desejar;O café da manhã e a localização são os pontos fortes do hotel.;O wi-fi no quarto era muito precário, muito instável, e constantemente zero conexão. A roupa de cama poderia ser melhor, e a limpeza do banheiro deixou a desejar. A janela do quarto dava de frente para uma obra, o que tornou a estadia bastante desagradável e barulhenta. No geral, é um hotel razoável, mas que precisa de melhorias e mais capricho com os quartos.;6;;;;;;;;
22 de novembro de 2022;Excepcional;Excelente localização;;10;;;;;;;;
22 de novembro de 2022;Satisfatório;local espaçoso e com boa localização;cheiro de mofo no quarto;6;;;;;;;;
21 de novembro de 2022;Excelente!;De tudo! A acomodação tripla em que ficamos foi excelente, espaçosa, integrada e ao mesmo tempo permitia a privacidade. O hotel é super bem localizado, o café da manhã é variado e delicioso. O staff também é bastante simpático e solicito.;;10;;;;;;;;
20 de novembro de 2022;Hospedagem nota 10;Super limpo, funcionários educados e dedicados,bom café da manhã, boa localização, vista linda do mar!!!! Super indico!! Nenhuma reclamação!!! Taxistas que ficam na portaria nota dez!!!;;10;;;;;;;;
20 de novembro de 2022;Decepcionante;Da localização do hotel;O quarto é bem de razoável para ruim! Não conta com cobertor, só lençóis! O banheiro tem aspecto de velho e aparenta ser sujo. Mas o pior foi a posição da privada! fica muito apertada para usar!;5;;;;;;;;
20 de novembro de 2022;excepcional;camas limpas e café da manhã bem servido;;10;;;;;;;;
19 de novembro de 2022;Excepcional;Localização, limpeza e conforto.;Nada a reclamar.;10;;;;;;;;
17 de novembro de 2022;Excepcional;Cafe da manhã maravilhoso;;10;;;;;;;;
16 de novembro de 2022;Café da manhã diferenciado e localização incrível.;Café da manhã excepcional, com muita variedade e bem saboroso. Localização excelente, dá pra ir a pé para a praia e está bem em frente a feira da Boa Viagem. Equipe muito atenciosa em todos os atendimentos.;Ausência de estacionamento próprio para guardar o carro. Só tem a opção de guardar com manobrista a 25 reais a diária ou estacionar na rua do hotel, porém as vagas disponíveis são poucas e bem distantes.;10;;;;;;;;
14 de novembro de 2022;Custo-benefício;Localização;O hotel tem um aspecto de muito ultrapassado, mas era uma noite só.;6;;;;;;;;
12 de novembro de 2022;Vale a pena;Café da manhã.;;;;;;;;;;
"Muito bom. A Tapioca é muito boa.""";Reforma. Tinha cheiro de solda nos corredores.;10;;;;;;;;;;
11 de novembro de 2022;Excepcional;Da localização, educação dos funcionários e do café da manhã.;Não tem nada que não tenha gostado.;10;;;;;;;;
11 de novembro de 2022;Excepcional;Conforto do quarto. Café da manhã muito bom.;Apesar do café da manhã ser muito bom. Não tinha suco de laranja disponível. Sempre tinha que solicitar ao garçom. Isso, fica desagradável.;10;;;;;;;;
10 de novembro de 2022;Adorei tudo, funcionários nota 10, tapioca deliciosa todo dia no café da manhã.;quarto grande, banheiro com ótimo chuveiro;área de piscina do hotel em reforma !;10;;;;;;;;
9 de novembro de 2022;Super Top;Gostei de tudo,os recepcionistas,manobristas,pessoal do restaurante,muito solícitos,educados,muito maravilhoso não tem como descrever.;;;;;;;;;;
A localização perfeita; tem uma feirinha de artesanato bem variada .Recomendo esse hotel o recepcionista Cristopher muito simpático e prestativo . ;;;;;;;;;;;
Café da manhã maravilhoso bem diversificado tapioca 1000;"cuscuz 1000 tudo 1000.""";Tudo perfeito.;;;;;;;;;;
"Não teve nada que não gostei""";10;;;;;;;;;;;
8 de novembro de 2022;Decepcionante;localização;colchão mole, empossa água no box;4;;;;;;;;
7 de novembro de 2022;Família Park Hotel Boa Viagem Recife, todos vocês são maravilhosos, nos sentimos muito bem aí...;Já é a quarta vez que ficamos hospedados no mesmo, amamos sempre ficar no park Hotel , já levamos a família toda e como sempre foi maravilhoso, vários restaurantes por perto, que dá para ir tudo a pé, a praia só é atravessar a avenida está com o pés na areia, a localização perfeita, tranquilo, tem um supermercado enorme por trás do hotel,os funcionários muito simpáticos e super atenciosos, o café da manhã sempre diversificado o almoço uma delícia e várias opções tbm, quarto perfeito, só a agradecer a todos que fazem essa família Park Hotel boa viagem Recife♥;os dias se passaram muito rápido;10;;;;;;;;
6 de novembro de 2022;Excepcional;a localização é perfeita, na frente da feirinha de boa viagem.;;;;;;;;;;
o atendimento tbm foi muito bom;;;;;;;;;;;;
"confortável e limpo""";;10;;;;;;;;;;
5 de novembro de 2022;Excepcional;Quarto amplo e arejado. Café da manhã muito farto. Excelente.;Gostei de tudo, mas sugiro deixar no quarto um cobertor.;10;;;;;;;;
1º de novembro de 2022;Satisfatório;gostei do tamanho dos quartos e o café da manhã.;o ar condicionado estava fraco, o vaso entupido e um dos funcionários ficou falando mal e com nomes criticando pessoas de determinado partido, sendo que estava claro qual partido nós éramos. achei indelicado e as coisas que ele falou eram agressivas.;6;;;;;;;;
31 de outubro de 2022;Ótima localização, café, conforto amei tudo;Perfeita em tudo;;10;;;;;;;;
30 de outubro de 2022;Vele pela localização e preço.;Localização e preço.;Baixa resolutividade de problemas apresentados.;6;;;;;;;;
27 de outubro de 2022;Localização perfeita!;Excelente localização, perto de muita coisa, feirinha, restaurantes, supermercado, bancos...etc. Ótimo hotel, com quarto bem arrumado e limpo. Café da manhã muito bom e o atendimento excelente! Recomendo!;Não tivemos problemas!;10;;;;;;;;
24 de outubro de 2022;Excepcional;Atendimento;;10;;;;;;;;
22 de outubro de 2022;recomendo! 👍🏻;Dos quartos, são ótimos!! ;;;;;;;;;;
"super confortável e grandes""";;10;;;;;;;;;;
21 de outubro de 2022;Ruim;Não me hospedaria de novo. O staff é ótimo. O pessoal muito atencioso. Bem localizado.;Pedi para limparem o quarto, o banheiro continuou sujo. Tinha deixado cabelo no box que continuou do jeito que estava. Parece que só juntaram as coisas no lugar. Bem sapecado mesmo. Banheiro escuro. Chuveiro velho e não esquenta muito. Tive a impressão de ser um local sujo desde a hora que cheguei. Cortinas com cara de sujas. Mofo.;3;;;;;;;;
20 de outubro de 2022;Foi sensacional!;Excelente localização e quarto amplo, confortável e limpo;Gostei de tudo;10;;;;;;;;
19 de outubro de 2022;Maravilhosa;Tudo;Td perfeito nada a reclamar;10;;;;;;;;
19 de outubro de 2022;Excepcional;Otima localização;;10;;;;;;;;
18 de outubro de 2022;Ótima;De tudo localização ótima.cafe da manhã farto . Limpeza;De nada;10;;;;;;;;
17 de outubro de 2022;Excelente hotel.;Funcionários muito prestativos e simpáticos, café da manhã excelente e ótima localização.;Nada a reclamar.;10;;;;;;;;
17 de outubro de 2022;Excepcional;Gostei de tudo, quarto muito confortável, café da manhã excepcional, funcionários prestativos;;10;;;;;;;;
17 de outubro de 2022;Boa estadia;Equipe agiu com profissionalismo.;;;;;;;;;;
Quarto e banheiro confortáveis com o que foi prometido na reserva. Opção de temperatura no chuveiro; espelhos grandes; gavetas; varal de chão...;;;;;;;;;
Café da manhã gostoso; típico e com variedade; o refeitório tem janelas para a pracinha e vista da praia.;;;;;;;;;;
Localização ótima para sair a passeios; com farmácia e supermercado próximos;" além da pracinha que é um ponto turístico.""";Peguei um quarto com mais vista para uma obra do que para o mar.;10;;;;;;;;
17 de outubro de 2022;Muitoo boa a estadia.;Gostei de tudo , principalmente da localização.;De um momento, constrangedor de um hóspede, que entrou no hotel e deixou o elevador e hall de entrada com o mal cheiro insuportável. Pois não segurou suas necessidades fisiológicas, e sujou tudo. Mas acredito, que foi alheio a sua vontade. Mas foi constrangedor.;10;;;;;;;;
15 de outubro de 2022;Felicidade total;Período de 10 à 12/10/2022, achei o padrão excelente, conforto, localização 10 e custo.;;;;;;;;;;
Obrigada por nos fazer feliz.;;;;;;;;;;;;
As ofertas de estadias em Recife são muitas e deixa uma certa insegurança em escolher a melhor graças à Deus; nossa experiência foi a melhor possível. ;;;;;;;;;;;
Além do hotel nos oferecer o que queríamos a localização para tudo numa hospedagem; Praia; supermercados; farmácias; restaurantes e a feirinha de artesatos diariamente tudo na porta do hotel. ;;;;;;;;
Café da manhã excelente. ;;;;;;;;;;;;
"Cleidimar e Luiz""";Não temos.;10;;;;;;;;;;
14 de outubro de 2022;Hotel excelente, muito confortável, limpo e bem localizado.;Gostei de tudo nesse hotel. Uma pena que ficamos pouquíssimo tempo. Mas minha família e eu fomos muito bem atendidos e ficamos muito bem hospedados. A localização é perfeita. As janelas têm vista para o mar. O café da manhã é bem gostoso. E os quartos são bonitos, limpos e confortáveis. Importante: o hotel fica perto do aeroporto, então o taxi fica barato e não precisa de correria para chegar lá.;Não tenho nada a reclamar. Só acho que poderia ter tomada perto das camas para ajudar a carregar os celulares, mas o fato de não ter não atrapalhou nada.;10;;;;;;;;
13 de outubro de 2022;Excepcional;Achei o café da manhã muito bom e variado. A localização muito boa.;sem comentários;10;;;;;;;;
13 de outubro de 2022;Excelente;Cordialidade dos funcionários, o quarto muito bom, limpeza é a vista!;;10;;;;;;;;
13 de outubro de 2022;Razoável.;Localização.;Ar condicionado não funcionou.;6;;;;;;;;
11 de outubro de 2022;Excepcional;Gostei da receptividade dos funcionários, muito educados, muito simpáticos e assertivos, notal mil pra todos os funcionários desse hotel. Local limpo, tudo cheiroso, cafe da manhã espetacular. Quarto bem claro, bem arejado. Ótimas instalações. Chuveiro ótimo. Facilidades como shampoo, secador de cabelo. Super seguro, uma vez que viajei sozinha!!! Simplesmente amei. Tudo excelente!!! Quero voltar e voltarei pro mesmo hotel.;Não gostei de ter uma estadia curta. Queria morar nesse hotel. Maravilhoso. Amei tudo.;10;;;;;;;;
11 de outubro de 2022;Acima das expectativas.;Localização muito boa. Café da manhã e atendentes da cozinha, recepção e limpeza, sempre atenciosos.;Piscina pequena, bordas altas, apesar do serviço de toalhas e restaurante bem satisfatórios.;10;;;;;;;;
9 de outubro de 2022;Muito boa experiência.;Café da manhã muito bom com muitas opções.;;10;;;;;;;;
7 de outubro de 2022;Decepcionante;Faltou luz a noite toda e o gerador só atendia as áreas comuns e elevador, os quartos ficaram sem energia não tinha como ligar ar condicionado, luzes , tomadas, enfim NADA. Pelo preço cobrado teriam que no mínimo terem um GERADOR para atendimento aos clientes em suas acomodações.;;4;;;;;;;;
7 de outubro de 2022;Hotel decadente;Localização;Café da manhã;;;;;;;;;
Cama;;;;;;;;;;;;
TV não smartv; e sem canais a cabo;;;;;;;;;;;
"Internet péssima""";5;;;;;;;;;;;
7 de outubro de 2022;Excepcional;De tudo;;10;;;;;;;;
7 de outubro de 2022;Satisfatório;Cordialidade equipe recepção;Limpeza , dedetizacao, manutenção.;6;;;;;;;;
6 de outubro de 2022;Custo benefício;Localização boa, próximo ao aeroporto.;Local não tem estacionamento, paguei um valor para uma empresa conveniada e meu carro ficou no Sol em frente ao hotel. Peguei um quarto com vista para o mar, me colocaram em um quarto com vista para uma construção inacabada, tive que argumentar muito para conseguir o que eu havia contratado.;6;;;;;;;;
4 de outubro de 2022;Excepcional;Café da manhã maravilhoso, com varias opções.;;10;;;;;;;;
4 de outubro de 2022;Satisfeito;Localização excelente, com tudo pertinho.;I hotel é excelente, os funcionários e acomodação. Estão de parabéns;10;;;;;;;;
4 de outubro de 2022;não vale a pena;educação dos colaboradores;estrutura, insegurança do local;1;;;;;;;;
2 de outubro de 2022;Aceitável;Bom café da manhã, localização maravilhosa, equipe cordial.;Elevadores em constante manutenção, andar baixo muito barulhento, quarto antigo, ar condicionado insuficiente para o quarto, péssimo wifi, cobrança indevida de frigobar no checkout.;5;;;;;;;;
1º de outubro de 2022;Excepcional;Tudo excelente. ;;;;;;;;;;
Esse hotel merece nota 1.000;;;;;;;;;;;;
"5 estrelas.""";;10;;;;;;;;;;
30 de setembro de 2022;Excepcional;Quarto super espaçoso, com uma vista maravilhosa, tudo muito limpo e agradável, café da manhã delicioso, localização nota mil.;De ter ficado só uma noite, foi difícil voltar pra casa 😂 Espero retornar em breve ❤;10;;;;;;;;
30 de setembro de 2022;Excelente. Voltarei.;Café da manhã excelente! Variado e gostoso Serviço eficiente.;;10;;;;;;;;
28 de setembro de 2022;Boa localização e equipe nota 10.;Ambiente agradável, próximo do mar, espaço amplo, café da manhã maravilhoso e equipe muito receptiva, com destaque aos garçons do restaurante que são muito divertidos.;;10;;;;;;;;
28 de setembro de 2022;Excepcional;Gostamos de tudo;Não teve, tudo perfeito;10;;;;;;;;
28 de setembro de 2022;limpeza do banheiro precária;o conforto da cama, café da manhã e da localização.;limpeza precária. o banheiro tem vários bichinhos de banheiro, o box todo marcado de sujeira. A limpeza do banheiro é muito ruim.;6;;;;;;;;
27 de setembro de 2022;Excepcional;Gostei do hotel, funcionários educados e prestativos , excelente localização, ponto de táxi ao lado do hotel. Ótimo custo-benefício.;Nada a reclamar.;10;;;;;;;;
27 de setembro de 2022;Excepcional;#NOME?;;;;;;;;;;
#NOME?;;;;;;;;;;;;
#NOME?;;;;;;;;;;;;
#NOME?;;;;;;;;;;;;
"-Hotel estava lotado mas ainda assim tudo fluiu bem""";#NOME?;;;;;;;;;;;
-O acesso a piscina é extremamente dificil com varios degraus e confuso . Pessoas com dificuldade de locomoção; carrinhos de bebê e etc. não tem acesso ja que são mais de 30 degraus de escadas + corredores confusos.;;;;;;;;;;;
"-Chuveiro antigo ou era muito quente ou muito frio.""";10;;;;;;;;;;;
26 de setembro de 2022;Excepcional;Tudo perfeito, café da manhã, funcionarios muito atenciosos, localização ótima.. voltarei com certeza de Deus quiser.;;10;;;;;;;;
26 de setembro de 2022;Limpeza ruim;A localização é boa, embora com muitas pessoas em situação de rua no entorno. O café da manhã é variado.;A limpeza deixa muito a desejar. O banheiro tinha mau cheiro de xixi, dando a impressão de que não é lavado com frequência. As instalações já estão mais velhas.;6;;;;;;;;
25 de setembro de 2022;Excepcional;A localização do hotel é excelente, fica em frente a feirinha permanente e a praia. O atendimento da recepção do hotel e de todos os funcionários é maravilhosa! Parabéns a equipe! A vista do quarto fez toda diferença.;;10;;;;;;;;
25 de setembro de 2022;Excepcional;De tudo!! Café da manhã maravilhoso, os quartos perfeitos;Não teve;;;;;;;;;
"Ahhh tive que vim embora 😔""";10;;;;;;;;;;;
25 de setembro de 2022;Excepcional;Muito bom;Café;10;;;;;;;;
19 de setembro de 2022;óTimo custo benefício;quarto espaçoso, chuveiro ótimo, muito confortável.;;10;;;;;;;;
17 de setembro de 2022;Excepcional;Ótima localização.;;;;;;;;;;
;;;;;;;;;;;;
"Cama confortável.""";;10;;;;;;;;;;
13 de setembro de 2022;Excepcional;Quarto grande, acima da média, cama confortável, secador de cabelo no banheiro, café da manhã com boas opções. A localização também é muito boa, a poucos metros da praia de Boa Viagem;O hotel indicou que havia quartos de frente pro mar, mas a vista não compensa. Há um predio a frente que tampa a maior visão para o mar.;10;;;;;;;;
13 de setembro de 2022;Excepcional;Tudo perfeito.;;10;;;;;;;;
11 de setembro de 2022;Excepcional;O Quanto a equipe de funcionários foi atenciosa;;10;;;;;;;;
10 de setembro de 2022;vista linda e bom atendimento;a localização é excelente e o café da manhã uma delícia!!;o banheiro precisa de uma reforma;10;;;;;;;;
10 de setembro de 2022;Agradável;Ótima localização, quarto enorme, disponibilizaram berço e estava tudo limpo e cheiroso.;Precisei esquentar a comida que havia levado para minha filha e disseram que talvez o pessoal do restaurante esquentaria por ser para criança...esquentaram...mas poderiam ter sido mais solícitos ao pedido.;10;;;;;;;;
8 de setembro de 2022;Razoável;Elevadores super rápidos. Café da manhã com opções variadas. Localização muito boa, ao lado da feirinha de boa viagem.;O quarto quase não tem isolamento acústico, acordei todos os dias com barulho do pessoal do próprio hotel. Falta tomada próxima da cama. A TV é muito mal posicionada. O ar condicionado estava com a palheta quebrada, não conseguimos direcionar o vento para cima. Internet lenta. Chuveiro elétrico ruim de ajustar a temperatura.;5;;;;;;;;
7 de setembro de 2022;Bem localizado, ótima recepção e suíte confortável.;Da localização do hotel, do espaço e da divisão da suíte.;Atendeu nossa expectativa.;10;;;;;;;;
6 de setembro de 2022;Ótimo hotel para se hospedar em Boa viagem.;Tudo maravilhoso 👏;;10;;;;;;;;
6 de setembro de 2022;Excepcional;Localização, café da manhã.;Poucas tomadas no quarto, difícil usar o chuveiro.;10;;;;;;;;
6 de setembro de 2022;O cheiro ruim do banheiro não impediu que apreciássemos as boas condições gerais do hotel no que se refere as instalaçõe;localização.;O banheiro tinha cheiro ruim a ponto de passar pro quarto.;10;;;;;;;;
4 de setembro de 2022;Excelente;Localização, atendimento, higiene, alimentação e conforto;Estacionamento pago;10;;;;;;;;
4 de setembro de 2022;Satisfatório;Localização e café da manhã razoável.;Limpeza da acomodação. Roupa de cama. Ausência de ducha (chuveirinho) para banhar crianças.;6;;;;;;;;
4 de setembro de 2022;De maneira geral a estadia foi agradável.;O café da manhã e a localização do hotel são bons. O pessoal do atendimento e da limpeza são muito educados e prestativos.;#NOME?;;;;;;;;;
#NOME?;;;;;;;;;;;;
#NOME?;;;;;;;;;;;;
"- a energia elétrica caiu duas vezes durante a noite""";6;;;;;;;;;;;
4 de setembro de 2022;Não gostei;Atendimento bom ;;;;;;;;;;
"Café da manhã bom""";Banheiro antigo;;;;;;;;;;;
Chuveiro ruim;;;;;;;;;;;;
Tv pequena;;;;;;;;;;;;
Cama ruim;;;;;;;;;;;;
Travesseiro ruim;;;;;;;;;;;;
"Toalhas encardidas""";5;;;;;;;;;;;
3 de setembro de 2022;Excepcional;Maravilhoso;;10;;;;;;;;
2 de setembro de 2022;razoável.;localização ;;;;;;;;;;
2 de setembro de 2022;Simplesmente fantástico.;A gentileza e profissionalismo das recepcionistas faz a diferença. Você se sente acolhido, e só dá vontade de ficar mais tempo.;;;;;;;;;;
"Café da manhã muito bom.""";Nenhuma coisa negativa a relatar.;10;;;;;;;;;;
2 de setembro de 2022;Tranquila e bem aproveitada;Hotel movimentado, mas os funcionários dão conta. Equipe prestativa. Localização boa, porém é preciso tomar cuidado com a população de rua que fica na praça próximo ao hotel. Tudo muito próximo como supermercado, farmácia e restaurantes;Não tive problema nenhum na minha estadia. Não contar com a área da piscina, é pequena e sem atrativo;10;;;;;;;;
30 de agosto de 2022;Muito ruim;A única coisa boa foi o atendimento dos funcionários.;O quarto 806 que fiquei foi decepcionante, lençóis encardidos, a cama era mto velha, parece que tinha bichinho de ácaro no colchão pois ficamos coçando, minha filha está com a pele irritada e acredito ter sido do colchão.;;;;;;;;;
;;;;;;;;;;;;
Em baixo da cama tinha um outro colchão velho e bem sujo escondido. ;;;;;;;;;;;;
;;;;;;;;;;;;
O box do banheiro tinha vazamento de água; deixando molhado o piso de fora do box.;;;;;;;;;;;
;;;;;;;;;;;;
O quarto tinha aspecto de sujo; cheiro ruim; cortinas sujas. Não sei se todos os quartos estão assim;" mas o que fiquei precisa urgente de cuidados. Pelo preço a experiência foi ruim.""";2;;;;;;;;
29 de agosto de 2022;Razoável;Ótima localização, com vista para o mar. Quarto espaçoso e bem limpo, camas confortáveis, bom café da manhã, funcionários atenciosos.;Retornamos ao hotel por volta das 22h30 e não havia energia elétrica nos quartos. O problema (que estava ocorrendo apenas no hotel, e não na região) foi solucionado somente por volta das 02h30 da manhã.;6;;;;;;;;
27 de agosto de 2022;Muito bom .;Boa localização quarto muito confortável e café da manhã muito bom!;Só tinha manteiga congelada!;10;;;;;;;;
25 de agosto de 2022;Fui ao inferno com a ineficiência da internet e ao paraiso com o café da manhã. Não voltarei;O café da manhã é excelente e o atendimento foi incrível. todos os funcionários muito educados e competentes, no entanto o hotel não tem sistema de wi-fi, e isso me deixou bastante irritado e insatisfeito, pois eu precisava da internet para trabalhar a noite e simplesmente o sinal não pega dentro do quarto. e nos demais andares ocorre da mesma forma. Isso deve ser informado antes da reserva, me senti enganado;apenas fiquei bastante insatisfeito e me prejudicou e muito o fato da internet wi-fi do hotel ser inexistente. existe sinal no quarto, voce consegue conectar mas não consegue entrar em nenhuma pagina da internet e nem baixar qualquer tipo de documento. apesar de ser uma reclamação recorrente nas avaliações o hotel não informa corretamente isso na reserva ou no ato de entrada. tive meu trabalho bastante prejudicado por isso.;1;;;;;;;;
25 de agosto de 2022;Excepcional;Gostei de tudo!Localização perfeita,atendimento excelente,café da manhã muito bom.Obrigado a todos funcionários e em especial a Bruno que fez nosso check out.;de ter ficado pouco tempo;10;;;;;;;;
25 de agosto de 2022;Tudo muito bom;ótima localização, café da manhã espetacular, tudo muito limpo.;Nada;10;;;;;;;;
24 de agosto de 2022;Excepcional;Ótimo hotel, boa localização e funcionários muito receptivos;;10;;;;;;;;
22 de agosto de 2022;Simplesmente perfeito 😍;Perfeito o melhor atendimento em Hotel em Recife, camareira muito atenciosa, pessoal do restaurante maravilhoso pedi o café da manhã para 05 horas da manhã por que precisava sair muito cedo do hotel e ficou tudo pronto impecável, o menino que carrega malas tem um ótimo atendimento bem atencioso oriento a gente sobre os melhores restaurantes passeios e etc , pessoal do estacionamento muito prestativo, bom conforto do quarto internet muito boa , em fim mudei minha opinião sobre os atendimentos em Recifes que em outros hotéis deixavam muito a desejar eu já estava até desistindo de viajar para Recife até ficar no Park Hotel recomendo e uma e mil vezes voltaria só pelo carinho e profissionalismo dos funcionários parabéns pra vcs continuem assim;Nada para relatar achei tudo simplesmente perfeito , só o conforto do colchão que poderia ser um pouco mais confortável, mais nada que atrapalhasse a viagem;10;;;;;;;;
22 de agosto de 2022;Incomodado com o Barulho.;Atendimento.;Muito Barulho no Apartamento durante a noite e madrugada;6;;;;;;;;
22 de agosto de 2022;ótimo custo benefício na praia de Boa Viagem!;Gostei demais de nossa estadia no Park Hotel. Equipe atenciosa, café da manhã incrível, limpeza do quarto impecável, chuveiro com uma pressão e temperatura perfeita.;;10;;;;;;;;
22 de agosto de 2022;Excepcional;café da manhã e quarto;nada;10;;;;;;;;
21 de agosto de 2022;Excepcional;Já sou hospede frequente;Nada;10;;;;;;;;
20 de agosto de 2022;Otimo custo beneficio, fiquei apenas uma noite de passagem, porem um otimo hotel.;boa localização, cafe da manha bom, quarto com vista maravilhosa e limpinho.;praia nao era como eu imaginava;10;;;;;;;;
