data_avaliacao;titulo;comentario_positivo;comentario_negativo;nota;;;;;;;;
A vista é boa ; porém tem um prédio bem de frente mais da pra ver o mar mesmo assim ;;;;;;;;;;;
"Música ao vivo ambiente tranquilo da pra curtir mesmo estando com criança.""";Primeiro que o hotel está em reforma e vc só fica sabendo depois que fecha a estadia .;;;;;;;;;;;
 Cheguei no hotel e a roupa de cama estava suja (foi trocada mais deixada no meu quarto);;;;;;;;;;;;
 No café da manhã tinha casca de ovo caldo. Os demais itens estavam bons. ;;;;;;;;;;;;
 No último dia liguei na recepção as 07:30 para prolongar a estadia pois meu voo havia mudado o horário e o atendente informou que só o próximo turno poderia ver se era possível estender a estadia . ;;;;;;;;;;;;
"Por fim não estendi pois o valor saeria muito alto para apenas 3 horas a mais e ninguém se prontificou a atender minha solicitação .""";5;;;;;;;;;;;
8 de março de 2025;Excepcional;Tudo;Poucas tomadas no quarto;10;;;;;;;;
7 de março de 2025;Muito ruim;No hotel? Nada, pois nos deram um quarto péssimo.;Do atendimento na recepção do hotel.;2;;;;;;;;
7 de março de 2025;Excepcional;muito bom;;10;;;;;;;;
7 de março de 2025;Decepcionante;Praticamente nada;Muito sujo. Lençóis sujos e banheiro imundo;2;;;;;;;;
5 de março de 2025;Muito boa;Quarto confortável. Localização muito boa. Café da manhã gostoso.;O ar condicionado não estava gelando muito bem. Acabou que na correria não fiz essa reclamação. Mas fica de atenção para a próxima estadia no quarto.;10;;;;;;;;
5 de março de 2025;Péssimo;Realidade totalmente diferente das fotos. E não é por questão da situação da reforma que está sendo realizada, uma vez que reforma era na fachada. Os quartos, banheiro, recepção, restaurante antigos, sujos, com mofo, falta capricho no geral.;;1;;;;;;;;
2 de março de 2025;Ótima opção em Recife;Ótimo custo benefício e super bem localizado.;;10;;;;;;;;
1º de março de 2025;Perfeita;Conforto, ótima localização e excelente atendimento!;Nada;10;;;;;;;;
28 de fevereiro de 2025;Foi bom;Possui ótima localização, meninas da limpeza são super simpáticas. Bar do terraço super gostoso.;O banheiro parece ter pouca manutenção, um tanto deteriorado, com vazamento e tampa do assento sanitário solta.;6;;;;;;;;
27 de fevereiro de 2025;Amei e voltaria;Amei que ofertaram passadeira para nós.;Banheiro com chuveiro frio;10;;;;;;;;
27 de fevereiro de 2025;Voltarei na próxima viagem.;Gostei de tudo, quarto muito confortável, café excepcional.;;10;;;;;;;;
26 de fevereiro de 2025;Excepcional;O rooftop é maravilhoso e o café da manhã também;Achamos o banheiro bem antigo, mas funcionava bem;10;;;;;;;;
23 de fevereiro de 2025;Que desse o horário do meu voo para ir embora!!!;Muito sujo!;;;;;;;;;;
"Café da manhã horrível.""";;1;;;;;;;;;;
23 de fevereiro de 2025;Perfeita, adorei tudo.;Localização, estrutura do hotel, café da manhã.;Não tenho nada a acrescentar.;10;;;;;;;;
22 de fevereiro de 2025;Excelente!;Tudo!;Nada;10;;;;;;;;
21 de fevereiro de 2025;Excelente;Academia excelente ;;;;;;;;;;
Café da manhã excelente ;;;;;;;;;;;;
"Quarto bem amplo""";;10;;;;;;;;;;
20 de fevereiro de 2025;Ótimo custo benefício! Vale muito a pena;Funcionários são muito solícitos! Fizeram de tudo pra me ajudar e foram muito dispostos. O rooftop é maravilhoso, quarto tamanho bom.;Pressão do chuveiro fraca;10;;;;;;;;
17 de fevereiro de 2025;Minha estadia foi excelente!;Piscina, restaurante da área da piscina porque tinha uma comida excelente!!;;;;;;;;;;
Quarto super aconchegante; cama grande e confortável.;;;;;;;;;;;
Café da manhã bem servido!;;;;;;;;;;;;
Ótima localização;" muito perto do aeroporto.""";Academia poderia ser um pouco melhor, mas atende um treino nas férias.;10;;;;;;;;;
13 de fevereiro de 2025;Maravilha de hospedagem;Tudo;Nada a relatar;10;;;;;;;;
12 de fevereiro de 2025;O Park Hotel é TOP!!;Apesar do Hall de entrada estar em reforma, tudo o mais foi perfeito: Recepção, Café, funcionários etc. A localização do hotel foi o que mais superou nossas expectativas. Parabéns ao hotel!!;Não houve nada do que não gostamos, graças a Deus.;10;;;;;;;;
12 de fevereiro de 2025;ok;Quarto grande e a piscina é linda.;A recepção é bem confusa. Reservei um quarto com camas separadas e me enviaram para um com cama de casal. Após reclamar trocamos de quarto mas no sistema continuou constando o quarto antigo e eu não conseguia fazer nenhum pedido para o quarto pois no sistema eu não aparecia no quarto e eles não resolveram o problema.;;;;;;;;;
"O hotel está em obras e não há entrada de pedestre. Para entrar no hotel precisa disputar espaço com os carros e desviar da obra. Acabei tropeçando e me machucando.""";6;;;;;;;;;;;
9 de fevereiro de 2025;Satisfatório;Localização ótima, em frente a feirinha de onde saem vários passeios , café da manhã bom;Estava em reforma, então mto barulho e fluxo de gente … já havia me hospedado anteriormente e a experiência foi diferente;6;;;;;;;;
9 de fevereiro de 2025;Excepcional;Hotel é muito bom, quarto com ampla vista para o mar, confortável e limpo. Banheiro amplo. Café da manhã muito bom! Funcionários muito solícitos! Área da piscina é maravilhosa! Adoramos o restaurante!!;;10;;;;;;;;
7 de fevereiro de 2025;Já foi uma ótima opção! Caiu muito!;A localização é excelente!;O hotel está em obras, os quartos precisam de modernização, o café da manhã não estava bom e havia fila para poder descer nos elevadores!;5;;;;;;;;
3 de fevereiro de 2025;Excepcional;Café da manhã excelente, completo e delicioso. Localização excelente, ao lado da pracinha de boa viagem, muito próximo ao aeroporto. Vista linda, rooftop 17 maravilhoso, piscina ótima. Acomodações muito boas.;Senti falta de sacada no quarto.;10;;;;;;;;
31 de janeiro de 2025;Ainda vale;Localização e apartamento;Internet e o rapaz que nos atendeu foi estremamente mal educado;6;;;;;;;;
30 de janeiro de 2025;Os dias que fiquei nesse hotel serão memoráveis local perfeito;A vista para o mar;Falta um espelho grande de corpo inteiro na habitação e cabideiro nas paredes para pendurar roupas ,toalhas etc;10;;;;;;;;
29 de janeiro de 2025;Satisfatório;Localização boa;Salão do café da manhã pequeno para o número de hóspedes o que gerava fila para o café da manhã;6;;;;;;;;
29 de janeiro de 2025;Adorei! Voltaria;Tudo estava ótimo! bom café da manhã, confortável e bem localizado.;;10;;;;;;;;
27 de janeiro de 2025;Muito Top;De tudo as comidas e atendimento atencioso muito bom.;Não tenho o que falar;10;;;;;;;;
24 de janeiro de 2025;Excepcional;O que mais gostamos foi a localização, fica a uns 15 minutos do aeroporto e uns 10 do shopping Recife, além de ficar praticamente de frente para a praia de Boa Viagem e como bônus ao lado da Igreja Nossa Senhora da Boa Viagem. (Ao lado da igreja fica uma feirinha muito boa, com preços melhores que Olinda e Centro Histórico). Não deixe de conhecer o restaurante que fica no 17* andar.;Nada!!!;10;;;;;;;;
21 de janeiro de 2025;Excepcional;Rooftop espetacular para um fim de tarde + Boa localização + Quarto espaçoso.;;10;;;;;;;;
21 de janeiro de 2025;nao volto;localizaçao;quarto e banheiro precisam de manutenção;;;;;;;;;
frente do hotel estava em construção;;;;;;;;;;;;
"hotel bem velho""";5;;;;;;;;;;;
21 de janeiro de 2025;Agradável mas poderia ser melhor pelo preço;A localização é ótima;O café da manhã poderia ser mais completo pelo custo da diária;6;;;;;;;;
20 de janeiro de 2025;Excepcional;Comida. Localização. Quarto;;10;;;;;;;;
18 de janeiro de 2025;CAÓTICO;;EQUIPE TOTALMENTE DESPREPARADA PARA A QUANTIDADE DE HÓSPEDES EM HORARIOS DE CHECKIN E CHECKOUT. ;;;;;;;;;
RECEPÇÃO SEM ARCONDICIONADO; AO SOLICITAR PARA AGUARDAR O HORARIO DO CHECKIN NO RESTAURANTE DO HOTEL SIMPLESMENTE NÃO PERMITIRAM ( EU VIAJEI PARA FAZER PROVA DE CONCURSO E ESTAVA ESTUDANDO;" SÓ QUERIA UM LOCAL PARA SENTAR E ESTUDAR NO SILÊNCIO). FORA O BARULHO DE BRITADEIRA POIS ESTAVA EM OBRAS - E POR ISSO ENTRADA E SAÍDA MAL SINALIZADA PARA O HÓSPEDE.""";3;;;;;;;;;
17 de janeiro de 2025;Ótima estadia em. Recife;O novo espaço da piscina e bar no último andar ficou excelente;Tudo tranquilo;10;;;;;;;;
15 de janeiro de 2025;Boa hospedagem;Café da manhã, piscina, limpeza.;Nada demais.;10;;;;;;;;
14 de janeiro de 2025;Excepcional;Funcionários super atenciosos e simpáticos, parece que já nos conhecem, super amáveis. Anderson do restaurante é maravilhoso, ganhou o respeito e admiração da nossa família. Café da manhã espetacular. Suite com vista para o mar. Com certeza voltando a Recife a opção de hospedagem será está.;;10;;;;;;;;
13 de janeiro de 2025;Está em reforma e é bem localizado.;Localização e tamanho do quarto. Recepção muito solícita!;O banheiro não tinha nenhuma ventilação e o box não tinha iluminação.;6;;;;;;;;
12 de janeiro de 2025;custo muito alto para um hotel muito pobre;localização boa;cafe da manha. limpeza, material de banheiro. entrada em construção enao fui avisado.;4;;;;;;;;
11 de janeiro de 2025;Bom custo e benefício em Recife;Localização e café da manhã;Nada a destacar;10;;;;;;;;
10 de janeiro de 2025;Não gostei, não recomendo, não voltaria.;Da piscina no 17º andar ( apenas) e a alternância do café da manhã ( mas não tem muitas variedades);Primeiro disse que o estacionamento era incluso : não era, tinha que pagar 30,00 reais a diária. Depois que não era bem na frente da praia de boa viagem, é uma rua atrás. Sem contar que a frente do hotel bem destruída. Banheiro pequeno. Comida: tapioca péssima, sem muitas variedades de fruta, nem boas opções fitness e de intolerância, não vendo essa diversidade do público.;1;;;;;;;;
6 de janeiro de 2025;Satisfatório;Localização perfeito, custo-beneficio otimo;Edificio em obras no periodo de fim de ano, hotel lotado faltou travesseiro;6;;;;;;;;
6 de janeiro de 2025;Muito conforto, boa localização;Localização. Piscina e área de lazer. Café da manhã. Banheiro e camas do quarto;O ar condicionado poderia funcionar um pouco melhor;10;;;;;;;;
5 de janeiro de 2025;Excelente benefício a custo acessível;Localização, conforto, limpeza;Nada a reclamar;10;;;;;;;;
5 de janeiro de 2025;Aceitável;Localização.;Cama e travesseiros ruins, carpet sujo e com cheiro de velho no corredor aos quartos, toalhas velhas e encardidas, chuveiro elétrico fraco, box do banheiro sempre entupido com alagamento, piso quarto com bastante umidade.;5;;;;;;;;
4 de janeiro de 2025;Maravilhoso o hotel;Localização, limpeza;Gostamos de tudo;10;;;;;;;;
4 de janeiro de 2025;Excelente!;Gostamos de tudo: conforto do quarto, atendimento dos funcionários, café da manhã (completo e gostoso), área da piscina (que também fica anexa a um Rooftop - que é excelente), e a localização do hotel.;Embora não seja motivo para retirar o 10, observo que as instalações do hotel são um pouco antigas (acredito que eles estão pensando em reformular isso). Atrelado a isso, vaza muito som do corredor para o quarto.;10;;;;;;;;
3 de janeiro de 2025;Top;Localização perfeita. Atendimento e área da piscina show.;;10;;;;;;;;
3 de janeiro de 2025;Péssima higiene e muito caro pelo que oferecem;Da localização;A limpeza é horrível. Quando chegamos, o quarto estava cheio de formigas por todos os lados, porque eles deixam chocolates em cima do frigobar e isso atrai animais. Pela manhã, alem de formigas, tinha uma barata. O quarto ficou cheio de cabelos após a limpeza e não limparam nada bem, o ralo do banheiro estava travado e não abria, então a água ficava empoçada e não descia. Eu tive que pegar uma faca para abrir o ralo, pq a água estava quase transbordando. Enfim, não vale o dinheiro cobrado. Não recomendo! 👎;3;;;;;;;;
3 de janeiro de 2025;otimo custo beneficio;cafe da manhã bastante variado. é a seunda vez que me hospedo lá e não reclamo, preço justo e otima localização, em frente a feirinha e igreja da boa viagem.;;10;;;;;;;;
30 de dezembro de 2024;Satisfatório....boa localização;Localização 1;Tudo a contento;10;;;;;;;;
30 de dezembro de 2024;Estadia maravilhosa!!!!;Olha acho o hotel perfeito ,ótimo custo benefício ,quarto amplo com bom ar !!!!;;;;;;;;;;
Piscina showww!!!!!;;;;;;;;;;;;
O novo rooftop17 é fantástico; atendimento e comidas top...comemos todos os dias!!!!;;;;;;;;;;;
"Já reservei para 2025!!!!""";A limpeza só que podia melhorar um pouco... mais não atrapalha a estadia em nada !!!!hote maravilhoso, já nós hospedamos 3 vezes e já reservei para 2025!!!!;;;;;;;;;;;
A academia poderia ter um aparelho p abdômen; fui todos os dias ;mas ela é muito aconchegante;" recomendo!!!!""";10;;;;;;;;
30 de dezembro de 2024;Tudo maravilhoso, Roof Toof e piscina perfeita!!!;Tudo, lugar perfeito!!!;Nada a reclamar lugar maravilhoso;10;;;;;;;;
29 de dezembro de 2024;Excepcional;Do tamanho do quarto e da piscina;;10;;;;;;;;
29 de dezembro de 2024;Experiência incrível e com certeza voltarei;O lugar é maravilhoso e o atendimento impecável, sempre presando o bem estar do hóspede;;10;;;;;;;;
29 de dezembro de 2024;Excepcional;Gostei de tudo. A localização, o quarto, serviço de quarto, piscina com serviço de bar excelente. AMEI. Voltaria me hospedar.;;10;;;;;;;;
28 de dezembro de 2024;Excepcional;A localização do hotel é muito boa, os quartos são confortáveis e o café da manhã é bom.;As instalações do hotel são mais antigas e de vez enquando há congestionamentos no elevador e no restaurante que serve café da manhã.;10;;;;;;;;
26 de dezembro de 2024;Excepcional;O hotel tem uma estrutura excelente, adoramos o café da manhã e o restaurante na cobertura. A academia é pequena mas dá para fazer o essencial. Voltaria com certeza!;;10;;;;;;;;
25 de dezembro de 2024;Esperávamos mais pela propaganda!;Pontos positivos são a piscina e o rooftop. Alguns funcionários (camareira) muito educada e prestativa.;De resto, ficou muito a desejar. Camas desconfortáveis, roupas de cama e banho velhas, café simples, hotel em reforma com barulho intenso...;6;;;;;;;;
24 de dezembro de 2024;Excepcional;Tudo maravilhoso, café da manhã, o quarto super confortável os funcionários maravilhoso, tirando a reforma que estão fazendo na frente do hotel mais creio que seja para melhorar mais ainda o confronto dos hóspedes.;;10;;;;;;;;
24 de dezembro de 2024;Excepcional;Localização excelente. Quarto confortável. Comida muito boa e com preço justo. Piscina com vista muito bonita.;Nada que possa reclamar;10;;;;;;;;
24 de dezembro de 2024;Foi tudo agradável.;Tudo foi muito bom. Nota MIL;Gostei de tudo.foi;10;;;;;;;;
23 de dezembro de 2024;A localização é muito boa, o Hotel é bem antigo mas estava em reforma, custo benefício resoável.;O café da manhã estava muito bom, mutas frutas e bem completo;O colchão da cama de casal era bem antido estava mole e bem afundado, embora o Hotel estivesse em reforma. Espero que troquem também os colchões. Tinha um restaruante bem ao lado do HOTEL na praça com música ao vivo em volume excessivo só parou de tocar as 23:00 parecia que o CANTOR DESAFINADO estava dentro do meu quarto, bem provavelmente não me hospedarei nele novamente.;6;;;;;;;;
23 de dezembro de 2024;Péssima!;Localização;Quartos com isolamento acústico PÉSSIMO! Minha hospedagem foi para fazer prova pra concurso no dia seguinte: não consegui dormir bem devido barulho dos outros hóspedes no corredor e no andar de cima! ;;;;;;;;;
"Reservei um quarto com cama de casal. Nos colocaram em um com 2 camas de solteiro!""";1;;;;;;;;;;;
23 de dezembro de 2024;Maravilhosa;Gostei muito da vista do quarto e também do conforto da cama , quarto bem espaçoso;Nada a contestar;10;;;;;;;;
22 de dezembro de 2024;Pernoite em Recife;A localização é boa e o pessoal do check-in, simpático. O roof top passou por uma reforma e está bonito.;Limpeza zero. Havia cabelo no banheiro e a pia tinha restos de pasta de dente. Tb encontrei um tipo de larva no box do chuveiro enqto tomava banho. Só não sai do hotel pq era apenas uma pernoite e o destino final era Japaratinga. O café tb não é bom. Lençóis velhos.;5;;;;;;;;
20 de dezembro de 2024;Não voltarei;Sujas e os lençóis amassados, as paredes próximas a cama sujas estavam sujas o box do banheiro cheio de restos de sabonetes, tão sujo que comprei lenços de álcool 70 e passei nas superfícies. O hotel e área dos corredores e quartos muito sujos.;Quartos com limpeza superficial, cheios de marcas de dedos nas portas puxadores. parede Sujas e os lençóis amassados, as paredes próximas a cama sujas ,o box do banheiro cheio de restos de sabonetes, tão sujo que comprei lenços de álcool 70 e passei nas superfícies. O hotel e área dos corredores e quartos muito sujos.;5;;;;;;;;
19 de dezembro de 2024;Excepcional;Amamos tudo, muito bom!!;;10;;;;;;;;
17 de dezembro de 2024;Foi decepcionante, porque o preço aumentou mais a qualidade não;Quarto velho, estrutura ruim de cama;Quarto ruim, cama ruim e chuveiro ruim;4;;;;;;;;
15 de dezembro de 2024;Perfeita;Excelente acomodação e localização privilegiada, ao lado de uma feirinha muito boa e com preços convidativos . ;;;;;;;;;;
A lado da feirinha de artesanato ; há uma outra de comidas;" não deixem de experimentar o acarajé inigualável!!!!""";;10;;;;;;;;
11 de dezembro de 2024;Maravilha!;Localização perfeita. Os funcionários são simpáticos. O café da manhã é ótimo.;Nada;10;;;;;;;;
9 de dezembro de 2024;Excepcional;Excelente localização e café da manhã.;;10;;;;;;;;
4 de dezembro de 2024;Excepcional;Café da manhã com muitas opções e quarto bastante limpo.;;;;;;;;;;
"O rooftop tem uma vista maravilhosa. E ainda conta com um restaurante excelente.""";;10;;;;;;;;;;
4 de dezembro de 2024;Excepcional;Tudo excelente! Café da manhã excelente, ótima localização e restaurante perfeito.;;10;;;;;;;;
4 de dezembro de 2024;Acredito ter hospedagem mais barato com as mesmas condições;O quarto é bom, mas nada de mais;Alimentação muito caro, café da manhã razoável ;;;;;;;;;
Um cafezinho na área nova custa 8;"60""";6;;;;;;;;;;
3 de dezembro de 2024;Excepcional;Atendimento, limpeza e café da manhã. Tudo excelente, acomodação perfeita também!!;O estacionamento ser pago a parte.;10;;;;;;;;
2 de dezembro de 2024;Excepcional;Quarto, vista da área da piscina, piscina, chuveiros, tudo ótimo, ótimo atendimento na recepção, no restaurante, dos funcionários da piscina, excelente mesmo. Voltarei.;Como é ao lado da praça de artesanato, teve show até 21:00, incomodou um pouco. Mas foi breve.;10;;;;;;;;
30 de novembro de 2024;Excepcional;Da localização, da educação dos funcionários e das instalações no geral;Nada;10;;;;;;;;
29 de novembro de 2024;Espetáculo;Sensacional 👏👏👏👏;Tudo maravilhoso;10;;;;;;;;
28 de novembro de 2024;Gentileza;Gentileza;O café poderia ter mais itens regionais;10;;;;;;;;
28 de novembro de 2024;Muito caro pelo o que oferece;O terraço tem um restaurante espetacular. A piscina é um pouco suja e fria.;Tudo muito velho. Está precisando fazer um retrofit. Estava até bem cuidado. O café da manhã é fraco.;6;;;;;;;;
28 de novembro de 2024;Ótimo;Roof top é o que conquistou nos;O banheiro dos quartos são antigos, precisa de uma reforma;10;;;;;;;;
25 de novembro de 2024;Bom custo-benefício;Café da manhã farto e gostoso. Hotel bem localizado em frente à pracinha da Boa Viagem (feirinha, igreja). Rooftop é bastante agradável.;Nada a reclamar.;10;;;;;;;;
25 de novembro de 2024;Excepcional;Gostei de tudo na hospedagem! Cafe da manhã com varias opções! Localização otima em frente a feirinha de boa viagem !A piscina e magnífica;Nao teve nada q eu nao tenha gostado!me hospedei pela 2a vez;10;;;;;;;;
24 de novembro de 2024;Satisfação;Gostei de tudo, desde o início ao fim, com foco em especial no café da manhã, no pão de queijo, que maravilhoso.;Não se aplica!;;;;;;;;;
"Amamos tudo.""";10;;;;;;;;;;;
21 de novembro de 2024;Foram dias muito agradáveis;Excelente pequeno almoço. Funcionários muito atenciosos e educados. Atendimento ótimo;Nada a acrescentar. Talvez possa sugerir que coloquem luz na área do chuveiro.;10;;;;;;;;
18 de novembro de 2024;Boa localização e boa estrutura;O hotel é muito bom. Bem localizado, limpo e confortável. Quarto era bem amplo. Tem dois restaurantes que servem jantar (e acho que almoço também). Como só fiquei uma noite, apenas jantei. O cardápio é variado, comida gostosa e preço bem acessível. Um dos restaurantes é no terraço junto da piscina, ambiente bonito, mais barzinho. E o outro é no térreo. Recomendo o hotel.;;10;;;;;;;;
18 de novembro de 2024;Estadia simpática !;Muito bom e acessível.;;10;;;;;;;;
17 de novembro de 2024;Ótima hospedagem e hotel maravilhoso;Muito boa! Um hotel maravilhoso, super acolhedor e o pessoal da recepção muito educado, amamos.;Nada! Estava tudo perfeito;10;;;;;;;;
15 de novembro de 2024;Excepcional;ótimo café da manhã, excelente localização.;;10;;;;;;;;
14 de novembro de 2024;Excepcional;Localização perfeita. Hospedagem muito boa. Equipe maravilhosa, bom atendimento. Cordiais, me enviaram frutas de cortesia de aniversário. Amei minha estadia.;Não gostei muito de terem limpado o quarto sem necessidade, quando não estávamos, não tinha nem 10hs que tínhamos entrado. E do barulho da obra ao lado.;;;;;;;;;
"No mais foi perfeito.""";10;;;;;;;;;;;
14 de novembro de 2024;Decepcionante;Quarto é bom e o hotel possui uma otima localização, café da manhã razoável.;Funcionarios mal educados, no nosso checkin faltou a atendente agredir a gente com tamanha falta de educação e antipatia, parecia que realmente estava ofendida em fazer o nosso check-in. Diversas vezes que passamos no saguão os funcionarios não respondiam nosso bom dia/boa noite. Entendo que todos tem dias ruins, mas estão em um segmento com contato ao publico e em hotelaria, educação e bom atendimento é tudo, e não foi o que aconteceu conosco, não voltaremos mais. Limpeza pecou um pouco também, o box do banheiro estava sujo e tinha sangue seco na pia.;4;;;;;;;;
13 de novembro de 2024;Excepcional;Hotel muito bom, funcionarios super educados, fica perto de restaurantes e o comercio. A parte excelente do Hotel e o restaurante que fica no 17 andar Rooftop, que simplesmente de tirar o folego. Super recomendo;Nada;10;;;;;;;;
13 de novembro de 2024;hotel incrível.;A localização é ótima, o atendimento dos funcionários é muito bom, são educados e prestativos, o quanto é amplo e confortável, o café da manhã é muito bom.;foi tudo certo.;10;;;;;;;;
12 de novembro de 2024;Felicidade;Quarto limpo, atendimento muito bom;Nada;10;;;;;;;;
12 de novembro de 2024;hotel ultrapassado e sem conforto com nenhum investimento para acolher hospedes exigentes;nada;tudo;1;;;;;;;;
12 de novembro de 2024;Vale muito a pena;Tudo muito bem limpo (limparam o quarto todos os dias), café da manhã excepcional, funcionários bem receptivos. A vista do quarto maravilhosa, o rooftop muito agradável também.;;10;;;;;;;;
11 de novembro de 2024;Estadia maravilhosa, Rooftop perfeito.;O Hotel é antigo , e está passando por reforma , porém as áreas que ja foram reformadas estão ótimas. Fizeram um Barn a piscina do Rooftop MARAVILHOSO , nem saímos pra jantar fora , comemos todos os dias no bar. A comida estava Ótima e os drinks tbem. A piscina é linda , E A VISTA ENCANTADORA. a REFORMA NÃO ATRAPALHOU EM NADA NOSSA ESTADIA .Amamos o Hotel. A Equipe que cuida do Bar do Rooftop é maravilhosa;O check in demorou um pouco pra ser feito,.;10;;;;;;;;
10 de novembro de 2024;Hotel bom só não gostei do café da manhã;Piscina;café da manhã;6;;;;;;;;
9 de novembro de 2024;Excepcional;-;-;10;;;;;;;;
9 de novembro de 2024;Ótima opção em Boa Viagem;A área de lazer é excelente.;;;;;;;;;;
A comida do restaurante no rooftop é maravilhosa.;;;;;;;;;;;;
A limpeza dos quartos é muito boa.;;;;;;;;;;;;
Fiquei hospedada em 2 quartos diferentes (um na ida e outro na volta de Maragogi): 1110 e 705; no 1110 tinha vista lateral para o mar; mas o banheiro não era muito bom; principalmente o box que não tinha iluminação e era apertado; já no 705 a vista é para um prédio em construção; mas o box é espaçoso e tem boa iluminação; no restante os quartos são muito parecidos.;;;;;;
Há espaço para colocar 2 malas.;;;;;;;;;;;;
Todos os funcionários foram muito simpáticos e atenciosos.;;;;;;;;;;;;
A localização é perfeita; com comércio e restaurantes ao redor;" uma feirinha em frente e praticamente não beira da praia.""";Do box do quarto 1110, é muito mal iluminado e pequeno.;;;;;;;;;
A iluminação dos quartos podia ser um pouco mais clara.;;;;;;;;;;;;
O Café da manhã tem variedade; mas as coisas não são muito saborosas.;;;;;;;;;;;
"Estacionamento é vallet e é cobrado 30 reais a diária.""";10;;;;;;;;;;;
6 de novembro de 2024;Satisfatório;;Hotel muito velho. Tinha um vazamento no banheiro.;6;;;;;;;;
5 de novembro de 2024;Gostaria que as informações sobre o Hotel estivessem disponiveis antes de finalizar a reserva.;O hotel estava em reforma, e vcs não avisaram antes que eu finalizasse a reserva, que não tinha opção de cancelar, a culpa não é do hotel é de vcs.;Da Reforma, muito barulho e confusão.;4;;;;;;;;
4 de novembro de 2024;Excepcional;Gostei da localização , piscina , funcionários , a salada que almocei na piscina estava maravilhosa !!! ;;;;;;;;;;
"Adoramos o hotel .""";O espaço do café da manhã é pequeno para o tamanho do hotel , mas pode ser porque estava em obra;10;;;;;;;;;;
