data_avaliacao;titulo;comentario_positivo;comentario_negativo;nota;;;;;;;;
"O café da manhã e os garçons do restaurante são ótimos. O recepcionista Emannoel é muito simpático.""";O quarto é escuro, talvez tinha uma lâmpada queimada. Os preços do restaurante são salgados e você paga até se solicitar pratos e talheres para refeições compradas fora do hotel. O wi-fi é péssimo. Estava com um elevador em manutenção e demorava bastante para chegar no meu andar. No check-out, colocaram taxas de turismo diárias em minha conta, coisa que não me passaram previamente. Ao dizer que eu não iria pagar, a atendente não me tratou bem e nem me agradeceu pela hospedagem. Seria interessante vocês reavaliarem esse comportamento e procedimento. Não me senti confortável neste momento. Outro ponto ruim é o barulho, pois fica em uma avenida muito movimentada.;7;;;;;;;;;;
25 de setembro de 2023;Hotel com instalações e funcionários super atenciosos;Todas informações e atendimento;;9;;;;;;;;
25 de setembro de 2023;Fantástico;Ótimo atendimento dos funcionários, um variado café da manhã e boa localização do hotel. Um bom custo benefício.;;9;;;;;;;;
25 de setembro de 2023;bom;Vista do quarto para praia de Boa Viagem;1- mofo no teto e nos azulejos do banheiro. ;;;;;;;;;
2- 1 (uma) hora pra conseguir um copo de vidro. Desci para pegar mas foi negado e o recepcionista disse que iriam me entregar no quarto; o que só foi acontecer 50 minutos depois.;;;;;;;;;;;
"3- cortinas do quarto mofadas""";7;;;;;;;;;;;
25 de setembro de 2023;Fantástico;A cama de casal é excelente.;;9;;;;;;;;
25 de setembro de 2023;Muito bom;Localização e café da manhã;;8;;;;;;;;
23 de setembro de 2023;Muito bom;Sim;;8;;;;;;;;
22 de setembro de 2023;Fantástico;Atendimento da equipe.;;;;;;;;;;
;;;;;;;;;;;;
"Destaco a presteza de Emmanoel na recepção.""";;9;;;;;;;;;;
21 de setembro de 2023;Muito boa;Café da manhã e o tamanho do quarto.;A área de lazer estava em obras.;8;;;;;;;;
21 de setembro de 2023;Bom;Localização boa;Instalação;7;;;;;;;;
20 de setembro de 2023;Bom;Café da manhã. Instalações.;Obra em frente do quarto. A noite com o ventania tinha barulho constante.;;;;;;;;;
"Pena obra na piscina""";7;;;;;;;;;;;
20 de setembro de 2023;Muito bom;Localização;Hotel.antigo;8;;;;;;;;
20 de setembro de 2023;Uma estada sem transtornos . Recomendo .;Muito bom .;Variedade maior .;9;;;;;;;;
19 de setembro de 2023;Fantástico;Localização excelente na Praia da Boa Viagem;Quarto amplo, tudo muito limpo e confortável;9;;;;;;;;
18 de setembro de 2023;Muito bom;Excelente café da manhã, boa localização, equipe atenciosa. Vista belíssima.;Quarto precisa de manutenção.;8;;;;;;;;
18 de setembro de 2023;Fantástico;Hotel excelente com preço justo. Quarto confortável com vista para o mar. Localização ótima em Boa Viagem, perto da feirinha da praça e de bons restaurantes. Café da manhã muito bom.;;9;;;;;;;;
18 de setembro de 2023;Hotel com bom custo benefício;Localidade e atendimento;Quarto antigo;8;;;;;;;;
17 de setembro de 2023;Bom;Elevador;Chuveiro;7;;;;;;;;
16 de setembro de 2023;Muito bom;Localização e café da manhã.;A piscina estava em obras.;8;;;;;;;;
15 de setembro de 2023;Estadia regular.;Localização;Camas com colchão desgastados, deformados por muito uso.;7;;;;;;;;
14 de setembro de 2023;Muito bom;;Cama . O colchão estava velho , molas quebradas !;8;;;;;;;;
13 de setembro de 2023;Melhor localização de Recife.;Melhor localização de Recife na minha opinião, desce e já está dentro da feirinha da Boa Viagem e a uma quadra da praia e duas do mercado de boa viagem. Hotel com quartos grandes e estrutura grandiosa.;Piscina estava fechada para reforma e não havia espaço nenhum com brinquedo para crianças.;8;;;;;;;;
13 de setembro de 2023;Muito bom;Localização e café da manhã.;Instalações antigas e a área de lazer estava em reforma.;8;;;;;;;;
13 de setembro de 2023;Hotel que atende a ideia de passar apenas uma noite;Ficamos por uma noite para descansar da viagem de avião e não pegar a estrada à noite. A localização é boa por estar perto da praia de Boa Viagem e do aeroporto. A cama é confortável e nos arranjaram travesseiros adicionais. O café da manhã é ótimo e bem variado.;O prédio é bem antigo e a decoração parece quarto de motel. O estacionamento teve que ser pago à parte no valor de 25 reais (achava que já era incluso).;7;;;;;;;;
12 de setembro de 2023;Muito bom;Funcionários atenciosas, café da manhã bom. Facilidade de locomoção. Sempre táxi à disposição na porta.;Toalhas poderia ser melhor.;8;;;;;;;;
11 de setembro de 2023;Estadia atendeu perfeitamente minhas expectativas.;Ótima localização. Café da manhã muito bom.;Tudo dentro das expectativas.;8;;;;;;;;
10 de setembro de 2023;Muito bom;Conforto do quarto.;;8;;;;;;;;
10 de setembro de 2023;Foi muito boa, somente o susto com o elevador que não foi nada bom. Foi;Café da manhã e localização excelente;o elevador quase fechou na minha filha de 7 anos, ele abriu e fechou muito rápido, poderia ter causado um acidente. Foi na recepção e o pessoal que estava no atendimento pode visualizar. Foi o elevador bem da esquerda.;9;;;;;;;;
9 de setembro de 2023;Bom;Vista do quarto e localização.;Cama de casal, são duas camas de solteiro juntas. Isso é horrível!;7;;;;;;;;
8 de setembro de 2023;Muito bom;Limpeza, conforto, atendimento do recepcionista Emanuel.;Ar-condicionado controle com mal funcionamento. ;;;;;;;;;
;;;;;;;;;;;;
"Atendimento de algumas pessoas no restaurante.""";8;;;;;;;;;;;
8 de setembro de 2023;Ótima relação custo benefício;Espaço;Banheiro;9;;;;;;;;
6 de setembro de 2023;Gostei da estadia.;Limpeza e tamanho do quarto.;A água do chuveiro ficou fria em dois dias e não me emprestaram um ferro de passar por ter passado do horário estabelecido pelo hotel.;7;;;;;;;;
6 de setembro de 2023;Bom custo benéfico;Cafe da manhã, hospitalidade dos funcionários, localização.;A trava de uma das janelas estava ruim e com o vento vindo do mar, a janela ficou batendo a noite toda. O chuveiro não caia água direito.;8;;;;;;;;
4 de setembro de 2023;Fantástico;Excelente custo-benefício, boa localização e equipe ótima;;9;;;;;;;;
31 de agosto de 2023;Fantástico;NA PRAIA DE BOA VIAGEM, MUITO BOA A LOCALIZAÇÃO, PERTO DE TUDO.;;9;;;;;;;;
31 de agosto de 2023;Satisfatória;O atendimento excelente! Para quem viaja em família a melhor opção de quarto não está disponível no booking, é um quarto maior e sem vista para o mar- por isso é mais barato também. Quando chegamos pedimos para alterar e a recepção foi muito gentil.;;8;;;;;;;;
31 de agosto de 2023;Muito bom;Localização boa.;Piscina não aberta ao uso. ;;;;;;;;;
Queda de energia elétrica (apenas no prédio do hotel; com aparente falha de geradores); quase 2 horas sem elevador;" internet e luz em período da manhã em um dos dias da estadia. Serviço de estacionamento poderia ter menor custo.""";8;;;;;;;;
30 de agosto de 2023;A passagem foi rápida, porém, atendeu nossa expectativa.;Custo Benefício, proximidade com Aeroporto, proximidade com a Praia da Boa Viagem.;;8;;;;;;;;
27 de agosto de 2023;Fantástico;A localização é ótima. O quarto é amplo e confortável. O café da manhã é bastante diversificado.;;9;;;;;;;;
26 de agosto de 2023;Muito bom;Hotel bem localizado e com excelente café da manhã;;8;;;;;;;;
24 de agosto de 2023;Ótima experiência.;Acomodações, cama e conforto no quarto.;;9;;;;;;;;
24 de agosto de 2023;Um excelente custo/benefício. Ótima localização.;O preço;Estava em reforma e teve um barulhinho de construção civil logo cedo;8;;;;;;;;
24 de agosto de 2023;Bom;A localização perto da praia. O pequeno almoço é excelente. O quarto e wc eram muito espaçosos e com vista para praia.;O hotel é um pouco antigo e com algumas partes a necessitar de renovação.;7;;;;;;;;
23 de agosto de 2023;Bom local.;A localização é excelente! Ao lado da feirinha, dá para ver da janela. Tem restaurante, farmácia, padaria tudo próximo. O manobrista e o carregador de malas super simpáticos e agradáveis.;A recepção poderia ser um pouquinho mais calorosa, um “seja bem vindo” seria ótimo. Não tomei café, não posso avaliar. Os quartos estão mais antigos, funcionando e bem limpos, mas precisando de uma reforma para modernizar. Quartos e banheiros amplos. Por ser ao lado da feirinha, estava tendo música ao vivo, uma festa lá. Eu dormi super bem, estava muito cansada, mas é um ponto a observar pra quem tem sono leve. Fiquei no 13 andar, são 14 e estava alto o som.;7;;;;;;;;
23 de agosto de 2023;Muito bom;Café da manhã bem servido;;8;;;;;;;;
22 de agosto de 2023;Bom custo beneficio;Localização excelente a poucos metros da praia. Café da manhã muito bom com tapiocas e ovos feitos na hora. Restaurante do hotel bem bom e com preços justos. Quarto enorme.;Camas com molas meio velhas. Somente um elevador funcionando.;9;;;;;;;;
22 de agosto de 2023;Muito boa e acessível;Ótimo atendimento e ótimo café da manhã com muita variedade.;O chuveiro elétrico não da pra colocar um meio termo.;8;;;;;;;;
22 de agosto de 2023;Quarto agradável e localização ótima.;Boa localização e o quarto atendeu às expectativas;1) Quando chegamos, a limpeza não estava 100%. Nos dias seguintes, tudo OK.;;;;;;;;;
2) O wifi apresentou lentidão;" e a TV costumava dar paradas. Desisti de usar o meu laptop porque a Internet era muito fraca.""";8;;;;;;;;;;
21 de agosto de 2023;Bom hotel mas pode melhorar no preço;Café da manhã repleto de coisas boas e tinha a opção de pedir tapioca feita na hora.;;;;;;;;;;
Cama do quarto e o próprio quarto era grande.;;;;;;;;;;;;
Banheiro espaçoso.;;;;;;;;;;;;
Feirinha na frente.;;;;;;;;;;;;
"Calçadão de boa viagem para caminhada muito próximo ao hotel.""";Ter que pagar um valor extra para estacionar o carro com segurança.;;;;;;;;;;;
Ruas atrás do hotel não parecem ser muito seguras no período da noite. Na Frente tem uma feirinha que dá pra andar.;;;;;;;;;;;;
"Dos 3 elevadores do hotel apenas 01 estava em funcionamento o que gerou algumas esperas a mais.""";8;;;;;;;;;;;
21 de agosto de 2023;Ficamos 20 dias e todos atendentes foram ótimos , exceção faxineira;Ótimo café da manhã, funcionários sempre atentos e simpáticos;Da faxineira , sem horário para limpeza e faltou organização;9;;;;;;;;
21 de agosto de 2023;Confortável;Equipe atenciosa, ótima localização, café da manhã bem variado.;Gostei de tudo de maneira geral.;8;;;;;;;;
20 de agosto de 2023;Muito bom;Ar condicionado;Mal cheiro no banheiro;8;;;;;;;;
18 de agosto de 2023;Bom;A localização;As toalhas, muita usadas. Precisa se trocadas por outras mas novas.;7;;;;;;;;
18 de agosto de 2023;Bom;;Muito barulho no quarto por conta de uma reforma na piscina.;7;;;;;;;;
18 de agosto de 2023;Fantástico;Arrumação, simpatia dos profissionais, prontos p solucionar o que for necessário, café da manhã muito bom e completo...;Não tem nada que me incomodou...;9;;;;;;;;
18 de agosto de 2023;Estadia boa, porém o hotel tem que se adequar a fornecer mantas ou edredom para os hóspedes.;Gostei da localização,do café da manhã e do apartamento que era bem espaçoso.;Não gostei que no quarto somente fornecem sobre lençol para dormir, deveriam ofertar manta de microfibra ou um edredom para os hóspedes . Pedi na recepção e enviaram um tipo de cobre leito, o que não é confortável para cobrir.;;;;;;;;;
"Também não gostei da chave cartão do apartamento que sempre desmagnetizava e tínhamos que descer na recepção para magnetizar novamente.""";8;;;;;;;;;;;
17 de agosto de 2023;Excelente localização, vale a pena conhecer.;A Localização é ótima. O café da manhã é bom.;Precisa de algumas reformas, trocar o mobiliário, inovar.;8;;;;;;;;
16 de agosto de 2023;FOI BOA, MAS PODE MELHORAR;A LOCALIZAÇÃO, AS ACOMODAÇÕES, LIMPEZA;FIQUEI SOMENTE BEM INCOMODADA, ASSIM COMO OUTROS HOSPEDES, NO CAFE DA MANHA, COM A ROTINA COMO OS GARÇONS PROCEDEM QUANTO A RETIRADA DAS LOUÇAS QUE SE ESTÁ USANDO. CHEGA A SER INCOMODO MESMO, POIS NEM BEM TERMINAMOS DE COMER E DESOCUPAR AS LOUÇAS, SE APROXIMAM, E RECOLHEM AS MESMAS. TUDO BEM QUE EDUCADAMENTE, MAS CONSIDEREI UM POUCO EXACERBADA ESSA DINAMICA, POIS CHEGA INCOMODAR E A GENTE FICA MEIO QUE ACHANDO QUE DAQUI A POUCO, VÃO ARRANCAR AQUILO QUE AINDA ESTÁ NA NOSSA MÃO(rsrs). PENSO QUE PODERIAM PENSAR NUMA ESTRATEGIA, CUJA INCOMODASSE MENOS.;9;;;;;;;;
15 de agosto de 2023;Bom;;Falta mais travesseiros no quarto só 2 e pouco;7;;;;;;;;
15 de agosto de 2023;Muito bom;Excelente localização, próximo ao aeroporto, fácil acesso aos principais pontos de Recife e Olinda.;Roupa de cama estava com odor, pedimos pra trocar, de pronto os colaboradores providenciaram, mas continuaram com o odor.;8;;;;;;;;
14 de agosto de 2023;Muito bom;Localização excelente! Bom custo-benefício;;8;;;;;;;;
12 de agosto de 2023;Hotel com ótimo custo-benefício;Localização e custo-benefício;Rooftop ainda não disponível;8;;;;;;;;
12 de agosto de 2023;Conforto depois de longas viagens;Quando chego de longas viagens ao exterior é bom saber que tem um local confortável para me receber.;Eu queria tanto ter estacionamento fácil pois é um elemento importante para quem mora na região.;8;;;;;;;;
12 de agosto de 2023;Boa opção para hospedagem;Quarto amplo, cama boa, referente atendimento e bom café da manhã.;Os quartos poderiam recebeu um upgrade.;8;;;;;;;;
11 de agosto de 2023;Foi razoavelmente boa!;Gostei do atendimento. Tenho filha autista e ela foi razoavelmente bem-tratada. A alimentação dela não é igual às demais pessoas, mas ela se deu bem.;Não tenho nada a falar quanto a esse quesito...;8;;;;;;;;
11 de agosto de 2023;Muito bom;Perto do aeroporto e vista para o Mar;Nada;8;;;;;;;;
8 de agosto de 2023;Hotel Top.;Localização ótima, café da manhã excelente, variado, quarto com vista lateral do mar, da praça, igreja, cama confortável, ótima ventilação do quarto, diária preço compatível.;Não foi possível usar a piscina pois estava em obras;9;;;;;;;;
6 de agosto de 2023;Excelente custo-benefício;A uma quadra da praia, ao lado de uma feirinha com inúmeros itens de artesanato e alimentação.;;;;;;;;;;
Além do restaurante do hotel há dois excelentes restaurantes a uma quadra de distância. A praia também é a essa distância.;;;;;;;;;;;;
Faz parte do roteiro das empresas de turismo receptivo;" facilitando o acesso aos passeios.""";A TV parou de funcionar às 19h e só podiam consertar no dia seguinte.;9;;;;;;;;;
5 de agosto de 2023;Custo benefício relativamente pequeno;Localização;Preço muito além do esperado;7;;;;;;;;
2 de agosto de 2023;Excedeu minha expectativa;Localização ;;;;;;;;;;
2 de agosto de 2023;Esperava mais por tanto;Localização e limpeza e atendimento.;Muito caro para o que oferece. Cardápio deficiente. Pouca variedade no frigobar.;9;;;;;;;;
2 de agosto de 2023;Otimo custo beneficio;Hotel bem localizado, com a praia, restaurantes e mercado proximos. Café da manhã muito bom e variado. Equipe prestativa. Camas confortaveis.;O quarto precisava de uma pintura, as paredes estavam um pouco arranhadas.;9;;;;;;;;
1º de agosto de 2023;Fantástico;Conforto e atenção dos funcionários.;A falta de informação sobre a reforma que está em andamento no hotel.;9;;;;;;;;
1º de agosto de 2023;Fantástico;Excelente cama, banho e café da manhã.;;9;;;;;;;;
30 de julho de 2023;Boa;Atendimento muito bom, funcionários super solícitos. Fui cm minha mãe pra esperamos um voo e a localização muito boa e não é longe do aeroporto. Restaurante com os preços muito bom.;O quarto tinha um cheiro de umidade muito grande e lençóis muito finos, deveriam fornecer colcha no mesmo. Seria mais agraveis.;8;;;;;;;;
28 de julho de 2023;Muito bom;Funcionários simpáticos e prestativos.;A chave do quarto deu problema. Mas os funcionários resolveram rapidamente.;8;;;;;;;;
28 de julho de 2023;Ótimo custo benefício. Café da manhã bom. Roupa de cama boa.;Potencial vista p mar.;As janelas que dariam vista p mar estavam tao sujas que nao deu p tirar uma foto decente do mar. Faltou um local p pendurar toalha de rosto na pia do banheiro;8;;;;;;;;
27 de julho de 2023;Bom;Localização boa, vista para o mar, funcionários educados, ao lado de uma feira de arteanato.;A piscina em reforma e não foi no avisado no momento da reserva. Banheiro limpo porém antigo.;7;;;;;;;;
24 de julho de 2023;Muito bom;Café da manhã poderia ter mais alimentos menos caloricos( assim como ter uma boa banana cumprida cozida, ovo frito não é bom, não sei o que colocam no ovo), ter opção de tolerantes a lactose), falta opção de peito de peru ,;Falta de segurança na região;8;;;;;;;;
22 de julho de 2023;Muito bom;O destaque é dado à localização! Excelente! A feirinha defronte, bons restaurantes próximos... Hotel confortável, quarto amplo e ventilado, funcionários muito gentis (principalmente do café e restaurante).;Os aptos, apesar de bons, precisam de reformas. O ralo do box no nosso estava entupido. Um problema que tivemos independe do hotel, foi o barulho de obra no prédio ao lado.;8;;;;;;;;
22 de julho de 2023;Boa relação custo benefício;Localização e café da manhã.;As instalações precisam ser modernizadas. A TV poderia ser maior. A iluminação do quarto poderia ser melhor.;7;;;;;;;;
20 de julho de 2023;Suficiente para uma noite.;As camas são confortáveis. O café da manhã é bom e os funcionários são muito simpáticos.;O hotel precisa de manutenção. As instalações são muito antigas e haviam muitas formigas.;7;;;;;;;;
20 de julho de 2023;Fantástico;Atendimento dos funcionários.;Ovo mexido ruim ... resto do café da manhã fantástico. Muito barulho com a reforma, queria silêncio nas minhas férias.;9;;;;;;;;
17 de julho de 2023;Fantástico;Da simpatia do recepcionista sr. Muhammad!;Valor cobrado para antecipação de chick-in.;9;;;;;;;;
17 de julho de 2023;Poderia ter sido melhor;O café e a localização são ótimos.;Tive problema com a internet que é bem fraca. Eu viajei a trabalho então isso me atrapalhou bastante. O ar‐condicionado estava com a ventarola quebrada e pingando. O quarto ficou molhado. A posição das tomadas é ruim. O hotel está passando por uma reforma o que ocasionou muito barulho e a piscina não estava funcionando.;7;;;;;;;;
17 de julho de 2023;Bom custo-benefício;Localização. café da manhã muito bom, apesar de demorarem para repor as;;;;;;;;;;
"Coisas.""";Ar condicionado mal posicionado. Ar fica direto na cama. O que gerou um certo desconforto. Chuveiro frio.;7;;;;;;;;;;
17 de julho de 2023;Fantástico;Atendimento;;9;;;;;;;;
16 de julho de 2023;Ótima localização;Ótima localização!;De pagar 25,00 pelo estacionamento do próprio hotel e do Wi-Fi.;9;;;;;;;;
15 de julho de 2023;Muito bom;Boa localização, bom café da manhã.;Meio antigo.;8;;;;;;;;
15 de julho de 2023;A minha estadia foi muito boa.;A localização o café da manhã, limpeza dos quarto e a presteza de alguns funcionários.;Está em reforma e tem muito barulho.;9;;;;;;;;
14 de julho de 2023;Piscina em reforma.;Boa localização. Em frente a praia da Boa Viagem. Poucos minutos do aeroporto. Próximo do centro.;Piscina estava em reforma e isto não foi avisado do momento da reserva (no site consta fotos da piscina). ;;;;;;;;;
;;;;;;;;;;;;
"Tamanho do quarto ideal para família.""";8;;;;;;;;;;;
13 de julho de 2023;Perfeita para nossa proposta de curtir a cidade e não o hotel. Voltaremos!;Localização, boa, café da manhã bem completo, funcionários atenciosos, fácil acesso aos pontos de interesse, em frente a feirinha de artesanato e próximo de restaurantes. Recomendo como uma opção com bom custo beneficio.;É um hotel antigo reformado e/ou em reforma. Achamos que o banheiro estava com a obra incompleta, pois havia uma abertura para fora por onde entrava barulho das máquinas de AC, mas não comprometeu a hospedagem e o passeio. Recomendo;9;;;;;;;;
12 de julho de 2023;Ótimo custo benefício.;Carro amplo, café da manhã bem variado e a localização é excelente.;;8;;;;;;;;
10 de julho de 2023;Boa;Cama confortável;;7;;;;;;;;
10 de julho de 2023;Estadia boa.;Localização do hotel;Condições do enxoval que pareceu mal cuidado.;8;;;;;;;;
10 de julho de 2023;Muito boa;Café bom e uma boa localização.;;8;;;;;;;;
5 de julho de 2023;Hotel muito bom.;Café da manhã muito bom e localização excelente.;;8;;;;;;;;
3 de julho de 2023;Bom;Café da manhã superou a expectativa na variedade e na qualidade.;;7;;;;;;;;
2 de julho de 2023;Bom;Dos funcionários do hotel, todos muito simpáticos, o café da manhã também foi bem agradável.;A Localização;7;;;;;;;;
2 de julho de 2023;Localização e conveniência;Localização muito boa, ao lado da igrejinha de Boa Viagem e com fácil acesso ao aeroporto. Café da manhã é bom e quartos tem espaço adequado. Funcionários educados.;Hotel precisa de algumas renovações no banheiro e quarto, mas já iniciaram.algumas reformas.;8;;;;;;;;
1º de julho de 2023;Bom custo-benefício.;Localização é ótima, no meu caso deram vista para o mar, atendimento dos funcionários foi ótimo, café da manha muito bom.;Janelas não travaram abertas, wifi foi fraco na minha estadia perdeu sinal varias vezes. Estacionamento terceirizado cobrado a parte.;9;;;;;;;;
26 de junho de 2023;Ótima localização;Localização ótima;;8;;;;;;;;
26 de junho de 2023;Muito bom;A localização é fantástica... O tamanho do quarto família perfeito...;No booking dizia com vista pro mar e não teve...;8;;;;;;;;
22 de junho de 2023;Trabalho e trabalho.;Café da manhã excelente! Horário flexível, com atendimento prestimoso dos garçons.;De duas coisas:;;;;;;;;;
Cancelaram a preparação de omeletes.;;;;;;;;;;;;
Pedi à recepção para me acordar às 6 e 30 min; Programei o mesmo com meu celular. Acordei com a campainha do celular. Da chamada na recepção nenhuma notícia. Perguntei o que houve na recepção; mas não identificaram a pessoa responsável pelo registro das chamadas.;;;;;;;;;;
Como não me preocupei em perguntar o nome com quem falei na recepção;" dei o caso por encerrado. Mas teria perdido meu embarque para o Rio se não fosse meu celular.""";8;;;;;;;;;;
22 de junho de 2023;Ótima opção em Recife, com excelente localização.;Gostei da localização, do atendimento dos funcionários e do hotel em geral;;;;;;;;;;
Foi uma ótima estadia de 5 dias.;;;;;;;;;;;;
"Da próxima vez voltarei a me hospedar neste hotel.""";Não teve nenhum quesito que me desagradou;9;;;;;;;;;;
22 de junho de 2023;Valeu!;A vista para o mar;Nada a declarar;9;;;;;;;;
22 de junho de 2023;Ótima localização, já as camas totalmente desconfortáveis.;Da localiza e do atendimento dos colaboradores.;As camas.;7;;;;;;;;
18 de junho de 2023;Recomendo.;Cafe da manhã tem um senhora que faz uma tapioca otimo.;Tudo otimo. Staff preparado ta ajudar e solucionar o problema.;9;;;;;;;;
16 de junho de 2023;Um boa opção na Boa Viagem.;Café da manhã muito bom, além de ótima localização e atendimento em geral extremamente bom e atencioso.;Instalações nos quartos muito antiquadas, faltavam até tomadas nos quartos, inclusive banheiro muito antigo. Quartos limpos, bem espaçosos. Mesmo assim, falta conforto na cama, travesseiro e infraestrutura.;7;;;;;;;;
16 de junho de 2023;Muito bom;Localização, Limpeza, Café da manhã, serviço de estacionamento.;Preço ainda elevado para estrutura e pela piscina em reforma, checkout demorado devido a ter apenas um funcionário atendendo um grupo enorme de pessoas por um longo tempo.;8;;;;;;;;
15 de junho de 2023;Bom;quartos confortáveis;tivemos pagar diferença na tarifa da reserva;7;;;;;;;;
14 de junho de 2023;Maravilhosa;De tudo amo a café da manhã a localização;;9;;;;;;;;
13 de junho de 2023;Bom hotel, custo beneficio muito bom!;Hotel muito bem localizado e o atendimento foi excelente.;Nada a declarar.;8;;;;;;;;
13 de junho de 2023;Muito bom;O hotel possui boa localização, atendimento dos funcionários tbm muito bom e café da manhã com muita diversidade.;O hotel poderia melhorar a estrutura dos quartos, o atual atende satisfatoriamente, mas tem uma estrutura envelhecida.;8;;;;;;;;
12 de junho de 2023;Um bom hotel;Gostei do atendimento e da localização;Não gostei do forro da cama;;;;;;;;;
Por ser um período mais frio e chuvoso não vi opções de cobertores mais quentes...;;;;;;;;;;;;
A cama só com um forro fino; sem manta; sem edredom;;;;;;;;;;
11 de junho de 2023;Excelente localização e café da manhã!;O café da manhã é farto e com tudo sendo renovado constantemente, sempre td fresquinho e o salão limpo. A educação e simpatia dos funcionários tmb, excelente!;Inicialmente ficamos num apto do lado par, onde estava de frente pra uma obra, bem desconfortável por causa do abrulho e ausência de privacidade, mas o pessoal da recepção pronctamente atendeu o pedido de nos mudarem de quarto! Outra coisa que acredito q pode ser melhor regulada é a temperatura do ar-condicionado na recepção e no restaurante: estavam mto frios!;8;;;;;;;;
10 de junho de 2023;Muito bom;Localização do hotel, fica próximo a tudo, bons restaurantes, bares, feirinha, etc.;O quarto tinha cheiro de mofo, conseguimos uma troca de quarto o que ajudou a não voltarmos com uma crise de renite.;8;;;;;;;;
9 de junho de 2023;Muito bom;Café da manhã variado, tapioca deliciosa.;Havia uma obra ao lado do hotel fazendo barulho muito cedo.;8;;;;;;;;
8 de junho de 2023;agradável;localização, atendimento;;8;;;;;;;;
7 de junho de 2023;Muito bom;Gostei muito do café da manhã, muitas opções, o quarto também é bom.;Quando eu fui não gostei porque a piscina estava interditada e não mandaram mensagem pra avisar.;;;;;;;;;
